Anon Item ID,Operation,Field,Previous value,New value,Anon Actor,Date logged,timestamp_utc,case_id,bucket,level,translated_value,sequence,activity_name
ITEM-000002,Update,owningbusinessunit,"businessunit,0a4ccfd6-e6d9-e611-80f2-5065f38aba91","businessunit,0a4ccfd6-e6d9-e611-80f2-5065f38aba91",ACTOR-0002,22/08/2025 13:23,2025-08-22T13:23:00Z,ITEM-000002,L3_ADMIN,L3,"businessunit,0a4ccfd6-e6d9-e611-80f2-5065f38aba91",,owningbusinessunit changed
ITEM-000002,Update,ownerid,"systemuser,7b9d5323-2ef3-4d52-9d6c-dd45deb05e3b","systemuser,efd3822d-8c8b-4619-8eb9-39ddf9c5c57f",ACTOR-0002,22/08/2025 13:23,2025-08-22T13:23:00Z,ITEM-000002,L3_ADMIN,L3,"systemuser,efd3822d-8c8b-4619-8eb9-39ddf9c5c57f",,Owner changed
ITEM-000004,Update,owningbusinessunit,"businessunit,0a4ccfd6-e6d9-e611-80f2-5065f38aba91","businessunit,0a4ccfd6-e6d9-e611-80f2-5065f38aba91",ACTOR-0002,7/10/25 10:45,2025-07-10T10:45:00Z,ITEM-000004,L3_ADMIN,L3,"businessunit,0a4ccfd6-e6d9-e611-80f2-5065f38aba91",,owningbusinessunit changed
ITEM-000004,Update,ownerid,"systemuser,7b9d5323-2ef3-4d52-9d6c-dd45deb05e3b","systemuser,efd3822d-8c8b-4619-8eb9-39ddf9c5c57f",ACTOR-0002,7/10/25 10:45,2025-07-10T10:45:00Z,ITEM-000004,L3_ADMIN,L3,"systemuser,efd3822d-8c8b-4619-8eb9-39ddf9c5c57f",,Owner changed
ITEM-000005,Update,owningbusinessunit,"businessunit,0a4ccfd6-e6d9-e611-80f2-5065f38aba91","businessunit,0a4ccfd6-e6d9-e611-80f2-5065f38aba91",ACTOR-0003,26/08/2025 07:43,2025-08-26T07:43:00Z,ITEM-000005,L3_ADMIN,L3,"businessunit,0a4ccfd6-e6d9-e611-80f2-5065f38aba91",,owningbusinessunit changed
ITEM-000005,Update,ownerid,"systemuser,b5f00e27-78b3-4a71-90af-5dcef3c25bba","systemuser,efd3822d-8c8b-4619-8eb9-39ddf9c5c57f",ACTOR-0003,26/08/2025 07:43,2025-08-26T07:43:00Z,ITEM-000005,L3_ADMIN,L3,"systemuser,efd3822d-8c8b-4619-8eb9-39ddf9c5c57f",,Owner changed
ITEM-000006,Update,estimatedclosedate,9/10/25 0:00,1/8/26 0:00,ACTOR-0009,6/10/25 11:20,2025-06-10T11:20:00Z,ITEM-000006,L1_STAGE,L1,1/8/26 0:00,,estimatedclosedate → 1/8/26 0:00
ITEM-000006,Update,the000g_revenuetype,,604720000,ACTOR-0003,15/08/2025 08:12,2025-08-15T08:12:00Z,ITEM-000006,L2_MILESTONE,L2,604720000,,the000g_revenuetype → 604720000
ITEM-000006,Update,the000g_isrenewal,,TRUE,ACTOR-0003,15/08/2025 08:12,2025-08-15T08:12:00Z,ITEM-000006,L3_ADMIN,L3,TRUE,,the000g_isrenewal changed
ITEM-000006,Update,the000g__revenuetype,,604720001,ACTOR-0009,5/1/26 10:04,2026-05-01T10:04:00Z,ITEM-000006,L2_MILESTONE,L2,604720001,,the000g__revenuetype → 604720001
ITEM-000006,Update,estimatedclosedate,1/8/26 0:00,6/18/26 0:00,ACTOR-0009,5/1/26 10:04,2026-05-01T10:04:00Z,ITEM-000006,L1_STAGE,L1,6/18/26 0:00,,estimatedclosedate → 6/18/26 0:00
ITEM-000007,Update,estimatedclosedate,10/16/25 0:00,10/31/25 0:00,ACTOR-0009,29/10/2025 09:17,2025-10-29T09:17:00Z,ITEM-000007,L1_STAGE,L1,10/31/25 0:00,,estimatedclosedate → 10/31/25 0:00
ITEM-000007,Update,estimatedclosedate,10/31/25 0:00,11/27/25 0:00,ACTOR-0009,13/11/2025 12:06,2025-11-13T12:06:00Z,ITEM-000007,L1_STAGE,L1,11/27/25 0:00,,estimatedclosedate → 11/27/25 0:00
ITEM-000007,Update,the000g__revenuetype,,604720004,ACTOR-0009,18/12/2025 09:21,2025-12-18T09:21:00Z,ITEM-000007,L2_MILESTONE,L2,604720004,,the000g__revenuetype → 604720004
ITEM-000007,Update,estimatedclosedate,11/27/25 0:00,2/11/26 0:00,ACTOR-0009,18/12/2025 09:21,2025-12-18T09:21:00Z,ITEM-000007,L1_STAGE,L1,2/11/26 0:00,,estimatedclosedate → 2/11/26 0:00
ITEM-000007,Update,estimatedclosedate,2/11/26 0:00,4/23/26 0:00,ACTOR-0009,26/01/2026 15:33,2026-01-26T15:33:00Z,ITEM-000007,L1_STAGE,L1,4/23/26 0:00,,estimatedclosedate → 4/23/26 0:00
ITEM-000007,Update,closeprobability,,25,ACTOR-0003,5/1/26 15:39,2026-05-01T15:39:00Z,ITEM-000007,L1_STAGE,L1,25,,closeprobability → 25
ITEM-000008,Update,owningbusinessunit,"businessunit,0a4ccfd6-e6d9-e611-80f2-5065f38aba91","businessunit,0a4ccfd6-e6d9-e611-80f2-5065f38aba91",ACTOR-0002,7/10/25 10:46,2025-07-10T10:46:00Z,ITEM-000008,L3_ADMIN,L3,"businessunit,0a4ccfd6-e6d9-e611-80f2-5065f38aba91",,owningbusinessunit changed
ITEM-000008,Update,ownerid,"systemuser,7b9d5323-2ef3-4d52-9d6c-dd45deb05e3b","systemuser,efd3822d-8c8b-4619-8eb9-39ddf9c5c57f",ACTOR-0002,7/10/25 10:46,2025-07-10T10:46:00Z,ITEM-000008,L3_ADMIN,L3,"systemuser,efd3822d-8c8b-4619-8eb9-39ddf9c5c57f",,Owner changed
ITEM-000009,Update,stepname,,14-Qualify,ACTOR-0008,8/12/25 10:24,2025-08-12T10:24:00Z,ITEM-000009,L1_STAGE,L1,14-Qualify,14.0,stepname → 14-Qualify
ITEM-000009,Create,statecode,,0,ACTOR-0002,8/12/25 10:24,2025-08-12T10:24:00Z,ITEM-000009,L1_STAGE,L1,Open,,Case Created
ITEM-000010,Update,stepname,,14-Qualify,ACTOR-0008,29/09/2025 09:44,2025-09-29T09:44:00Z,ITEM-000010,L1_STAGE,L1,14-Qualify,14.0,stepname → 14-Qualify
ITEM-000010,Create,statecode,,0,ACTOR-0009,29/09/2025 09:44,2025-09-29T09:44:00Z,ITEM-000010,L1_STAGE,L1,Open,,Case Created
ITEM-000010,Update,estimatedclosedate,10/9/25 0:00,6/17/26 0:00,ACTOR-0009,29/10/2025 09:16,2025-10-29T09:16:00Z,ITEM-000010,L1_STAGE,L1,6/17/26 0:00,,estimatedclosedate → 6/17/26 0:00
ITEM-000011,Update,owningbusinessunit,"businessunit,0a4ccfd6-e6d9-e611-80f2-5065f38aba91","businessunit,0a4ccfd6-e6d9-e611-80f2-5065f38aba91",ACTOR-0003,27/10/2025 11:18,2025-10-27T11:18:00Z,ITEM-000011,L3_ADMIN,L3,"businessunit,0a4ccfd6-e6d9-e611-80f2-5065f38aba91",,owningbusinessunit changed
ITEM-000011,Update,ownerid,"systemuser,2d7fbe83-3f35-4a1d-bc05-1b39dbf446d9","systemuser,efd3822d-8c8b-4619-8eb9-39ddf9c5c57f",ACTOR-0003,27/10/2025 11:18,2025-10-27T11:18:00Z,ITEM-000011,L3_ADMIN,L3,"systemuser,efd3822d-8c8b-4619-8eb9-39ddf9c5c57f",,Owner changed
ITEM-000013,Update,stepname,,14-Qualify,ACTOR-0008,13/08/2025 10:15,2025-08-13T10:15:00Z,ITEM-000013,L1_STAGE,L1,14-Qualify,14.0,stepname → 14-Qualify
ITEM-000013,Create,statecode,,0,ACTOR-0003,13/08/2025 10:15,2025-08-13T10:15:00Z,ITEM-000013,L1_STAGE,L1,Open,,Case Created
ITEM-000013,Update,estimatedclosedate,8/29/25 0:00,11/28/25 0:00,ACTOR-0003,17/10/2025 09:01,2025-10-17T09:01:00Z,ITEM-000013,L1_STAGE,L1,11/28/25 0:00,,estimatedclosedate → 11/28/25 0:00
ITEM-000013,Update,closeprobability,50,75,ACTOR-0003,11/11/25 9:59,2025-11-11T09:59:00Z,ITEM-000013,L1_STAGE,L1,75,,closeprobability → 75
ITEM-000013,Update,estimatedclosedate,11/28/25 0:00,2/20/26 0:00,ACTOR-0003,8/1/26 10:36,2026-08-01T10:36:00Z,ITEM-000013,L1_STAGE,L1,2/20/26 0:00,,estimatedclosedate → 2/20/26 0:00
ITEM-000014,Update,the000g_revenuetype,,604720001,ACTOR-0009,6/10/25 9:48,2025-06-10T09:48:00Z,ITEM-000014,L2_MILESTONE,L2,604720001,,the000g_revenuetype → 604720001
ITEM-000014,Update,the000g_isrenewal,,FALSE,ACTOR-0009,6/10/25 9:48,2025-06-10T09:48:00Z,ITEM-000014,L3_ADMIN,L3,FALSE,,the000g_isrenewal changed
ITEM-000014,Update,estimatedclosedate,12/25/25 0:00,2/26/26 0:00,ACTOR-0009,6/10/25 9:48,2025-06-10T09:48:00Z,ITEM-000014,L1_STAGE,L1,2/26/26 0:00,,estimatedclosedate → 2/26/26 0:00
ITEM-000014,Update,the000g__revenuetype,,604720002,ACTOR-0009,26/01/2026 15:36,2026-01-26T15:36:00Z,ITEM-000014,L2_MILESTONE,L2,604720002,,the000g__revenuetype → 604720002
ITEM-000014,Update,estimatedclosedate,2/26/26 0:00,5/21/26 0:00,ACTOR-0009,26/01/2026 15:36,2026-01-26T15:36:00Z,ITEM-000014,L1_STAGE,L1,5/21/26 0:00,,estimatedclosedate → 5/21/26 0:00
ITEM-000014,Update,closeprobability,,25,ACTOR-0003,5/1/26 15:54,2026-05-01T15:54:00Z,ITEM-000014,L1_STAGE,L1,25,,closeprobability → 25
ITEM-000015,Update,owningbusinessunit,"businessunit,0a4ccfd6-e6d9-e611-80f2-5065f38aba91","businessunit,0a4ccfd6-e6d9-e611-80f2-5065f38aba91",ACTOR-0002,7/10/25 10:46,2025-07-10T10:46:00Z,ITEM-000015,L3_ADMIN,L3,"businessunit,0a4ccfd6-e6d9-e611-80f2-5065f38aba91",,owningbusinessunit changed
ITEM-000015,Update,ownerid,"systemuser,7b9d5323-2ef3-4d52-9d6c-dd45deb05e3b","systemuser,efd3822d-8c8b-4619-8eb9-39ddf9c5c57f",ACTOR-0002,7/10/25 10:46,2025-07-10T10:46:00Z,ITEM-000015,L3_ADMIN,L3,"systemuser,efd3822d-8c8b-4619-8eb9-39ddf9c5c57f",,Owner changed
ITEM-000016,Update,owningbusinessunit,"businessunit,0a4ccfd6-e6d9-e611-80f2-5065f38aba91","businessunit,0a4ccfd6-e6d9-e611-80f2-5065f38aba91",ACTOR-0004,26/09/2025 09:21,2025-09-26T09:21:00Z,ITEM-000016,L3_ADMIN,L3,"businessunit,0a4ccfd6-e6d9-e611-80f2-5065f38aba91",,owningbusinessunit changed
ITEM-000016,Update,ownerid,"systemuser,09f34b91-4d86-4fc8-8b41-8af3d91e94bf","systemuser,b5f00e27-78b3-4a71-90af-5dcef3c25bba",ACTOR-0004,26/09/2025 09:21,2025-09-26T09:21:00Z,ITEM-000016,L3_ADMIN,L3,"systemuser,b5f00e27-78b3-4a71-90af-5dcef3c25bba",,Owner changed
ITEM-000018,Update,owningbusinessunit,"businessunit,0a4ccfd6-e6d9-e611-80f2-5065f38aba91","businessunit,0a4ccfd6-e6d9-e611-80f2-5065f38aba91",ACTOR-0004,26/09/2025 09:20,2025-09-26T09:20:00Z,ITEM-000018,L3_ADMIN,L3,"businessunit,0a4ccfd6-e6d9-e611-80f2-5065f38aba91",,owningbusinessunit changed
ITEM-000018,Update,ownerid,"systemuser,1cba5fd4-6e4e-4e0f-85ff-a6438bc2f2f0","systemuser,b5f00e27-78b3-4a71-90af-5dcef3c25bba",ACTOR-0004,26/09/2025 09:20,2025-09-26T09:20:00Z,ITEM-000018,L3_ADMIN,L3,"systemuser,b5f00e27-78b3-4a71-90af-5dcef3c25bba",,Owner changed
ITEM-000019,Update,owningbusinessunit,"businessunit,0a4ccfd6-e6d9-e611-80f2-5065f38aba91","businessunit,0a4ccfd6-e6d9-e611-80f2-5065f38aba91",ACTOR-0002,7/10/25 10:45,2025-07-10T10:45:00Z,ITEM-000019,L3_ADMIN,L3,"businessunit,0a4ccfd6-e6d9-e611-80f2-5065f38aba91",,owningbusinessunit changed
ITEM-000019,Update,ownerid,"systemuser,7b9d5323-2ef3-4d52-9d6c-dd45deb05e3b","systemuser,efd3822d-8c8b-4619-8eb9-39ddf9c5c57f",ACTOR-0002,7/10/25 10:45,2025-07-10T10:45:00Z,ITEM-000019,L3_ADMIN,L3,"systemuser,efd3822d-8c8b-4619-8eb9-39ddf9c5c57f",,Owner changed
ITEM-000020,Update,stepname,,14-Qualify,ACTOR-0008,27/01/2026 09:52,2026-01-27T09:52:00Z,ITEM-000020,L1_STAGE,L1,14-Qualify,14.0,stepname → 14-Qualify
ITEM-000020,Create,statecode,,0,ACTOR-0002,27/01/2026 09:52,2026-01-27T09:52:00Z,ITEM-000020,L1_STAGE,L1,Open,,Case Created
ITEM-000021,Update,stepname,,14-Qualify,ACTOR-0008,13/01/2026 10:41,2026-01-13T10:41:00Z,ITEM-000021,L1_STAGE,L1,14-Qualify,14.0,stepname → 14-Qualify
ITEM-000021,Create,statecode,,0,ACTOR-0009,13/01/2026 10:41,2026-01-13T10:41:00Z,ITEM-000021,L1_STAGE,L1,Open,,Case Created
ITEM-000024,Update,stepname,,14-Qualify,ACTOR-0008,7/10/25 10:12,2025-07-10T10:12:00Z,ITEM-000024,L1_STAGE,L1,14-Qualify,14.0,stepname → 14-Qualify
ITEM-000024,Create,statecode,,0,ACTOR-0009,7/10/25 10:12,2025-07-10T10:12:00Z,ITEM-000024,L1_STAGE,L1,Open,,Case Created
ITEM-000024,Update,statuscode,1,3,ACTOR-0009,7/10/25 11:05,2025-07-10T11:05:00Z,ITEM-000024,L1_STAGE,L1,Won,,statuscode → Won
ITEM-000024,Update,msdyn_forecastcategory,100000001,100000005,ACTOR-0009,7/10/25 11:05,2025-07-10T11:05:00Z,ITEM-000024,L1_STAGE,L1,100000005,,msdyn_forecastcategory → 100000005
ITEM-000024,Update,actualclosedate,,10/7/25 0:00,ACTOR-0009,7/10/25 11:05,2025-07-10T11:05:00Z,ITEM-000024,L1_STAGE,L1,10/7/25 0:00,,actualclosedate → 10/7/25 0:00
ITEM-000024,Update,salesstage,,3,ACTOR-0009,7/10/25 11:05,2025-07-10T11:05:00Z,ITEM-000024,L1_STAGE,L1,3,,salesstage → 3
ITEM-000024,Update,statecode,0,1,ACTOR-0009,7/10/25 11:05,2025-07-10T11:05:00Z,ITEM-000024,L1_STAGE,L1,Won,,statecode → Won
ITEM-000026,Update,owningbusinessunit,"businessunit,0a4ccfd6-e6d9-e611-80f2-5065f38aba91","businessunit,0a4ccfd6-e6d9-e611-80f2-5065f38aba91",ACTOR-0003,27/08/2025 12:57,2025-08-27T12:57:00Z,ITEM-000026,L3_ADMIN,L3,"businessunit,0a4ccfd6-e6d9-e611-80f2-5065f38aba91",,owningbusinessunit changed
ITEM-000026,Update,ownerid,"systemuser,7b9d5323-2ef3-4d52-9d6c-dd45deb05e3b","systemuser,b5f00e27-78b3-4a71-90af-5dcef3c25bba",ACTOR-0003,27/08/2025 12:57,2025-08-27T12:57:00Z,ITEM-000026,L3_ADMIN,L3,"systemuser,b5f00e27-78b3-4a71-90af-5dcef3c25bba",,Owner changed
ITEM-000027,Update,stepname,,14-Qualify,ACTOR-0008,20/11/2025 11:52,2025-11-20T11:52:00Z,ITEM-000027,L1_STAGE,L1,14-Qualify,14.0,stepname → 14-Qualify
ITEM-000027,Create,statecode,,0,ACTOR-0009,20/11/2025 11:52,2025-11-20T11:52:00Z,ITEM-000027,L1_STAGE,L1,Open,,Case Created
ITEM-000027,Update,the000g__revenuetype,,604720002,ACTOR-0009,18/12/2025 09:22,2025-12-18T09:22:00Z,ITEM-000027,L2_MILESTONE,L2,604720002,,the000g__revenuetype → 604720002
ITEM-000027,Update,estimatedclosedate,12/4/25 0:00,1/31/26 0:00,ACTOR-0009,18/12/2025 09:22,2025-12-18T09:22:00Z,ITEM-000027,L1_STAGE,L1,1/31/26 0:00,,estimatedclosedate → 1/31/26 0:00
ITEM-000027,Update,closeprobability,,25,ACTOR-0003,5/1/26 15:35,2026-05-01T15:35:00Z,ITEM-000027,L1_STAGE,L1,25,,closeprobability → 25
ITEM-000027,Update,estimatedclosedate,1/31/26 0:00,2/26/26 0:00,ACTOR-0009,8/1/26 15:24,2026-08-01T15:24:00Z,ITEM-000027,L1_STAGE,L1,2/26/26 0:00,,estimatedclosedate → 2/26/26 0:00
ITEM-000028,Update,stepname,14-Qualify,15-Develop,ACTOR-0008,1/9/25 7:27,2025-01-09T07:27:00Z,ITEM-000028,L1_STAGE,L1,15-Develop,15.0,stepname → 15-Develop
ITEM-000028,Update,stepname,15-Develop,16-Propose,ACTOR-0008,1/9/25 7:27,2025-01-09T07:27:00Z,ITEM-000028,L1_STAGE,L1,16-Propose,16.0,stepname → 16-Propose
ITEM-000028,Update,stepname,16-Propose,17-Close,ACTOR-0008,1/9/25 7:27,2025-01-09T07:27:00Z,ITEM-000028,L1_STAGE,L1,17-Close,17.0,stepname → 17-Close
ITEM-000028,Update,purchaseprocess,,0,ACTOR-0002,1/9/25 7:27,2025-01-09T07:27:00Z,ITEM-000028,L2_MILESTONE,L2,0,,purchaseprocess → 0
ITEM-000028,Update,statuscode,1,100000006,ACTOR-0002,1/9/25 7:28,2025-01-09T07:28:00Z,ITEM-000028,L1_STAGE,L1,100000006,,statuscode → 100000006
ITEM-000028,Update,the000g_purchaseorderstatus,,604720000,ACTOR-0002,1/9/25 7:29,2025-01-09T07:29:00Z,ITEM-000028,L1_STAGE,L1,604720000,,the000g_purchaseorderstatus → 604720000
ITEM-000028,Update,statuscode,100000006,4,ACTOR-0002,1/9/25 7:31,2025-01-09T07:31:00Z,ITEM-000028,L1_STAGE,L1,Canceled,,statuscode → Canceled
ITEM-000028,Update,msdyn_forecastcategory,100000001,100000006,ACTOR-0002,1/9/25 7:31,2025-01-09T07:31:00Z,ITEM-000028,L1_STAGE,L1,100000006,,msdyn_forecastcategory → 100000006
ITEM-000028,Update,actualclosedate,,9/1/25 0:00,ACTOR-0002,1/9/25 7:31,2025-01-09T07:31:00Z,ITEM-000028,L1_STAGE,L1,9/1/25 0:00,,actualclosedate → 9/1/25 0:00
ITEM-000028,Update,salesstage,,3,ACTOR-0002,1/9/25 7:31,2025-01-09T07:31:00Z,ITEM-000028,L1_STAGE,L1,3,,salesstage → 3
ITEM-000028,Update,statecode,0,2,ACTOR-0002,1/9/25 7:31,2025-01-09T07:31:00Z,ITEM-000028,L1_STAGE,L1,Lost,,statecode → Lost
ITEM-000028,Update,stepname,,14-Qualify,ACTOR-0008,22/08/2025 09:15,2025-08-22T09:15:00Z,ITEM-000028,L1_STAGE,L1,14-Qualify,14.0,stepname → 14-Qualify
ITEM-000028,Create,statecode,,0,ACTOR-0002,22/08/2025 09:15,2025-08-22T09:15:00Z,ITEM-000028,L1_STAGE,L1,Open,,Case Created
ITEM-000030,Update,statuscode,1,756150007,ACTOR-0003,28/08/2025 09:33,2025-08-28T09:33:00Z,ITEM-000030,L1_STAGE,L1,756150007,,statuscode → 756150007
ITEM-000030,Update,msdyn_forecastcategory,100000001,100000006,ACTOR-0003,28/08/2025 09:33,2025-08-28T09:33:00Z,ITEM-000030,L1_STAGE,L1,100000006,,msdyn_forecastcategory → 100000006
ITEM-000030,Update,actualclosedate,,8/28/25 0:00,ACTOR-0003,28/08/2025 09:33,2025-08-28T09:33:00Z,ITEM-000030,L1_STAGE,L1,8/28/25 0:00,,actualclosedate → 8/28/25 0:00
ITEM-000030,Update,salesstage,,3,ACTOR-0003,28/08/2025 09:33,2025-08-28T09:33:00Z,ITEM-000030,L1_STAGE,L1,3,,salesstage → 3
ITEM-000030,Update,statecode,0,2,ACTOR-0003,28/08/2025 09:33,2025-08-28T09:33:00Z,ITEM-000030,L1_STAGE,L1,Lost,,statecode → Lost
ITEM-000031,Update,owningbusinessunit,"businessunit,0a4ccfd6-e6d9-e611-80f2-5065f38aba91","businessunit,0a4ccfd6-e6d9-e611-80f2-5065f38aba91",ACTOR-0003,27/10/2025 11:18,2025-10-27T11:18:00Z,ITEM-000031,L3_ADMIN,L3,"businessunit,0a4ccfd6-e6d9-e611-80f2-5065f38aba91",,owningbusinessunit changed
ITEM-000031,Update,ownerid,"systemuser,2d7fbe83-3f35-4a1d-bc05-1b39dbf446d9","systemuser,efd3822d-8c8b-4619-8eb9-39ddf9c5c57f",ACTOR-0003,27/10/2025 11:18,2025-10-27T11:18:00Z,ITEM-000031,L3_ADMIN,L3,"systemuser,efd3822d-8c8b-4619-8eb9-39ddf9c5c57f",,Owner changed
ITEM-000033,Update,stepname,,14-Qualify,ACTOR-0008,28/10/2025 14:19,2025-10-28T14:19:00Z,ITEM-000033,L1_STAGE,L1,14-Qualify,14.0,stepname → 14-Qualify
ITEM-000033,Create,purchasetimeframe,,0,ACTOR-0003,28/10/2025 14:19,2025-10-28T14:19:00Z,ITEM-000033,L2_MILESTONE,L2,0,,Case Created
ITEM-000033,Update,statuscode,1,3,ACTOR-0003,28/10/2025 14:22,2025-10-28T14:22:00Z,ITEM-000033,L1_STAGE,L1,Won,,statuscode → Won
ITEM-000033,Update,msdyn_forecastcategory,100000001,100000005,ACTOR-0003,28/10/2025 14:22,2025-10-28T14:22:00Z,ITEM-000033,L1_STAGE,L1,100000005,,msdyn_forecastcategory → 100000005
ITEM-000033,Update,actualclosedate,,10/28/25 0:00,ACTOR-0003,28/10/2025 14:22,2025-10-28T14:22:00Z,ITEM-000033,L1_STAGE,L1,10/28/25 0:00,,actualclosedate → 10/28/25 0:00
ITEM-000033,Update,salesstage,,3,ACTOR-0003,28/10/2025 14:22,2025-10-28T14:22:00Z,ITEM-000033,L1_STAGE,L1,3,,salesstage → 3
ITEM-000033,Update,statecode,0,1,ACTOR-0003,28/10/2025 14:22,2025-10-28T14:22:00Z,ITEM-000033,L1_STAGE,L1,Won,,statecode → Won
ITEM-000035,Update,owningbusinessunit,"businessunit,0a4ccfd6-e6d9-e611-80f2-5065f38aba91","businessunit,0a4ccfd6-e6d9-e611-80f2-5065f38aba91",ACTOR-0003,26/08/2025 07:42,2025-08-26T07:42:00Z,ITEM-000035,L3_ADMIN,L3,"businessunit,0a4ccfd6-e6d9-e611-80f2-5065f38aba91",,owningbusinessunit changed
ITEM-000035,Update,ownerid,"team,0e9fee3e-5a6b-ef11-a670-6045bdf33728","systemuser,efd3822d-8c8b-4619-8eb9-39ddf9c5c57f",ACTOR-0003,26/08/2025 07:42,2025-08-26T07:42:00Z,ITEM-000035,L3_ADMIN,L3,"systemuser,efd3822d-8c8b-4619-8eb9-39ddf9c5c57f",,Owner changed
ITEM-000037,Update,owningbusinessunit,"businessunit,0a4ccfd6-e6d9-e611-80f2-5065f38aba91","businessunit,0a4ccfd6-e6d9-e611-80f2-5065f38aba91",ACTOR-0002,22/08/2025 13:23,2025-08-22T13:23:00Z,ITEM-000037,L3_ADMIN,L3,"businessunit,0a4ccfd6-e6d9-e611-80f2-5065f38aba91",,owningbusinessunit changed
ITEM-000037,Update,ownerid,"systemuser,7b9d5323-2ef3-4d52-9d6c-dd45deb05e3b","systemuser,efd3822d-8c8b-4619-8eb9-39ddf9c5c57f",ACTOR-0002,22/08/2025 13:23,2025-08-22T13:23:00Z,ITEM-000037,L3_ADMIN,L3,"systemuser,efd3822d-8c8b-4619-8eb9-39ddf9c5c57f",,Owner changed
ITEM-000038,Update,owningbusinessunit,"businessunit,0a4ccfd6-e6d9-e611-80f2-5065f38aba91","businessunit,0a4ccfd6-e6d9-e611-80f2-5065f38aba91",ACTOR-0004,26/09/2025 09:21,2025-09-26T09:21:00Z,ITEM-000038,L3_ADMIN,L3,"businessunit,0a4ccfd6-e6d9-e611-80f2-5065f38aba91",,owningbusinessunit changed
ITEM-000038,Update,ownerid,"systemuser,1cba5fd4-6e4e-4e0f-85ff-a6438bc2f2f0","systemuser,b5f00e27-78b3-4a71-90af-5dcef3c25bba",ACTOR-0004,26/09/2025 09:21,2025-09-26T09:21:00Z,ITEM-000038,L3_ADMIN,L3,"systemuser,b5f00e27-78b3-4a71-90af-5dcef3c25bba",,Owner changed
ITEM-000040,Update,estimatedclosedate,3/4/26 0:00,1/30/26 0:00,ACTOR-0002,19/01/2026 10:19,2026-01-19T10:19:00Z,ITEM-000040,L1_STAGE,L1,1/30/26 0:00,,estimatedclosedate → 1/30/26 0:00
ITEM-000040,Update,stepname,,14-Qualify,ACTOR-0008,8/1/26 11:11,2026-08-01T11:11:00Z,ITEM-000040,L1_STAGE,L1,14-Qualify,14.0,stepname → 14-Qualify
ITEM-000040,Create,statecode,,0,ACTOR-0002,8/1/26 11:11,2026-08-01T11:11:00Z,ITEM-000040,L1_STAGE,L1,Open,,Case Created
ITEM-000040,Update,new_contracttermmonths,,12,ACTOR-0002,8/1/26 11:16,2026-08-01T11:16:00Z,ITEM-000040,L2_MILESTONE,L2,12,,new_contracttermmonths → 12
ITEM-000041,Update,owningbusinessunit,"businessunit,0a4ccfd6-e6d9-e611-80f2-5065f38aba91","businessunit,0a4ccfd6-e6d9-e611-80f2-5065f38aba91",ACTOR-0002,8/9/25 8:04,2025-08-09T08:04:00Z,ITEM-000041,L3_ADMIN,L3,"businessunit,0a4ccfd6-e6d9-e611-80f2-5065f38aba91",,owningbusinessunit changed
ITEM-000041,Update,ownerid,"systemuser,ddf0a409-01d5-4caa-bd27-c1b42fee109e","systemuser,efd3822d-8c8b-4619-8eb9-39ddf9c5c57f",ACTOR-0002,8/9/25 8:04,2025-08-09T08:04:00Z,ITEM-000041,L3_ADMIN,L3,"systemuser,efd3822d-8c8b-4619-8eb9-39ddf9c5c57f",,Owner changed
ITEM-000044,Update,stepname,,14-Qualify,ACTOR-0008,15/08/2025 11:47,2025-08-15T11:47:00Z,ITEM-000044,L1_STAGE,L1,14-Qualify,14.0,stepname → 14-Qualify
ITEM-000044,Create,statecode,,0,ACTOR-0009,15/08/2025 11:47,2025-08-15T11:47:00Z,ITEM-000044,L1_STAGE,L1,Open,,Case Created
ITEM-000044,Update,statuscode,1,3,ACTOR-0009,15/08/2025 12:04,2025-08-15T12:04:00Z,ITEM-000044,L1_STAGE,L1,Won,,statuscode → Won
ITEM-000044,Update,msdyn_forecastcategory,100000001,100000005,ACTOR-0009,15/08/2025 12:04,2025-08-15T12:04:00Z,ITEM-000044,L1_STAGE,L1,100000005,,msdyn_forecastcategory → 100000005
ITEM-000044,Update,actualclosedate,,8/12/25 0:00,ACTOR-0009,15/08/2025 12:04,2025-08-15T12:04:00Z,ITEM-000044,L1_STAGE,L1,8/12/25 0:00,,actualclosedate → 8/12/25 0:00
ITEM-000044,Update,salesstage,,3,ACTOR-0009,15/08/2025 12:04,2025-08-15T12:04:00Z,ITEM-000044,L1_STAGE,L1,3,,salesstage → 3
ITEM-000044,Update,statecode,0,1,ACTOR-0009,15/08/2025 12:04,2025-08-15T12:04:00Z,ITEM-000044,L1_STAGE,L1,Won,,statecode → Won
ITEM-000046,Update,owningbusinessunit,"businessunit,0a4ccfd6-e6d9-e611-80f2-5065f38aba91","businessunit,0a4ccfd6-e6d9-e611-80f2-5065f38aba91",ACTOR-0002,22/08/2025 13:23,2025-08-22T13:23:00Z,ITEM-000046,L3_ADMIN,L3,"businessunit,0a4ccfd6-e6d9-e611-80f2-5065f38aba91",,owningbusinessunit changed
ITEM-000046,Update,ownerid,"systemuser,7b9d5323-2ef3-4d52-9d6c-dd45deb05e3b","systemuser,efd3822d-8c8b-4619-8eb9-39ddf9c5c57f",ACTOR-0002,22/08/2025 13:23,2025-08-22T13:23:00Z,ITEM-000046,L3_ADMIN,L3,"systemuser,efd3822d-8c8b-4619-8eb9-39ddf9c5c57f",,Owner changed
ITEM-000048,Update,the000g_revenuetype,,604720001,ACTOR-0009,6/10/25 9:53,2025-06-10T09:53:00Z,ITEM-000048,L2_MILESTONE,L2,604720001,,the000g_revenuetype → 604720001
ITEM-000048,Update,the000g_isrenewal,,FALSE,ACTOR-0009,6/10/25 9:53,2025-06-10T09:53:00Z,ITEM-000048,L3_ADMIN,L3,FALSE,,the000g_isrenewal changed
ITEM-000048,Update,estimatedclosedate,10/2/25 0:00,2/11/26 0:00,ACTOR-0009,6/10/25 9:53,2025-06-10T09:53:00Z,ITEM-000048,L1_STAGE,L1,2/11/26 0:00,,estimatedclosedate → 2/11/26 0:00
ITEM-000048,Update,estimatedclosedate,2/11/26 0:00,2/27/26 0:00,ACTOR-0009,28/01/2026 12:07,2026-01-28T12:07:00Z,ITEM-000048,L1_STAGE,L1,2/27/26 0:00,,estimatedclosedate → 2/27/26 0:00
ITEM-000048,Update,the000g__revenuetype,,604720002,ACTOR-0009,8/1/26 14:14,2026-08-01T14:14:00Z,ITEM-000048,L2_MILESTONE,L2,604720002,,the000g__revenuetype → 604720002
ITEM-000049,Update,the000g_revenuetype,,604720002,ACTOR-0003,17/08/2025 12:56,2025-08-17T12:56:00Z,ITEM-000049,L2_MILESTONE,L2,604720002,,the000g_revenuetype → 604720002
ITEM-000049,Update,owningbusinessunit,"businessunit,0a4ccfd6-e6d9-e611-80f2-5065f38aba91","businessunit,0a4ccfd6-e6d9-e611-80f2-5065f38aba91",ACTOR-0003,27/08/2025 12:57,2025-08-27T12:57:00Z,ITEM-000049,L3_ADMIN,L3,"businessunit,0a4ccfd6-e6d9-e611-80f2-5065f38aba91",,owningbusinessunit changed
ITEM-000049,Update,ownerid,"systemuser,a1bb889b-dfab-4e28-b508-75e672da7cb8","systemuser,b5f00e27-78b3-4a71-90af-5dcef3c25bba",ACTOR-0003,27/08/2025 12:57,2025-08-27T12:57:00Z,ITEM-000049,L3_ADMIN,L3,"systemuser,b5f00e27-78b3-4a71-90af-5dcef3c25bba",,Owner changed
ITEM-000052,Update,owningbusinessunit,"businessunit,0a4ccfd6-e6d9-e611-80f2-5065f38aba91","businessunit,0a4ccfd6-e6d9-e611-80f2-5065f38aba91",ACTOR-0002,8/1/26 9:40,2026-08-01T09:40:00Z,ITEM-000052,L3_ADMIN,L3,"businessunit,0a4ccfd6-e6d9-e611-80f2-5065f38aba91",,owningbusinessunit changed
ITEM-000052,Update,ownerid,"systemuser,7b9d5323-2ef3-4d52-9d6c-dd45deb05e3b","systemuser,efd3822d-8c8b-4619-8eb9-39ddf9c5c57f",ACTOR-0002,8/1/26 9:40,2026-08-01T09:40:00Z,ITEM-000052,L3_ADMIN,L3,"systemuser,efd3822d-8c8b-4619-8eb9-39ddf9c5c57f",,Owner changed
ITEM-000053,Update,the000g_revenuetype,,604720002,ACTOR-0003,17/08/2025 13:03,2025-08-17T13:03:00Z,ITEM-000053,L2_MILESTONE,L2,604720002,,the000g_revenuetype → 604720002
ITEM-000053,Update,owningbusinessunit,"businessunit,0a4ccfd6-e6d9-e611-80f2-5065f38aba91","businessunit,0a4ccfd6-e6d9-e611-80f2-5065f38aba91",ACTOR-0004,26/09/2025 09:21,2025-09-26T09:21:00Z,ITEM-000053,L3_ADMIN,L3,"businessunit,0a4ccfd6-e6d9-e611-80f2-5065f38aba91",,owningbusinessunit changed
ITEM-000053,Update,ownerid,"systemuser,a1bb889b-dfab-4e28-b508-75e672da7cb8","systemuser,b5f00e27-78b3-4a71-90af-5dcef3c25bba",ACTOR-0004,26/09/2025 09:21,2025-09-26T09:21:00Z,ITEM-000053,L3_ADMIN,L3,"systemuser,b5f00e27-78b3-4a71-90af-5dcef3c25bba",,Owner changed
ITEM-000054,Update,owningbusinessunit,"businessunit,0a4ccfd6-e6d9-e611-80f2-5065f38aba91","businessunit,0a4ccfd6-e6d9-e611-80f2-5065f38aba91",ACTOR-0002,7/10/25 10:46,2025-07-10T10:46:00Z,ITEM-000054,L3_ADMIN,L3,"businessunit,0a4ccfd6-e6d9-e611-80f2-5065f38aba91",,owningbusinessunit changed
ITEM-000054,Update,ownerid,"systemuser,7b9d5323-2ef3-4d52-9d6c-dd45deb05e3b","systemuser,efd3822d-8c8b-4619-8eb9-39ddf9c5c57f",ACTOR-0002,7/10/25 10:46,2025-07-10T10:46:00Z,ITEM-000054,L3_ADMIN,L3,"systemuser,efd3822d-8c8b-4619-8eb9-39ddf9c5c57f",,Owner changed
ITEM-000055,Update,owningbusinessunit,"businessunit,0a4ccfd6-e6d9-e611-80f2-5065f38aba91","businessunit,0a4ccfd6-e6d9-e611-80f2-5065f38aba91",ACTOR-0004,26/09/2025 09:21,2025-09-26T09:21:00Z,ITEM-000055,L3_ADMIN,L3,"businessunit,0a4ccfd6-e6d9-e611-80f2-5065f38aba91",,owningbusinessunit changed
ITEM-000055,Update,ownerid,"systemuser,76f7f7be-53c2-41e6-af67-e0af93c6b2c2","systemuser,09f34b91-4d86-4fc8-8b41-8af3d91e94bf",ACTOR-0004,26/09/2025 09:21,2025-09-26T09:21:00Z,ITEM-000055,L3_ADMIN,L3,"systemuser,09f34b91-4d86-4fc8-8b41-8af3d91e94bf",,Owner changed
ITEM-000056,Update,owningbusinessunit,"businessunit,0a4ccfd6-e6d9-e611-80f2-5065f38aba91","businessunit,0a4ccfd6-e6d9-e611-80f2-5065f38aba91",ACTOR-0002,7/10/25 10:45,2025-07-10T10:45:00Z,ITEM-000056,L3_ADMIN,L3,"businessunit,0a4ccfd6-e6d9-e611-80f2-5065f38aba91",,owningbusinessunit changed
ITEM-000056,Update,ownerid,"systemuser,7b9d5323-2ef3-4d52-9d6c-dd45deb05e3b","systemuser,efd3822d-8c8b-4619-8eb9-39ddf9c5c57f",ACTOR-0002,7/10/25 10:45,2025-07-10T10:45:00Z,ITEM-000056,L3_ADMIN,L3,"systemuser,efd3822d-8c8b-4619-8eb9-39ddf9c5c57f",,Owner changed
ITEM-000057,Update,stepname,,14-Qualify,ACTOR-0008,11/11/25 10:12,2025-11-11T10:12:00Z,ITEM-000057,L1_STAGE,L1,14-Qualify,14.0,stepname → 14-Qualify
ITEM-000057,Create,statecode,,0,ACTOR-0009,11/11/25 10:12,2025-11-11T10:12:00Z,ITEM-000057,L1_STAGE,L1,Open,,Case Created
ITEM-000061,Update,owningbusinessunit,"businessunit,0a4ccfd6-e6d9-e611-80f2-5065f38aba91","businessunit,0a4ccfd6-e6d9-e611-80f2-5065f38aba91",ACTOR-0002,16/10/2025 10:39,2025-10-16T10:39:00Z,ITEM-000061,L3_ADMIN,L3,"businessunit,0a4ccfd6-e6d9-e611-80f2-5065f38aba91",,owningbusinessunit changed
ITEM-000061,Update,ownerid,"systemuser,9ab13e3b-1ff4-4d57-a2c8-d0c8f2ce3f42","systemuser,efd3822d-8c8b-4619-8eb9-39ddf9c5c57f",ACTOR-0002,16/10/2025 10:39,2025-10-16T10:39:00Z,ITEM-000061,L3_ADMIN,L3,"systemuser,efd3822d-8c8b-4619-8eb9-39ddf9c5c57f",,Owner changed
ITEM-000062,Update,stepname,,14-Qualify,ACTOR-0008,18/09/2025 11:38,2025-09-18T11:38:00Z,ITEM-000062,L1_STAGE,L1,14-Qualify,14.0,stepname → 14-Qualify
ITEM-000062,Create,statecode,,0,ACTOR-0007,18/09/2025 11:38,2025-09-18T11:38:00Z,ITEM-000062,L1_STAGE,L1,Open,,Case Created
ITEM-000062,Update,purchasetimeframe,,0,ACTOR-0007,18/09/2025 11:38,2025-09-18T11:38:00Z,ITEM-000062,L2_MILESTONE,L2,0,,purchasetimeframe → 0
ITEM-000062,Update,parentaccountid,,"account,1cae755b-dedf-e611-80f3-5065f38bd451",ACTOR-0007,18/09/2025 13:13,2025-09-18T13:13:00Z,ITEM-000062,L3_ADMIN,L3,"account,1cae755b-dedf-e611-80f3-5065f38bd451",,parentaccountid changed
ITEM-000062,Update,customerid,"contact,3c028195-e2df-e611-80f2-5065f38aba91","account,1cae755b-dedf-e611-80f3-5065f38bd451",ACTOR-0007,18/09/2025 13:13,2025-09-18T13:13:00Z,ITEM-000062,L3_ADMIN,L3,"account,1cae755b-dedf-e611-80f3-5065f38bd451",,customerid changed
ITEM-000062,Update,the000g__revenuetype,,604720004,ACTOR-0007,14/01/2026 14:17,2026-01-14T14:17:00Z,ITEM-000062,L2_MILESTONE,L2,604720004,,the000g__revenuetype → 604720004
ITEM-000062,Update,statuscode,1,4,ACTOR-0007,14/01/2026 14:20,2026-01-14T14:20:00Z,ITEM-000062,L1_STAGE,L1,Canceled,,statuscode → Canceled
ITEM-000062,Update,msdyn_forecastcategory,100000001,100000006,ACTOR-0007,14/01/2026 14:20,2026-01-14T14:20:00Z,ITEM-000062,L1_STAGE,L1,100000006,,msdyn_forecastcategory → 100000006
ITEM-000062,Update,actualclosedate,,1/14/26 0:00,ACTOR-0007,14/01/2026 14:20,2026-01-14T14:20:00Z,ITEM-000062,L1_STAGE,L1,1/14/26 0:00,,actualclosedate → 1/14/26 0:00
ITEM-000062,Update,salesstage,,3,ACTOR-0007,14/01/2026 14:20,2026-01-14T14:20:00Z,ITEM-000062,L1_STAGE,L1,3,,salesstage → 3
ITEM-000062,Update,statecode,0,2,ACTOR-0007,14/01/2026 14:20,2026-01-14T14:20:00Z,ITEM-000062,L1_STAGE,L1,Lost,,statecode → Lost
ITEM-000063,Update,stepname,,14-Qualify,ACTOR-0008,10/10/25 11:12,2025-10-10T11:12:00Z,ITEM-000063,L1_STAGE,L1,14-Qualify,14.0,stepname → 14-Qualify
ITEM-000063,Create,statecode,,0,ACTOR-0009,10/10/25 11:12,2025-10-10T11:12:00Z,ITEM-000063,L1_STAGE,L1,Open,,Case Created
ITEM-000063,Update,stepname,14-Qualify,16-Propose,ACTOR-0003,5/1/26 15:23,2026-05-01T15:23:00Z,ITEM-000063,L1_STAGE,L1,16-Propose,16.0,stepname → 16-Propose
ITEM-000063,Update,closeprobability,,50,ACTOR-0003,5/1/26 15:24,2026-05-01T15:24:00Z,ITEM-000063,L1_STAGE,L1,50,,closeprobability → 50
ITEM-000063,Update,the000g__revenuetype,,604720001,ACTOR-0009,12/1/26 15:05,2026-12-01T15:05:00Z,ITEM-000063,L2_MILESTONE,L2,604720001,,the000g__revenuetype → 604720001
ITEM-000063,Update,estimatedclosedate,1/28/26 0:00,2/26/26 0:00,ACTOR-0009,12/1/26 15:05,2026-12-01T15:05:00Z,ITEM-000063,L1_STAGE,L1,2/26/26 0:00,,estimatedclosedate → 2/26/26 0:00
ITEM-000064,Update,owningbusinessunit,"businessunit,0a4ccfd6-e6d9-e611-80f2-5065f38aba91","businessunit,0a4ccfd6-e6d9-e611-80f2-5065f38aba91",ACTOR-0002,16/10/2025 10:39,2025-10-16T10:39:00Z,ITEM-000064,L3_ADMIN,L3,"businessunit,0a4ccfd6-e6d9-e611-80f2-5065f38aba91",,owningbusinessunit changed
ITEM-000064,Update,ownerid,"systemuser,9ab13e3b-1ff4-4d57-a2c8-d0c8f2ce3f42","systemuser,efd3822d-8c8b-4619-8eb9-39ddf9c5c57f",ACTOR-0002,16/10/2025 10:39,2025-10-16T10:39:00Z,ITEM-000064,L3_ADMIN,L3,"systemuser,efd3822d-8c8b-4619-8eb9-39ddf9c5c57f",,Owner changed
ITEM-000067,Update,owningbusinessunit,"businessunit,0a4ccfd6-e6d9-e611-80f2-5065f38aba91","businessunit,0a4ccfd6-e6d9-e611-80f2-5065f38aba91",ACTOR-0002,1/9/25 9:15,2025-01-09T09:15:00Z,ITEM-000067,L3_ADMIN,L3,"businessunit,0a4ccfd6-e6d9-e611-80f2-5065f38aba91",,owningbusinessunit changed
ITEM-000067,Update,ownerid,"systemuser,b5f00e27-78b3-4a71-90af-5dcef3c25bba","systemuser,efd3822d-8c8b-4619-8eb9-39ddf9c5c57f",ACTOR-0002,1/9/25 9:15,2025-01-09T09:15:00Z,ITEM-000067,L3_ADMIN,L3,"systemuser,efd3822d-8c8b-4619-8eb9-39ddf9c5c57f",,Owner changed
ITEM-000068,Update,stepname,16-Propose,15-Develop,ACTOR-0008,13/01/2026 08:28,2026-01-13T08:28:00Z,ITEM-000068,L1_STAGE,L1,15-Develop,15.0,stepname → 15-Develop
ITEM-000068,Update,stepname,16-,16-Propose,ACTOR-0003,13/01/2026 08:28,2026-01-13T08:28:00Z,ITEM-000068,L1_STAGE,L1,16-Propose,16.0,stepname → 16-Propose
ITEM-000068,Update,stepname,14-Qualify,16-,ACTOR-0003,13/01/2026 08:28,2026-01-13T08:28:00Z,ITEM-000068,L1_STAGE,L1,16-,16.0,stepname → 16-
ITEM-000068,Update,closeprobability,,25,ACTOR-0003,13/01/2026 08:28,2026-01-13T08:28:00Z,ITEM-000068,L1_STAGE,L1,25,,closeprobability → 25
ITEM-000068,Update,stepname,15-Develop,16-Propose,ACTOR-0003,13/01/2026 08:30,2026-01-13T08:30:00Z,ITEM-000068,L1_STAGE,L1,16-Propose,16.0,stepname → 16-Propose
ITEM-000068,Update,estimatedclosedate,1/30/26 0:00,2/27/26 0:00,ACTOR-0003,21/01/2026 19:49,2026-01-21T19:49:00Z,ITEM-000068,L1_STAGE,L1,2/27/26 0:00,,estimatedclosedate → 2/27/26 0:00
ITEM-000068,Create,statecode,,0,ACTOR-0003,6/1/26 17:09,2026-06-01T17:09:00Z,ITEM-000068,L1_STAGE,L1,Open,,Case Created
ITEM-000071,Update,owningbusinessunit,"businessunit,0a4ccfd6-e6d9-e611-80f2-5065f38aba91","businessunit,0a4ccfd6-e6d9-e611-80f2-5065f38aba91",ACTOR-0002,22/08/2025 13:23,2025-08-22T13:23:00Z,ITEM-000071,L3_ADMIN,L3,"businessunit,0a4ccfd6-e6d9-e611-80f2-5065f38aba91",,owningbusinessunit changed
ITEM-000071,Update,ownerid,"systemuser,7b9d5323-2ef3-4d52-9d6c-dd45deb05e3b","systemuser,efd3822d-8c8b-4619-8eb9-39ddf9c5c57f",ACTOR-0002,22/08/2025 13:23,2025-08-22T13:23:00Z,ITEM-000071,L3_ADMIN,L3,"systemuser,efd3822d-8c8b-4619-8eb9-39ddf9c5c57f",,Owner changed
ITEM-000072,Update,owningbusinessunit,"businessunit,0a4ccfd6-e6d9-e611-80f2-5065f38aba91","businessunit,0a4ccfd6-e6d9-e611-80f2-5065f38aba91",ACTOR-0002,22/08/2025 13:23,2025-08-22T13:23:00Z,ITEM-000072,L3_ADMIN,L3,"businessunit,0a4ccfd6-e6d9-e611-80f2-5065f38aba91",,owningbusinessunit changed
ITEM-000072,Update,ownerid,"systemuser,7b9d5323-2ef3-4d52-9d6c-dd45deb05e3b","systemuser,efd3822d-8c8b-4619-8eb9-39ddf9c5c57f",ACTOR-0002,22/08/2025 13:23,2025-08-22T13:23:00Z,ITEM-000072,L3_ADMIN,L3,"systemuser,efd3822d-8c8b-4619-8eb9-39ddf9c5c57f",,Owner changed
ITEM-000073,Update,owningbusinessunit,"businessunit,0a4ccfd6-e6d9-e611-80f2-5065f38aba91","businessunit,0a4ccfd6-e6d9-e611-80f2-5065f38aba91",ACTOR-0002,8/1/26 9:40,2026-08-01T09:40:00Z,ITEM-000073,L3_ADMIN,L3,"businessunit,0a4ccfd6-e6d9-e611-80f2-5065f38aba91",,owningbusinessunit changed
ITEM-000073,Update,ownerid,"systemuser,7b9d5323-2ef3-4d52-9d6c-dd45deb05e3b","systemuser,efd3822d-8c8b-4619-8eb9-39ddf9c5c57f",ACTOR-0002,8/1/26 9:40,2026-08-01T09:40:00Z,ITEM-000073,L3_ADMIN,L3,"systemuser,efd3822d-8c8b-4619-8eb9-39ddf9c5c57f",,Owner changed
ITEM-000074,Update,stepname,,14-Qualify,ACTOR-0008,19/09/2025 08:15,2025-09-19T08:15:00Z,ITEM-000074,L1_STAGE,L1,14-Qualify,14.0,stepname → 14-Qualify
ITEM-000074,Create,purchasetimeframe,,0,ACTOR-0007,19/09/2025 08:15,2025-09-19T08:15:00Z,ITEM-000074,L2_MILESTONE,L2,0,,Case Created
ITEM-000074,Update,the000g__revenuetype,,604720004,ACTOR-0007,14/01/2026 14:24,2026-01-14T14:24:00Z,ITEM-000074,L2_MILESTONE,L2,604720004,,the000g__revenuetype → 604720004
ITEM-000074,Update,estimatedclosedate,10/31/25 0:00,1/31/26 0:00,ACTOR-0007,14/01/2026 14:24,2026-01-14T14:24:00Z,ITEM-000074,L1_STAGE,L1,1/31/26 0:00,,estimatedclosedate → 1/31/26 0:00
ITEM-000076,Update,owningbusinessunit,"businessunit,0a4ccfd6-e6d9-e611-80f2-5065f38aba91","businessunit,0a4ccfd6-e6d9-e611-80f2-5065f38aba91",ACTOR-0002,7/10/25 10:45,2025-07-10T10:45:00Z,ITEM-000076,L3_ADMIN,L3,"businessunit,0a4ccfd6-e6d9-e611-80f2-5065f38aba91",,owningbusinessunit changed
ITEM-000076,Update,ownerid,"systemuser,7b9d5323-2ef3-4d52-9d6c-dd45deb05e3b","systemuser,efd3822d-8c8b-4619-8eb9-39ddf9c5c57f",ACTOR-0002,7/10/25 10:45,2025-07-10T10:45:00Z,ITEM-000076,L3_ADMIN,L3,"systemuser,efd3822d-8c8b-4619-8eb9-39ddf9c5c57f",,Owner changed
ITEM-000077,Update,owningbusinessunit,"businessunit,0a4ccfd6-e6d9-e611-80f2-5065f38aba91","businessunit,0a4ccfd6-e6d9-e611-80f2-5065f38aba91",ACTOR-0002,8/1/26 9:40,2026-08-01T09:40:00Z,ITEM-000077,L3_ADMIN,L3,"businessunit,0a4ccfd6-e6d9-e611-80f2-5065f38aba91",,owningbusinessunit changed
ITEM-000077,Update,ownerid,"systemuser,7b9d5323-2ef3-4d52-9d6c-dd45deb05e3b","systemuser,efd3822d-8c8b-4619-8eb9-39ddf9c5c57f",ACTOR-0002,8/1/26 9:40,2026-08-01T09:40:00Z,ITEM-000077,L3_ADMIN,L3,"systemuser,efd3822d-8c8b-4619-8eb9-39ddf9c5c57f",,Owner changed
ITEM-000078,Update,owningbusinessunit,"businessunit,0a4ccfd6-e6d9-e611-80f2-5065f38aba91","businessunit,0a4ccfd6-e6d9-e611-80f2-5065f38aba91",ACTOR-0003,27/10/2025 11:18,2025-10-27T11:18:00Z,ITEM-000078,L3_ADMIN,L3,"businessunit,0a4ccfd6-e6d9-e611-80f2-5065f38aba91",,owningbusinessunit changed
ITEM-000078,Update,ownerid,"systemuser,2d7fbe83-3f35-4a1d-bc05-1b39dbf446d9","systemuser,efd3822d-8c8b-4619-8eb9-39ddf9c5c57f",ACTOR-0003,27/10/2025 11:18,2025-10-27T11:18:00Z,ITEM-000078,L3_ADMIN,L3,"systemuser,efd3822d-8c8b-4619-8eb9-39ddf9c5c57f",,Owner changed
ITEM-000079,Update,owningbusinessunit,"businessunit,0a4ccfd6-e6d9-e611-80f2-5065f38aba91","businessunit,0a4ccfd6-e6d9-e611-80f2-5065f38aba91",ACTOR-0003,27/10/2025 11:18,2025-10-27T11:18:00Z,ITEM-000079,L3_ADMIN,L3,"businessunit,0a4ccfd6-e6d9-e611-80f2-5065f38aba91",,owningbusinessunit changed
ITEM-000079,Update,ownerid,"systemuser,a1bb889b-dfab-4e28-b508-75e672da7cb8","systemuser,efd3822d-8c8b-4619-8eb9-39ddf9c5c57f",ACTOR-0003,27/10/2025 11:18,2025-10-27T11:18:00Z,ITEM-000079,L3_ADMIN,L3,"systemuser,efd3822d-8c8b-4619-8eb9-39ddf9c5c57f",,Owner changed
ITEM-000081,Update,owningbusinessunit,"businessunit,0a4ccfd6-e6d9-e611-80f2-5065f38aba91","businessunit,0a4ccfd6-e6d9-e611-80f2-5065f38aba91",ACTOR-0002,7/10/25 10:46,2025-07-10T10:46:00Z,ITEM-000081,L3_ADMIN,L3,"businessunit,0a4ccfd6-e6d9-e611-80f2-5065f38aba91",,owningbusinessunit changed
ITEM-000081,Update,ownerid,"systemuser,7b9d5323-2ef3-4d52-9d6c-dd45deb05e3b","systemuser,efd3822d-8c8b-4619-8eb9-39ddf9c5c57f",ACTOR-0002,7/10/25 10:46,2025-07-10T10:46:00Z,ITEM-000081,L3_ADMIN,L3,"systemuser,efd3822d-8c8b-4619-8eb9-39ddf9c5c57f",,Owner changed
ITEM-000083,Update,stepname,,14-Qualify,ACTOR-0008,12/1/26 9:59,2026-12-01T09:59:00Z,ITEM-000083,L1_STAGE,L1,14-Qualify,14.0,stepname → 14-Qualify
ITEM-000083,Create,purchaseprocess,,0,ACTOR-0002,12/1/26 9:59,2026-12-01T09:59:00Z,ITEM-000083,L2_MILESTONE,L2,0,,Case Created
ITEM-000084,Update,the000g_revenuetype,,604720000,ACTOR-0003,26/08/2025 08:18,2025-08-26T08:18:00Z,ITEM-000084,L2_MILESTONE,L2,604720000,,the000g_revenuetype → 604720000
ITEM-000084,Update,the000g_isrenewal,,TRUE,ACTOR-0003,26/08/2025 08:18,2025-08-26T08:18:00Z,ITEM-000084,L3_ADMIN,L3,TRUE,,the000g_isrenewal changed
ITEM-000084,Update,new_contracttermmonths,,12,ACTOR-0003,26/08/2025 08:19,2025-08-26T08:19:00Z,ITEM-000084,L2_MILESTONE,L2,12,,new_contracttermmonths → 12
ITEM-000084,Update,new_contracttermmonths,12,36,ACTOR-0009,15/10/2025 13:23,2025-10-15T13:23:00Z,ITEM-000084,L2_MILESTONE,L2,36,,new_contracttermmonths → 36
ITEM-000084,Update,statuscode,1,3,ACTOR-0009,15/10/2025 13:25,2025-10-15T13:25:00Z,ITEM-000084,L1_STAGE,L1,Won,,statuscode → Won
ITEM-000084,Update,msdyn_forecastcategory,100000001,100000005,ACTOR-0009,15/10/2025 13:25,2025-10-15T13:25:00Z,ITEM-000084,L1_STAGE,L1,100000005,,msdyn_forecastcategory → 100000005
ITEM-000084,Update,actualclosedate,,10/15/25 0:00,ACTOR-0009,15/10/2025 13:25,2025-10-15T13:25:00Z,ITEM-000084,L1_STAGE,L1,10/15/25 0:00,,actualclosedate → 10/15/25 0:00
ITEM-000084,Update,salesstage,,3,ACTOR-0009,15/10/2025 13:25,2025-10-15T13:25:00Z,ITEM-000084,L1_STAGE,L1,3,,salesstage → 3
ITEM-000084,Update,statecode,0,1,ACTOR-0009,15/10/2025 13:25,2025-10-15T13:25:00Z,ITEM-000084,L1_STAGE,L1,Won,,statecode → Won
ITEM-000085,Update,stepname,,14-Qualify,ACTOR-0008,26/08/2025 07:56,2025-08-26T07:56:00Z,ITEM-000085,L1_STAGE,L1,14-Qualify,14.0,stepname → 14-Qualify
ITEM-000085,Create,statecode,,0,ACTOR-0009,26/08/2025 07:56,2025-08-26T07:56:00Z,ITEM-000085,L1_STAGE,L1,Open,,Case Created
ITEM-000085,Update,statuscode,1,3,ACTOR-0009,26/08/2025 12:31,2025-08-26T12:31:00Z,ITEM-000085,L1_STAGE,L1,Won,,statuscode → Won
ITEM-000085,Update,msdyn_forecastcategory,100000001,100000005,ACTOR-0009,26/08/2025 12:31,2025-08-26T12:31:00Z,ITEM-000085,L1_STAGE,L1,100000005,,msdyn_forecastcategory → 100000005
ITEM-000085,Update,actualclosedate,,8/26/25 0:00,ACTOR-0009,26/08/2025 12:31,2025-08-26T12:31:00Z,ITEM-000085,L1_STAGE,L1,8/26/25 0:00,,actualclosedate → 8/26/25 0:00
ITEM-000085,Update,salesstage,,3,ACTOR-0009,26/08/2025 12:31,2025-08-26T12:31:00Z,ITEM-000085,L1_STAGE,L1,3,,salesstage → 3
ITEM-000085,Update,statecode,0,1,ACTOR-0009,26/08/2025 12:31,2025-08-26T12:31:00Z,ITEM-000085,L1_STAGE,L1,Won,,statecode → Won
ITEM-000086,Update,stepname,17-Close,14-Qualify,ACTOR-0002,13/11/2025 14:50,2025-11-13T14:50:00Z,ITEM-000086,L1_STAGE,L1,14-Qualify,14.0,stepname → 14-Qualify
ITEM-000086,Create,statecode,,0,ACTOR-0002,13/11/2025 14:50,2025-11-13T14:50:00Z,ITEM-000086,L1_STAGE,L1,Open,,Case Created
ITEM-000086,Update,closeprobability,100,75,ACTOR-0002,13/11/2025 14:51,2025-11-13T14:51:00Z,ITEM-000086,L1_STAGE,L1,75,,closeprobability → 75
ITEM-000086,Update,msdyn_forecastcategory,100000005,100000001,ACTOR-0002,13/11/2025 14:51,2025-11-13T14:51:00Z,ITEM-000086,L1_STAGE,L1,100000001,,msdyn_forecastcategory → 100000001
ITEM-000086,Update,estimatedclosedate,11/10/25 0:00,9/29/27 0:00,ACTOR-0002,13/11/2025 14:51,2025-11-13T14:51:00Z,ITEM-000086,L1_STAGE,L1,9/29/27 0:00,,estimatedclosedate → 9/29/27 0:00
ITEM-000086,Update,purchaseprocess,2,0,ACTOR-0002,13/11/2025 14:51,2025-11-13T14:51:00Z,ITEM-000086,L2_MILESTONE,L2,0,,purchaseprocess → 0
ITEM-000086,Update,new_contracttermmonths,24,12,ACTOR-0002,13/11/2025 14:51,2025-11-13T14:51:00Z,ITEM-000086,L2_MILESTONE,L2,12,,new_contracttermmonths → 12
ITEM-000089,Update,stepname,,14-Qualify,ACTOR-0008,2/9/25 13:17,2025-02-09T13:17:00Z,ITEM-000089,L1_STAGE,L1,14-Qualify,14.0,stepname → 14-Qualify
ITEM-000089,Create,statecode,,0,ACTOR-0003,2/9/25 13:17,2025-02-09T13:17:00Z,ITEM-000089,L1_STAGE,L1,Open,,Case Created
ITEM-000089,Update,closeprobability,75,50,ACTOR-0003,11/11/25 9:58,2025-11-11T09:58:00Z,ITEM-000089,L1_STAGE,L1,50,,closeprobability → 50
ITEM-000089,Update,estimatedclosedate,11/7/25 0:00,12/12/25 0:00,ACTOR-0003,11/11/25 9:59,2025-11-11T09:59:00Z,ITEM-000089,L1_STAGE,L1,12/12/25 0:00,,estimatedclosedate → 12/12/25 0:00
ITEM-000089,Update,estimatedclosedate,1/30/26 0:00,2/6/26 0:00,ACTOR-0003,13/01/2026 08:30,2026-01-13T08:30:00Z,ITEM-000089,L1_STAGE,L1,2/6/26 0:00,,estimatedclosedate → 2/6/26 0:00
ITEM-000089,Update,the000g__revenuetype,,604720001,ACTOR-0003,15/01/2026 12:26,2026-01-15T12:26:00Z,ITEM-000089,L2_MILESTONE,L2,604720001,,the000g__revenuetype → 604720001
ITEM-000089,Update,the000g_revenuetype,604720001,604720000,ACTOR-0003,15/01/2026 12:26,2026-01-15T12:26:00Z,ITEM-000089,L2_MILESTONE,L2,604720000,,the000g_revenuetype → 604720000
ITEM-000089,Update,stepname,14-Qualify,15-Develop,ACTOR-0008,15/01/2026 12:27,2026-01-15T12:27:00Z,ITEM-000089,L1_STAGE,L1,15-Develop,15.0,stepname → 15-Develop
ITEM-000089,Update,stepname,15-Develop,16-Propose,ACTOR-0008,15/01/2026 12:27,2026-01-15T12:27:00Z,ITEM-000089,L1_STAGE,L1,16-Propose,16.0,stepname → 16-Propose
ITEM-000089,Update,stepname,16-Propose,17-Close,ACTOR-0008,15/01/2026 12:27,2026-01-15T12:27:00Z,ITEM-000089,L1_STAGE,L1,17-Close,17.0,stepname → 17-Close
ITEM-000089,Update,new_contracttermmonths,9,12,ACTOR-0003,15/01/2026 12:27,2026-01-15T12:27:00Z,ITEM-000089,L2_MILESTONE,L2,12,,new_contracttermmonths → 12
ITEM-000089,Update,closeprobability,50,75,ACTOR-0003,22/01/2026 05:18,2026-01-22T05:18:00Z,ITEM-000089,L1_STAGE,L1,75,,closeprobability → 75
ITEM-000089,Update,msdyn_forecastcategory,100000001,100000003,ACTOR-0003,22/01/2026 05:18,2026-01-22T05:18:00Z,ITEM-000089,L1_STAGE,L1,100000003,,msdyn_forecastcategory → 100000003
ITEM-000089,Update,estimatedclosedate,12/12/25 0:00,1/30/26 0:00,ACTOR-0003,8/1/26 10:36,2026-08-01T10:36:00Z,ITEM-000089,L1_STAGE,L1,1/30/26 0:00,,estimatedclosedate → 1/30/26 0:00
ITEM-000092,Update,owningbusinessunit,"businessunit,0a4ccfd6-e6d9-e611-80f2-5065f38aba91","businessunit,0a4ccfd6-e6d9-e611-80f2-5065f38aba91",ACTOR-0002,7/10/25 10:46,2025-07-10T10:46:00Z,ITEM-000092,L3_ADMIN,L3,"businessunit,0a4ccfd6-e6d9-e611-80f2-5065f38aba91",,owningbusinessunit changed
ITEM-000092,Update,ownerid,"systemuser,7b9d5323-2ef3-4d52-9d6c-dd45deb05e3b","systemuser,efd3822d-8c8b-4619-8eb9-39ddf9c5c57f",ACTOR-0002,7/10/25 10:46,2025-07-10T10:46:00Z,ITEM-000092,L3_ADMIN,L3,"systemuser,efd3822d-8c8b-4619-8eb9-39ddf9c5c57f",,Owner changed
ITEM-000094,Update,owningbusinessunit,"businessunit,0a4ccfd6-e6d9-e611-80f2-5065f38aba91","businessunit,0a4ccfd6-e6d9-e611-80f2-5065f38aba91",ACTOR-0002,16/10/2025 10:39,2025-10-16T10:39:00Z,ITEM-000094,L3_ADMIN,L3,"businessunit,0a4ccfd6-e6d9-e611-80f2-5065f38aba91",,owningbusinessunit changed
ITEM-000094,Update,ownerid,"systemuser,9ab13e3b-1ff4-4d57-a2c8-d0c8f2ce3f42","systemuser,efd3822d-8c8b-4619-8eb9-39ddf9c5c57f",ACTOR-0002,16/10/2025 10:39,2025-10-16T10:39:00Z,ITEM-000094,L3_ADMIN,L3,"systemuser,efd3822d-8c8b-4619-8eb9-39ddf9c5c57f",,Owner changed
ITEM-000095,Update,owningbusinessunit,"businessunit,0a4ccfd6-e6d9-e611-80f2-5065f38aba91","businessunit,0a4ccfd6-e6d9-e611-80f2-5065f38aba91",ACTOR-0004,26/09/2025 09:20,2025-09-26T09:20:00Z,ITEM-000095,L3_ADMIN,L3,"businessunit,0a4ccfd6-e6d9-e611-80f2-5065f38aba91",,owningbusinessunit changed
ITEM-000095,Update,ownerid,"systemuser,1cba5fd4-6e4e-4e0f-85ff-a6438bc2f2f0","systemuser,b5f00e27-78b3-4a71-90af-5dcef3c25bba",ACTOR-0004,26/09/2025 09:20,2025-09-26T09:20:00Z,ITEM-000095,L3_ADMIN,L3,"systemuser,b5f00e27-78b3-4a71-90af-5dcef3c25bba",,Owner changed
ITEM-000096,Update,owningbusinessunit,"businessunit,0a4ccfd6-e6d9-e611-80f2-5065f38aba91","businessunit,0a4ccfd6-e6d9-e611-80f2-5065f38aba91",ACTOR-0002,1/9/25 9:16,2025-01-09T09:16:00Z,ITEM-000096,L3_ADMIN,L3,"businessunit,0a4ccfd6-e6d9-e611-80f2-5065f38aba91",,owningbusinessunit changed
ITEM-000096,Update,ownerid,"systemuser,b5f00e27-78b3-4a71-90af-5dcef3c25bba","systemuser,efd3822d-8c8b-4619-8eb9-39ddf9c5c57f",ACTOR-0002,1/9/25 9:16,2025-01-09T09:16:00Z,ITEM-000096,L3_ADMIN,L3,"systemuser,efd3822d-8c8b-4619-8eb9-39ddf9c5c57f",,Owner changed
ITEM-000097,Update,owningbusinessunit,"businessunit,0a4ccfd6-e6d9-e611-80f2-5065f38aba91","businessunit,0a4ccfd6-e6d9-e611-80f2-5065f38aba91",ACTOR-0003,28/08/2025 09:32,2025-08-28T09:32:00Z,ITEM-000097,L3_ADMIN,L3,"businessunit,0a4ccfd6-e6d9-e611-80f2-5065f38aba91",,owningbusinessunit changed
ITEM-000097,Update,ownerid,"systemuser,09f34b91-4d86-4fc8-8b41-8af3d91e94bf","systemuser,efd3822d-8c8b-4619-8eb9-39ddf9c5c57f",ACTOR-0003,28/08/2025 09:32,2025-08-28T09:32:00Z,ITEM-000097,L3_ADMIN,L3,"systemuser,efd3822d-8c8b-4619-8eb9-39ddf9c5c57f",,Owner changed
ITEM-000097,Update,estimatedclosedate,8/29/25 0:00,10/31/25 0:00,ACTOR-0003,21/10/2025 12:49,2025-10-21T12:49:00Z,ITEM-000097,L1_STAGE,L1,10/31/25 0:00,,estimatedclosedate → 10/31/25 0:00
ITEM-000097,Update,estimatedclosedate,10/31/25 0:00,9/25/26 0:00,ACTOR-0002,23/10/2025 09:18,2025-10-23T09:18:00Z,ITEM-000097,L1_STAGE,L1,9/25/26 0:00,,estimatedclosedate → 9/25/26 0:00
ITEM-000097,Update,purchaseprocess,,2,ACTOR-0002,23/10/2025 09:25,2025-10-23T09:25:00Z,ITEM-000097,L2_MILESTONE,L2,2,,purchaseprocess → 2
ITEM-000097,Update,new_contracttermmonths,,36,ACTOR-0002,23/10/2025 09:25,2025-10-23T09:25:00Z,ITEM-000097,L2_MILESTONE,L2,36,,new_contracttermmonths → 36
ITEM-000097,Update,purchasetimeframe,,4,ACTOR-0002,23/10/2025 09:25,2025-10-23T09:25:00Z,ITEM-000097,L2_MILESTONE,L2,4,,purchasetimeframe → 4
ITEM-000097,Update,parentaccountid,"account,740d1046-e54c-f011-877a-7c1e5284b4af","account,f62b15a3-dfdf-e611-80f3-5065f38bd451",ACTOR-0003,30/10/2025 15:57,2025-10-30T15:57:00Z,ITEM-000097,L3_ADMIN,L3,"account,f62b15a3-dfdf-e611-80f3-5065f38bd451",,parentaccountid changed
ITEM-000097,Update,customerid,"account,740d1046-e54c-f011-877a-7c1e5284b4af","account,f62b15a3-dfdf-e611-80f3-5065f38bd451",ACTOR-0003,30/10/2025 15:57,2025-10-30T15:57:00Z,ITEM-000097,L3_ADMIN,L3,"account,f62b15a3-dfdf-e611-80f3-5065f38bd451",,customerid changed
ITEM-000097,Update,closeprobability,,25,ACTOR-0002,12/1/26 15:58,2026-12-01T15:58:00Z,ITEM-000097,L1_STAGE,L1,25,,closeprobability → 25
ITEM-000097,Update,the000g__revenuetype,,604720001,ACTOR-0002,12/1/26 15:58,2026-12-01T15:58:00Z,ITEM-000097,L2_MILESTONE,L2,604720001,,the000g__revenuetype → 604720001
ITEM-000098,Update,stepname,,14-Qualify,ACTOR-0008,27/01/2026 15:29,2026-01-27T15:29:00Z,ITEM-000098,L1_STAGE,L1,14-Qualify,14.0,stepname → 14-Qualify
ITEM-000098,Create,statecode,,0,ACTOR-0002,27/01/2026 15:29,2026-01-27T15:29:00Z,ITEM-000098,L1_STAGE,L1,Open,,Case Created
ITEM-000099,Update,estimatedclosedate,11/7/25 0:00,11/10/25 0:00,ACTOR-0002,6/11/25 10:50,2025-06-11T10:50:00Z,ITEM-000099,L1_STAGE,L1,11/10/25 0:00,,estimatedclosedate → 11/10/25 0:00
ITEM-000099,Create,statecode,,0,ACTOR-0002,18/08/2025 14:43,2025-08-18T14:43:00Z,ITEM-000099,L1_STAGE,L1,Open,,Case Created
ITEM-000099,Update,stepname,,14-Qualify,ACTOR-0008,18/08/2025 14:44,2025-08-18T14:44:00Z,ITEM-000099,L1_STAGE,L1,14-Qualify,14.0,stepname → 14-Qualify
ITEM-000099,Update,the000g_revenuetype,604720001,604720000,ACTOR-0002,20/08/2025 15:29,2025-08-20T15:29:00Z,ITEM-000099,L2_MILESTONE,L2,604720000,,the000g_revenuetype → 604720000
ITEM-000099,Update,estimatedclosedate,8/28/25 0:00,9/18/25 0:00,ACTOR-0002,20/08/2025 15:30,2025-08-20T15:30:00Z,ITEM-000099,L1_STAGE,L1,9/18/25 0:00,,estimatedclosedate → 9/18/25 0:00
ITEM-000099,Update,stepname,14-Qualify,15-Develop,ACTOR-0008,29/10/2025 06:41,2025-10-29T06:41:00Z,ITEM-000099,L1_STAGE,L1,15-Develop,15.0,stepname → 15-Develop
ITEM-000099,Update,stepname,15-Develop,16-Propose,ACTOR-0008,29/10/2025 06:41,2025-10-29T06:41:00Z,ITEM-000099,L1_STAGE,L1,16-Propose,16.0,stepname → 16-Propose
ITEM-000099,Update,new_contracttermmonths,,36,ACTOR-0002,29/10/2025 06:42,2025-10-29T06:42:00Z,ITEM-000099,L2_MILESTONE,L2,36,,new_contracttermmonths → 36
ITEM-000099,Update,estimatedclosedate,9/18/25 0:00,10/31/25 0:00,ACTOR-0002,29/10/2025 06:42,2025-10-29T06:42:00Z,ITEM-000099,L1_STAGE,L1,10/31/25 0:00,,estimatedclosedate → 10/31/25 0:00
ITEM-000099,Update,estimatedclosedate,10/31/25 0:00,11/7/25 0:00,ACTOR-0002,30/10/2025 09:57,2025-10-30T09:57:00Z,ITEM-000099,L1_STAGE,L1,11/7/25 0:00,,estimatedclosedate → 11/7/25 0:00
ITEM-000099,Update,msdyn_forecastcategory,100000001,100000005,ACTOR-0002,13/11/2025 14:47,2025-11-13T14:47:00Z,ITEM-000099,L1_STAGE,L1,100000005,,msdyn_forecastcategory → 100000005
ITEM-000099,Update,new_contracttermmonths,36,24,ACTOR-0002,13/11/2025 14:47,2025-11-13T14:47:00Z,ITEM-000099,L2_MILESTONE,L2,24,,new_contracttermmonths → 24
ITEM-000099,Update,closeprobability,75,100,ACTOR-0002,13/11/2025 14:47,2025-11-13T14:47:00Z,ITEM-000099,L1_STAGE,L1,100,,closeprobability → 100
ITEM-000099,Update,stepname,16-Propose,17-Close,ACTOR-0008,13/11/2025 14:48,2025-11-13T14:48:00Z,ITEM-000099,L1_STAGE,L1,17-Close,17.0,stepname → 17-Close
ITEM-000099,Update,statuscode,1,3,ACTOR-0002,13/11/2025 14:49,2025-11-13T14:49:00Z,ITEM-000099,L1_STAGE,L1,Won,,statuscode → Won
ITEM-000099,Update,actualclosedate,,11/13/25 0:00,ACTOR-0002,13/11/2025 14:49,2025-11-13T14:49:00Z,ITEM-000099,L1_STAGE,L1,11/13/25 0:00,,actualclosedate → 11/13/25 0:00
ITEM-000099,Update,salesstage,,3,ACTOR-0002,13/11/2025 14:49,2025-11-13T14:49:00Z,ITEM-000099,L1_STAGE,L1,3,,salesstage → 3
ITEM-000099,Update,statecode,0,1,ACTOR-0002,13/11/2025 14:49,2025-11-13T14:49:00Z,ITEM-000099,L1_STAGE,L1,Won,,statecode → Won
ITEM-000101,Update,stepname,,14-Qualify,ACTOR-0008,7/10/25 13:31,2025-07-10T13:31:00Z,ITEM-000101,L1_STAGE,L1,14-Qualify,14.0,stepname → 14-Qualify
ITEM-000101,Create,statecode,,0,ACTOR-0009,7/10/25 13:31,2025-07-10T13:31:00Z,ITEM-000101,L1_STAGE,L1,Open,,Case Created
ITEM-000102,Update,owningbusinessunit,"businessunit,0a4ccfd6-e6d9-e611-80f2-5065f38aba91","businessunit,0a4ccfd6-e6d9-e611-80f2-5065f38aba91",ACTOR-0002,1/9/25 9:15,2025-01-09T09:15:00Z,ITEM-000102,L3_ADMIN,L3,"businessunit,0a4ccfd6-e6d9-e611-80f2-5065f38aba91",,owningbusinessunit changed
ITEM-000102,Update,ownerid,"systemuser,b5f00e27-78b3-4a71-90af-5dcef3c25bba","systemuser,efd3822d-8c8b-4619-8eb9-39ddf9c5c57f",ACTOR-0002,1/9/25 9:15,2025-01-09T09:15:00Z,ITEM-000102,L3_ADMIN,L3,"systemuser,efd3822d-8c8b-4619-8eb9-39ddf9c5c57f",,Owner changed
ITEM-000104,Update,stepname,,14-Qualify,ACTOR-0008,12/11/25 11:06,2025-12-11T11:06:00Z,ITEM-000104,L1_STAGE,L1,14-Qualify,14.0,stepname → 14-Qualify
ITEM-000104,Create,statecode,,0,ACTOR-0002,12/11/25 11:06,2025-12-11T11:06:00Z,ITEM-000104,L1_STAGE,L1,Open,,Case Created
ITEM-000104,Update,estimatedclosedate,12/17/25 0:00,1/7/26 0:00,ACTOR-0002,15/12/2025 14:34,2025-12-15T14:34:00Z,ITEM-000104,L1_STAGE,L1,1/7/26 0:00,,estimatedclosedate → 1/7/26 0:00
ITEM-000104,Update,the000g__revenuetype,,604720002,ACTOR-0002,18/12/2025 15:45,2025-12-18T15:45:00Z,ITEM-000104,L2_MILESTONE,L2,604720002,,the000g__revenuetype → 604720002
ITEM-000104,Update,estimatedclosedate,1/7/26 0:00,12/19/25 0:00,ACTOR-0002,18/12/2025 15:46,2025-12-18T15:46:00Z,ITEM-000104,L1_STAGE,L1,12/19/25 0:00,,estimatedclosedate → 12/19/25 0:00
ITEM-000104,Update,statuscode,1,3,ACTOR-0002,23/12/2025 09:32,2025-12-23T09:32:00Z,ITEM-000104,L1_STAGE,L1,Won,,statuscode → Won
ITEM-000104,Update,stepname,14-Qualify,15-Develop,ACTOR-0008,23/12/2025 09:32,2025-12-23T09:32:00Z,ITEM-000104,L1_STAGE,L1,15-Develop,15.0,stepname → 15-Develop
ITEM-000104,Update,stepname,15-Develop,16-Propose,ACTOR-0008,23/12/2025 09:32,2025-12-23T09:32:00Z,ITEM-000104,L1_STAGE,L1,16-Propose,16.0,stepname → 16-Propose
ITEM-000104,Update,stepname,16-Propose,17-Close,ACTOR-0008,23/12/2025 09:32,2025-12-23T09:32:00Z,ITEM-000104,L1_STAGE,L1,17-Close,17.0,stepname → 17-Close
ITEM-000104,Update,msdyn_forecastcategory,100000001,100000005,ACTOR-0002,23/12/2025 09:32,2025-12-23T09:32:00Z,ITEM-000104,L1_STAGE,L1,100000005,,msdyn_forecastcategory → 100000005
ITEM-000104,Update,actualclosedate,,12/23/25 0:00,ACTOR-0002,23/12/2025 09:32,2025-12-23T09:32:00Z,ITEM-000104,L1_STAGE,L1,12/23/25 0:00,,actualclosedate → 12/23/25 0:00
ITEM-000104,Update,salesstage,,3,ACTOR-0002,23/12/2025 09:32,2025-12-23T09:32:00Z,ITEM-000104,L1_STAGE,L1,3,,salesstage → 3
ITEM-000104,Update,statecode,0,1,ACTOR-0002,23/12/2025 09:32,2025-12-23T09:32:00Z,ITEM-000104,L1_STAGE,L1,Won,,statecode → Won
ITEM-000106,Update,owningbusinessunit,"businessunit,0a4ccfd6-e6d9-e611-80f2-5065f38aba91","businessunit,0a4ccfd6-e6d9-e611-80f2-5065f38aba91",ACTOR-0004,26/09/2025 09:20,2025-09-26T09:20:00Z,ITEM-000106,L3_ADMIN,L3,"businessunit,0a4ccfd6-e6d9-e611-80f2-5065f38aba91",,owningbusinessunit changed
ITEM-000106,Update,ownerid,"systemuser,1cba5fd4-6e4e-4e0f-85ff-a6438bc2f2f0","systemuser,b5f00e27-78b3-4a71-90af-5dcef3c25bba",ACTOR-0004,26/09/2025 09:20,2025-09-26T09:20:00Z,ITEM-000106,L3_ADMIN,L3,"systemuser,b5f00e27-78b3-4a71-90af-5dcef3c25bba",,Owner changed
ITEM-000107,Update,the000g_revenuetype,,604720001,ACTOR-0003,17/08/2025 13:01,2025-08-17T13:01:00Z,ITEM-000107,L2_MILESTONE,L2,604720001,,the000g_revenuetype → 604720001
ITEM-000107,Update,owningbusinessunit,"businessunit,0a4ccfd6-e6d9-e611-80f2-5065f38aba91","businessunit,0a4ccfd6-e6d9-e611-80f2-5065f38aba91",ACTOR-0003,27/10/2025 11:18,2025-10-27T11:18:00Z,ITEM-000107,L3_ADMIN,L3,"businessunit,0a4ccfd6-e6d9-e611-80f2-5065f38aba91",,owningbusinessunit changed
ITEM-000107,Update,ownerid,"systemuser,2d7fbe83-3f35-4a1d-bc05-1b39dbf446d9","systemuser,efd3822d-8c8b-4619-8eb9-39ddf9c5c57f",ACTOR-0003,27/10/2025 11:18,2025-10-27T11:18:00Z,ITEM-000107,L3_ADMIN,L3,"systemuser,efd3822d-8c8b-4619-8eb9-39ddf9c5c57f",,Owner changed
ITEM-000108,Update,owningbusinessunit,"businessunit,0a4ccfd6-e6d9-e611-80f2-5065f38aba91","businessunit,0a4ccfd6-e6d9-e611-80f2-5065f38aba91",ACTOR-0002,1/9/25 9:16,2025-01-09T09:16:00Z,ITEM-000108,L3_ADMIN,L3,"businessunit,0a4ccfd6-e6d9-e611-80f2-5065f38aba91",,owningbusinessunit changed
ITEM-000108,Update,ownerid,"systemuser,b5f00e27-78b3-4a71-90af-5dcef3c25bba","systemuser,efd3822d-8c8b-4619-8eb9-39ddf9c5c57f",ACTOR-0002,1/9/25 9:16,2025-01-09T09:16:00Z,ITEM-000108,L3_ADMIN,L3,"systemuser,efd3822d-8c8b-4619-8eb9-39ddf9c5c57f",,Owner changed
ITEM-000109,Update,owningbusinessunit,"businessunit,0a4ccfd6-e6d9-e611-80f2-5065f38aba91","businessunit,0a4ccfd6-e6d9-e611-80f2-5065f38aba91",ACTOR-0002,16/10/2025 10:39,2025-10-16T10:39:00Z,ITEM-000109,L3_ADMIN,L3,"businessunit,0a4ccfd6-e6d9-e611-80f2-5065f38aba91",,owningbusinessunit changed
ITEM-000109,Update,ownerid,"systemuser,9ab13e3b-1ff4-4d57-a2c8-d0c8f2ce3f42","systemuser,efd3822d-8c8b-4619-8eb9-39ddf9c5c57f",ACTOR-0002,16/10/2025 10:39,2025-10-16T10:39:00Z,ITEM-000109,L3_ADMIN,L3,"systemuser,efd3822d-8c8b-4619-8eb9-39ddf9c5c57f",,Owner changed
ITEM-000110,Update,stepname,,14-Qualify,ACTOR-0008,8/1/26 11:21,2026-08-01T11:21:00Z,ITEM-000110,L1_STAGE,L1,14-Qualify,14.0,stepname → 14-Qualify
ITEM-000110,Create,statecode,,0,ACTOR-0002,8/1/26 11:21,2026-08-01T11:21:00Z,ITEM-000110,L1_STAGE,L1,Open,,Case Created
ITEM-000110,Update,statuscode,1,4,ACTOR-0002,12/1/26 15:52,2026-12-01T15:52:00Z,ITEM-000110,L1_STAGE,L1,Canceled,,statuscode → Canceled
ITEM-000110,Update,msdyn_forecastcategory,100000001,100000006,ACTOR-0002,12/1/26 15:52,2026-12-01T15:52:00Z,ITEM-000110,L1_STAGE,L1,100000006,,msdyn_forecastcategory → 100000006
ITEM-000110,Update,actualclosedate,,1/12/26 0:00,ACTOR-0002,12/1/26 15:52,2026-12-01T15:52:00Z,ITEM-000110,L1_STAGE,L1,1/12/26 0:00,,actualclosedate → 1/12/26 0:00
ITEM-000110,Update,salesstage,,3,ACTOR-0002,12/1/26 15:52,2026-12-01T15:52:00Z,ITEM-000110,L1_STAGE,L1,3,,salesstage → 3
ITEM-000110,Update,statecode,0,2,ACTOR-0002,12/1/26 15:52,2026-12-01T15:52:00Z,ITEM-000110,L1_STAGE,L1,Lost,,statecode → Lost
ITEM-000114,Update,stepname,,14-Qualify,ACTOR-0008,6/10/25 15:03,2025-06-10T15:03:00Z,ITEM-000114,L1_STAGE,L1,14-Qualify,14.0,stepname → 14-Qualify
ITEM-000114,Create,statecode,,0,ACTOR-0005,6/10/25 15:03,2025-06-10T15:03:00Z,ITEM-000114,L1_STAGE,L1,Open,,Case Created
ITEM-000114,Update,the000g__revenuetype,,604720001,ACTOR-0005,12/1/26 12:36,2026-12-01T12:36:00Z,ITEM-000114,L2_MILESTONE,L2,604720001,,the000g__revenuetype → 604720001
ITEM-000116,Update,stepname,,14-Qualify,ACTOR-0008,16/09/2025 11:03,2025-09-16T11:03:00Z,ITEM-000116,L1_STAGE,L1,14-Qualify,14.0,stepname → 14-Qualify
ITEM-000116,Create,purchasetimeframe,,0,ACTOR-0007,16/09/2025 11:03,2025-09-16T11:03:00Z,ITEM-000116,L2_MILESTONE,L2,0,,Case Created
ITEM-000116,Update,statuscode,1,3,ACTOR-0007,26/09/2025 14:18,2025-09-26T14:18:00Z,ITEM-000116,L1_STAGE,L1,Won,,statuscode → Won
ITEM-000116,Update,msdyn_forecastcategory,100000001,100000005,ACTOR-0007,26/09/2025 14:18,2025-09-26T14:18:00Z,ITEM-000116,L1_STAGE,L1,100000005,,msdyn_forecastcategory → 100000005
ITEM-000116,Update,actualclosedate,,9/26/25 0:00,ACTOR-0007,26/09/2025 14:18,2025-09-26T14:18:00Z,ITEM-000116,L1_STAGE,L1,9/26/25 0:00,,actualclosedate → 9/26/25 0:00
ITEM-000116,Update,salesstage,,3,ACTOR-0007,26/09/2025 14:18,2025-09-26T14:18:00Z,ITEM-000116,L1_STAGE,L1,3,,salesstage → 3
ITEM-000116,Update,statecode,0,1,ACTOR-0007,26/09/2025 14:18,2025-09-26T14:18:00Z,ITEM-000116,L1_STAGE,L1,Won,,statecode → Won
ITEM-000117,Update,stepname,,14-Qualify,ACTOR-0008,17/10/2025 09:12,2025-10-17T09:12:00Z,ITEM-000117,L1_STAGE,L1,14-Qualify,14.0,stepname → 14-Qualify
ITEM-000117,Create,purchasetimeframe,,0,ACTOR-0003,17/10/2025 09:12,2025-10-17T09:12:00Z,ITEM-000117,L2_MILESTONE,L2,0,,Case Created
ITEM-000117,Update,statuscode,1,3,ACTOR-0003,17/10/2025 09:17,2025-10-17T09:17:00Z,ITEM-000117,L1_STAGE,L1,Won,,statuscode → Won
ITEM-000117,Update,msdyn_forecastcategory,100000001,100000005,ACTOR-0003,17/10/2025 09:17,2025-10-17T09:17:00Z,ITEM-000117,L1_STAGE,L1,100000005,,msdyn_forecastcategory → 100000005
ITEM-000117,Update,actualclosedate,,10/17/25 0:00,ACTOR-0003,17/10/2025 09:17,2025-10-17T09:17:00Z,ITEM-000117,L1_STAGE,L1,10/17/25 0:00,,actualclosedate → 10/17/25 0:00
ITEM-000117,Update,salesstage,,3,ACTOR-0003,17/10/2025 09:17,2025-10-17T09:17:00Z,ITEM-000117,L1_STAGE,L1,3,,salesstage → 3
ITEM-000117,Update,statecode,0,1,ACTOR-0003,17/10/2025 09:17,2025-10-17T09:17:00Z,ITEM-000117,L1_STAGE,L1,Won,,statecode → Won
ITEM-000117,Update,statuscode,1,3,ACTOR-0003,17/10/2025 09:22,2025-10-17T09:22:00Z,ITEM-000117,L1_STAGE,L1,Won,,statuscode → Won
ITEM-000117,Update,statuscode,3,1,ACTOR-0003,17/10/2025 09:22,2025-10-17T09:22:00Z,ITEM-000117,L1_STAGE,L1,In Progress,,statuscode → In Progress
ITEM-000117,Update,msdyn_forecastcategory,100000001,100000005,ACTOR-0003,17/10/2025 09:22,2025-10-17T09:22:00Z,ITEM-000117,L1_STAGE,L1,100000005,,msdyn_forecastcategory → 100000005
ITEM-000117,Update,actualclosedate,,10/17/25 0:00,ACTOR-0003,17/10/2025 09:22,2025-10-17T09:22:00Z,ITEM-000117,L1_STAGE,L1,10/17/25 0:00,,actualclosedate → 10/17/25 0:00
ITEM-000117,Update,statecode,0,1,ACTOR-0003,17/10/2025 09:22,2025-10-17T09:22:00Z,ITEM-000117,L1_STAGE,L1,Won,,statecode → Won
ITEM-000117,Update,salesstage,0,3,ACTOR-0003,17/10/2025 09:22,2025-10-17T09:22:00Z,ITEM-000117,L1_STAGE,L1,3,,salesstage → 3
ITEM-000117,Update,msdyn_forecastcategory,100000005,100000001,ACTOR-0003,17/10/2025 09:22,2025-10-17T09:22:00Z,ITEM-000117,L1_STAGE,L1,100000001,,msdyn_forecastcategory → 100000001
ITEM-000117,Update,statecode,1,0,ACTOR-0003,17/10/2025 09:22,2025-10-17T09:22:00Z,ITEM-000117,L1_STAGE,L1,Open,,statecode → Open
ITEM-000117,Update,actualclosedate,10/17/25 0:00,,ACTOR-0003,17/10/2025 09:22,2025-10-17T09:22:00Z,ITEM-000117,L1_STAGE,L1,,,actualclosedate → 
ITEM-000117,Update,salesstage,3,0,ACTOR-0003,17/10/2025 09:22,2025-10-17T09:22:00Z,ITEM-000117,L1_STAGE,L1,0,,salesstage → 0
ITEM-000117,Update,statuscode,3,1,ACTOR-0003,17/10/2025 09:26,2025-10-17T09:26:00Z,ITEM-000117,L1_STAGE,L1,In Progress,,statuscode → In Progress
ITEM-000117,Update,msdyn_forecastcategory,100000005,100000001,ACTOR-0003,17/10/2025 09:26,2025-10-17T09:26:00Z,ITEM-000117,L1_STAGE,L1,100000001,,msdyn_forecastcategory → 100000001
ITEM-000117,Update,statecode,1,0,ACTOR-0003,17/10/2025 09:26,2025-10-17T09:26:00Z,ITEM-000117,L1_STAGE,L1,Open,,statecode → Open
ITEM-000117,Update,actualclosedate,10/17/25 0:00,,ACTOR-0003,17/10/2025 09:26,2025-10-17T09:26:00Z,ITEM-000117,L1_STAGE,L1,,,actualclosedate → 
ITEM-000117,Update,salesstage,3,0,ACTOR-0003,17/10/2025 09:26,2025-10-17T09:26:00Z,ITEM-000117,L1_STAGE,L1,0,,salesstage → 0
ITEM-000117,Update,statuscode,1,3,ACTOR-0003,17/10/2025 09:27,2025-10-17T09:27:00Z,ITEM-000117,L1_STAGE,L1,Won,,statuscode → Won
ITEM-000117,Update,msdyn_forecastcategory,100000001,100000005,ACTOR-0003,17/10/2025 09:27,2025-10-17T09:27:00Z,ITEM-000117,L1_STAGE,L1,100000005,,msdyn_forecastcategory → 100000005
ITEM-000117,Update,actualclosedate,,10/17/25 0:00,ACTOR-0003,17/10/2025 09:27,2025-10-17T09:27:00Z,ITEM-000117,L1_STAGE,L1,10/17/25 0:00,,actualclosedate → 10/17/25 0:00
ITEM-000117,Update,statecode,0,1,ACTOR-0003,17/10/2025 09:27,2025-10-17T09:27:00Z,ITEM-000117,L1_STAGE,L1,Won,,statecode → Won
ITEM-000117,Update,salesstage,0,3,ACTOR-0003,17/10/2025 09:27,2025-10-17T09:27:00Z,ITEM-000117,L1_STAGE,L1,3,,salesstage → 3
ITEM-000117,Update,statuscode,1,3,ACTOR-0003,17/10/2025 09:38,2025-10-17T09:38:00Z,ITEM-000117,L1_STAGE,L1,Won,,statuscode → Won
ITEM-000117,Update,statuscode,3,1,ACTOR-0003,17/10/2025 09:38,2025-10-17T09:38:00Z,ITEM-000117,L1_STAGE,L1,In Progress,,statuscode → In Progress
ITEM-000117,Update,msdyn_forecastcategory,100000001,100000005,ACTOR-0003,17/10/2025 09:38,2025-10-17T09:38:00Z,ITEM-000117,L1_STAGE,L1,100000005,,msdyn_forecastcategory → 100000005
ITEM-000117,Update,actualclosedate,,10/17/25 0:00,ACTOR-0003,17/10/2025 09:38,2025-10-17T09:38:00Z,ITEM-000117,L1_STAGE,L1,10/17/25 0:00,,actualclosedate → 10/17/25 0:00
ITEM-000117,Update,statecode,0,1,ACTOR-0003,17/10/2025 09:38,2025-10-17T09:38:00Z,ITEM-000117,L1_STAGE,L1,Won,,statecode → Won
ITEM-000117,Update,salesstage,0,3,ACTOR-0003,17/10/2025 09:38,2025-10-17T09:38:00Z,ITEM-000117,L1_STAGE,L1,3,,salesstage → 3
ITEM-000117,Update,msdyn_forecastcategory,100000005,100000001,ACTOR-0003,17/10/2025 09:38,2025-10-17T09:38:00Z,ITEM-000117,L1_STAGE,L1,100000001,,msdyn_forecastcategory → 100000001
ITEM-000117,Update,statecode,1,0,ACTOR-0003,17/10/2025 09:38,2025-10-17T09:38:00Z,ITEM-000117,L1_STAGE,L1,Open,,statecode → Open
ITEM-000117,Update,actualclosedate,10/17/25 0:00,,ACTOR-0003,17/10/2025 09:38,2025-10-17T09:38:00Z,ITEM-000117,L1_STAGE,L1,,,actualclosedate → 
ITEM-000117,Update,salesstage,3,0,ACTOR-0003,17/10/2025 09:38,2025-10-17T09:38:00Z,ITEM-000117,L1_STAGE,L1,0,,salesstage → 0
ITEM-000117,Update,statuscode,1,3,ACTOR-0003,17/10/2025 09:43,2025-10-17T09:43:00Z,ITEM-000117,L1_STAGE,L1,Won,,statuscode → Won
ITEM-000117,Update,statuscode,3,1,ACTOR-0003,17/10/2025 09:43,2025-10-17T09:43:00Z,ITEM-000117,L1_STAGE,L1,In Progress,,statuscode → In Progress
ITEM-000117,Update,msdyn_forecastcategory,100000001,100000005,ACTOR-0003,17/10/2025 09:43,2025-10-17T09:43:00Z,ITEM-000117,L1_STAGE,L1,100000005,,msdyn_forecastcategory → 100000005
ITEM-000117,Update,actualclosedate,,10/17/25 0:00,ACTOR-0003,17/10/2025 09:43,2025-10-17T09:43:00Z,ITEM-000117,L1_STAGE,L1,10/17/25 0:00,,actualclosedate → 10/17/25 0:00
ITEM-000117,Update,statecode,0,1,ACTOR-0003,17/10/2025 09:43,2025-10-17T09:43:00Z,ITEM-000117,L1_STAGE,L1,Won,,statecode → Won
ITEM-000117,Update,salesstage,0,3,ACTOR-0003,17/10/2025 09:43,2025-10-17T09:43:00Z,ITEM-000117,L1_STAGE,L1,3,,salesstage → 3
ITEM-000117,Update,msdyn_forecastcategory,100000005,100000001,ACTOR-0003,17/10/2025 09:43,2025-10-17T09:43:00Z,ITEM-000117,L1_STAGE,L1,100000001,,msdyn_forecastcategory → 100000001
ITEM-000117,Update,statecode,1,0,ACTOR-0003,17/10/2025 09:43,2025-10-17T09:43:00Z,ITEM-000117,L1_STAGE,L1,Open,,statecode → Open
ITEM-000117,Update,actualclosedate,10/17/25 0:00,,ACTOR-0003,17/10/2025 09:43,2025-10-17T09:43:00Z,ITEM-000117,L1_STAGE,L1,,,actualclosedate → 
ITEM-000117,Update,salesstage,3,0,ACTOR-0003,17/10/2025 09:43,2025-10-17T09:43:00Z,ITEM-000117,L1_STAGE,L1,0,,salesstage → 0
ITEM-000117,Update,statuscode,3,1,ACTOR-0003,17/10/2025 10:00,2025-10-17T10:00:00Z,ITEM-000117,L1_STAGE,L1,In Progress,,statuscode → In Progress
ITEM-000117,Update,msdyn_forecastcategory,100000005,100000001,ACTOR-0003,17/10/2025 10:00,2025-10-17T10:00:00Z,ITEM-000117,L1_STAGE,L1,100000001,,msdyn_forecastcategory → 100000001
ITEM-000117,Update,statecode,1,0,ACTOR-0003,17/10/2025 10:00,2025-10-17T10:00:00Z,ITEM-000117,L1_STAGE,L1,Open,,statecode → Open
ITEM-000117,Update,actualclosedate,10/17/25 0:00,,ACTOR-0003,17/10/2025 10:00,2025-10-17T10:00:00Z,ITEM-000117,L1_STAGE,L1,,,actualclosedate → 
ITEM-000117,Update,salesstage,3,0,ACTOR-0003,17/10/2025 10:00,2025-10-17T10:00:00Z,ITEM-000117,L1_STAGE,L1,0,,salesstage → 0
ITEM-000117,Update,statuscode,1,3,ACTOR-0003,17/10/2025 10:01,2025-10-17T10:01:00Z,ITEM-000117,L1_STAGE,L1,Won,,statuscode → Won
ITEM-000117,Update,msdyn_forecastcategory,100000001,100000005,ACTOR-0003,17/10/2025 10:01,2025-10-17T10:01:00Z,ITEM-000117,L1_STAGE,L1,100000005,,msdyn_forecastcategory → 100000005
ITEM-000117,Update,actualclosedate,,10/17/25 0:00,ACTOR-0003,17/10/2025 10:01,2025-10-17T10:01:00Z,ITEM-000117,L1_STAGE,L1,10/17/25 0:00,,actualclosedate → 10/17/25 0:00
ITEM-000117,Update,statecode,0,1,ACTOR-0003,17/10/2025 10:01,2025-10-17T10:01:00Z,ITEM-000117,L1_STAGE,L1,Won,,statecode → Won
ITEM-000117,Update,salesstage,0,3,ACTOR-0003,17/10/2025 10:01,2025-10-17T10:01:00Z,ITEM-000117,L1_STAGE,L1,3,,salesstage → 3
ITEM-000117,Update,statuscode,3,1,ACTOR-0003,17/10/2025 10:03,2025-10-17T10:03:00Z,ITEM-000117,L1_STAGE,L1,In Progress,,statuscode → In Progress
ITEM-000117,Update,msdyn_forecastcategory,100000005,100000001,ACTOR-0003,17/10/2025 10:03,2025-10-17T10:03:00Z,ITEM-000117,L1_STAGE,L1,100000001,,msdyn_forecastcategory → 100000001
ITEM-000117,Update,statecode,1,0,ACTOR-0003,17/10/2025 10:03,2025-10-17T10:03:00Z,ITEM-000117,L1_STAGE,L1,Open,,statecode → Open
ITEM-000117,Update,actualclosedate,10/17/25 0:00,,ACTOR-0003,17/10/2025 10:03,2025-10-17T10:03:00Z,ITEM-000117,L1_STAGE,L1,,,actualclosedate → 
ITEM-000117,Update,salesstage,3,0,ACTOR-0003,17/10/2025 10:03,2025-10-17T10:03:00Z,ITEM-000117,L1_STAGE,L1,0,,salesstage → 0
ITEM-000117,Update,statuscode,1,3,ACTOR-0003,17/10/2025 10:10,2025-10-17T10:10:00Z,ITEM-000117,L1_STAGE,L1,Won,,statuscode → Won
ITEM-000117,Update,msdyn_forecastcategory,100000001,100000005,ACTOR-0003,17/10/2025 10:10,2025-10-17T10:10:00Z,ITEM-000117,L1_STAGE,L1,100000005,,msdyn_forecastcategory → 100000005
ITEM-000117,Update,actualclosedate,,10/17/25 0:00,ACTOR-0003,17/10/2025 10:10,2025-10-17T10:10:00Z,ITEM-000117,L1_STAGE,L1,10/17/25 0:00,,actualclosedate → 10/17/25 0:00
ITEM-000117,Update,statecode,0,1,ACTOR-0003,17/10/2025 10:10,2025-10-17T10:10:00Z,ITEM-000117,L1_STAGE,L1,Won,,statecode → Won
ITEM-000117,Update,salesstage,0,3,ACTOR-0003,17/10/2025 10:10,2025-10-17T10:10:00Z,ITEM-000117,L1_STAGE,L1,3,,salesstage → 3
ITEM-000117,Update,statuscode,1,3,ACTOR-0003,17/10/2025 10:20,2025-10-17T10:20:00Z,ITEM-000117,L1_STAGE,L1,Won,,statuscode → Won
ITEM-000117,Update,statuscode,3,1,ACTOR-0003,17/10/2025 10:20,2025-10-17T10:20:00Z,ITEM-000117,L1_STAGE,L1,In Progress,,statuscode → In Progress
ITEM-000117,Update,msdyn_forecastcategory,100000001,100000005,ACTOR-0003,17/10/2025 10:20,2025-10-17T10:20:00Z,ITEM-000117,L1_STAGE,L1,100000005,,msdyn_forecastcategory → 100000005
ITEM-000117,Update,actualclosedate,,10/17/25 0:00,ACTOR-0003,17/10/2025 10:20,2025-10-17T10:20:00Z,ITEM-000117,L1_STAGE,L1,10/17/25 0:00,,actualclosedate → 10/17/25 0:00
ITEM-000117,Update,statecode,0,1,ACTOR-0003,17/10/2025 10:20,2025-10-17T10:20:00Z,ITEM-000117,L1_STAGE,L1,Won,,statecode → Won
ITEM-000117,Update,salesstage,0,3,ACTOR-0003,17/10/2025 10:20,2025-10-17T10:20:00Z,ITEM-000117,L1_STAGE,L1,3,,salesstage → 3
ITEM-000117,Update,msdyn_forecastcategory,100000005,100000001,ACTOR-0003,17/10/2025 10:20,2025-10-17T10:20:00Z,ITEM-000117,L1_STAGE,L1,100000001,,msdyn_forecastcategory → 100000001
ITEM-000117,Update,statecode,1,0,ACTOR-0003,17/10/2025 10:20,2025-10-17T10:20:00Z,ITEM-000117,L1_STAGE,L1,Open,,statecode → Open
ITEM-000117,Update,actualclosedate,10/17/25 0:00,,ACTOR-0003,17/10/2025 10:20,2025-10-17T10:20:00Z,ITEM-000117,L1_STAGE,L1,,,actualclosedate → 
ITEM-000117,Update,salesstage,3,0,ACTOR-0003,17/10/2025 10:20,2025-10-17T10:20:00Z,ITEM-000117,L1_STAGE,L1,0,,salesstage → 0
ITEM-000117,Update,statuscode,3,1,ACTOR-0003,17/10/2025 10:33,2025-10-17T10:33:00Z,ITEM-000117,L1_STAGE,L1,In Progress,,statuscode → In Progress
ITEM-000117,Update,msdyn_forecastcategory,100000005,100000001,ACTOR-0003,17/10/2025 10:33,2025-10-17T10:33:00Z,ITEM-000117,L1_STAGE,L1,100000001,,msdyn_forecastcategory → 100000001
ITEM-000117,Update,statecode,1,0,ACTOR-0003,17/10/2025 10:33,2025-10-17T10:33:00Z,ITEM-000117,L1_STAGE,L1,Open,,statecode → Open
ITEM-000117,Update,actualclosedate,10/17/25 0:00,,ACTOR-0003,17/10/2025 10:33,2025-10-17T10:33:00Z,ITEM-000117,L1_STAGE,L1,,,actualclosedate → 
ITEM-000117,Update,salesstage,3,0,ACTOR-0003,17/10/2025 10:33,2025-10-17T10:33:00Z,ITEM-000117,L1_STAGE,L1,0,,salesstage → 0
ITEM-000117,Update,statuscode,1,3,ACTOR-0003,17/10/2025 10:34,2025-10-17T10:34:00Z,ITEM-000117,L1_STAGE,L1,Won,,statuscode → Won
ITEM-000117,Update,msdyn_forecastcategory,100000001,100000005,ACTOR-0003,17/10/2025 10:34,2025-10-17T10:34:00Z,ITEM-000117,L1_STAGE,L1,100000005,,msdyn_forecastcategory → 100000005
ITEM-000117,Update,actualclosedate,,10/17/25 0:00,ACTOR-0003,17/10/2025 10:34,2025-10-17T10:34:00Z,ITEM-000117,L1_STAGE,L1,10/17/25 0:00,,actualclosedate → 10/17/25 0:00
ITEM-000117,Update,statecode,0,1,ACTOR-0003,17/10/2025 10:34,2025-10-17T10:34:00Z,ITEM-000117,L1_STAGE,L1,Won,,statecode → Won
ITEM-000117,Update,salesstage,0,3,ACTOR-0003,17/10/2025 10:34,2025-10-17T10:34:00Z,ITEM-000117,L1_STAGE,L1,3,,salesstage → 3
ITEM-000120,Update,the000g_revenuetype,,604720001,ACTOR-0009,6/10/25 9:53,2025-06-10T09:53:00Z,ITEM-000120,L2_MILESTONE,L2,604720001,,the000g_revenuetype → 604720001
ITEM-000120,Update,the000g_isrenewal,,FALSE,ACTOR-0009,6/10/25 9:53,2025-06-10T09:53:00Z,ITEM-000120,L3_ADMIN,L3,FALSE,,the000g_isrenewal changed
ITEM-000120,Update,estimatedclosedate,10/15/25 0:00,1/29/26 0:00,ACTOR-0009,6/10/25 9:53,2025-06-10T09:53:00Z,ITEM-000120,L1_STAGE,L1,1/29/26 0:00,,estimatedclosedate → 1/29/26 0:00
ITEM-000120,Update,the000g__revenuetype,,604720002,ACTOR-0009,26/01/2026 15:35,2026-01-26T15:35:00Z,ITEM-000120,L2_MILESTONE,L2,604720002,,the000g__revenuetype → 604720002
ITEM-000120,Update,estimatedclosedate,2/20/26 0:00,5/13/26 0:00,ACTOR-0009,26/01/2026 15:35,2026-01-26T15:35:00Z,ITEM-000120,L1_STAGE,L1,5/13/26 0:00,,estimatedclosedate → 5/13/26 0:00
ITEM-000120,Update,estimatedclosedate,1/29/26 0:00,2/20/26 0:00,ACTOR-0003,5/1/26 15:28,2026-05-01T15:28:00Z,ITEM-000120,L1_STAGE,L1,2/20/26 0:00,,estimatedclosedate → 2/20/26 0:00
ITEM-000120,Update,closeprobability,,25,ACTOR-0003,5/1/26 15:28,2026-05-01T15:28:00Z,ITEM-000120,L1_STAGE,L1,25,,closeprobability → 25
ITEM-000121,Update,stepname,,14-Qualify,ACTOR-0008,10/10/25 11:03,2025-10-10T11:03:00Z,ITEM-000121,L1_STAGE,L1,14-Qualify,14.0,stepname → 14-Qualify
ITEM-000121,Create,statecode,,0,ACTOR-0009,10/10/25 11:03,2025-10-10T11:03:00Z,ITEM-000121,L1_STAGE,L1,Open,,Case Created
ITEM-000121,Update,the000g__revenuetype,,604720001,ACTOR-0009,18/12/2025 09:20,2025-12-18T09:20:00Z,ITEM-000121,L2_MILESTONE,L2,604720001,,the000g__revenuetype → 604720001
ITEM-000121,Update,estimatedclosedate,11/20/25 0:00,12/31/25 0:00,ACTOR-0009,18/12/2025 09:20,2025-12-18T09:20:00Z,ITEM-000121,L1_STAGE,L1,12/31/25 0:00,,estimatedclosedate → 12/31/25 0:00
ITEM-000121,Update,stepname,14-Qualify,,ACTOR-0003,5/1/26 15:18,2026-05-01T15:18:00Z,ITEM-000121,L1_STAGE,L1,,,stepname → 
ITEM-000121,Update,estimatedclosedate,12/31/25 0:00,1/9/26 0:00,ACTOR-0003,5/1/26 15:18,2026-05-01T15:18:00Z,ITEM-000121,L1_STAGE,L1,1/9/26 0:00,,estimatedclosedate → 1/9/26 0:00
ITEM-000121,Update,stepname,,15-Develop,ACTOR-0008,5/1/26 15:19,2026-05-01T15:19:00Z,ITEM-000121,L1_STAGE,L1,15-Develop,15.0,stepname → 15-Develop
ITEM-000121,Update,stepname,15-Develop,16-Propose,ACTOR-0008,5/1/26 15:19,2026-05-01T15:19:00Z,ITEM-000121,L1_STAGE,L1,16-Propose,16.0,stepname → 16-Propose
ITEM-000121,Update,stepname,16-Propose,17-Close,ACTOR-0008,5/1/26 15:19,2026-05-01T15:19:00Z,ITEM-000121,L1_STAGE,L1,17-Close,17.0,stepname → 17-Close
ITEM-000121,Update,closeprobability,,100,ACTOR-0003,5/1/26 15:19,2026-05-01T15:19:00Z,ITEM-000121,L1_STAGE,L1,100,,closeprobability → 100
ITEM-000121,Update,stepname,17-Close,,ACTOR-0003,5/1/26 15:19,2026-05-01T15:19:00Z,ITEM-000121,L1_STAGE,L1,,,stepname → 
ITEM-000121,Update,purchasetimeframe,,1,ACTOR-0003,5/1/26 15:19,2026-05-01T15:19:00Z,ITEM-000121,L2_MILESTONE,L2,1,,purchasetimeframe → 1
ITEM-000121,Update,stepname,,17-Close,ACTOR-0003,5/1/26 15:22,2026-05-01T15:22:00Z,ITEM-000121,L1_STAGE,L1,17-Close,17.0,stepname → 17-Close
ITEM-000121,Update,msdyn_forecastcategory,100000001,100000003,ACTOR-0003,5/1/26 15:36,2026-05-01T15:36:00Z,ITEM-000121,L1_STAGE,L1,100000003,,msdyn_forecastcategory → 100000003
ITEM-000121,Update,statuscode,1,3,ACTOR-0009,12/1/26 10:28,2026-12-01T10:28:00Z,ITEM-000121,L1_STAGE,L1,Won,,statuscode → Won
ITEM-000121,Update,msdyn_forecastcategory,100000003,100000005,ACTOR-0009,12/1/26 10:28,2026-12-01T10:28:00Z,ITEM-000121,L1_STAGE,L1,100000005,,msdyn_forecastcategory → 100000005
ITEM-000121,Update,actualclosedate,,1/12/26 0:00,ACTOR-0009,12/1/26 10:28,2026-12-01T10:28:00Z,ITEM-000121,L1_STAGE,L1,1/12/26 0:00,,actualclosedate → 1/12/26 0:00
ITEM-000121,Update,salesstage,,3,ACTOR-0009,12/1/26 10:28,2026-12-01T10:28:00Z,ITEM-000121,L1_STAGE,L1,3,,salesstage → 3
ITEM-000121,Update,statecode,0,1,ACTOR-0009,12/1/26 10:28,2026-12-01T10:28:00Z,ITEM-000121,L1_STAGE,L1,Won,,statecode → Won
ITEM-000123,Update,stepname,,14-Qualify,ACTOR-0008,28/08/2025 09:26,2025-08-28T09:26:00Z,ITEM-000123,L1_STAGE,L1,14-Qualify,14.0,stepname → 14-Qualify
ITEM-000123,Create,statecode,,0,ACTOR-0009,28/08/2025 09:26,2025-08-28T09:26:00Z,ITEM-000123,L1_STAGE,L1,Open,,Case Created
ITEM-000123,Update,estimatedclosedate,11/19/25 0:00,3/18/26 0:00,ACTOR-0009,29/10/2025 09:20,2025-10-29T09:20:00Z,ITEM-000123,L1_STAGE,L1,3/18/26 0:00,,estimatedclosedate → 3/18/26 0:00
ITEM-000123,Update,closeprobability,,25,ACTOR-0003,5/1/26 15:55,2026-05-01T15:55:00Z,ITEM-000123,L1_STAGE,L1,25,,closeprobability → 25
ITEM-000124,Create,statecode,,0,ACTOR-0003,13/08/2025 10:11,2025-08-13T10:11:00Z,ITEM-000124,L1_STAGE,L1,Open,,Case Created
ITEM-000124,Update,stepname,,14-Qualify,ACTOR-0008,13/08/2025 10:12,2025-08-13T10:12:00Z,ITEM-000124,L1_STAGE,L1,14-Qualify,14.0,stepname → 14-Qualify
ITEM-000124,Update,estimatedclosedate,9/12/25 0:00,10/24/25 0:00,ACTOR-0003,17/10/2025 09:01,2025-10-17T09:01:00Z,ITEM-000124,L1_STAGE,L1,10/24/25 0:00,,estimatedclosedate → 10/24/25 0:00
ITEM-000124,Update,estimatedclosedate,10/24/25 0:00,1/9/26 0:00,ACTOR-0003,17/10/2025 12:15,2025-10-17T12:15:00Z,ITEM-000124,L1_STAGE,L1,1/9/26 0:00,,estimatedclosedate → 1/9/26 0:00
ITEM-000124,Update,statuscode,1,4,ACTOR-0003,13/01/2026 08:17,2026-01-13T08:17:00Z,ITEM-000124,L1_STAGE,L1,Canceled,,statuscode → Canceled
ITEM-000124,Update,msdyn_forecastcategory,100000002,100000006,ACTOR-0003,13/01/2026 08:17,2026-01-13T08:17:00Z,ITEM-000124,L1_STAGE,L1,100000006,,msdyn_forecastcategory → 100000006
ITEM-000124,Update,actualclosedate,,1/13/26 0:00,ACTOR-0003,13/01/2026 08:17,2026-01-13T08:17:00Z,ITEM-000124,L1_STAGE,L1,1/13/26 0:00,,actualclosedate → 1/13/26 0:00
ITEM-000124,Update,salesstage,,3,ACTOR-0003,13/01/2026 08:17,2026-01-13T08:17:00Z,ITEM-000124,L1_STAGE,L1,3,,salesstage → 3
ITEM-000124,Update,statecode,0,2,ACTOR-0003,13/01/2026 08:17,2026-01-13T08:17:00Z,ITEM-000124,L1_STAGE,L1,Lost,,statecode → Lost
ITEM-000124,Update,the000g__revenuetype,,604720001,ACTOR-0003,13/01/2026 08:17,2026-01-13T08:17:00Z,ITEM-000124,L2_MILESTONE,L2,604720001,,the000g__revenuetype → 604720001
ITEM-000124,Update,estimatedclosedate,1/9/26 0:00,1/30/26 0:00,ACTOR-0003,12/1/26 17:12,2026-12-01T17:12:00Z,ITEM-000124,L1_STAGE,L1,1/30/26 0:00,,estimatedclosedate → 1/30/26 0:00
ITEM-000124,Update,stepname,14-Qualify,15-Develop,ACTOR-0003,12/1/26 17:13,2026-12-01T17:13:00Z,ITEM-000124,L1_STAGE,L1,15-Develop,15.0,stepname → 15-Develop
ITEM-000124,Update,msdyn_forecastcategory,100000001,100000002,ACTOR-0003,12/1/26 17:13,2026-12-01T17:13:00Z,ITEM-000124,L1_STAGE,L1,100000002,,msdyn_forecastcategory → 100000002
ITEM-000126,Update,the000g_revenuetype,,604720000,ACTOR-0003,17/08/2025 12:53,2025-08-17T12:53:00Z,ITEM-000126,L2_MILESTONE,L2,604720000,,the000g_revenuetype → 604720000
ITEM-000126,Update,owningbusinessunit,"businessunit,0a4ccfd6-e6d9-e611-80f2-5065f38aba91","businessunit,0a4ccfd6-e6d9-e611-80f2-5065f38aba91",ACTOR-0004,26/09/2025 09:21,2025-09-26T09:21:00Z,ITEM-000126,L3_ADMIN,L3,"businessunit,0a4ccfd6-e6d9-e611-80f2-5065f38aba91",,owningbusinessunit changed
ITEM-000126,Update,ownerid,"systemuser,09f34b91-4d86-4fc8-8b41-8af3d91e94bf","systemuser,b5f00e27-78b3-4a71-90af-5dcef3c25bba",ACTOR-0004,26/09/2025 09:21,2025-09-26T09:21:00Z,ITEM-000126,L3_ADMIN,L3,"systemuser,b5f00e27-78b3-4a71-90af-5dcef3c25bba",,Owner changed
ITEM-000127,Create,statecode,,0,ACTOR-0007,18/09/2025 11:31,2025-09-18T11:31:00Z,ITEM-000127,L1_STAGE,L1,Open,,Case Created
ITEM-000127,Update,stepname,,14-Qualify,ACTOR-0008,18/09/2025 11:32,2025-09-18T11:32:00Z,ITEM-000127,L1_STAGE,L1,14-Qualify,14.0,stepname → 14-Qualify
ITEM-000127,Update,purchasetimeframe,,0,ACTOR-0007,18/09/2025 11:33,2025-09-18T11:33:00Z,ITEM-000127,L2_MILESTONE,L2,0,,purchasetimeframe → 0
ITEM-000127,Update,statuscode,1,3,ACTOR-0007,26/09/2025 14:26,2025-09-26T14:26:00Z,ITEM-000127,L1_STAGE,L1,Won,,statuscode → Won
ITEM-000127,Update,msdyn_forecastcategory,100000001,100000005,ACTOR-0007,26/09/2025 14:26,2025-09-26T14:26:00Z,ITEM-000127,L1_STAGE,L1,100000005,,msdyn_forecastcategory → 100000005
ITEM-000127,Update,actualclosedate,,9/26/25 0:00,ACTOR-0007,26/09/2025 14:26,2025-09-26T14:26:00Z,ITEM-000127,L1_STAGE,L1,9/26/25 0:00,,actualclosedate → 9/26/25 0:00
ITEM-000127,Update,salesstage,,3,ACTOR-0007,26/09/2025 14:26,2025-09-26T14:26:00Z,ITEM-000127,L1_STAGE,L1,3,,salesstage → 3
ITEM-000127,Update,statecode,0,1,ACTOR-0007,26/09/2025 14:26,2025-09-26T14:26:00Z,ITEM-000127,L1_STAGE,L1,Won,,statecode → Won
ITEM-000129,Update,stepname,,14-Qualify,ACTOR-0008,30/10/2025 09:02,2025-10-30T09:02:00Z,ITEM-000129,L1_STAGE,L1,14-Qualify,14.0,stepname → 14-Qualify
ITEM-000129,Create,statecode,,0,ACTOR-0009,30/10/2025 09:02,2025-10-30T09:02:00Z,ITEM-000129,L1_STAGE,L1,Open,,Case Created
ITEM-000129,Update,statuscode,1,4,ACTOR-0009,18/12/2025 09:17,2025-12-18T09:17:00Z,ITEM-000129,L1_STAGE,L1,Canceled,,statuscode → Canceled
ITEM-000129,Update,msdyn_forecastcategory,100000001,100000006,ACTOR-0009,18/12/2025 09:17,2025-12-18T09:17:00Z,ITEM-000129,L1_STAGE,L1,100000006,,msdyn_forecastcategory → 100000006
ITEM-000129,Update,actualclosedate,,12/18/25 0:00,ACTOR-0009,18/12/2025 09:17,2025-12-18T09:17:00Z,ITEM-000129,L1_STAGE,L1,12/18/25 0:00,,actualclosedate → 12/18/25 0:00
ITEM-000129,Update,salesstage,,3,ACTOR-0009,18/12/2025 09:17,2025-12-18T09:17:00Z,ITEM-000129,L1_STAGE,L1,3,,salesstage → 3
ITEM-000129,Update,statecode,0,2,ACTOR-0009,18/12/2025 09:17,2025-12-18T09:17:00Z,ITEM-000129,L1_STAGE,L1,Lost,,statecode → Lost
ITEM-000130,Update,stepname,,14-Qualify,ACTOR-0008,13/01/2026 10:40,2026-01-13T10:40:00Z,ITEM-000130,L1_STAGE,L1,14-Qualify,14.0,stepname → 14-Qualify
ITEM-000130,Create,statecode,,0,ACTOR-0009,13/01/2026 10:40,2026-01-13T10:40:00Z,ITEM-000130,L1_STAGE,L1,Open,,Case Created
ITEM-000134,Update,stepname,,14-Qualify,ACTOR-0008,15/10/2025 13:26,2025-10-15T13:26:00Z,ITEM-000134,L1_STAGE,L1,14-Qualify,14.0,stepname → 14-Qualify
ITEM-000134,Create,statecode,,0,ACTOR-0009,15/10/2025 13:26,2025-10-15T13:26:00Z,ITEM-000134,L1_STAGE,L1,Open,,Case Created
ITEM-000136,Update,owningbusinessunit,"businessunit,0a4ccfd6-e6d9-e611-80f2-5065f38aba91","businessunit,0a4ccfd6-e6d9-e611-80f2-5065f38aba91",ACTOR-0003,27/10/2025 11:18,2025-10-27T11:18:00Z,ITEM-000136,L3_ADMIN,L3,"businessunit,0a4ccfd6-e6d9-e611-80f2-5065f38aba91",,owningbusinessunit changed
ITEM-000136,Update,ownerid,"systemuser,2d7fbe83-3f35-4a1d-bc05-1b39dbf446d9","systemuser,efd3822d-8c8b-4619-8eb9-39ddf9c5c57f",ACTOR-0003,27/10/2025 11:18,2025-10-27T11:18:00Z,ITEM-000136,L3_ADMIN,L3,"systemuser,efd3822d-8c8b-4619-8eb9-39ddf9c5c57f",,Owner changed
ITEM-000137,Update,owningbusinessunit,"businessunit,0a4ccfd6-e6d9-e611-80f2-5065f38aba91","businessunit,0a4ccfd6-e6d9-e611-80f2-5065f38aba91",ACTOR-0002,16/10/2025 10:39,2025-10-16T10:39:00Z,ITEM-000137,L3_ADMIN,L3,"businessunit,0a4ccfd6-e6d9-e611-80f2-5065f38aba91",,owningbusinessunit changed
ITEM-000137,Update,ownerid,"systemuser,9ab13e3b-1ff4-4d57-a2c8-d0c8f2ce3f42","systemuser,efd3822d-8c8b-4619-8eb9-39ddf9c5c57f",ACTOR-0002,16/10/2025 10:39,2025-10-16T10:39:00Z,ITEM-000137,L3_ADMIN,L3,"systemuser,efd3822d-8c8b-4619-8eb9-39ddf9c5c57f",,Owner changed
ITEM-000138,Update,stepname,,14-Qualify,ACTOR-0008,16/09/2025 10:58,2025-09-16T10:58:00Z,ITEM-000138,L1_STAGE,L1,14-Qualify,14.0,stepname → 14-Qualify
ITEM-000138,Create,purchasetimeframe,,0,ACTOR-0007,16/09/2025 10:58,2025-09-16T10:58:00Z,ITEM-000138,L2_MILESTONE,L2,0,,Case Created
ITEM-000138,Update,statuscode,1,3,ACTOR-0007,26/09/2025 14:18,2025-09-26T14:18:00Z,ITEM-000138,L1_STAGE,L1,Won,,statuscode → Won
ITEM-000138,Update,msdyn_forecastcategory,100000001,100000005,ACTOR-0007,26/09/2025 14:18,2025-09-26T14:18:00Z,ITEM-000138,L1_STAGE,L1,100000005,,msdyn_forecastcategory → 100000005
ITEM-000138,Update,actualclosedate,,9/26/25 0:00,ACTOR-0007,26/09/2025 14:18,2025-09-26T14:18:00Z,ITEM-000138,L1_STAGE,L1,9/26/25 0:00,,actualclosedate → 9/26/25 0:00
ITEM-000138,Update,salesstage,,3,ACTOR-0007,26/09/2025 14:18,2025-09-26T14:18:00Z,ITEM-000138,L1_STAGE,L1,3,,salesstage → 3
ITEM-000138,Update,statecode,0,1,ACTOR-0007,26/09/2025 14:18,2025-09-26T14:18:00Z,ITEM-000138,L1_STAGE,L1,Won,,statecode → Won
ITEM-000139,Update,owningbusinessunit,"businessunit,0a4ccfd6-e6d9-e611-80f2-5065f38aba91","businessunit,0a4ccfd6-e6d9-e611-80f2-5065f38aba91",ACTOR-0003,27/10/2025 11:18,2025-10-27T11:18:00Z,ITEM-000139,L3_ADMIN,L3,"businessunit,0a4ccfd6-e6d9-e611-80f2-5065f38aba91",,owningbusinessunit changed
ITEM-000139,Update,ownerid,"systemuser,2d7fbe83-3f35-4a1d-bc05-1b39dbf446d9","systemuser,efd3822d-8c8b-4619-8eb9-39ddf9c5c57f",ACTOR-0003,27/10/2025 11:18,2025-10-27T11:18:00Z,ITEM-000139,L3_ADMIN,L3,"systemuser,efd3822d-8c8b-4619-8eb9-39ddf9c5c57f",,Owner changed
ITEM-000143,Update,owningbusinessunit,"businessunit,0a4ccfd6-e6d9-e611-80f2-5065f38aba91","businessunit,0a4ccfd6-e6d9-e611-80f2-5065f38aba91",ACTOR-0004,26/09/2025 09:20,2025-09-26T09:20:00Z,ITEM-000143,L3_ADMIN,L3,"businessunit,0a4ccfd6-e6d9-e611-80f2-5065f38aba91",,owningbusinessunit changed
ITEM-000143,Update,ownerid,"systemuser,1cba5fd4-6e4e-4e0f-85ff-a6438bc2f2f0","systemuser,b5f00e27-78b3-4a71-90af-5dcef3c25bba",ACTOR-0004,26/09/2025 09:20,2025-09-26T09:20:00Z,ITEM-000143,L3_ADMIN,L3,"systemuser,b5f00e27-78b3-4a71-90af-5dcef3c25bba",,Owner changed
ITEM-000144,Update,the000g_revenuetype,,604720001,ACTOR-0009,6/10/25 11:21,2025-06-10T11:21:00Z,ITEM-000144,L2_MILESTONE,L2,604720001,,the000g_revenuetype → 604720001
ITEM-000144,Update,the000g_isrenewal,,FALSE,ACTOR-0009,6/10/25 11:21,2025-06-10T11:21:00Z,ITEM-000144,L3_ADMIN,L3,FALSE,,the000g_isrenewal changed
ITEM-000144,Update,estimatedclosedate,10/15/25 0:00,11/20/25 0:00,ACTOR-0009,6/10/25 11:21,2025-06-10T11:21:00Z,ITEM-000144,L1_STAGE,L1,11/20/25 0:00,,estimatedclosedate → 11/20/25 0:00
ITEM-000144,Update,the000g__revenuetype,,604720002,ACTOR-0009,18/12/2025 09:20,2025-12-18T09:20:00Z,ITEM-000144,L2_MILESTONE,L2,604720002,,the000g__revenuetype → 604720002
ITEM-000144,Update,estimatedclosedate,11/20/25 0:00,1/21/26 0:00,ACTOR-0009,18/12/2025 09:20,2025-12-18T09:20:00Z,ITEM-000144,L1_STAGE,L1,1/21/26 0:00,,estimatedclosedate → 1/21/26 0:00
ITEM-000144,Update,estimatedclosedate,1/21/26 0:00,2/28/26 0:00,ACTOR-0009,26/01/2026 15:27,2026-01-26T15:27:00Z,ITEM-000144,L1_STAGE,L1,2/28/26 0:00,,estimatedclosedate → 2/28/26 0:00
ITEM-000144,Update,stepname,14-Qualify,15-Develop,ACTOR-0008,5/1/26 15:20,2026-05-01T15:20:00Z,ITEM-000144,L1_STAGE,L1,15-Develop,15.0,stepname → 15-Develop
ITEM-000144,Update,stepname,15-Develop,16-Propose,ACTOR-0008,5/1/26 15:20,2026-05-01T15:20:00Z,ITEM-000144,L1_STAGE,L1,16-Propose,16.0,stepname → 16-Propose
ITEM-000144,Update,stepname,16-Propose,,ACTOR-0003,5/1/26 15:21,2026-05-01T15:21:00Z,ITEM-000144,L1_STAGE,L1,,,stepname → 
ITEM-000144,Update,stepname,,16-Propose,ACTOR-0003,5/1/26 15:22,2026-05-01T15:22:00Z,ITEM-000144,L1_STAGE,L1,16-Propose,16.0,stepname → 16-Propose
ITEM-000144,Update,closeprobability,,75,ACTOR-0003,5/1/26 15:22,2026-05-01T15:22:00Z,ITEM-000144,L1_STAGE,L1,75,,closeprobability → 75
ITEM-000144,Update,msdyn_forecastcategory,100000001,100000002,ACTOR-0003,5/1/26 15:37,2026-05-01T15:37:00Z,ITEM-000144,L1_STAGE,L1,100000002,,msdyn_forecastcategory → 100000002
ITEM-000145,Update,owningbusinessunit,"businessunit,0a4ccfd6-e6d9-e611-80f2-5065f38aba91","businessunit,0a4ccfd6-e6d9-e611-80f2-5065f38aba91",ACTOR-0002,16/10/2025 10:39,2025-10-16T10:39:00Z,ITEM-000145,L3_ADMIN,L3,"businessunit,0a4ccfd6-e6d9-e611-80f2-5065f38aba91",,owningbusinessunit changed
ITEM-000145,Update,ownerid,"systemuser,9ab13e3b-1ff4-4d57-a2c8-d0c8f2ce3f42","systemuser,efd3822d-8c8b-4619-8eb9-39ddf9c5c57f",ACTOR-0002,16/10/2025 10:39,2025-10-16T10:39:00Z,ITEM-000145,L3_ADMIN,L3,"systemuser,efd3822d-8c8b-4619-8eb9-39ddf9c5c57f",,Owner changed
ITEM-000146,Update,the000g_revenuetype,,604720001,ACTOR-0003,17/08/2025 13:01,2025-08-17T13:01:00Z,ITEM-000146,L2_MILESTONE,L2,604720001,,the000g_revenuetype → 604720001
ITEM-000146,Update,owningbusinessunit,"businessunit,0a4ccfd6-e6d9-e611-80f2-5065f38aba91","businessunit,0a4ccfd6-e6d9-e611-80f2-5065f38aba91",ACTOR-0003,26/08/2025 07:43,2025-08-26T07:43:00Z,ITEM-000146,L3_ADMIN,L3,"businessunit,0a4ccfd6-e6d9-e611-80f2-5065f38aba91",,owningbusinessunit changed
ITEM-000146,Update,ownerid,"systemuser,b5f00e27-78b3-4a71-90af-5dcef3c25bba","systemuser,efd3822d-8c8b-4619-8eb9-39ddf9c5c57f",ACTOR-0003,26/08/2025 07:43,2025-08-26T07:43:00Z,ITEM-000146,L3_ADMIN,L3,"systemuser,efd3822d-8c8b-4619-8eb9-39ddf9c5c57f",,Owner changed
ITEM-000150,Update,stepname,,14-Qualify,ACTOR-0008,14/10/2025 09:15,2025-10-14T09:15:00Z,ITEM-000150,L1_STAGE,L1,14-Qualify,14.0,stepname → 14-Qualify
ITEM-000150,Create,statecode,,0,ACTOR-0009,14/10/2025 09:15,2025-10-14T09:15:00Z,ITEM-000150,L1_STAGE,L1,Open,,Case Created
ITEM-000150,Update,the000g__revenuetype,,604720002,ACTOR-0009,18/12/2025 09:23,2025-12-18T09:23:00Z,ITEM-000150,L2_MILESTONE,L2,604720002,,the000g__revenuetype → 604720002
ITEM-000150,Update,estimatedclosedate,1/15/26 0:00,3/25/26 0:00,ACTOR-0009,18/12/2025 09:23,2025-12-18T09:23:00Z,ITEM-000150,L1_STAGE,L1,3/25/26 0:00,,estimatedclosedate → 3/25/26 0:00
ITEM-000151,Update,owningbusinessunit,"businessunit,0a4ccfd6-e6d9-e611-80f2-5065f38aba91","businessunit,0a4ccfd6-e6d9-e611-80f2-5065f38aba91",ACTOR-0004,26/09/2025 09:20,2025-09-26T09:20:00Z,ITEM-000151,L3_ADMIN,L3,"businessunit,0a4ccfd6-e6d9-e611-80f2-5065f38aba91",,owningbusinessunit changed
ITEM-000151,Update,ownerid,"systemuser,1cba5fd4-6e4e-4e0f-85ff-a6438bc2f2f0","systemuser,b5f00e27-78b3-4a71-90af-5dcef3c25bba",ACTOR-0004,26/09/2025 09:20,2025-09-26T09:20:00Z,ITEM-000151,L3_ADMIN,L3,"systemuser,b5f00e27-78b3-4a71-90af-5dcef3c25bba",,Owner changed
ITEM-000153,Update,owningbusinessunit,"businessunit,0a4ccfd6-e6d9-e611-80f2-5065f38aba91","businessunit,0a4ccfd6-e6d9-e611-80f2-5065f38aba91",ACTOR-0003,26/08/2025 07:43,2025-08-26T07:43:00Z,ITEM-000153,L3_ADMIN,L3,"businessunit,0a4ccfd6-e6d9-e611-80f2-5065f38aba91",,owningbusinessunit changed
ITEM-000153,Update,ownerid,"systemuser,b5f00e27-78b3-4a71-90af-5dcef3c25bba","systemuser,efd3822d-8c8b-4619-8eb9-39ddf9c5c57f",ACTOR-0003,26/08/2025 07:43,2025-08-26T07:43:00Z,ITEM-000153,L3_ADMIN,L3,"systemuser,efd3822d-8c8b-4619-8eb9-39ddf9c5c57f",,Owner changed
ITEM-000155,Update,estimatedclosedate,1/29/26 0:00,2/20/26 0:00,ACTOR-0003,22/01/2026 04:39,2026-01-22T04:39:00Z,ITEM-000155,L1_STAGE,L1,2/20/26 0:00,,estimatedclosedate → 2/20/26 0:00
ITEM-000155,Update,statuscode,1,4,ACTOR-0009,26/01/2026 15:34,2026-01-26T15:34:00Z,ITEM-000155,L1_STAGE,L1,Canceled,,statuscode → Canceled
ITEM-000155,Update,msdyn_forecastcategory,100000001,100000006,ACTOR-0009,26/01/2026 15:34,2026-01-26T15:34:00Z,ITEM-000155,L1_STAGE,L1,100000006,,msdyn_forecastcategory → 100000006
ITEM-000155,Update,actualclosedate,,1/26/26 0:00,ACTOR-0009,26/01/2026 15:34,2026-01-26T15:34:00Z,ITEM-000155,L1_STAGE,L1,1/26/26 0:00,,actualclosedate → 1/26/26 0:00
ITEM-000155,Update,salesstage,,3,ACTOR-0009,26/01/2026 15:34,2026-01-26T15:34:00Z,ITEM-000155,L1_STAGE,L1,3,,salesstage → 3
ITEM-000155,Update,statecode,0,2,ACTOR-0009,26/01/2026 15:34,2026-01-26T15:34:00Z,ITEM-000155,L1_STAGE,L1,Lost,,statecode → Lost
ITEM-000155,Update,stepname,,14-Qualify,ACTOR-0008,8/1/26 10:42,2026-08-01T10:42:00Z,ITEM-000155,L1_STAGE,L1,14-Qualify,14.0,stepname → 14-Qualify
ITEM-000155,Create,statecode,,0,ACTOR-0009,8/1/26 10:42,2026-08-01T10:42:00Z,ITEM-000155,L1_STAGE,L1,Open,,Case Created
ITEM-000156,Update,owningbusinessunit,"businessunit,0a4ccfd6-e6d9-e611-80f2-5065f38aba91","businessunit,0a4ccfd6-e6d9-e611-80f2-5065f38aba91",ACTOR-0002,7/10/25 10:45,2025-07-10T10:45:00Z,ITEM-000156,L3_ADMIN,L3,"businessunit,0a4ccfd6-e6d9-e611-80f2-5065f38aba91",,owningbusinessunit changed
ITEM-000156,Update,ownerid,"systemuser,7b9d5323-2ef3-4d52-9d6c-dd45deb05e3b","systemuser,efd3822d-8c8b-4619-8eb9-39ddf9c5c57f",ACTOR-0002,7/10/25 10:45,2025-07-10T10:45:00Z,ITEM-000156,L3_ADMIN,L3,"systemuser,efd3822d-8c8b-4619-8eb9-39ddf9c5c57f",,Owner changed
ITEM-000157,Update,owningbusinessunit,"businessunit,0a4ccfd6-e6d9-e611-80f2-5065f38aba91","businessunit,0a4ccfd6-e6d9-e611-80f2-5065f38aba91",ACTOR-0003,27/08/2025 12:57,2025-08-27T12:57:00Z,ITEM-000157,L3_ADMIN,L3,"businessunit,0a4ccfd6-e6d9-e611-80f2-5065f38aba91",,owningbusinessunit changed
ITEM-000157,Update,ownerid,"systemuser,7b9d5323-2ef3-4d52-9d6c-dd45deb05e3b","systemuser,b5f00e27-78b3-4a71-90af-5dcef3c25bba",ACTOR-0003,27/08/2025 12:57,2025-08-27T12:57:00Z,ITEM-000157,L3_ADMIN,L3,"systemuser,b5f00e27-78b3-4a71-90af-5dcef3c25bba",,Owner changed
ITEM-000158,Update,statuscode,1,3,ACTOR-0009,15/08/2025 14:51,2025-08-15T14:51:00Z,ITEM-000158,L1_STAGE,L1,Won,,statuscode → Won
ITEM-000158,Update,msdyn_forecastcategory,100000001,100000005,ACTOR-0009,15/08/2025 14:51,2025-08-15T14:51:00Z,ITEM-000158,L1_STAGE,L1,100000005,,msdyn_forecastcategory → 100000005
ITEM-000158,Update,statecode,0,1,ACTOR-0009,15/08/2025 14:51,2025-08-15T14:51:00Z,ITEM-000158,L1_STAGE,L1,Won,,statecode → Won
ITEM-000158,Update,actualclosedate,5/15/23 0:00,8/15/25 0:00,ACTOR-0009,15/08/2025 14:51,2025-08-15T14:51:00Z,ITEM-000158,L1_STAGE,L1,8/15/25 0:00,,actualclosedate → 8/15/25 0:00
ITEM-000159,Update,statuscode,1,3,ACTOR-0009,15/08/2025 10:51,2025-08-15T10:51:00Z,ITEM-000159,L1_STAGE,L1,Won,,statuscode → Won
ITEM-000159,Update,msdyn_forecastcategory,100000001,100000005,ACTOR-0009,15/08/2025 10:51,2025-08-15T10:51:00Z,ITEM-000159,L1_STAGE,L1,100000005,,msdyn_forecastcategory → 100000005
ITEM-000159,Update,actualclosedate,,8/12/25 0:00,ACTOR-0009,15/08/2025 10:51,2025-08-15T10:51:00Z,ITEM-000159,L1_STAGE,L1,8/12/25 0:00,,actualclosedate → 8/12/25 0:00
ITEM-000159,Update,salesstage,,3,ACTOR-0009,15/08/2025 10:51,2025-08-15T10:51:00Z,ITEM-000159,L1_STAGE,L1,3,,salesstage → 3
ITEM-000159,Update,statecode,0,1,ACTOR-0009,15/08/2025 10:51,2025-08-15T10:51:00Z,ITEM-000159,L1_STAGE,L1,Won,,statecode → Won
ITEM-000160,Update,stepname,,14-Qualify,ACTOR-0008,15/08/2025 14:47,2025-08-15T14:47:00Z,ITEM-000160,L1_STAGE,L1,14-Qualify,14.0,stepname → 14-Qualify
ITEM-000160,Create,statecode,,0,ACTOR-0009,15/08/2025 14:47,2025-08-15T14:47:00Z,ITEM-000160,L1_STAGE,L1,Open,,Case Created
ITEM-000160,Update,new_contracttermmonths,,12,ACTOR-0009,15/08/2025 14:49,2025-08-15T14:49:00Z,ITEM-000160,L2_MILESTONE,L2,12,,new_contracttermmonths → 12
ITEM-000162,Update,owningbusinessunit,"businessunit,0a4ccfd6-e6d9-e611-80f2-5065f38aba91","businessunit,0a4ccfd6-e6d9-e611-80f2-5065f38aba91",ACTOR-0002,7/10/25 10:45,2025-07-10T10:45:00Z,ITEM-000162,L3_ADMIN,L3,"businessunit,0a4ccfd6-e6d9-e611-80f2-5065f38aba91",,owningbusinessunit changed
ITEM-000162,Update,ownerid,"systemuser,7b9d5323-2ef3-4d52-9d6c-dd45deb05e3b","systemuser,efd3822d-8c8b-4619-8eb9-39ddf9c5c57f",ACTOR-0002,7/10/25 10:45,2025-07-10T10:45:00Z,ITEM-000162,L3_ADMIN,L3,"systemuser,efd3822d-8c8b-4619-8eb9-39ddf9c5c57f",,Owner changed
ITEM-000164,Update,owningbusinessunit,"businessunit,0a4ccfd6-e6d9-e611-80f2-5065f38aba91","businessunit,0a4ccfd6-e6d9-e611-80f2-5065f38aba91",ACTOR-0002,8/1/26 9:40,2026-08-01T09:40:00Z,ITEM-000164,L3_ADMIN,L3,"businessunit,0a4ccfd6-e6d9-e611-80f2-5065f38aba91",,owningbusinessunit changed
ITEM-000164,Update,ownerid,"systemuser,f0df2f4c-7b1a-46f2-9e80-2a19c6df8dd8","systemuser,efd3822d-8c8b-4619-8eb9-39ddf9c5c57f",ACTOR-0002,8/1/26 9:40,2026-08-01T09:40:00Z,ITEM-000164,L3_ADMIN,L3,"systemuser,efd3822d-8c8b-4619-8eb9-39ddf9c5c57f",,Owner changed
ITEM-000166,Update,owningbusinessunit,"businessunit,0a4ccfd6-e6d9-e611-80f2-5065f38aba91","businessunit,0a4ccfd6-e6d9-e611-80f2-5065f38aba91",ACTOR-0002,22/08/2025 13:23,2025-08-22T13:23:00Z,ITEM-000166,L3_ADMIN,L3,"businessunit,0a4ccfd6-e6d9-e611-80f2-5065f38aba91",,owningbusinessunit changed
ITEM-000166,Update,ownerid,"systemuser,7b9d5323-2ef3-4d52-9d6c-dd45deb05e3b","systemuser,efd3822d-8c8b-4619-8eb9-39ddf9c5c57f",ACTOR-0002,22/08/2025 13:23,2025-08-22T13:23:00Z,ITEM-000166,L3_ADMIN,L3,"systemuser,efd3822d-8c8b-4619-8eb9-39ddf9c5c57f",,Owner changed
ITEM-000167,Update,stepname,,14-Qualify,ACTOR-0008,14/10/2025 09:10,2025-10-14T09:10:00Z,ITEM-000167,L1_STAGE,L1,14-Qualify,14.0,stepname → 14-Qualify
ITEM-000167,Create,statecode,,0,ACTOR-0009,14/10/2025 09:10,2025-10-14T09:10:00Z,ITEM-000167,L1_STAGE,L1,Open,,Case Created
ITEM-000167,Update,statuscode,1,4,ACTOR-0009,18/12/2025 09:21,2025-12-18T09:21:00Z,ITEM-000167,L1_STAGE,L1,Canceled,,statuscode → Canceled
ITEM-000167,Update,msdyn_forecastcategory,100000001,100000006,ACTOR-0009,18/12/2025 09:21,2025-12-18T09:21:00Z,ITEM-000167,L1_STAGE,L1,100000006,,msdyn_forecastcategory → 100000006
ITEM-000167,Update,actualclosedate,,12/18/25 0:00,ACTOR-0009,18/12/2025 09:21,2025-12-18T09:21:00Z,ITEM-000167,L1_STAGE,L1,12/18/25 0:00,,actualclosedate → 12/18/25 0:00
ITEM-000167,Update,salesstage,,3,ACTOR-0009,18/12/2025 09:21,2025-12-18T09:21:00Z,ITEM-000167,L1_STAGE,L1,3,,salesstage → 3
ITEM-000167,Update,statecode,0,2,ACTOR-0009,18/12/2025 09:21,2025-12-18T09:21:00Z,ITEM-000167,L1_STAGE,L1,Lost,,statecode → Lost
ITEM-000169,Update,owningbusinessunit,"businessunit,0a4ccfd6-e6d9-e611-80f2-5065f38aba91","businessunit,0a4ccfd6-e6d9-e611-80f2-5065f38aba91",ACTOR-0002,7/10/25 10:46,2025-07-10T10:46:00Z,ITEM-000169,L3_ADMIN,L3,"businessunit,0a4ccfd6-e6d9-e611-80f2-5065f38aba91",,owningbusinessunit changed
ITEM-000169,Update,ownerid,"systemuser,7b9d5323-2ef3-4d52-9d6c-dd45deb05e3b","systemuser,efd3822d-8c8b-4619-8eb9-39ddf9c5c57f",ACTOR-0002,7/10/25 10:46,2025-07-10T10:46:00Z,ITEM-000169,L3_ADMIN,L3,"systemuser,efd3822d-8c8b-4619-8eb9-39ddf9c5c57f",,Owner changed
ITEM-000170,Update,owningbusinessunit,"businessunit,0a4ccfd6-e6d9-e611-80f2-5065f38aba91","businessunit,0a4ccfd6-e6d9-e611-80f2-5065f38aba91",ACTOR-0002,1/9/25 9:15,2025-01-09T09:15:00Z,ITEM-000170,L3_ADMIN,L3,"businessunit,0a4ccfd6-e6d9-e611-80f2-5065f38aba91",,owningbusinessunit changed
ITEM-000170,Update,ownerid,"systemuser,b5f00e27-78b3-4a71-90af-5dcef3c25bba","systemuser,efd3822d-8c8b-4619-8eb9-39ddf9c5c57f",ACTOR-0002,1/9/25 9:15,2025-01-09T09:15:00Z,ITEM-000170,L3_ADMIN,L3,"systemuser,efd3822d-8c8b-4619-8eb9-39ddf9c5c57f",,Owner changed
ITEM-000173,Update,stepname,,14-Qualify,ACTOR-0008,13/01/2026 10:38,2026-01-13T10:38:00Z,ITEM-000173,L1_STAGE,L1,14-Qualify,14.0,stepname → 14-Qualify
ITEM-000173,Create,statecode,,0,ACTOR-0009,13/01/2026 10:38,2026-01-13T10:38:00Z,ITEM-000173,L1_STAGE,L1,Open,,Case Created
ITEM-000174,Update,owningbusinessunit,"businessunit,0a4ccfd6-e6d9-e611-80f2-5065f38aba91","businessunit,0a4ccfd6-e6d9-e611-80f2-5065f38aba91",ACTOR-0004,26/09/2025 09:21,2025-09-26T09:21:00Z,ITEM-000174,L3_ADMIN,L3,"businessunit,0a4ccfd6-e6d9-e611-80f2-5065f38aba91",,owningbusinessunit changed
ITEM-000174,Update,ownerid,"systemuser,1cba5fd4-6e4e-4e0f-85ff-a6438bc2f2f0","systemuser,b5f00e27-78b3-4a71-90af-5dcef3c25bba",ACTOR-0004,26/09/2025 09:21,2025-09-26T09:21:00Z,ITEM-000174,L3_ADMIN,L3,"systemuser,b5f00e27-78b3-4a71-90af-5dcef3c25bba",,Owner changed
ITEM-000176,Update,parentaccountid,,"account,64ccf363-d021-ec11-b6e6-6045bd8a151e",ACTOR-0009,8/10/25 9:01,2025-08-10T09:01:00Z,ITEM-000176,L3_ADMIN,L3,"account,64ccf363-d021-ec11-b6e6-6045bd8a151e",,parentaccountid changed
ITEM-000176,Update,customerid,"contact,ad0d3070-d021-ec11-b6e6-6045bd8a15d0","account,64ccf363-d021-ec11-b6e6-6045bd8a151e",ACTOR-0009,8/10/25 9:01,2025-08-10T09:01:00Z,ITEM-000176,L3_ADMIN,L3,"account,64ccf363-d021-ec11-b6e6-6045bd8a151e",,customerid changed
ITEM-000176,Create,statecode,,0,ACTOR-0009,30/09/2025 09:29,2025-09-30T09:29:00Z,ITEM-000176,L1_STAGE,L1,Open,,Case Created
ITEM-000176,Update,stepname,,14-Qualify,ACTOR-0008,30/09/2025 09:30,2025-09-30T09:30:00Z,ITEM-000176,L1_STAGE,L1,14-Qualify,14.0,stepname → 14-Qualify
ITEM-000176,Update,estimatedclosedate,10/14/25 0:00,6/25/26 0:00,ACTOR-0009,29/10/2025 09:16,2025-10-29T09:16:00Z,ITEM-000176,L1_STAGE,L1,6/25/26 0:00,,estimatedclosedate → 6/25/26 0:00
ITEM-000177,Update,stepname,,14-Qualify,ACTOR-0008,6/10/25 15:25,2025-06-10T15:25:00Z,ITEM-000177,L1_STAGE,L1,14-Qualify,14.0,stepname → 14-Qualify
ITEM-000177,Create,statecode,,0,ACTOR-0005,6/10/25 15:25,2025-06-10T15:25:00Z,ITEM-000177,L1_STAGE,L1,Open,,Case Created
ITEM-000177,Update,statuscode,1,756150002,ACTOR-0005,22/10/2025 09:55,2025-10-22T09:55:00Z,ITEM-000177,L1_STAGE,L1,756150002,,statuscode → 756150002
ITEM-000177,Update,msdyn_forecastcategory,100000001,100000006,ACTOR-0005,22/10/2025 09:55,2025-10-22T09:55:00Z,ITEM-000177,L1_STAGE,L1,100000006,,msdyn_forecastcategory → 100000006
ITEM-000177,Update,actualclosedate,,10/22/25 0:00,ACTOR-0005,22/10/2025 09:55,2025-10-22T09:55:00Z,ITEM-000177,L1_STAGE,L1,10/22/25 0:00,,actualclosedate → 10/22/25 0:00
ITEM-000177,Update,salesstage,,3,ACTOR-0005,22/10/2025 09:55,2025-10-22T09:55:00Z,ITEM-000177,L1_STAGE,L1,3,,salesstage → 3
ITEM-000177,Update,statecode,0,2,ACTOR-0005,22/10/2025 09:55,2025-10-22T09:55:00Z,ITEM-000177,L1_STAGE,L1,Lost,,statecode → Lost
ITEM-000178,Update,estimatedclosedate,11/28/25 0:00,1/8/26 0:00,ACTOR-0002,1/12/25 16:51,2025-01-12T16:51:00Z,ITEM-000178,L1_STAGE,L1,1/8/26 0:00,,estimatedclosedate → 1/8/26 0:00
ITEM-000178,Create,statecode,,0,ACTOR-0002,23/10/2025 09:47,2025-10-23T09:47:00Z,ITEM-000178,L1_STAGE,L1,Open,,Case Created
ITEM-000178,Update,purchasetimeframe,4,1,ACTOR-0002,23/10/2025 09:49,2025-10-23T09:49:00Z,ITEM-000178,L2_MILESTONE,L2,1,,purchasetimeframe → 1
ITEM-000178,Update,the000g_revenuetype,604720000,604720001,ACTOR-0002,23/10/2025 09:49,2025-10-23T09:49:00Z,ITEM-000178,L2_MILESTONE,L2,604720001,,the000g_revenuetype → 604720001
ITEM-000178,Update,stepname,14-Qualify,15-Develop,ACTOR-0008,23/10/2025 09:50,2025-10-23T09:50:00Z,ITEM-000178,L1_STAGE,L1,15-Develop,15.0,stepname → 15-Develop
ITEM-000178,Update,estimatedclosedate,9/25/26 0:00,11/28/25 0:00,ACTOR-0002,23/10/2025 09:50,2025-10-23T09:50:00Z,ITEM-000178,L1_STAGE,L1,11/28/25 0:00,,estimatedclosedate → 11/28/25 0:00
ITEM-000178,Update,parentaccountid,"account,740d1046-e54c-f011-877a-7c1e5284b4af","account,f62b15a3-dfdf-e611-80f3-5065f38bd451",ACTOR-0003,30/10/2025 15:57,2025-10-30T15:57:00Z,ITEM-000178,L3_ADMIN,L3,"account,f62b15a3-dfdf-e611-80f3-5065f38bd451",,parentaccountid changed
ITEM-000178,Update,customerid,"account,740d1046-e54c-f011-877a-7c1e5284b4af","account,f62b15a3-dfdf-e611-80f3-5065f38bd451",ACTOR-0003,30/10/2025 15:57,2025-10-30T15:57:00Z,ITEM-000178,L3_ADMIN,L3,"account,f62b15a3-dfdf-e611-80f3-5065f38bd451",,customerid changed
ITEM-000178,Update,estimatedclosedate,1/29/26 0:00,2/20/26 0:00,ACTOR-0003,22/01/2026 04:39,2026-01-22T04:39:00Z,ITEM-000178,L1_STAGE,L1,2/20/26 0:00,,estimatedclosedate → 2/20/26 0:00
ITEM-000178,Update,closeprobability,,25,ACTOR-0002,5/1/26 14:24,2026-05-01T14:24:00Z,ITEM-000178,L1_STAGE,L1,25,,closeprobability → 25
ITEM-000178,Update,the000g__revenuetype,,604720002,ACTOR-0002,5/1/26 14:24,2026-05-01T14:24:00Z,ITEM-000178,L2_MILESTONE,L2,604720002,,the000g__revenuetype → 604720002
ITEM-000178,Update,estimatedclosedate,1/8/26 0:00,1/12/26 0:00,ACTOR-0002,5/1/26 14:24,2026-05-01T14:24:00Z,ITEM-000178,L1_STAGE,L1,1/12/26 0:00,,estimatedclosedate → 1/12/26 0:00
ITEM-000178,Update,new_contracttermmonths,36,,ACTOR-0002,5/1/26 14:24,2026-05-01T14:24:00Z,ITEM-000178,L2_MILESTONE,L2,,,new_contracttermmonths → 
ITEM-000178,Update,closeprobability,25,75,ACTOR-0003,5/1/26 16:08,2026-05-01T16:08:00Z,ITEM-000178,L1_STAGE,L1,75,,closeprobability → 75
ITEM-000178,Update,estimatedclosedate,1/12/26 0:00,1/29/26 0:00,ACTOR-0002,12/1/26 9:48,2026-12-01T09:48:00Z,ITEM-000178,L1_STAGE,L1,1/29/26 0:00,,estimatedclosedate → 1/29/26 0:00
ITEM-000180,Update,owningbusinessunit,"businessunit,0a4ccfd6-e6d9-e611-80f2-5065f38aba91","businessunit,0a4ccfd6-e6d9-e611-80f2-5065f38aba91",ACTOR-0003,26/08/2025 07:42,2025-08-26T07:42:00Z,ITEM-000180,L3_ADMIN,L3,"businessunit,0a4ccfd6-e6d9-e611-80f2-5065f38aba91",,owningbusinessunit changed
ITEM-000180,Update,ownerid,"systemuser,09f34b91-4d86-4fc8-8b41-8af3d91e94bf","systemuser,efd3822d-8c8b-4619-8eb9-39ddf9c5c57f",ACTOR-0003,26/08/2025 07:42,2025-08-26T07:42:00Z,ITEM-000180,L3_ADMIN,L3,"systemuser,efd3822d-8c8b-4619-8eb9-39ddf9c5c57f",,Owner changed
ITEM-000182,Update,owningbusinessunit,"businessunit,0a4ccfd6-e6d9-e611-80f2-5065f38aba91","businessunit,0a4ccfd6-e6d9-e611-80f2-5065f38aba91",ACTOR-0002,22/08/2025 13:23,2025-08-22T13:23:00Z,ITEM-000182,L3_ADMIN,L3,"businessunit,0a4ccfd6-e6d9-e611-80f2-5065f38aba91",,owningbusinessunit changed
ITEM-000182,Update,ownerid,"systemuser,7b9d5323-2ef3-4d52-9d6c-dd45deb05e3b","systemuser,efd3822d-8c8b-4619-8eb9-39ddf9c5c57f",ACTOR-0002,22/08/2025 13:23,2025-08-22T13:23:00Z,ITEM-000182,L3_ADMIN,L3,"systemuser,efd3822d-8c8b-4619-8eb9-39ddf9c5c57f",,Owner changed
ITEM-000183,Update,owningbusinessunit,"businessunit,0a4ccfd6-e6d9-e611-80f2-5065f38aba91","businessunit,0a4ccfd6-e6d9-e611-80f2-5065f38aba91",ACTOR-0003,27/08/2025 12:57,2025-08-27T12:57:00Z,ITEM-000183,L3_ADMIN,L3,"businessunit,0a4ccfd6-e6d9-e611-80f2-5065f38aba91",,owningbusinessunit changed
ITEM-000183,Update,ownerid,"systemuser,7b9d5323-2ef3-4d52-9d6c-dd45deb05e3b","systemuser,b5f00e27-78b3-4a71-90af-5dcef3c25bba",ACTOR-0003,27/08/2025 12:57,2025-08-27T12:57:00Z,ITEM-000183,L3_ADMIN,L3,"systemuser,b5f00e27-78b3-4a71-90af-5dcef3c25bba",,Owner changed
ITEM-000185,Update,owningbusinessunit,"businessunit,0a4ccfd6-e6d9-e611-80f2-5065f38aba91","businessunit,0a4ccfd6-e6d9-e611-80f2-5065f38aba91",ACTOR-0002,7/10/25 10:46,2025-07-10T10:46:00Z,ITEM-000185,L3_ADMIN,L3,"businessunit,0a4ccfd6-e6d9-e611-80f2-5065f38aba91",,owningbusinessunit changed
ITEM-000185,Update,ownerid,"systemuser,7b9d5323-2ef3-4d52-9d6c-dd45deb05e3b","systemuser,efd3822d-8c8b-4619-8eb9-39ddf9c5c57f",ACTOR-0002,7/10/25 10:46,2025-07-10T10:46:00Z,ITEM-000185,L3_ADMIN,L3,"systemuser,efd3822d-8c8b-4619-8eb9-39ddf9c5c57f",,Owner changed
ITEM-000186,Update,owningbusinessunit,"businessunit,0a4ccfd6-e6d9-e611-80f2-5065f38aba91","businessunit,0a4ccfd6-e6d9-e611-80f2-5065f38aba91",ACTOR-0002,8/1/26 9:40,2026-08-01T09:40:00Z,ITEM-000186,L3_ADMIN,L3,"businessunit,0a4ccfd6-e6d9-e611-80f2-5065f38aba91",,owningbusinessunit changed
ITEM-000186,Update,ownerid,"systemuser,7b9d5323-2ef3-4d52-9d6c-dd45deb05e3b","systemuser,efd3822d-8c8b-4619-8eb9-39ddf9c5c57f",ACTOR-0002,8/1/26 9:40,2026-08-01T09:40:00Z,ITEM-000186,L3_ADMIN,L3,"systemuser,efd3822d-8c8b-4619-8eb9-39ddf9c5c57f",,Owner changed
ITEM-000187,Update,owningbusinessunit,"businessunit,0a4ccfd6-e6d9-e611-80f2-5065f38aba91","businessunit,0a4ccfd6-e6d9-e611-80f2-5065f38aba91",ACTOR-0002,7/10/25 10:46,2025-07-10T10:46:00Z,ITEM-000187,L3_ADMIN,L3,"businessunit,0a4ccfd6-e6d9-e611-80f2-5065f38aba91",,owningbusinessunit changed
ITEM-000187,Update,ownerid,"systemuser,7b9d5323-2ef3-4d52-9d6c-dd45deb05e3b","systemuser,efd3822d-8c8b-4619-8eb9-39ddf9c5c57f",ACTOR-0002,7/10/25 10:46,2025-07-10T10:46:00Z,ITEM-000187,L3_ADMIN,L3,"systemuser,efd3822d-8c8b-4619-8eb9-39ddf9c5c57f",,Owner changed
ITEM-000190,Update,stepname,,14-Qualify,ACTOR-0008,16/09/2025 11:04,2025-09-16T11:04:00Z,ITEM-000190,L1_STAGE,L1,14-Qualify,14.0,stepname → 14-Qualify
ITEM-000190,Create,purchasetimeframe,,0,ACTOR-0007,16/09/2025 11:04,2025-09-16T11:04:00Z,ITEM-000190,L2_MILESTONE,L2,0,,Case Created
ITEM-000190,Update,statuscode,1,3,ACTOR-0007,26/09/2025 14:20,2025-09-26T14:20:00Z,ITEM-000190,L1_STAGE,L1,Won,,statuscode → Won
ITEM-000190,Update,msdyn_forecastcategory,100000001,100000005,ACTOR-0007,26/09/2025 14:20,2025-09-26T14:20:00Z,ITEM-000190,L1_STAGE,L1,100000005,,msdyn_forecastcategory → 100000005
ITEM-000190,Update,actualclosedate,,9/26/25 0:00,ACTOR-0007,26/09/2025 14:20,2025-09-26T14:20:00Z,ITEM-000190,L1_STAGE,L1,9/26/25 0:00,,actualclosedate → 9/26/25 0:00
ITEM-000190,Update,salesstage,,3,ACTOR-0007,26/09/2025 14:20,2025-09-26T14:20:00Z,ITEM-000190,L1_STAGE,L1,3,,salesstage → 3
ITEM-000190,Update,statecode,0,1,ACTOR-0007,26/09/2025 14:20,2025-09-26T14:20:00Z,ITEM-000190,L1_STAGE,L1,Won,,statecode → Won
ITEM-000190,Update,owningbusinessunit,"businessunit,0a4ccfd6-e6d9-e611-80f2-5065f38aba91","businessunit,0a4ccfd6-e6d9-e611-80f2-5065f38aba91",ACTOR-0003,27/10/2025 11:18,2025-10-27T11:18:00Z,ITEM-000190,L3_ADMIN,L3,"businessunit,0a4ccfd6-e6d9-e611-80f2-5065f38aba91",,owningbusinessunit changed
ITEM-000190,Update,ownerid,"systemuser,33e3af6d-9b6c-4c1f-9efe-82d0f365ef59","systemuser,efd3822d-8c8b-4619-8eb9-39ddf9c5c57f",ACTOR-0003,27/10/2025 11:18,2025-10-27T11:18:00Z,ITEM-000190,L3_ADMIN,L3,"systemuser,efd3822d-8c8b-4619-8eb9-39ddf9c5c57f",,Owner changed
ITEM-000191,Update,stepname,,14-Qualify,ACTOR-0008,15/01/2026 13:52,2026-01-15T13:52:00Z,ITEM-000191,L1_STAGE,L1,14-Qualify,14.0,stepname → 14-Qualify
ITEM-000191,Create,statecode,,0,ACTOR-0009,15/01/2026 13:52,2026-01-15T13:52:00Z,ITEM-000191,L1_STAGE,L1,Open,,Case Created
ITEM-000193,Update,stepname,,14-Qualify,ACTOR-0008,22/10/2025 09:11,2025-10-22T09:11:00Z,ITEM-000193,L1_STAGE,L1,14-Qualify,14.0,stepname → 14-Qualify
ITEM-000193,Create,purchaseprocess,,0,ACTOR-0002,22/10/2025 09:11,2025-10-22T09:11:00Z,ITEM-000193,L2_MILESTONE,L2,0,,Case Created
ITEM-000194,Update,stepname,,14-Qualify,ACTOR-0008,28/01/2026 10:37,2026-01-28T10:37:00Z,ITEM-000194,L1_STAGE,L1,14-Qualify,14.0,stepname → 14-Qualify
ITEM-000194,Create,statecode,,0,ACTOR-0006,28/01/2026 10:37,2026-01-28T10:37:00Z,ITEM-000194,L1_STAGE,L1,Open,,Case Created
ITEM-000195,Update,owningbusinessunit,"businessunit,0a4ccfd6-e6d9-e611-80f2-5065f38aba91","businessunit,0a4ccfd6-e6d9-e611-80f2-5065f38aba91",ACTOR-0003,27/10/2025 11:18,2025-10-27T11:18:00Z,ITEM-000195,L3_ADMIN,L3,"businessunit,0a4ccfd6-e6d9-e611-80f2-5065f38aba91",,owningbusinessunit changed
ITEM-000195,Update,ownerid,"systemuser,2d7fbe83-3f35-4a1d-bc05-1b39dbf446d9","systemuser,efd3822d-8c8b-4619-8eb9-39ddf9c5c57f",ACTOR-0003,27/10/2025 11:18,2025-10-27T11:18:00Z,ITEM-000195,L3_ADMIN,L3,"systemuser,efd3822d-8c8b-4619-8eb9-39ddf9c5c57f",,Owner changed
ITEM-000197,Update,owningbusinessunit,"businessunit,0a4ccfd6-e6d9-e611-80f2-5065f38aba91","businessunit,0a4ccfd6-e6d9-e611-80f2-5065f38aba91",ACTOR-0002,7/10/25 10:45,2025-07-10T10:45:00Z,ITEM-000197,L3_ADMIN,L3,"businessunit,0a4ccfd6-e6d9-e611-80f2-5065f38aba91",,owningbusinessunit changed
ITEM-000197,Update,ownerid,"systemuser,7b9d5323-2ef3-4d52-9d6c-dd45deb05e3b","systemuser,efd3822d-8c8b-4619-8eb9-39ddf9c5c57f",ACTOR-0002,7/10/25 10:45,2025-07-10T10:45:00Z,ITEM-000197,L3_ADMIN,L3,"systemuser,efd3822d-8c8b-4619-8eb9-39ddf9c5c57f",,Owner changed
ITEM-000198,Update,stepname,,14-Qualify,ACTOR-0008,8/12/25 10:28,2025-08-12T10:28:00Z,ITEM-000198,L1_STAGE,L1,14-Qualify,14.0,stepname → 14-Qualify
ITEM-000198,Create,purchaseprocess,,0,ACTOR-0002,8/12/25 10:28,2025-08-12T10:28:00Z,ITEM-000198,L2_MILESTONE,L2,0,,Case Created
ITEM-000198,Update,stepname,14-Qualify,15-Develop,ACTOR-0008,15/12/2025 14:27,2025-12-15T14:27:00Z,ITEM-000198,L1_STAGE,L1,15-Develop,15.0,stepname → 15-Develop
ITEM-000198,Update,the000g__revenuetype,,604720002,ACTOR-0002,26/01/2026 14:23,2026-01-26T14:23:00Z,ITEM-000198,L2_MILESTONE,L2,604720002,,the000g__revenuetype → 604720002
ITEM-000198,Update,estimatedclosedate,2/18/26 0:00,3/11/26 0:00,ACTOR-0002,26/01/2026 14:23,2026-01-26T14:23:00Z,ITEM-000198,L1_STAGE,L1,3/11/26 0:00,,estimatedclosedate → 3/11/26 0:00
ITEM-000199,Update,stepname,,14-Qualify,ACTOR-0008,12/11/25 15:50,2025-12-11T15:50:00Z,ITEM-000199,L1_STAGE,L1,14-Qualify,14.0,stepname → 14-Qualify
ITEM-000199,Create,statecode,,0,ACTOR-0009,12/11/25 15:50,2025-12-11T15:50:00Z,ITEM-000199,L1_STAGE,L1,Open,,Case Created
ITEM-000199,Update,statuscode,1,3,ACTOR-0009,17/12/2025 15:49,2025-12-17T15:49:00Z,ITEM-000199,L1_STAGE,L1,Won,,statuscode → Won
ITEM-000199,Update,msdyn_forecastcategory,100000001,100000005,ACTOR-0009,17/12/2025 15:49,2025-12-17T15:49:00Z,ITEM-000199,L1_STAGE,L1,100000005,,msdyn_forecastcategory → 100000005
ITEM-000199,Update,actualclosedate,,12/17/25 0:00,ACTOR-0009,17/12/2025 15:49,2025-12-17T15:49:00Z,ITEM-000199,L1_STAGE,L1,12/17/25 0:00,,actualclosedate → 12/17/25 0:00
ITEM-000199,Update,salesstage,,3,ACTOR-0009,17/12/2025 15:49,2025-12-17T15:49:00Z,ITEM-000199,L1_STAGE,L1,3,,salesstage → 3
ITEM-000199,Update,statecode,0,1,ACTOR-0009,17/12/2025 15:49,2025-12-17T15:49:00Z,ITEM-000199,L1_STAGE,L1,Won,,statecode → Won
ITEM-000199,Update,the000g__revenuetype,,604720002,ACTOR-0009,17/12/2025 15:49,2025-12-17T15:49:00Z,ITEM-000199,L2_MILESTONE,L2,604720002,,the000g__revenuetype → 604720002
ITEM-000200,Update,stepname,,14-Qualify,ACTOR-0008,29/09/2025 11:24,2025-09-29T11:24:00Z,ITEM-000200,L1_STAGE,L1,14-Qualify,14.0,stepname → 14-Qualify
ITEM-000200,Create,statecode,,0,ACTOR-0009,29/09/2025 11:24,2025-09-29T11:24:00Z,ITEM-000200,L1_STAGE,L1,Open,,Case Created
ITEM-000200,Update,estimatedclosedate,10/15/25 0:00,11/19/25 0:00,ACTOR-0009,29/10/2025 09:17,2025-10-29T09:17:00Z,ITEM-000200,L1_STAGE,L1,11/19/25 0:00,,estimatedclosedate → 11/19/25 0:00
ITEM-000200,Update,the000g__revenuetype,,604720002,ACTOR-0009,18/12/2025 09:19,2025-12-18T09:19:00Z,ITEM-000200,L2_MILESTONE,L2,604720002,,the000g__revenuetype → 604720002
ITEM-000200,Update,estimatedclosedate,11/19/25 0:00,1/31/26 0:00,ACTOR-0009,18/12/2025 09:19,2025-12-18T09:19:00Z,ITEM-000200,L1_STAGE,L1,1/31/26 0:00,,estimatedclosedate → 1/31/26 0:00
ITEM-000200,Update,estimatedclosedate,1/31/26 0:00,2/20/26 0:00,ACTOR-0003,22/01/2026 04:41,2026-01-22T04:41:00Z,ITEM-000200,L1_STAGE,L1,2/20/26 0:00,,estimatedclosedate → 2/20/26 0:00
ITEM-000200,Update,closeprobability,,25,ACTOR-0003,5/1/26 15:35,2026-05-01T15:35:00Z,ITEM-000200,L1_STAGE,L1,25,,closeprobability → 25
ITEM-000201,Update,owningbusinessunit,"businessunit,0a4ccfd6-e6d9-e611-80f2-5065f38aba91","businessunit,0a4ccfd6-e6d9-e611-80f2-5065f38aba91",ACTOR-0002,7/10/25 10:45,2025-07-10T10:45:00Z,ITEM-000201,L3_ADMIN,L3,"businessunit,0a4ccfd6-e6d9-e611-80f2-5065f38aba91",,owningbusinessunit changed
ITEM-000201,Update,ownerid,"systemuser,7b9d5323-2ef3-4d52-9d6c-dd45deb05e3b","systemuser,efd3822d-8c8b-4619-8eb9-39ddf9c5c57f",ACTOR-0002,7/10/25 10:45,2025-07-10T10:45:00Z,ITEM-000201,L3_ADMIN,L3,"systemuser,efd3822d-8c8b-4619-8eb9-39ddf9c5c57f",,Owner changed
ITEM-000202,Update,owningbusinessunit,"businessunit,0a4ccfd6-e6d9-e611-80f2-5065f38aba91","businessunit,0a4ccfd6-e6d9-e611-80f2-5065f38aba91",ACTOR-0003,27/10/2025 11:18,2025-10-27T11:18:00Z,ITEM-000202,L3_ADMIN,L3,"businessunit,0a4ccfd6-e6d9-e611-80f2-5065f38aba91",,owningbusinessunit changed
ITEM-000202,Update,ownerid,"systemuser,2d7fbe83-3f35-4a1d-bc05-1b39dbf446d9","systemuser,efd3822d-8c8b-4619-8eb9-39ddf9c5c57f",ACTOR-0003,27/10/2025 11:18,2025-10-27T11:18:00Z,ITEM-000202,L3_ADMIN,L3,"systemuser,efd3822d-8c8b-4619-8eb9-39ddf9c5c57f",,Owner changed
ITEM-000203,Update,ownerid,"systemuser,09f34b91-4d86-4fc8-8b41-8af3d91e94bf","systemuser,efd3822d-8c8b-4619-8eb9-39ddf9c5c57f",ACTOR-0003,2/12/25 10:29,2025-02-12T10:29:00Z,ITEM-000203,L3_ADMIN,L3,"systemuser,efd3822d-8c8b-4619-8eb9-39ddf9c5c57f",,Owner changed
ITEM-000203,Update,the000g_revenuetype,,604720001,ACTOR-0003,17/08/2025 13:01,2025-08-17T13:01:00Z,ITEM-000203,L2_MILESTONE,L2,604720001,,the000g_revenuetype → 604720001
ITEM-000204,Update,stepname,,14-Qualify,ACTOR-0008,20/08/2025 10:56,2025-08-20T10:56:00Z,ITEM-000204,L1_STAGE,L1,14-Qualify,14.0,stepname → 14-Qualify
ITEM-000204,Create,purchasetimeframe,,0,ACTOR-0002,20/08/2025 10:56,2025-08-20T10:56:00Z,ITEM-000204,L2_MILESTONE,L2,0,,Case Created
ITEM-000204,Update,estimatedclosedate,8/20/25 0:00,8/21/25 0:00,ACTOR-0002,20/08/2025 15:35,2025-08-20T15:35:00Z,ITEM-000204,L1_STAGE,L1,8/21/25 0:00,,estimatedclosedate → 8/21/25 0:00
ITEM-000204,Update,completeinternalreview,FALSE,TRUE,ACTOR-0002,20/08/2025 15:37,2025-08-20T15:37:00Z,ITEM-000204,L2_MILESTONE,L2,TRUE,,completeinternalreview completed
ITEM-000204,Update,developproposal,FALSE,TRUE,ACTOR-0002,20/08/2025 15:37,2025-08-20T15:37:00Z,ITEM-000204,L2_MILESTONE,L2,TRUE,,developproposal completed
ITEM-000204,Update,identifycustomercontacts,FALSE,TRUE,ACTOR-0002,20/08/2025 15:37,2025-08-20T15:37:00Z,ITEM-000204,L2_MILESTONE,L2,TRUE,,identifycustomercontacts completed
ITEM-000204,Update,identifypursuitteam,FALSE,TRUE,ACTOR-0002,20/08/2025 15:37,2025-08-20T15:37:00Z,ITEM-000204,L2_MILESTONE,L2,TRUE,,identifypursuitteam completed
ITEM-000204,Update,presentproposal,FALSE,TRUE,ACTOR-0002,20/08/2025 15:37,2025-08-20T15:37:00Z,ITEM-000204,L2_MILESTONE,L2,TRUE,,presentproposal completed
ITEM-000204,Update,statuscode,100000003,3,ACTOR-0002,26/08/2025 08:42,2025-08-26T08:42:00Z,ITEM-000204,L1_STAGE,L1,Won,,statuscode → Won
ITEM-000204,Update,msdyn_forecastcategory,100000003,100000005,ACTOR-0002,26/08/2025 08:42,2025-08-26T08:42:00Z,ITEM-000204,L1_STAGE,L1,100000005,,msdyn_forecastcategory → 100000005
ITEM-000204,Update,actualclosedate,,8/26/25 0:00,ACTOR-0002,26/08/2025 08:42,2025-08-26T08:42:00Z,ITEM-000204,L1_STAGE,L1,8/26/25 0:00,,actualclosedate → 8/26/25 0:00
ITEM-000204,Update,salesstage,,3,ACTOR-0002,26/08/2025 08:42,2025-08-26T08:42:00Z,ITEM-000204,L1_STAGE,L1,3,,salesstage → 3
ITEM-000204,Update,statecode,0,1,ACTOR-0002,26/08/2025 08:42,2025-08-26T08:42:00Z,ITEM-000204,L1_STAGE,L1,Won,,statecode → Won
ITEM-000210,Update,stepname,,14-Qualify,ACTOR-0008,1/10/25 10:19,2025-01-10T10:19:00Z,ITEM-000210,L1_STAGE,L1,14-Qualify,14.0,stepname → 14-Qualify
ITEM-000210,Create,purchaseprocess,,0,ACTOR-0002,1/10/25 10:19,2025-01-10T10:19:00Z,ITEM-000210,L2_MILESTONE,L2,0,,Case Created
ITEM-000210,Update,parentaccountid,,"account,e497e6e1-af9e-f011-b41c-6045bd9a4d98",ACTOR-0002,1/10/25 10:22,2025-01-10T10:22:00Z,ITEM-000210,L3_ADMIN,L3,"account,e497e6e1-af9e-f011-b41c-6045bd9a4d98",,parentaccountid changed
ITEM-000210,Update,customerid,"contact,4de10df4-af9e-f011-b41c-6045bd9a4d98","account,e497e6e1-af9e-f011-b41c-6045bd9a4d98",ACTOR-0002,1/10/25 10:22,2025-01-10T10:22:00Z,ITEM-000210,L3_ADMIN,L3,"account,e497e6e1-af9e-f011-b41c-6045bd9a4d98",,customerid changed
ITEM-000210,Update,stepname,14-Qualify,15-Develop,ACTOR-0008,18/11/2025 09:32,2025-11-18T09:32:00Z,ITEM-000210,L1_STAGE,L1,15-Develop,15.0,stepname → 15-Develop
ITEM-000210,Update,stepname,15-Develop,16-Propose,ACTOR-0008,18/11/2025 09:32,2025-11-18T09:32:00Z,ITEM-000210,L1_STAGE,L1,16-Propose,16.0,stepname → 16-Propose
ITEM-000210,Update,stepname,16-Propose,17-Close,ACTOR-0008,18/11/2025 09:32,2025-11-18T09:32:00Z,ITEM-000210,L1_STAGE,L1,17-Close,17.0,stepname → 17-Close
ITEM-000210,Update,statuscode,1,4,ACTOR-0002,18/11/2025 09:33,2025-11-18T09:33:00Z,ITEM-000210,L1_STAGE,L1,Canceled,,statuscode → Canceled
ITEM-000210,Update,msdyn_forecastcategory,100000001,100000006,ACTOR-0002,18/11/2025 09:33,2025-11-18T09:33:00Z,ITEM-000210,L1_STAGE,L1,100000006,,msdyn_forecastcategory → 100000006
ITEM-000210,Update,actualclosedate,,11/18/25 0:00,ACTOR-0002,18/11/2025 09:33,2025-11-18T09:33:00Z,ITEM-000210,L1_STAGE,L1,11/18/25 0:00,,actualclosedate → 11/18/25 0:00
ITEM-000210,Update,salesstage,,3,ACTOR-0002,18/11/2025 09:33,2025-11-18T09:33:00Z,ITEM-000210,L1_STAGE,L1,3,,salesstage → 3
ITEM-000210,Update,statecode,0,2,ACTOR-0002,18/11/2025 09:33,2025-11-18T09:33:00Z,ITEM-000210,L1_STAGE,L1,Lost,,statecode → Lost
ITEM-000211,Update,ownerid,"systemuser,09f34b91-4d86-4fc8-8b41-8af3d91e94bf","systemuser,efd3822d-8c8b-4619-8eb9-39ddf9c5c57f",ACTOR-0003,2/12/25 10:30,2025-02-12T10:30:00Z,ITEM-000211,L3_ADMIN,L3,"systemuser,efd3822d-8c8b-4619-8eb9-39ddf9c5c57f",,Owner changed
ITEM-000211,Update,the000g_revenuetype,,604720001,ACTOR-0003,17/08/2025 13:01,2025-08-17T13:01:00Z,ITEM-000211,L2_MILESTONE,L2,604720001,,the000g_revenuetype → 604720001
ITEM-000212,Update,statuscode,1,4,ACTOR-0009,29/10/2025 09:20,2025-10-29T09:20:00Z,ITEM-000212,L1_STAGE,L1,Canceled,,statuscode → Canceled
ITEM-000212,Update,msdyn_forecastcategory,100000001,100000006,ACTOR-0009,29/10/2025 09:20,2025-10-29T09:20:00Z,ITEM-000212,L1_STAGE,L1,100000006,,msdyn_forecastcategory → 100000006
ITEM-000212,Update,actualclosedate,,10/29/25 0:00,ACTOR-0009,29/10/2025 09:20,2025-10-29T09:20:00Z,ITEM-000212,L1_STAGE,L1,10/29/25 0:00,,actualclosedate → 10/29/25 0:00
ITEM-000212,Update,salesstage,,3,ACTOR-0009,29/10/2025 09:20,2025-10-29T09:20:00Z,ITEM-000212,L1_STAGE,L1,3,,salesstage → 3
ITEM-000212,Update,statecode,0,2,ACTOR-0009,29/10/2025 09:20,2025-10-29T09:20:00Z,ITEM-000212,L1_STAGE,L1,Lost,,statecode → Lost
ITEM-000214,Update,the000g_revenuetype,,604720001,ACTOR-0003,17/08/2025 12:54,2025-08-17T12:54:00Z,ITEM-000214,L2_MILESTONE,L2,604720001,,the000g_revenuetype → 604720001
ITEM-000214,Update,owningbusinessunit,"businessunit,0a4ccfd6-e6d9-e611-80f2-5065f38aba91","businessunit,0a4ccfd6-e6d9-e611-80f2-5065f38aba91",ACTOR-0004,26/09/2025 09:20,2025-09-26T09:20:00Z,ITEM-000214,L3_ADMIN,L3,"businessunit,0a4ccfd6-e6d9-e611-80f2-5065f38aba91",,owningbusinessunit changed
ITEM-000214,Update,ownerid,"systemuser,1cba5fd4-6e4e-4e0f-85ff-a6438bc2f2f0","systemuser,b5f00e27-78b3-4a71-90af-5dcef3c25bba",ACTOR-0004,26/09/2025 09:20,2025-09-26T09:20:00Z,ITEM-000214,L3_ADMIN,L3,"systemuser,b5f00e27-78b3-4a71-90af-5dcef3c25bba",,Owner changed
ITEM-000216,Update,statuscode,1,4,ACTOR-0003,21/10/2025 12:10,2025-10-21T12:10:00Z,ITEM-000216,L1_STAGE,L1,Canceled,,statuscode → Canceled
ITEM-000216,Update,msdyn_forecastcategory,100000001,100000006,ACTOR-0003,21/10/2025 12:10,2025-10-21T12:10:00Z,ITEM-000216,L1_STAGE,L1,100000006,,msdyn_forecastcategory → 100000006
ITEM-000216,Update,actualclosedate,,10/21/25 0:00,ACTOR-0003,21/10/2025 12:10,2025-10-21T12:10:00Z,ITEM-000216,L1_STAGE,L1,10/21/25 0:00,,actualclosedate → 10/21/25 0:00
ITEM-000216,Update,salesstage,,3,ACTOR-0003,21/10/2025 12:10,2025-10-21T12:10:00Z,ITEM-000216,L1_STAGE,L1,3,,salesstage → 3
ITEM-000216,Update,statecode,0,2,ACTOR-0003,21/10/2025 12:10,2025-10-21T12:10:00Z,ITEM-000216,L1_STAGE,L1,Lost,,statecode → Lost
ITEM-000217,Update,owningbusinessunit,"businessunit,0a4ccfd6-e6d9-e611-80f2-5065f38aba91","businessunit,0a4ccfd6-e6d9-e611-80f2-5065f38aba91",ACTOR-0002,7/10/25 10:45,2025-07-10T10:45:00Z,ITEM-000217,L3_ADMIN,L3,"businessunit,0a4ccfd6-e6d9-e611-80f2-5065f38aba91",,owningbusinessunit changed
ITEM-000217,Update,ownerid,"systemuser,7b9d5323-2ef3-4d52-9d6c-dd45deb05e3b","systemuser,efd3822d-8c8b-4619-8eb9-39ddf9c5c57f",ACTOR-0002,7/10/25 10:45,2025-07-10T10:45:00Z,ITEM-000217,L3_ADMIN,L3,"systemuser,efd3822d-8c8b-4619-8eb9-39ddf9c5c57f",,Owner changed
ITEM-000218,Update,stepname,,14-Qualify,ACTOR-0008,29/10/2025 07:02,2025-10-29T07:02:00Z,ITEM-000218,L1_STAGE,L1,14-Qualify,14.0,stepname → 14-Qualify
ITEM-000218,Create,statecode,,0,ACTOR-0002,29/10/2025 07:02,2025-10-29T07:02:00Z,ITEM-000218,L1_STAGE,L1,Open,,Case Created
ITEM-000221,Update,owningbusinessunit,"businessunit,0a4ccfd6-e6d9-e611-80f2-5065f38aba91","businessunit,0a4ccfd6-e6d9-e611-80f2-5065f38aba91",ACTOR-0004,26/09/2025 09:21,2025-09-26T09:21:00Z,ITEM-000221,L3_ADMIN,L3,"businessunit,0a4ccfd6-e6d9-e611-80f2-5065f38aba91",,owningbusinessunit changed
ITEM-000221,Update,ownerid,"systemuser,1cba5fd4-6e4e-4e0f-85ff-a6438bc2f2f0","systemuser,b5f00e27-78b3-4a71-90af-5dcef3c25bba",ACTOR-0004,26/09/2025 09:21,2025-09-26T09:21:00Z,ITEM-000221,L3_ADMIN,L3,"systemuser,b5f00e27-78b3-4a71-90af-5dcef3c25bba",,Owner changed
ITEM-000223,Update,estimatedclosedate,11/26/25 0:00,12/9/25 0:00,ACTOR-0002,6/11/25 10:55,2025-06-11T10:55:00Z,ITEM-000223,L1_STAGE,L1,12/9/25 0:00,,estimatedclosedate → 12/9/25 0:00
ITEM-000223,Update,the000g_isrenewal,,FALSE,ACTOR-0002,8/9/25 16:03,2025-08-09T16:03:00Z,ITEM-000223,L3_ADMIN,L3,FALSE,,the000g_isrenewal changed
ITEM-000223,Update,stepname,14-Qualify,15-Develop,ACTOR-0008,22/10/2025 09:03,2025-10-22T09:03:00Z,ITEM-000223,L1_STAGE,L1,15-Develop,15.0,stepname → 15-Develop
ITEM-000223,Update,stepname,15-Develop,16-Propose,ACTOR-0008,22/10/2025 09:03,2025-10-22T09:03:00Z,ITEM-000223,L1_STAGE,L1,16-Propose,16.0,stepname → 16-Propose
ITEM-000223,Update,estimatedclosedate,8/15/25 0:00,11/26/25 0:00,ACTOR-0002,22/10/2025 09:03,2025-10-22T09:03:00Z,ITEM-000223,L1_STAGE,L1,11/26/25 0:00,,estimatedclosedate → 11/26/25 0:00
ITEM-000223,Update,developproposal,FALSE,TRUE,ACTOR-0002,22/10/2025 09:04,2025-10-22T09:04:00Z,ITEM-000223,L2_MILESTONE,L2,TRUE,,developproposal completed
ITEM-000223,Update,owningbusinessunit,"businessunit,0a4ccfd6-e6d9-e611-80f2-5065f38aba91","businessunit,0a4ccfd6-e6d9-e611-80f2-5065f38aba91",ACTOR-0003,11/8/25 8:54,2025-11-08T08:54:00Z,ITEM-000223,L3_ADMIN,L3,"businessunit,0a4ccfd6-e6d9-e611-80f2-5065f38aba91",,owningbusinessunit changed
ITEM-000223,Update,ownerid,"systemuser,09f34b91-4d86-4fc8-8b41-8af3d91e94bf","systemuser,efd3822d-8c8b-4619-8eb9-39ddf9c5c57f",ACTOR-0003,11/8/25 8:54,2025-11-08T08:54:00Z,ITEM-000223,L3_ADMIN,L3,"systemuser,efd3822d-8c8b-4619-8eb9-39ddf9c5c57f",,Owner changed
ITEM-000223,Update,estimatedclosedate,12/9/25 0:00,1/28/26 0:00,ACTOR-0002,20/11/2025 11:13,2025-11-20T11:13:00Z,ITEM-000223,L1_STAGE,L1,1/28/26 0:00,,estimatedclosedate → 1/28/26 0:00
ITEM-000223,Update,the000g__revenuetype,,604720002,ACTOR-0002,12/1/26 15:41,2026-12-01T15:41:00Z,ITEM-000223,L2_MILESTONE,L2,604720002,,the000g__revenuetype → 604720002
ITEM-000223,Update,estimatedclosedate,1/28/26 0:00,2/19/26 0:00,ACTOR-0002,12/1/26 15:41,2026-12-01T15:41:00Z,ITEM-000223,L1_STAGE,L1,2/19/26 0:00,,estimatedclosedate → 2/19/26 0:00
ITEM-000224,Update,owningbusinessunit,"businessunit,0a4ccfd6-e6d9-e611-80f2-5065f38aba91","businessunit,0a4ccfd6-e6d9-e611-80f2-5065f38aba91",ACTOR-0003,27/10/2025 11:18,2025-10-27T11:18:00Z,ITEM-000224,L3_ADMIN,L3,"businessunit,0a4ccfd6-e6d9-e611-80f2-5065f38aba91",,owningbusinessunit changed
ITEM-000224,Update,ownerid,"systemuser,2d7fbe83-3f35-4a1d-bc05-1b39dbf446d9","systemuser,efd3822d-8c8b-4619-8eb9-39ddf9c5c57f",ACTOR-0003,27/10/2025 11:18,2025-10-27T11:18:00Z,ITEM-000224,L3_ADMIN,L3,"systemuser,efd3822d-8c8b-4619-8eb9-39ddf9c5c57f",,Owner changed
ITEM-000225,Update,owningbusinessunit,"businessunit,0a4ccfd6-e6d9-e611-80f2-5065f38aba91","businessunit,0a4ccfd6-e6d9-e611-80f2-5065f38aba91",ACTOR-0002,7/10/25 10:45,2025-07-10T10:45:00Z,ITEM-000225,L3_ADMIN,L3,"businessunit,0a4ccfd6-e6d9-e611-80f2-5065f38aba91",,owningbusinessunit changed
ITEM-000225,Update,ownerid,"systemuser,7b9d5323-2ef3-4d52-9d6c-dd45deb05e3b","systemuser,efd3822d-8c8b-4619-8eb9-39ddf9c5c57f",ACTOR-0002,7/10/25 10:45,2025-07-10T10:45:00Z,ITEM-000225,L3_ADMIN,L3,"systemuser,efd3822d-8c8b-4619-8eb9-39ddf9c5c57f",,Owner changed
ITEM-000226,Update,stepname,,14-Qualify,ACTOR-0008,13/01/2026 10:46,2026-01-13T10:46:00Z,ITEM-000226,L1_STAGE,L1,14-Qualify,14.0,stepname → 14-Qualify
ITEM-000226,Create,statecode,,0,ACTOR-0009,13/01/2026 10:46,2026-01-13T10:46:00Z,ITEM-000226,L1_STAGE,L1,Open,,Case Created
ITEM-000227,Update,stepname,,14-Qualify,ACTOR-0008,14/08/2025 14:20,2025-08-14T14:20:00Z,ITEM-000227,L1_STAGE,L1,14-Qualify,14.0,stepname → 14-Qualify
ITEM-000227,Create,statecode,,0,ACTOR-0009,14/08/2025 14:20,2025-08-14T14:20:00Z,ITEM-000227,L1_STAGE,L1,Open,,Case Created
ITEM-000227,Update,statuscode,1,3,ACTOR-0009,15/08/2025 09:35,2025-08-15T09:35:00Z,ITEM-000227,L1_STAGE,L1,Won,,statuscode → Won
ITEM-000227,Update,msdyn_forecastcategory,100000001,100000005,ACTOR-0009,15/08/2025 09:35,2025-08-15T09:35:00Z,ITEM-000227,L1_STAGE,L1,100000005,,msdyn_forecastcategory → 100000005
ITEM-000227,Update,actualclosedate,,8/11/25 0:00,ACTOR-0009,15/08/2025 09:35,2025-08-15T09:35:00Z,ITEM-000227,L1_STAGE,L1,8/11/25 0:00,,actualclosedate → 8/11/25 0:00
ITEM-000227,Update,salesstage,,3,ACTOR-0009,15/08/2025 09:35,2025-08-15T09:35:00Z,ITEM-000227,L1_STAGE,L1,3,,salesstage → 3
ITEM-000227,Update,statecode,0,1,ACTOR-0009,15/08/2025 09:35,2025-08-15T09:35:00Z,ITEM-000227,L1_STAGE,L1,Won,,statecode → Won
ITEM-000228,Update,stepname,,14-Qualify,ACTOR-0008,8/1/26 10:41,2026-08-01T10:41:00Z,ITEM-000228,L1_STAGE,L1,14-Qualify,14.0,stepname → 14-Qualify
ITEM-000228,Create,statecode,,0,ACTOR-0009,8/1/26 10:41,2026-08-01T10:41:00Z,ITEM-000228,L1_STAGE,L1,Open,,Case Created
ITEM-000229,Update,the000g_revenuetype,,604720002,ACTOR-0003,17/08/2025 13:03,2025-08-17T13:03:00Z,ITEM-000229,L2_MILESTONE,L2,604720002,,the000g_revenuetype → 604720002
ITEM-000229,Update,owningbusinessunit,"businessunit,0a4ccfd6-e6d9-e611-80f2-5065f38aba91","businessunit,0a4ccfd6-e6d9-e611-80f2-5065f38aba91",ACTOR-0002,8/1/26 9:40,2026-08-01T09:40:00Z,ITEM-000229,L3_ADMIN,L3,"businessunit,0a4ccfd6-e6d9-e611-80f2-5065f38aba91",,owningbusinessunit changed
ITEM-000229,Update,ownerid,"systemuser,a1bb889b-dfab-4e28-b508-75e672da7cb8","systemuser,efd3822d-8c8b-4619-8eb9-39ddf9c5c57f",ACTOR-0002,8/1/26 9:40,2026-08-01T09:40:00Z,ITEM-000229,L3_ADMIN,L3,"systemuser,efd3822d-8c8b-4619-8eb9-39ddf9c5c57f",,Owner changed
ITEM-000230,Update,the000g_revenuetype,,604720000,ACTOR-0003,5/1/26 15:31,2026-05-01T15:31:00Z,ITEM-000230,L2_MILESTONE,L2,604720000,,the000g_revenuetype → 604720000
ITEM-000230,Update,the000g__revenuetype,,604720001,ACTOR-0003,5/1/26 15:31,2026-05-01T15:31:00Z,ITEM-000230,L2_MILESTONE,L2,604720001,,the000g__revenuetype → 604720001
ITEM-000230,Update,the000g_isrenewal,,TRUE,ACTOR-0003,5/1/26 15:31,2026-05-01T15:31:00Z,ITEM-000230,L3_ADMIN,L3,TRUE,,the000g_isrenewal changed
ITEM-000231,Update,stepname,,14-Qualify,ACTOR-0008,7/11/25 12:02,2025-07-11T12:02:00Z,ITEM-000231,L1_STAGE,L1,14-Qualify,14.0,stepname → 14-Qualify
ITEM-000231,Create,purchaseprocess,,0,ACTOR-0002,7/11/25 12:02,2025-07-11T12:02:00Z,ITEM-000231,L2_MILESTONE,L2,0,,Case Created
ITEM-000234,Update,stepname,,14-Qualify,ACTOR-0008,13/10/2025 15:43,2025-10-13T15:43:00Z,ITEM-000234,L1_STAGE,L1,14-Qualify,14.0,stepname → 14-Qualify
ITEM-000234,Create,statecode,,0,ACTOR-0003,13/10/2025 15:43,2025-10-13T15:43:00Z,ITEM-000234,L1_STAGE,L1,Open,,Case Created
ITEM-000234,Update,statuscode,1,4,ACTOR-0003,19/01/2026 11:40,2026-01-19T11:40:00Z,ITEM-000234,L1_STAGE,L1,Canceled,,statuscode → Canceled
ITEM-000234,Update,msdyn_forecastcategory,100000001,100000006,ACTOR-0003,19/01/2026 11:40,2026-01-19T11:40:00Z,ITEM-000234,L1_STAGE,L1,100000006,,msdyn_forecastcategory → 100000006
ITEM-000234,Update,actualclosedate,,1/19/26 0:00,ACTOR-0003,19/01/2026 11:40,2026-01-19T11:40:00Z,ITEM-000234,L1_STAGE,L1,1/19/26 0:00,,actualclosedate → 1/19/26 0:00
ITEM-000234,Update,salesstage,,3,ACTOR-0003,19/01/2026 11:40,2026-01-19T11:40:00Z,ITEM-000234,L1_STAGE,L1,3,,salesstage → 3
ITEM-000234,Update,statecode,0,2,ACTOR-0003,19/01/2026 11:40,2026-01-19T11:40:00Z,ITEM-000234,L1_STAGE,L1,Lost,,statecode → Lost
ITEM-000234,Update,estimatedclosedate,11/28/25 0:00,2/20/26 0:00,ACTOR-0003,8/1/26 10:35,2026-08-01T10:35:00Z,ITEM-000234,L1_STAGE,L1,2/20/26 0:00,,estimatedclosedate → 2/20/26 0:00
ITEM-000235,Update,stepname,,14-Qualify,ACTOR-0008,7/10/25 11:29,2025-07-10T11:29:00Z,ITEM-000235,L1_STAGE,L1,14-Qualify,14.0,stepname → 14-Qualify
ITEM-000235,Create,statecode,,0,ACTOR-0009,7/10/25 11:29,2025-07-10T11:29:00Z,ITEM-000235,L1_STAGE,L1,Open,,Case Created
ITEM-000235,Update,the000g__revenuetype,,604720002,ACTOR-0009,18/12/2025 09:18,2025-12-18T09:18:00Z,ITEM-000235,L2_MILESTONE,L2,604720002,,the000g__revenuetype → 604720002
ITEM-000235,Update,estimatedclosedate,12/15/25 0:00,2/11/26 0:00,ACTOR-0009,18/12/2025 09:18,2025-12-18T09:18:00Z,ITEM-000235,L1_STAGE,L1,2/11/26 0:00,,estimatedclosedate → 2/11/26 0:00
ITEM-000235,Update,estimatedclosedate,2/11/26 0:00,3/31/26 0:00,ACTOR-0009,26/01/2026 15:26,2026-01-26T15:26:00Z,ITEM-000235,L1_STAGE,L1,3/31/26 0:00,,estimatedclosedate → 3/31/26 0:00
ITEM-000235,Update,stepname,14-Qualify,15-Develop,ACTOR-0008,5/1/26 15:39,2026-05-01T15:39:00Z,ITEM-000235,L1_STAGE,L1,15-Develop,15.0,stepname → 15-Develop
ITEM-000235,Update,closeprobability,,25,ACTOR-0003,5/1/26 15:39,2026-05-01T15:39:00Z,ITEM-000235,L1_STAGE,L1,25,,closeprobability → 25
ITEM-000236,Update,owningbusinessunit,"businessunit,0a4ccfd6-e6d9-e611-80f2-5065f38aba91","businessunit,0a4ccfd6-e6d9-e611-80f2-5065f38aba91",ACTOR-0002,1/9/25 9:15,2025-01-09T09:15:00Z,ITEM-000236,L3_ADMIN,L3,"businessunit,0a4ccfd6-e6d9-e611-80f2-5065f38aba91",,owningbusinessunit changed
ITEM-000236,Update,ownerid,"systemuser,b5f00e27-78b3-4a71-90af-5dcef3c25bba","systemuser,efd3822d-8c8b-4619-8eb9-39ddf9c5c57f",ACTOR-0002,1/9/25 9:15,2025-01-09T09:15:00Z,ITEM-000236,L3_ADMIN,L3,"systemuser,efd3822d-8c8b-4619-8eb9-39ddf9c5c57f",,Owner changed
ITEM-000238,Update,stepname,,14-Qualify,ACTOR-0008,14/10/2025 13:53,2025-10-14T13:53:00Z,ITEM-000238,L1_STAGE,L1,14-Qualify,14.0,stepname → 14-Qualify
ITEM-000238,Create,statecode,,0,ACTOR-0009,14/10/2025 13:53,2025-10-14T13:53:00Z,ITEM-000238,L1_STAGE,L1,Open,,Case Created
ITEM-000238,Update,statuscode,1,3,ACTOR-0009,14/10/2025 14:01,2025-10-14T14:01:00Z,ITEM-000238,L1_STAGE,L1,Won,,statuscode → Won
ITEM-000238,Update,msdyn_forecastcategory,100000001,100000005,ACTOR-0009,14/10/2025 14:01,2025-10-14T14:01:00Z,ITEM-000238,L1_STAGE,L1,100000005,,msdyn_forecastcategory → 100000005
ITEM-000238,Update,actualclosedate,,10/14/25 0:00,ACTOR-0009,14/10/2025 14:01,2025-10-14T14:01:00Z,ITEM-000238,L1_STAGE,L1,10/14/25 0:00,,actualclosedate → 10/14/25 0:00
ITEM-000238,Update,salesstage,,3,ACTOR-0009,14/10/2025 14:01,2025-10-14T14:01:00Z,ITEM-000238,L1_STAGE,L1,3,,salesstage → 3
ITEM-000238,Update,statecode,0,1,ACTOR-0009,14/10/2025 14:01,2025-10-14T14:01:00Z,ITEM-000238,L1_STAGE,L1,Won,,statecode → Won
ITEM-000238,Update,owningbusinessunit,"businessunit,0a4ccfd6-e6d9-e611-80f2-5065f38aba91","businessunit,0a4ccfd6-e6d9-e611-80f2-5065f38aba91",ACTOR-0003,27/10/2025 11:18,2025-10-27T11:18:00Z,ITEM-000238,L3_ADMIN,L3,"businessunit,0a4ccfd6-e6d9-e611-80f2-5065f38aba91",,owningbusinessunit changed
ITEM-000238,Update,ownerid,"systemuser,b5f00e27-78b3-4a71-90af-5dcef3c25bba","systemuser,efd3822d-8c8b-4619-8eb9-39ddf9c5c57f",ACTOR-0003,27/10/2025 11:18,2025-10-27T11:18:00Z,ITEM-000238,L3_ADMIN,L3,"systemuser,efd3822d-8c8b-4619-8eb9-39ddf9c5c57f",,Owner changed
ITEM-000240,Update,owningbusinessunit,"businessunit,0a4ccfd6-e6d9-e611-80f2-5065f38aba91","businessunit,0a4ccfd6-e6d9-e611-80f2-5065f38aba91",ACTOR-0003,27/10/2025 11:18,2025-10-27T11:18:00Z,ITEM-000240,L3_ADMIN,L3,"businessunit,0a4ccfd6-e6d9-e611-80f2-5065f38aba91",,owningbusinessunit changed
ITEM-000240,Update,ownerid,"systemuser,2d7fbe83-3f35-4a1d-bc05-1b39dbf446d9","systemuser,efd3822d-8c8b-4619-8eb9-39ddf9c5c57f",ACTOR-0003,27/10/2025 11:18,2025-10-27T11:18:00Z,ITEM-000240,L3_ADMIN,L3,"systemuser,efd3822d-8c8b-4619-8eb9-39ddf9c5c57f",,Owner changed
ITEM-000241,Update,stepname,,14-Qualify,ACTOR-0008,14/01/2026 16:52,2026-01-14T16:52:00Z,ITEM-000241,L1_STAGE,L1,14-Qualify,14.0,stepname → 14-Qualify
ITEM-000241,Create,statecode,,0,ACTOR-0002,14/01/2026 16:52,2026-01-14T16:52:00Z,ITEM-000241,L1_STAGE,L1,Open,,Case Created
ITEM-000242,Create,statecode,,0,ACTOR-0009,15/08/2025 12:06,2025-08-15T12:06:00Z,ITEM-000242,L1_STAGE,L1,Open,,Case Created
ITEM-000242,Update,stepname,,14-Qualify,ACTOR-0008,15/08/2025 12:07,2025-08-15T12:07:00Z,ITEM-000242,L1_STAGE,L1,14-Qualify,14.0,stepname → 14-Qualify
ITEM-000243,Update,owningbusinessunit,"businessunit,0a4ccfd6-e6d9-e611-80f2-5065f38aba91","businessunit,0a4ccfd6-e6d9-e611-80f2-5065f38aba91",ACTOR-0002,16/10/2025 10:39,2025-10-16T10:39:00Z,ITEM-000243,L3_ADMIN,L3,"businessunit,0a4ccfd6-e6d9-e611-80f2-5065f38aba91",,owningbusinessunit changed
ITEM-000243,Update,ownerid,"systemuser,9ab13e3b-1ff4-4d57-a2c8-d0c8f2ce3f42","systemuser,efd3822d-8c8b-4619-8eb9-39ddf9c5c57f",ACTOR-0002,16/10/2025 10:39,2025-10-16T10:39:00Z,ITEM-000243,L3_ADMIN,L3,"systemuser,efd3822d-8c8b-4619-8eb9-39ddf9c5c57f",,Owner changed
ITEM-000244,Update,owningbusinessunit,"businessunit,0a4ccfd6-e6d9-e611-80f2-5065f38aba91","businessunit,0a4ccfd6-e6d9-e611-80f2-5065f38aba91",ACTOR-0002,1/9/25 9:16,2025-01-09T09:16:00Z,ITEM-000244,L3_ADMIN,L3,"businessunit,0a4ccfd6-e6d9-e611-80f2-5065f38aba91",,owningbusinessunit changed
ITEM-000244,Update,ownerid,"systemuser,b5f00e27-78b3-4a71-90af-5dcef3c25bba","systemuser,efd3822d-8c8b-4619-8eb9-39ddf9c5c57f",ACTOR-0002,1/9/25 9:16,2025-01-09T09:16:00Z,ITEM-000244,L3_ADMIN,L3,"systemuser,efd3822d-8c8b-4619-8eb9-39ddf9c5c57f",,Owner changed
ITEM-000245,Update,ownerid,"systemuser,09f34b91-4d86-4fc8-8b41-8af3d91e94bf","systemuser,efd3822d-8c8b-4619-8eb9-39ddf9c5c57f",ACTOR-0003,2/12/25 10:29,2025-02-12T10:29:00Z,ITEM-000245,L3_ADMIN,L3,"systemuser,efd3822d-8c8b-4619-8eb9-39ddf9c5c57f",,Owner changed
ITEM-000245,Update,the000g_revenuetype,,604720001,ACTOR-0003,17/08/2025 13:01,2025-08-17T13:01:00Z,ITEM-000245,L2_MILESTONE,L2,604720001,,the000g_revenuetype → 604720001
ITEM-000246,Update,the000g_revenuetype,,604720001,ACTOR-0009,6/10/25 9:48,2025-06-10T09:48:00Z,ITEM-000246,L2_MILESTONE,L2,604720001,,the000g_revenuetype → 604720001
ITEM-000246,Update,the000g_isrenewal,,FALSE,ACTOR-0009,6/10/25 9:48,2025-06-10T09:48:00Z,ITEM-000246,L3_ADMIN,L3,FALSE,,the000g_isrenewal changed
ITEM-000246,Update,estimatedclosedate,11/13/25 0:00,2/4/26 0:00,ACTOR-0009,6/10/25 9:48,2025-06-10T09:48:00Z,ITEM-000246,L1_STAGE,L1,2/4/26 0:00,,estimatedclosedate → 2/4/26 0:00
ITEM-000246,Update,statuscode,1,4,ACTOR-0009,29/10/2025 09:22,2025-10-29T09:22:00Z,ITEM-000246,L1_STAGE,L1,Canceled,,statuscode → Canceled
ITEM-000246,Update,msdyn_forecastcategory,100000001,100000006,ACTOR-0009,29/10/2025 09:22,2025-10-29T09:22:00Z,ITEM-000246,L1_STAGE,L1,100000006,,msdyn_forecastcategory → 100000006
ITEM-000246,Update,actualclosedate,,10/29/25 0:00,ACTOR-0009,29/10/2025 09:22,2025-10-29T09:22:00Z,ITEM-000246,L1_STAGE,L1,10/29/25 0:00,,actualclosedate → 10/29/25 0:00
ITEM-000246,Update,salesstage,,3,ACTOR-0009,29/10/2025 09:22,2025-10-29T09:22:00Z,ITEM-000246,L1_STAGE,L1,3,,salesstage → 3
ITEM-000246,Update,statecode,0,2,ACTOR-0009,29/10/2025 09:22,2025-10-29T09:22:00Z,ITEM-000246,L1_STAGE,L1,Lost,,statecode → Lost
ITEM-000247,Update,stepname,,14-Qualify,ACTOR-0008,15/08/2025 10:57,2025-08-15T10:57:00Z,ITEM-000247,L1_STAGE,L1,14-Qualify,14.0,stepname → 14-Qualify
ITEM-000247,Create,statecode,,0,ACTOR-0009,15/08/2025 10:57,2025-08-15T10:57:00Z,ITEM-000247,L1_STAGE,L1,Open,,Case Created
ITEM-000247,Update,statuscode,1,3,ACTOR-0009,15/08/2025 11:15,2025-08-15T11:15:00Z,ITEM-000247,L1_STAGE,L1,Won,,statuscode → Won
ITEM-000247,Update,msdyn_forecastcategory,100000001,100000005,ACTOR-0009,15/08/2025 11:15,2025-08-15T11:15:00Z,ITEM-000247,L1_STAGE,L1,100000005,,msdyn_forecastcategory → 100000005
ITEM-000247,Update,actualclosedate,,8/12/25 0:00,ACTOR-0009,15/08/2025 11:15,2025-08-15T11:15:00Z,ITEM-000247,L1_STAGE,L1,8/12/25 0:00,,actualclosedate → 8/12/25 0:00
ITEM-000247,Update,salesstage,,3,ACTOR-0009,15/08/2025 11:15,2025-08-15T11:15:00Z,ITEM-000247,L1_STAGE,L1,3,,salesstage → 3
ITEM-000247,Update,statecode,0,1,ACTOR-0009,15/08/2025 11:15,2025-08-15T11:15:00Z,ITEM-000247,L1_STAGE,L1,Won,,statecode → Won
ITEM-000248,Update,owningbusinessunit,"businessunit,0a4ccfd6-e6d9-e611-80f2-5065f38aba91","businessunit,0a4ccfd6-e6d9-e611-80f2-5065f38aba91",ACTOR-0003,27/10/2025 11:18,2025-10-27T11:18:00Z,ITEM-000248,L3_ADMIN,L3,"businessunit,0a4ccfd6-e6d9-e611-80f2-5065f38aba91",,owningbusinessunit changed
ITEM-000248,Update,ownerid,"systemuser,2d7fbe83-3f35-4a1d-bc05-1b39dbf446d9","systemuser,efd3822d-8c8b-4619-8eb9-39ddf9c5c57f",ACTOR-0003,27/10/2025 11:18,2025-10-27T11:18:00Z,ITEM-000248,L3_ADMIN,L3,"systemuser,efd3822d-8c8b-4619-8eb9-39ddf9c5c57f",,Owner changed
ITEM-000250,Update,stepname,,14-Qualify,ACTOR-0008,23/10/2025 13:45,2025-10-23T13:45:00Z,ITEM-000250,L1_STAGE,L1,14-Qualify,14.0,stepname → 14-Qualify
ITEM-000250,Create,statecode,,0,ACTOR-0003,23/10/2025 13:45,2025-10-23T13:45:00Z,ITEM-000250,L1_STAGE,L1,Open,,Case Created
ITEM-000250,Update,closeprobability,,50,ACTOR-0003,11/11/25 9:58,2025-11-11T09:58:00Z,ITEM-000250,L1_STAGE,L1,50,,closeprobability → 50
ITEM-000250,Update,estimatedclosedate,12/19/25 0:00,1/16/26 0:00,ACTOR-0003,8/1/26 10:37,2026-08-01T10:37:00Z,ITEM-000250,L1_STAGE,L1,1/16/26 0:00,,estimatedclosedate → 1/16/26 0:00
ITEM-000250,Update,statuscode,1,4,ACTOR-0003,8/1/26 15:40,2026-08-01T15:40:00Z,ITEM-000250,L1_STAGE,L1,Canceled,,statuscode → Canceled
ITEM-000250,Update,msdyn_forecastcategory,100000001,100000006,ACTOR-0003,8/1/26 15:40,2026-08-01T15:40:00Z,ITEM-000250,L1_STAGE,L1,100000006,,msdyn_forecastcategory → 100000006
ITEM-000250,Update,actualclosedate,,1/8/26 0:00,ACTOR-0003,8/1/26 15:40,2026-08-01T15:40:00Z,ITEM-000250,L1_STAGE,L1,1/8/26 0:00,,actualclosedate → 1/8/26 0:00
ITEM-000250,Update,salesstage,,3,ACTOR-0003,8/1/26 15:40,2026-08-01T15:40:00Z,ITEM-000250,L1_STAGE,L1,3,,salesstage → 3
ITEM-000250,Update,statecode,0,2,ACTOR-0003,8/1/26 15:40,2026-08-01T15:40:00Z,ITEM-000250,L1_STAGE,L1,Lost,,statecode → Lost
ITEM-000253,Update,owningbusinessunit,"businessunit,0a4ccfd6-e6d9-e611-80f2-5065f38aba91","businessunit,0a4ccfd6-e6d9-e611-80f2-5065f38aba91",ACTOR-0002,7/10/25 10:45,2025-07-10T10:45:00Z,ITEM-000253,L3_ADMIN,L3,"businessunit,0a4ccfd6-e6d9-e611-80f2-5065f38aba91",,owningbusinessunit changed
ITEM-000253,Update,ownerid,"systemuser,7b9d5323-2ef3-4d52-9d6c-dd45deb05e3b","systemuser,efd3822d-8c8b-4619-8eb9-39ddf9c5c57f",ACTOR-0002,7/10/25 10:45,2025-07-10T10:45:00Z,ITEM-000253,L3_ADMIN,L3,"systemuser,efd3822d-8c8b-4619-8eb9-39ddf9c5c57f",,Owner changed
ITEM-000254,Update,owningbusinessunit,"businessunit,0a4ccfd6-e6d9-e611-80f2-5065f38aba91","businessunit,0a4ccfd6-e6d9-e611-80f2-5065f38aba91",ACTOR-0002,7/10/25 10:46,2025-07-10T10:46:00Z,ITEM-000254,L3_ADMIN,L3,"businessunit,0a4ccfd6-e6d9-e611-80f2-5065f38aba91",,owningbusinessunit changed
ITEM-000254,Update,ownerid,"systemuser,7b9d5323-2ef3-4d52-9d6c-dd45deb05e3b","systemuser,efd3822d-8c8b-4619-8eb9-39ddf9c5c57f",ACTOR-0002,7/10/25 10:46,2025-07-10T10:46:00Z,ITEM-000254,L3_ADMIN,L3,"systemuser,efd3822d-8c8b-4619-8eb9-39ddf9c5c57f",,Owner changed
ITEM-000258,Update,stepname,,14-Qualify,ACTOR-0008,6/10/25 9:04,2025-06-10T09:04:00Z,ITEM-000258,L1_STAGE,L1,14-Qualify,14.0,stepname → 14-Qualify
ITEM-000258,Create,purchaseprocess,,0,ACTOR-0002,6/10/25 9:04,2025-06-10T09:04:00Z,ITEM-000258,L2_MILESTONE,L2,0,,Case Created
ITEM-000258,Update,msdyn_forecastcategory,100000003,100000005,ACTOR-0002,8/10/25 10:59,2025-08-10T10:59:00Z,ITEM-000258,L1_STAGE,L1,100000005,,msdyn_forecastcategory → 100000005
ITEM-000258,Update,stepname,14-Qualify,15-Develop,ACTOR-0008,8/10/25 11:00,2025-08-10T11:00:00Z,ITEM-000258,L1_STAGE,L1,15-Develop,15.0,stepname → 15-Develop
ITEM-000258,Update,stepname,15-Develop,16-Propose,ACTOR-0008,8/10/25 11:00,2025-08-10T11:00:00Z,ITEM-000258,L1_STAGE,L1,16-Propose,16.0,stepname → 16-Propose
ITEM-000258,Update,stepname,16-Propose,17-Close,ACTOR-0008,8/10/25 11:01,2025-08-10T11:01:00Z,ITEM-000258,L1_STAGE,L1,17-Close,17.0,stepname → 17-Close
ITEM-000258,Update,statuscode,100000003,3,ACTOR-0002,8/10/25 11:09,2025-08-10T11:09:00Z,ITEM-000258,L1_STAGE,L1,Won,,statuscode → Won
ITEM-000258,Update,actualclosedate,,10/8/25 0:00,ACTOR-0002,8/10/25 11:09,2025-08-10T11:09:00Z,ITEM-000258,L1_STAGE,L1,10/8/25 0:00,,actualclosedate → 10/8/25 0:00
ITEM-000258,Update,salesstage,,3,ACTOR-0002,8/10/25 11:09,2025-08-10T11:09:00Z,ITEM-000258,L1_STAGE,L1,3,,salesstage → 3
ITEM-000258,Update,statecode,0,1,ACTOR-0002,8/10/25 11:09,2025-08-10T11:09:00Z,ITEM-000258,L1_STAGE,L1,Won,,statecode → Won
ITEM-000258,Update,statuscode,3,1,ACTOR-0003,8/10/25 12:15,2025-08-10T12:15:00Z,ITEM-000258,L1_STAGE,L1,In Progress,,statuscode → In Progress
ITEM-000258,Update,msdyn_forecastcategory,100000005,100000001,ACTOR-0003,8/10/25 12:15,2025-08-10T12:15:00Z,ITEM-000258,L1_STAGE,L1,100000001,,msdyn_forecastcategory → 100000001
ITEM-000258,Update,statecode,1,0,ACTOR-0003,8/10/25 12:15,2025-08-10T12:15:00Z,ITEM-000258,L1_STAGE,L1,Open,,statecode → Open
ITEM-000258,Update,actualclosedate,10/8/25 0:00,,ACTOR-0003,8/10/25 12:15,2025-08-10T12:15:00Z,ITEM-000258,L1_STAGE,L1,,,actualclosedate → 
ITEM-000258,Update,salesstage,3,0,ACTOR-0003,8/10/25 12:15,2025-08-10T12:15:00Z,ITEM-000258,L1_STAGE,L1,0,,salesstage → 0
ITEM-000258,Update,statuscode,1,3,ACTOR-0003,8/10/25 13:17,2025-08-10T13:17:00Z,ITEM-000258,L1_STAGE,L1,Won,,statuscode → Won
ITEM-000258,Update,msdyn_forecastcategory,100000001,100000005,ACTOR-0003,8/10/25 13:17,2025-08-10T13:17:00Z,ITEM-000258,L1_STAGE,L1,100000005,,msdyn_forecastcategory → 100000005
ITEM-000258,Update,actualclosedate,,10/8/25 0:00,ACTOR-0003,8/10/25 13:17,2025-08-10T13:17:00Z,ITEM-000258,L1_STAGE,L1,10/8/25 0:00,,actualclosedate → 10/8/25 0:00
ITEM-000258,Update,statecode,0,1,ACTOR-0003,8/10/25 13:17,2025-08-10T13:17:00Z,ITEM-000258,L1_STAGE,L1,Won,,statecode → Won
ITEM-000258,Update,salesstage,0,3,ACTOR-0003,8/10/25 13:17,2025-08-10T13:17:00Z,ITEM-000258,L1_STAGE,L1,3,,salesstage → 3
ITEM-000259,Update,stepname,,14-Qualify,ACTOR-0008,6/10/25 10:02,2025-06-10T10:02:00Z,ITEM-000259,L1_STAGE,L1,14-Qualify,14.0,stepname → 14-Qualify
ITEM-000259,Create,statecode,,0,ACTOR-0009,6/10/25 10:02,2025-06-10T10:02:00Z,ITEM-000259,L1_STAGE,L1,Open,,Case Created
ITEM-000259,Update,estimatedclosedate,12/10/25 0:00,3/18/26 0:00,ACTOR-0009,29/10/2025 09:21,2025-10-29T09:21:00Z,ITEM-000259,L1_STAGE,L1,3/18/26 0:00,,estimatedclosedate → 3/18/26 0:00
ITEM-000260,Update,owningbusinessunit,"businessunit,0a4ccfd6-e6d9-e611-80f2-5065f38aba91","businessunit,0a4ccfd6-e6d9-e611-80f2-5065f38aba91",ACTOR-0004,26/09/2025 09:20,2025-09-26T09:20:00Z,ITEM-000260,L3_ADMIN,L3,"businessunit,0a4ccfd6-e6d9-e611-80f2-5065f38aba91",,owningbusinessunit changed
ITEM-000260,Update,ownerid,"systemuser,1cba5fd4-6e4e-4e0f-85ff-a6438bc2f2f0","systemuser,b5f00e27-78b3-4a71-90af-5dcef3c25bba",ACTOR-0004,26/09/2025 09:20,2025-09-26T09:20:00Z,ITEM-000260,L3_ADMIN,L3,"systemuser,b5f00e27-78b3-4a71-90af-5dcef3c25bba",,Owner changed
ITEM-000261,Update,stepname,,14-Qualify,ACTOR-0008,10/10/25 11:08,2025-10-10T11:08:00Z,ITEM-000261,L1_STAGE,L1,14-Qualify,14.0,stepname → 14-Qualify
ITEM-000261,Create,statecode,,0,ACTOR-0009,10/10/25 11:08,2025-10-10T11:08:00Z,ITEM-000261,L1_STAGE,L1,Open,,Case Created
ITEM-000261,Update,estimatedclosedate,1/21/26 0:00,2/19/26 0:00,ACTOR-0009,26/01/2026 15:29,2026-01-26T15:29:00Z,ITEM-000261,L1_STAGE,L1,2/19/26 0:00,,estimatedclosedate → 2/19/26 0:00
ITEM-000261,Update,stepname,14-Qualify,16-Propose,ACTOR-0003,5/1/26 15:22,2026-05-01T15:22:00Z,ITEM-000261,L1_STAGE,L1,16-Propose,16.0,stepname → 16-Propose
ITEM-000261,Update,closeprobability,,75,ACTOR-0003,5/1/26 15:22,2026-05-01T15:22:00Z,ITEM-000261,L1_STAGE,L1,75,,closeprobability → 75
ITEM-000261,Update,the000g__revenuetype,,604720001,ACTOR-0003,5/1/26 15:38,2026-05-01T15:38:00Z,ITEM-000261,L2_MILESTONE,L2,604720001,,the000g__revenuetype → 604720001
ITEM-000261,Update,msdyn_forecastcategory,100000001,100000002,ACTOR-0003,5/1/26 15:38,2026-05-01T15:38:00Z,ITEM-000261,L1_STAGE,L1,100000002,,msdyn_forecastcategory → 100000002
ITEM-000262,Update,owningbusinessunit,"businessunit,0a4ccfd6-e6d9-e611-80f2-5065f38aba91","businessunit,0a4ccfd6-e6d9-e611-80f2-5065f38aba91",ACTOR-0003,27/10/2025 11:18,2025-10-27T11:18:00Z,ITEM-000262,L3_ADMIN,L3,"businessunit,0a4ccfd6-e6d9-e611-80f2-5065f38aba91",,owningbusinessunit changed
ITEM-000262,Update,ownerid,"systemuser,2d7fbe83-3f35-4a1d-bc05-1b39dbf446d9","systemuser,efd3822d-8c8b-4619-8eb9-39ddf9c5c57f",ACTOR-0003,27/10/2025 11:18,2025-10-27T11:18:00Z,ITEM-000262,L3_ADMIN,L3,"systemuser,efd3822d-8c8b-4619-8eb9-39ddf9c5c57f",,Owner changed
ITEM-000263,Create,statecode,,0,ACTOR-0002,28/08/2025 13:41,2025-08-28T13:41:00Z,ITEM-000263,L1_STAGE,L1,Open,,Case Created
ITEM-000263,Update,stepname,,14-Qualify,ACTOR-0008,28/08/2025 13:42,2025-08-28T13:42:00Z,ITEM-000263,L1_STAGE,L1,14-Qualify,14.0,stepname → 14-Qualify
ITEM-000263,Update,purchaseprocess,,0,ACTOR-0002,5/1/26 9:51,2026-05-01T09:51:00Z,ITEM-000263,L2_MILESTONE,L2,0,,purchaseprocess → 0
ITEM-000263,Update,new_contracttermmonths,,12,ACTOR-0002,5/1/26 9:51,2026-05-01T09:51:00Z,ITEM-000263,L2_MILESTONE,L2,12,,new_contracttermmonths → 12
ITEM-000263,Update,closeprobability,,25,ACTOR-0002,5/1/26 9:51,2026-05-01T09:51:00Z,ITEM-000263,L1_STAGE,L1,25,,closeprobability → 25
ITEM-000263,Update,the000g__revenuetype,,604720001,ACTOR-0002,5/1/26 9:51,2026-05-01T09:51:00Z,ITEM-000263,L2_MILESTONE,L2,604720001,,the000g__revenuetype → 604720001
ITEM-000263,Update,estimatedclosedate,1/22/26 0:00,3/4/26 0:00,ACTOR-0002,5/1/26 9:51,2026-05-01T09:51:00Z,ITEM-000263,L1_STAGE,L1,3/4/26 0:00,,estimatedclosedate → 3/4/26 0:00
ITEM-000264,Update,owningbusinessunit,"businessunit,0a4ccfd6-e6d9-e611-80f2-5065f38aba91","businessunit,0a4ccfd6-e6d9-e611-80f2-5065f38aba91",ACTOR-0003,26/08/2025 07:43,2025-08-26T07:43:00Z,ITEM-000264,L3_ADMIN,L3,"businessunit,0a4ccfd6-e6d9-e611-80f2-5065f38aba91",,owningbusinessunit changed
ITEM-000264,Update,ownerid,"systemuser,b5f00e27-78b3-4a71-90af-5dcef3c25bba","systemuser,efd3822d-8c8b-4619-8eb9-39ddf9c5c57f",ACTOR-0003,26/08/2025 07:43,2025-08-26T07:43:00Z,ITEM-000264,L3_ADMIN,L3,"systemuser,efd3822d-8c8b-4619-8eb9-39ddf9c5c57f",,Owner changed
ITEM-000265,Update,stepname,,14-Qualify,ACTOR-0008,30/09/2025 08:46,2025-09-30T08:46:00Z,ITEM-000265,L1_STAGE,L1,14-Qualify,14.0,stepname → 14-Qualify
ITEM-000265,Create,statecode,,0,ACTOR-0009,30/09/2025 08:46,2025-09-30T08:46:00Z,ITEM-000265,L1_STAGE,L1,Open,,Case Created
ITEM-000265,Update,statuscode,1,3,ACTOR-0009,30/09/2025 08:49,2025-09-30T08:49:00Z,ITEM-000265,L1_STAGE,L1,Won,,statuscode → Won
ITEM-000265,Update,msdyn_forecastcategory,100000001,100000005,ACTOR-0009,30/09/2025 08:49,2025-09-30T08:49:00Z,ITEM-000265,L1_STAGE,L1,100000005,,msdyn_forecastcategory → 100000005
ITEM-000265,Update,actualclosedate,,9/30/25 0:00,ACTOR-0009,30/09/2025 08:49,2025-09-30T08:49:00Z,ITEM-000265,L1_STAGE,L1,9/30/25 0:00,,actualclosedate → 9/30/25 0:00
ITEM-000265,Update,salesstage,,3,ACTOR-0009,30/09/2025 08:49,2025-09-30T08:49:00Z,ITEM-000265,L1_STAGE,L1,3,,salesstage → 3
ITEM-000265,Update,statecode,0,1,ACTOR-0009,30/09/2025 08:49,2025-09-30T08:49:00Z,ITEM-000265,L1_STAGE,L1,Won,,statecode → Won
ITEM-000268,Update,stepname,,14-Qualify,ACTOR-0008,2/9/25 9:20,2025-02-09T09:20:00Z,ITEM-000268,L1_STAGE,L1,14-Qualify,14.0,stepname → 14-Qualify
ITEM-000268,Create,statecode,,0,ACTOR-0002,2/9/25 9:20,2025-02-09T09:20:00Z,ITEM-000268,L1_STAGE,L1,Open,,Case Created
ITEM-000268,Update,new_contracttermmonths,36,12,ACTOR-0002,29/10/2025 06:49,2025-10-29T06:49:00Z,ITEM-000268,L2_MILESTONE,L2,12,,new_contracttermmonths → 12
ITEM-000268,Update,estimatedclosedate,10/2/25 0:00,12/24/25 0:00,ACTOR-0002,29/10/2025 06:49,2025-10-29T06:49:00Z,ITEM-000268,L1_STAGE,L1,12/24/25 0:00,,estimatedclosedate → 12/24/25 0:00
ITEM-000268,Update,the000g__revenuetype,,604720002,ACTOR-0002,18/12/2025 15:44,2025-12-18T15:44:00Z,ITEM-000268,L2_MILESTONE,L2,604720002,,the000g__revenuetype → 604720002
ITEM-000268,Update,estimatedclosedate,12/24/25 0:00,1/29/26 0:00,ACTOR-0002,18/12/2025 15:44,2025-12-18T15:44:00Z,ITEM-000268,L1_STAGE,L1,1/29/26 0:00,,estimatedclosedate → 1/29/26 0:00
ITEM-000268,Update,estimatedclosedate,1/29/26 0:00,2/26/26 0:00,ACTOR-0002,12/1/26 15:43,2026-12-01T15:43:00Z,ITEM-000268,L1_STAGE,L1,2/26/26 0:00,,estimatedclosedate → 2/26/26 0:00
ITEM-000269,Create,statecode,,0,ACTOR-0006,28/01/2026 08:54,2026-01-28T08:54:00Z,ITEM-000269,L1_STAGE,L1,Open,,Case Created
ITEM-000269,Update,stepname,,14-Qualify,ACTOR-0008,28/01/2026 08:55,2026-01-28T08:55:00Z,ITEM-000269,L1_STAGE,L1,14-Qualify,14.0,stepname → 14-Qualify
ITEM-000269,Update,estimatedclosedate,12/31/26 0:00,2/20/26 0:00,ACTOR-0006,29/01/2026 13:53,2026-01-29T13:53:00Z,ITEM-000269,L1_STAGE,L1,2/20/26 0:00,,estimatedclosedate → 2/20/26 0:00
ITEM-000270,Update,owningbusinessunit,"businessunit,0a4ccfd6-e6d9-e611-80f2-5065f38aba91","businessunit,0a4ccfd6-e6d9-e611-80f2-5065f38aba91",ACTOR-0002,7/10/25 10:45,2025-07-10T10:45:00Z,ITEM-000270,L3_ADMIN,L3,"businessunit,0a4ccfd6-e6d9-e611-80f2-5065f38aba91",,owningbusinessunit changed
ITEM-000270,Update,ownerid,"systemuser,7b9d5323-2ef3-4d52-9d6c-dd45deb05e3b","systemuser,efd3822d-8c8b-4619-8eb9-39ddf9c5c57f",ACTOR-0002,7/10/25 10:45,2025-07-10T10:45:00Z,ITEM-000270,L3_ADMIN,L3,"systemuser,efd3822d-8c8b-4619-8eb9-39ddf9c5c57f",,Owner changed
ITEM-000272,Update,ownerid,"systemuser,09f34b91-4d86-4fc8-8b41-8af3d91e94bf","systemuser,efd3822d-8c8b-4619-8eb9-39ddf9c5c57f",ACTOR-0003,2/12/25 10:29,2025-02-12T10:29:00Z,ITEM-000272,L3_ADMIN,L3,"systemuser,efd3822d-8c8b-4619-8eb9-39ddf9c5c57f",,Owner changed
ITEM-000272,Update,the000g_revenuetype,,604720001,ACTOR-0003,17/08/2025 13:01,2025-08-17T13:01:00Z,ITEM-000272,L2_MILESTONE,L2,604720001,,the000g_revenuetype → 604720001
ITEM-000273,Update,the000g_revenuetype,,604720002,ACTOR-0003,17/08/2025 12:56,2025-08-17T12:56:00Z,ITEM-000273,L2_MILESTONE,L2,604720002,,the000g_revenuetype → 604720002
ITEM-000273,Update,owningbusinessunit,"businessunit,0a4ccfd6-e6d9-e611-80f2-5065f38aba91","businessunit,0a4ccfd6-e6d9-e611-80f2-5065f38aba91",ACTOR-0003,27/10/2025 11:18,2025-10-27T11:18:00Z,ITEM-000273,L3_ADMIN,L3,"businessunit,0a4ccfd6-e6d9-e611-80f2-5065f38aba91",,owningbusinessunit changed
ITEM-000273,Update,ownerid,"systemuser,a1bb889b-dfab-4e28-b508-75e672da7cb8","systemuser,efd3822d-8c8b-4619-8eb9-39ddf9c5c57f",ACTOR-0003,27/10/2025 11:18,2025-10-27T11:18:00Z,ITEM-000273,L3_ADMIN,L3,"systemuser,efd3822d-8c8b-4619-8eb9-39ddf9c5c57f",,Owner changed
ITEM-000274,Update,owningbusinessunit,"businessunit,0a4ccfd6-e6d9-e611-80f2-5065f38aba91","businessunit,0a4ccfd6-e6d9-e611-80f2-5065f38aba91",ACTOR-0002,8/9/25 8:04,2025-08-09T08:04:00Z,ITEM-000274,L3_ADMIN,L3,"businessunit,0a4ccfd6-e6d9-e611-80f2-5065f38aba91",,owningbusinessunit changed
ITEM-000274,Update,ownerid,"systemuser,ddf0a409-01d5-4caa-bd27-c1b42fee109e","systemuser,efd3822d-8c8b-4619-8eb9-39ddf9c5c57f",ACTOR-0002,8/9/25 8:04,2025-08-09T08:04:00Z,ITEM-000274,L3_ADMIN,L3,"systemuser,efd3822d-8c8b-4619-8eb9-39ddf9c5c57f",,Owner changed
ITEM-000278,Update,owningbusinessunit,"businessunit,0a4ccfd6-e6d9-e611-80f2-5065f38aba91","businessunit,0a4ccfd6-e6d9-e611-80f2-5065f38aba91",ACTOR-0004,26/09/2025 09:21,2025-09-26T09:21:00Z,ITEM-000278,L3_ADMIN,L3,"businessunit,0a4ccfd6-e6d9-e611-80f2-5065f38aba91",,owningbusinessunit changed
ITEM-000278,Update,ownerid,"systemuser,09f34b91-4d86-4fc8-8b41-8af3d91e94bf","systemuser,b5f00e27-78b3-4a71-90af-5dcef3c25bba",ACTOR-0004,26/09/2025 09:21,2025-09-26T09:21:00Z,ITEM-000278,L3_ADMIN,L3,"systemuser,b5f00e27-78b3-4a71-90af-5dcef3c25bba",,Owner changed
ITEM-000279,Update,stepname,,14-Qualify,ACTOR-0008,7/1/26 12:07,2026-07-01T12:07:00Z,ITEM-000279,L1_STAGE,L1,14-Qualify,14.0,stepname → 14-Qualify
ITEM-000279,Create,purchaseprocess,,0,ACTOR-0002,7/1/26 12:07,2026-07-01T12:07:00Z,ITEM-000279,L2_MILESTONE,L2,0,,Case Created
ITEM-000280,Update,owningbusinessunit,"businessunit,0a4ccfd6-e6d9-e611-80f2-5065f38aba91","businessunit,0a4ccfd6-e6d9-e611-80f2-5065f38aba91",ACTOR-0002,22/08/2025 13:23,2025-08-22T13:23:00Z,ITEM-000280,L3_ADMIN,L3,"businessunit,0a4ccfd6-e6d9-e611-80f2-5065f38aba91",,owningbusinessunit changed
ITEM-000280,Update,ownerid,"systemuser,a1bb889b-dfab-4e28-b508-75e672da7cb8","systemuser,efd3822d-8c8b-4619-8eb9-39ddf9c5c57f",ACTOR-0002,22/08/2025 13:23,2025-08-22T13:23:00Z,ITEM-000280,L3_ADMIN,L3,"systemuser,efd3822d-8c8b-4619-8eb9-39ddf9c5c57f",,Owner changed
ITEM-000281,Update,stepname,,14-Qualify,ACTOR-0008,8/9/25 11:54,2025-08-09T11:54:00Z,ITEM-000281,L1_STAGE,L1,14-Qualify,14.0,stepname → 14-Qualify
ITEM-000281,Create,statecode,,0,ACTOR-0002,8/9/25 11:54,2025-08-09T11:54:00Z,ITEM-000281,L1_STAGE,L1,Open,,Case Created
ITEM-000281,Update,stepname,14-Qualify,15-Develop,ACTOR-0008,8/10/25 11:10,2025-08-10T11:10:00Z,ITEM-000281,L1_STAGE,L1,15-Develop,15.0,stepname → 15-Develop
ITEM-000281,Update,stepname,15-Develop,16-Propose,ACTOR-0008,8/10/25 11:10,2025-08-10T11:10:00Z,ITEM-000281,L1_STAGE,L1,16-Propose,16.0,stepname → 16-Propose
ITEM-000281,Update,stepname,16-Propose,17-Close,ACTOR-0008,8/10/25 11:10,2025-08-10T11:10:00Z,ITEM-000281,L1_STAGE,L1,17-Close,17.0,stepname → 17-Close
ITEM-000281,Update,statuscode,1,4,ACTOR-0002,8/10/25 11:11,2025-08-10T11:11:00Z,ITEM-000281,L1_STAGE,L1,Canceled,,statuscode → Canceled
ITEM-000281,Update,msdyn_forecastcategory,100000001,100000006,ACTOR-0002,8/10/25 11:11,2025-08-10T11:11:00Z,ITEM-000281,L1_STAGE,L1,100000006,,msdyn_forecastcategory → 100000006
ITEM-000281,Update,actualclosedate,,10/8/25 0:00,ACTOR-0002,8/10/25 11:11,2025-08-10T11:11:00Z,ITEM-000281,L1_STAGE,L1,10/8/25 0:00,,actualclosedate → 10/8/25 0:00
ITEM-000281,Update,salesstage,,3,ACTOR-0002,8/10/25 11:11,2025-08-10T11:11:00Z,ITEM-000281,L1_STAGE,L1,3,,salesstage → 3
ITEM-000281,Update,statecode,0,2,ACTOR-0002,8/10/25 11:11,2025-08-10T11:11:00Z,ITEM-000281,L1_STAGE,L1,Lost,,statecode → Lost
ITEM-000281,Update,new_contracttermmonths,,36,ACTOR-0002,23/09/2025 09:49,2025-09-23T09:49:00Z,ITEM-000281,L2_MILESTONE,L2,36,,new_contracttermmonths → 36
ITEM-000282,Update,owningbusinessunit,"businessunit,0a4ccfd6-e6d9-e611-80f2-5065f38aba91","businessunit,0a4ccfd6-e6d9-e611-80f2-5065f38aba91",ACTOR-0004,26/09/2025 09:20,2025-09-26T09:20:00Z,ITEM-000282,L3_ADMIN,L3,"businessunit,0a4ccfd6-e6d9-e611-80f2-5065f38aba91",,owningbusinessunit changed
ITEM-000282,Update,ownerid,"systemuser,1cba5fd4-6e4e-4e0f-85ff-a6438bc2f2f0","systemuser,b5f00e27-78b3-4a71-90af-5dcef3c25bba",ACTOR-0004,26/09/2025 09:20,2025-09-26T09:20:00Z,ITEM-000282,L3_ADMIN,L3,"systemuser,b5f00e27-78b3-4a71-90af-5dcef3c25bba",,Owner changed
ITEM-000283,Update,owningbusinessunit,"businessunit,0a4ccfd6-e6d9-e611-80f2-5065f38aba91","businessunit,0a4ccfd6-e6d9-e611-80f2-5065f38aba91",ACTOR-0004,26/09/2025 09:21,2025-09-26T09:21:00Z,ITEM-000283,L3_ADMIN,L3,"businessunit,0a4ccfd6-e6d9-e611-80f2-5065f38aba91",,owningbusinessunit changed
ITEM-000283,Update,ownerid,"systemuser,1cba5fd4-6e4e-4e0f-85ff-a6438bc2f2f0","systemuser,b5f00e27-78b3-4a71-90af-5dcef3c25bba",ACTOR-0004,26/09/2025 09:21,2025-09-26T09:21:00Z,ITEM-000283,L3_ADMIN,L3,"systemuser,b5f00e27-78b3-4a71-90af-5dcef3c25bba",,Owner changed
ITEM-000284,Update,owningbusinessunit,"businessunit,0a4ccfd6-e6d9-e611-80f2-5065f38aba91","businessunit,0a4ccfd6-e6d9-e611-80f2-5065f38aba91",ACTOR-0002,7/10/25 10:46,2025-07-10T10:46:00Z,ITEM-000284,L3_ADMIN,L3,"businessunit,0a4ccfd6-e6d9-e611-80f2-5065f38aba91",,owningbusinessunit changed
ITEM-000284,Update,ownerid,"systemuser,7b9d5323-2ef3-4d52-9d6c-dd45deb05e3b","systemuser,efd3822d-8c8b-4619-8eb9-39ddf9c5c57f",ACTOR-0002,7/10/25 10:46,2025-07-10T10:46:00Z,ITEM-000284,L3_ADMIN,L3,"systemuser,efd3822d-8c8b-4619-8eb9-39ddf9c5c57f",,Owner changed
ITEM-000285,Update,owningbusinessunit,"businessunit,0a4ccfd6-e6d9-e611-80f2-5065f38aba91","businessunit,0a4ccfd6-e6d9-e611-80f2-5065f38aba91",ACTOR-0002,7/10/25 10:46,2025-07-10T10:46:00Z,ITEM-000285,L3_ADMIN,L3,"businessunit,0a4ccfd6-e6d9-e611-80f2-5065f38aba91",,owningbusinessunit changed
ITEM-000285,Update,ownerid,"systemuser,7b9d5323-2ef3-4d52-9d6c-dd45deb05e3b","systemuser,efd3822d-8c8b-4619-8eb9-39ddf9c5c57f",ACTOR-0002,7/10/25 10:46,2025-07-10T10:46:00Z,ITEM-000285,L3_ADMIN,L3,"systemuser,efd3822d-8c8b-4619-8eb9-39ddf9c5c57f",,Owner changed
ITEM-000286,Update,stepname,,14-Qualify,ACTOR-0008,22/10/2025 16:55,2025-10-22T16:55:00Z,ITEM-000286,L1_STAGE,L1,14-Qualify,14.0,stepname → 14-Qualify
ITEM-000286,Create,statecode,,0,ACTOR-0003,22/10/2025 16:55,2025-10-22T16:55:00Z,ITEM-000286,L1_STAGE,L1,Open,,Case Created
ITEM-000286,Update,purchaseprocess,,1,ACTOR-0006,28/01/2026 10:14,2026-01-28T10:14:00Z,ITEM-000286,L2_MILESTONE,L2,1,,purchaseprocess → 1
ITEM-000286,Update,closeprobability,,25,ACTOR-0006,28/01/2026 10:14,2026-01-28T10:14:00Z,ITEM-000286,L1_STAGE,L1,25,,closeprobability → 25
ITEM-000286,Update,the000g__revenuetype,,604720002,ACTOR-0006,28/01/2026 10:14,2026-01-28T10:14:00Z,ITEM-000286,L2_MILESTONE,L2,604720002,,the000g__revenuetype → 604720002
ITEM-000286,Update,estimatedclosedate,7/10/26 0:00,2/20/26 0:00,ACTOR-0006,29/01/2026 13:54,2026-01-29T13:54:00Z,ITEM-000286,L1_STAGE,L1,2/20/26 0:00,,estimatedclosedate → 2/20/26 0:00
ITEM-000287,Update,owningbusinessunit,"businessunit,0a4ccfd6-e6d9-e611-80f2-5065f38aba91","businessunit,0a4ccfd6-e6d9-e611-80f2-5065f38aba91",ACTOR-0002,22/08/2025 13:23,2025-08-22T13:23:00Z,ITEM-000287,L3_ADMIN,L3,"businessunit,0a4ccfd6-e6d9-e611-80f2-5065f38aba91",,owningbusinessunit changed
ITEM-000287,Update,ownerid,"systemuser,7b9d5323-2ef3-4d52-9d6c-dd45deb05e3b","systemuser,efd3822d-8c8b-4619-8eb9-39ddf9c5c57f",ACTOR-0002,22/08/2025 13:23,2025-08-22T13:23:00Z,ITEM-000287,L3_ADMIN,L3,"systemuser,efd3822d-8c8b-4619-8eb9-39ddf9c5c57f",,Owner changed
ITEM-000288,Update,statuscode,1,4,ACTOR-0009,6/10/25 9:57,2025-06-10T09:57:00Z,ITEM-000288,L1_STAGE,L1,Canceled,,statuscode → Canceled
ITEM-000288,Update,msdyn_forecastcategory,100000001,100000006,ACTOR-0009,6/10/25 9:57,2025-06-10T09:57:00Z,ITEM-000288,L1_STAGE,L1,100000006,,msdyn_forecastcategory → 100000006
ITEM-000288,Update,actualclosedate,,10/6/25 0:00,ACTOR-0009,6/10/25 9:57,2025-06-10T09:57:00Z,ITEM-000288,L1_STAGE,L1,10/6/25 0:00,,actualclosedate → 10/6/25 0:00
ITEM-000288,Update,salesstage,,3,ACTOR-0009,6/10/25 9:57,2025-06-10T09:57:00Z,ITEM-000288,L1_STAGE,L1,3,,salesstage → 3
ITEM-000288,Update,statecode,0,2,ACTOR-0009,6/10/25 9:57,2025-06-10T09:57:00Z,ITEM-000288,L1_STAGE,L1,Lost,,statecode → Lost
ITEM-000288,Update,the000g_revenuetype,,604720001,ACTOR-0009,18/08/2025 09:44,2025-08-18T09:44:00Z,ITEM-000288,L2_MILESTONE,L2,604720001,,the000g_revenuetype → 604720001
ITEM-000288,Update,the000g_isrenewal,,FALSE,ACTOR-0009,18/08/2025 09:44,2025-08-18T09:44:00Z,ITEM-000288,L3_ADMIN,L3,FALSE,,the000g_isrenewal changed
ITEM-000289,Update,owningbusinessunit,"businessunit,0a4ccfd6-e6d9-e611-80f2-5065f38aba91","businessunit,0a4ccfd6-e6d9-e611-80f2-5065f38aba91",ACTOR-0002,7/10/25 10:46,2025-07-10T10:46:00Z,ITEM-000289,L3_ADMIN,L3,"businessunit,0a4ccfd6-e6d9-e611-80f2-5065f38aba91",,owningbusinessunit changed
ITEM-000289,Update,ownerid,"systemuser,7b9d5323-2ef3-4d52-9d6c-dd45deb05e3b","systemuser,efd3822d-8c8b-4619-8eb9-39ddf9c5c57f",ACTOR-0002,7/10/25 10:46,2025-07-10T10:46:00Z,ITEM-000289,L3_ADMIN,L3,"systemuser,efd3822d-8c8b-4619-8eb9-39ddf9c5c57f",,Owner changed
ITEM-000291,Update,owningbusinessunit,"businessunit,0a4ccfd6-e6d9-e611-80f2-5065f38aba91","businessunit,0a4ccfd6-e6d9-e611-80f2-5065f38aba91",ACTOR-0003,27/10/2025 11:18,2025-10-27T11:18:00Z,ITEM-000291,L3_ADMIN,L3,"businessunit,0a4ccfd6-e6d9-e611-80f2-5065f38aba91",,owningbusinessunit changed
ITEM-000291,Update,ownerid,"systemuser,a1bb889b-dfab-4e28-b508-75e672da7cb8","systemuser,efd3822d-8c8b-4619-8eb9-39ddf9c5c57f",ACTOR-0003,27/10/2025 11:18,2025-10-27T11:18:00Z,ITEM-000291,L3_ADMIN,L3,"systemuser,efd3822d-8c8b-4619-8eb9-39ddf9c5c57f",,Owner changed
ITEM-000292,Update,owningbusinessunit,"businessunit,0a4ccfd6-e6d9-e611-80f2-5065f38aba91","businessunit,0a4ccfd6-e6d9-e611-80f2-5065f38aba91",ACTOR-0003,27/08/2025 12:57,2025-08-27T12:57:00Z,ITEM-000292,L3_ADMIN,L3,"businessunit,0a4ccfd6-e6d9-e611-80f2-5065f38aba91",,owningbusinessunit changed
ITEM-000292,Update,ownerid,"systemuser,7b9d5323-2ef3-4d52-9d6c-dd45deb05e3b","systemuser,b5f00e27-78b3-4a71-90af-5dcef3c25bba",ACTOR-0003,27/08/2025 12:57,2025-08-27T12:57:00Z,ITEM-000292,L3_ADMIN,L3,"systemuser,b5f00e27-78b3-4a71-90af-5dcef3c25bba",,Owner changed
ITEM-000293,Update,estimatedclosedate,11/19/25 0:00,1/21/26 0:00,ACTOR-0009,6/10/25 14:19,2025-06-10T14:19:00Z,ITEM-000293,L1_STAGE,L1,1/21/26 0:00,,estimatedclosedate → 1/21/26 0:00
ITEM-000293,Update,the000g__revenuetype,,604720002,ACTOR-0009,18/12/2025 09:24,2025-12-18T09:24:00Z,ITEM-000293,L2_MILESTONE,L2,604720002,,the000g__revenuetype → 604720002
ITEM-000293,Update,estimatedclosedate,1/21/26 0:00,4/15/26 0:00,ACTOR-0009,18/12/2025 09:24,2025-12-18T09:24:00Z,ITEM-000293,L1_STAGE,L1,4/15/26 0:00,,estimatedclosedate → 4/15/26 0:00
ITEM-000294,Update,stepname,,14-Qualify,ACTOR-0008,20/10/2025 12:44,2025-10-20T12:44:00Z,ITEM-000294,L1_STAGE,L1,14-Qualify,14.0,stepname → 14-Qualify
ITEM-000294,Create,statecode,,0,ACTOR-0003,20/10/2025 12:44,2025-10-20T12:44:00Z,ITEM-000294,L1_STAGE,L1,Open,,Case Created
ITEM-000294,Update,estimatedclosedate,12/24/25 0:00,10/24/25 0:00,ACTOR-0003,20/10/2025 12:49,2025-10-20T12:49:00Z,ITEM-000294,L1_STAGE,L1,10/24/25 0:00,,estimatedclosedate → 10/24/25 0:00
ITEM-000294,Update,statuscode,1,3,ACTOR-0003,11/11/25 15:55,2025-11-11T15:55:00Z,ITEM-000294,L1_STAGE,L1,Won,,statuscode → Won
ITEM-000294,Update,msdyn_forecastcategory,100000001,100000005,ACTOR-0003,11/11/25 15:55,2025-11-11T15:55:00Z,ITEM-000294,L1_STAGE,L1,100000005,,msdyn_forecastcategory → 100000005
ITEM-000294,Update,actualclosedate,,11/11/25 0:00,ACTOR-0003,11/11/25 15:55,2025-11-11T15:55:00Z,ITEM-000294,L1_STAGE,L1,11/11/25 0:00,,actualclosedate → 11/11/25 0:00
ITEM-000294,Update,salesstage,,3,ACTOR-0003,11/11/25 15:55,2025-11-11T15:55:00Z,ITEM-000294,L1_STAGE,L1,3,,salesstage → 3
ITEM-000294,Update,statecode,0,1,ACTOR-0003,11/11/25 15:55,2025-11-11T15:55:00Z,ITEM-000294,L1_STAGE,L1,Won,,statecode → Won
ITEM-000294,Update,closeprobability,50,100,ACTOR-0003,11/11/25 15:55,2025-11-11T15:55:00Z,ITEM-000294,L1_STAGE,L1,100,,closeprobability → 100
ITEM-000296,Update,stepname,,14-Qualify,ACTOR-0008,16/01/2026 09:25,2026-01-16T09:25:00Z,ITEM-000296,L1_STAGE,L1,14-Qualify,14.0,stepname → 14-Qualify
ITEM-000296,Create,purchaseprocess,,0,ACTOR-0002,16/01/2026 09:25,2026-01-16T09:25:00Z,ITEM-000296,L2_MILESTONE,L2,0,,Case Created
ITEM-000296,Update,estimatedclosedate,1/30/26 0:00,2/5/26 0:00,ACTOR-0002,27/01/2026 15:53,2026-01-27T15:53:00Z,ITEM-000296,L1_STAGE,L1,2/5/26 0:00,,estimatedclosedate → 2/5/26 0:00
ITEM-000296,Update,estimatedclosedate,2/5/26 0:00,2/19/26 0:00,ACTOR-0002,27/01/2026 16:23,2026-01-27T16:23:00Z,ITEM-000296,L1_STAGE,L1,2/19/26 0:00,,estimatedclosedate → 2/19/26 0:00
ITEM-000297,Update,owningbusinessunit,"businessunit,0a4ccfd6-e6d9-e611-80f2-5065f38aba91","businessunit,0a4ccfd6-e6d9-e611-80f2-5065f38aba91",ACTOR-0002,7/10/25 10:45,2025-07-10T10:45:00Z,ITEM-000297,L3_ADMIN,L3,"businessunit,0a4ccfd6-e6d9-e611-80f2-5065f38aba91",,owningbusinessunit changed
ITEM-000297,Update,ownerid,"systemuser,7b9d5323-2ef3-4d52-9d6c-dd45deb05e3b","systemuser,efd3822d-8c8b-4619-8eb9-39ddf9c5c57f",ACTOR-0002,7/10/25 10:45,2025-07-10T10:45:00Z,ITEM-000297,L3_ADMIN,L3,"systemuser,efd3822d-8c8b-4619-8eb9-39ddf9c5c57f",,Owner changed
ITEM-000298,Update,statuscode,1,4,ACTOR-0009,8/10/25 9:52,2025-08-10T09:52:00Z,ITEM-000298,L1_STAGE,L1,Canceled,,statuscode → Canceled
ITEM-000298,Update,msdyn_forecastcategory,100000001,100000006,ACTOR-0009,8/10/25 9:52,2025-08-10T09:52:00Z,ITEM-000298,L1_STAGE,L1,100000006,,msdyn_forecastcategory → 100000006
ITEM-000298,Update,actualclosedate,,10/8/25 0:00,ACTOR-0009,8/10/25 9:52,2025-08-10T09:52:00Z,ITEM-000298,L1_STAGE,L1,10/8/25 0:00,,actualclosedate → 10/8/25 0:00
ITEM-000298,Update,salesstage,,3,ACTOR-0009,8/10/25 9:52,2025-08-10T09:52:00Z,ITEM-000298,L1_STAGE,L1,3,,salesstage → 3
ITEM-000298,Update,statecode,0,2,ACTOR-0009,8/10/25 9:52,2025-08-10T09:52:00Z,ITEM-000298,L1_STAGE,L1,Lost,,statecode → Lost
ITEM-000299,Update,stepname,,14-Qualify,ACTOR-0008,8/1/26 12:36,2026-08-01T12:36:00Z,ITEM-000299,L1_STAGE,L1,14-Qualify,14.0,stepname → 14-Qualify
ITEM-000299,Create,statecode,,0,ACTOR-0009,8/1/26 12:36,2026-08-01T12:36:00Z,ITEM-000299,L1_STAGE,L1,Open,,Case Created
ITEM-000301,Update,stepname,16-Propose,17-Close,ACTOR-0008,1/12/25 10:38,2025-01-12T10:38:00Z,ITEM-000301,L1_STAGE,L1,17-Close,17.0,stepname → 17-Close
ITEM-000301,Update,the000g_purchaseorderstatus,,604720002,ACTOR-0002,1/12/25 10:38,2025-01-12T10:38:00Z,ITEM-000301,L1_STAGE,L1,604720002,,the000g_purchaseorderstatus → 604720002
ITEM-000301,Update,statuscode,1,3,ACTOR-0002,1/12/25 10:39,2025-01-12T10:39:00Z,ITEM-000301,L1_STAGE,L1,Won,,statuscode → Won
ITEM-000301,Update,msdyn_forecastcategory,100000001,100000005,ACTOR-0002,1/12/25 10:39,2025-01-12T10:39:00Z,ITEM-000301,L1_STAGE,L1,100000005,,msdyn_forecastcategory → 100000005
ITEM-000301,Update,actualclosedate,,12/1/25 0:00,ACTOR-0002,1/12/25 10:39,2025-01-12T10:39:00Z,ITEM-000301,L1_STAGE,L1,12/1/25 0:00,,actualclosedate → 12/1/25 0:00
ITEM-000301,Update,salesstage,,3,ACTOR-0002,1/12/25 10:39,2025-01-12T10:39:00Z,ITEM-000301,L1_STAGE,L1,3,,salesstage → 3
ITEM-000301,Update,statecode,0,1,ACTOR-0002,1/12/25 10:39,2025-01-12T10:39:00Z,ITEM-000301,L1_STAGE,L1,Won,,statecode → Won
ITEM-000301,Update,stepname,,14-Qualify,ACTOR-0008,10/11/25 9:30,2025-10-11T09:30:00Z,ITEM-000301,L1_STAGE,L1,14-Qualify,14.0,stepname → 14-Qualify
ITEM-000301,Create,purchaseprocess,,0,ACTOR-0002,10/11/25 9:30,2025-10-11T09:30:00Z,ITEM-000301,L2_MILESTONE,L2,0,,Case Created
ITEM-000301,Update,parentaccountid,,"account,f4067b55-dedf-e611-80f3-5065f38bd451",ACTOR-0002,11/11/25 12:33,2025-11-11T12:33:00Z,ITEM-000301,L3_ADMIN,L3,"account,f4067b55-dedf-e611-80f3-5065f38bd451",,parentaccountid changed
ITEM-000301,Update,customerid,"contact,1bf73459-17be-f011-bbd3-7ced8d956752","account,f4067b55-dedf-e611-80f3-5065f38bd451",ACTOR-0002,11/11/25 12:33,2025-11-11T12:33:00Z,ITEM-000301,L3_ADMIN,L3,"account,f4067b55-dedf-e611-80f3-5065f38bd451",,customerid changed
ITEM-000301,Update,stepname,14-Qualify,15-Develop,ACTOR-0008,21/11/2025 09:38,2025-11-21T09:38:00Z,ITEM-000301,L1_STAGE,L1,15-Develop,15.0,stepname → 15-Develop
ITEM-000301,Update,stepname,15-Develop,16-Propose,ACTOR-0008,21/11/2025 09:39,2025-11-21T09:39:00Z,ITEM-000301,L1_STAGE,L1,16-Propose,16.0,stepname → 16-Propose
ITEM-000301,Update,estimatedclosedate,11/18/25 0:00,11/27/25 0:00,ACTOR-0002,21/11/2025 09:39,2025-11-21T09:39:00Z,ITEM-000301,L1_STAGE,L1,11/27/25 0:00,,estimatedclosedate → 11/27/25 0:00
ITEM-000302,Update,owningbusinessunit,"businessunit,0a4ccfd6-e6d9-e611-80f2-5065f38aba91","businessunit,0a4ccfd6-e6d9-e611-80f2-5065f38aba91",ACTOR-0003,26/08/2025 07:43,2025-08-26T07:43:00Z,ITEM-000302,L3_ADMIN,L3,"businessunit,0a4ccfd6-e6d9-e611-80f2-5065f38aba91",,owningbusinessunit changed
ITEM-000302,Update,ownerid,"systemuser,b5f00e27-78b3-4a71-90af-5dcef3c25bba","systemuser,efd3822d-8c8b-4619-8eb9-39ddf9c5c57f",ACTOR-0003,26/08/2025 07:43,2025-08-26T07:43:00Z,ITEM-000302,L3_ADMIN,L3,"systemuser,efd3822d-8c8b-4619-8eb9-39ddf9c5c57f",,Owner changed
ITEM-000303,Update,the000g_revenuetype,,604720001,ACTOR-0003,17/08/2025 13:01,2025-08-17T13:01:00Z,ITEM-000303,L2_MILESTONE,L2,604720001,,the000g_revenuetype → 604720001
ITEM-000303,Update,ownerid,"systemuser,1cba5fd4-6e4e-4e0f-85ff-a6438bc2f2f0","systemuser,09f34b91-4d86-4fc8-8b41-8af3d91e94bf",ACTOR-0003,20/10/2025 12:42,2025-10-20T12:42:00Z,ITEM-000303,L3_ADMIN,L3,"systemuser,09f34b91-4d86-4fc8-8b41-8af3d91e94bf",,Owner changed
ITEM-000304,Update,stepname,,14-Qualify,ACTOR-0008,28/01/2026 10:33,2026-01-28T10:33:00Z,ITEM-000304,L1_STAGE,L1,14-Qualify,14.0,stepname → 14-Qualify
ITEM-000304,Create,statecode,,0,ACTOR-0006,28/01/2026 10:33,2026-01-28T10:33:00Z,ITEM-000304,L1_STAGE,L1,Open,,Case Created
ITEM-000305,Update,statuscode,1,4,ACTOR-0003,21/10/2025 12:48,2025-10-21T12:48:00Z,ITEM-000305,L1_STAGE,L1,Canceled,,statuscode → Canceled
ITEM-000305,Update,msdyn_forecastcategory,100000001,100000006,ACTOR-0003,21/10/2025 12:48,2025-10-21T12:48:00Z,ITEM-000305,L1_STAGE,L1,100000006,,msdyn_forecastcategory → 100000006
ITEM-000305,Update,actualclosedate,,10/21/25 0:00,ACTOR-0003,21/10/2025 12:48,2025-10-21T12:48:00Z,ITEM-000305,L1_STAGE,L1,10/21/25 0:00,,actualclosedate → 10/21/25 0:00
ITEM-000305,Update,salesstage,,3,ACTOR-0003,21/10/2025 12:48,2025-10-21T12:48:00Z,ITEM-000305,L1_STAGE,L1,3,,salesstage → 3
ITEM-000305,Update,statecode,0,2,ACTOR-0003,21/10/2025 12:48,2025-10-21T12:48:00Z,ITEM-000305,L1_STAGE,L1,Lost,,statecode → Lost
ITEM-000306,Update,owningbusinessunit,"businessunit,0a4ccfd6-e6d9-e611-80f2-5065f38aba91","businessunit,0a4ccfd6-e6d9-e611-80f2-5065f38aba91",ACTOR-0004,26/09/2025 09:21,2025-09-26T09:21:00Z,ITEM-000306,L3_ADMIN,L3,"businessunit,0a4ccfd6-e6d9-e611-80f2-5065f38aba91",,owningbusinessunit changed
ITEM-000306,Update,ownerid,"systemuser,1cba5fd4-6e4e-4e0f-85ff-a6438bc2f2f0","systemuser,b5f00e27-78b3-4a71-90af-5dcef3c25bba",ACTOR-0004,26/09/2025 09:21,2025-09-26T09:21:00Z,ITEM-000306,L3_ADMIN,L3,"systemuser,b5f00e27-78b3-4a71-90af-5dcef3c25bba",,Owner changed
ITEM-000307,Update,statuscode,1,4,ACTOR-0009,19/08/2025 09:27,2025-08-19T09:27:00Z,ITEM-000307,L1_STAGE,L1,Canceled,,statuscode → Canceled
ITEM-000307,Update,msdyn_forecastcategory,100000001,100000006,ACTOR-0009,19/08/2025 09:27,2025-08-19T09:27:00Z,ITEM-000307,L1_STAGE,L1,100000006,,msdyn_forecastcategory → 100000006
ITEM-000307,Update,actualclosedate,,8/19/25 0:00,ACTOR-0009,19/08/2025 09:27,2025-08-19T09:27:00Z,ITEM-000307,L1_STAGE,L1,8/19/25 0:00,,actualclosedate → 8/19/25 0:00
ITEM-000307,Update,salesstage,,3,ACTOR-0009,19/08/2025 09:27,2025-08-19T09:27:00Z,ITEM-000307,L1_STAGE,L1,3,,salesstage → 3
ITEM-000307,Update,statecode,0,2,ACTOR-0009,19/08/2025 09:27,2025-08-19T09:27:00Z,ITEM-000307,L1_STAGE,L1,Lost,,statecode → Lost
ITEM-000308,Update,owningbusinessunit,"businessunit,0a4ccfd6-e6d9-e611-80f2-5065f38aba91","businessunit,0a4ccfd6-e6d9-e611-80f2-5065f38aba91",ACTOR-0003,26/08/2025 07:42,2025-08-26T07:42:00Z,ITEM-000308,L3_ADMIN,L3,"businessunit,0a4ccfd6-e6d9-e611-80f2-5065f38aba91",,owningbusinessunit changed
ITEM-000308,Update,ownerid,"systemuser,ddf0a409-01d5-4caa-bd27-c1b42fee109e","systemuser,efd3822d-8c8b-4619-8eb9-39ddf9c5c57f",ACTOR-0003,26/08/2025 07:42,2025-08-26T07:42:00Z,ITEM-000308,L3_ADMIN,L3,"systemuser,efd3822d-8c8b-4619-8eb9-39ddf9c5c57f",,Owner changed
ITEM-000309,Update,owningbusinessunit,"businessunit,0a4ccfd6-e6d9-e611-80f2-5065f38aba91","businessunit,0a4ccfd6-e6d9-e611-80f2-5065f38aba91",ACTOR-0004,26/09/2025 09:21,2025-09-26T09:21:00Z,ITEM-000309,L3_ADMIN,L3,"businessunit,0a4ccfd6-e6d9-e611-80f2-5065f38aba91",,owningbusinessunit changed
ITEM-000309,Update,ownerid,"systemuser,1cba5fd4-6e4e-4e0f-85ff-a6438bc2f2f0","systemuser,b5f00e27-78b3-4a71-90af-5dcef3c25bba",ACTOR-0004,26/09/2025 09:21,2025-09-26T09:21:00Z,ITEM-000309,L3_ADMIN,L3,"systemuser,b5f00e27-78b3-4a71-90af-5dcef3c25bba",,Owner changed
ITEM-000310,Update,statuscode,1,3,ACTOR-0003,13/10/2025 15:45,2025-10-13T15:45:00Z,ITEM-000310,L1_STAGE,L1,Won,,statuscode → Won
ITEM-000310,Update,msdyn_forecastcategory,100000002,100000005,ACTOR-0003,13/10/2025 15:45,2025-10-13T15:45:00Z,ITEM-000310,L1_STAGE,L1,100000005,,msdyn_forecastcategory → 100000005
ITEM-000310,Update,statecode,0,1,ACTOR-0003,13/10/2025 15:45,2025-10-13T15:45:00Z,ITEM-000310,L1_STAGE,L1,Won,,statecode → Won
ITEM-000310,Update,actualclosedate,1/28/22 0:00,10/13/25 0:00,ACTOR-0003,13/10/2025 15:45,2025-10-13T15:45:00Z,ITEM-000310,L1_STAGE,L1,10/13/25 0:00,,actualclosedate → 10/13/25 0:00
ITEM-000311,Update,owningbusinessunit,"businessunit,0a4ccfd6-e6d9-e611-80f2-5065f38aba91","businessunit,0a4ccfd6-e6d9-e611-80f2-5065f38aba91",ACTOR-0004,26/09/2025 09:21,2025-09-26T09:21:00Z,ITEM-000311,L3_ADMIN,L3,"businessunit,0a4ccfd6-e6d9-e611-80f2-5065f38aba91",,owningbusinessunit changed
ITEM-000311,Update,ownerid,"systemuser,1cba5fd4-6e4e-4e0f-85ff-a6438bc2f2f0","systemuser,b5f00e27-78b3-4a71-90af-5dcef3c25bba",ACTOR-0004,26/09/2025 09:21,2025-09-26T09:21:00Z,ITEM-000311,L3_ADMIN,L3,"systemuser,b5f00e27-78b3-4a71-90af-5dcef3c25bba",,Owner changed
ITEM-000312,Update,owningbusinessunit,"businessunit,0a4ccfd6-e6d9-e611-80f2-5065f38aba91","businessunit,0a4ccfd6-e6d9-e611-80f2-5065f38aba91",ACTOR-0003,26/08/2025 07:43,2025-08-26T07:43:00Z,ITEM-000312,L3_ADMIN,L3,"businessunit,0a4ccfd6-e6d9-e611-80f2-5065f38aba91",,owningbusinessunit changed
ITEM-000312,Update,ownerid,"systemuser,b5f00e27-78b3-4a71-90af-5dcef3c25bba","systemuser,efd3822d-8c8b-4619-8eb9-39ddf9c5c57f",ACTOR-0003,26/08/2025 07:43,2025-08-26T07:43:00Z,ITEM-000312,L3_ADMIN,L3,"systemuser,efd3822d-8c8b-4619-8eb9-39ddf9c5c57f",,Owner changed
ITEM-000314,Create,statecode,,0,ACTOR-0009,11/11/25 10:13,2025-11-11T10:13:00Z,ITEM-000314,L1_STAGE,L1,Open,,Case Created
ITEM-000314,Update,stepname,,14-Qualify,ACTOR-0008,11/11/25 10:14,2025-11-11T10:14:00Z,ITEM-000314,L1_STAGE,L1,14-Qualify,14.0,stepname → 14-Qualify
ITEM-000314,Update,estimatedclosedate,1/29/26 0:00,2/20/26 0:00,ACTOR-0003,22/01/2026 04:40,2026-01-22T04:40:00Z,ITEM-000314,L1_STAGE,L1,2/20/26 0:00,,estimatedclosedate → 2/20/26 0:00
ITEM-000314,Update,estimatedclosedate,2/20/26 0:00,2/26/26 0:00,ACTOR-0009,26/01/2026 15:35,2026-01-26T15:35:00Z,ITEM-000314,L1_STAGE,L1,2/26/26 0:00,,estimatedclosedate → 2/26/26 0:00
ITEM-000314,Update,stepname,14-Qualify,15-Develop,ACTOR-0008,5/1/26 15:26,2026-05-01T15:26:00Z,ITEM-000314,L1_STAGE,L1,15-Develop,15.0,stepname → 15-Develop
ITEM-000314,Update,stepname,15-Develop,16-Propose,ACTOR-0008,5/1/26 15:26,2026-05-01T15:26:00Z,ITEM-000314,L1_STAGE,L1,16-Propose,16.0,stepname → 16-Propose
ITEM-000314,Update,closeprobability,,25,ACTOR-0003,5/1/26 15:26,2026-05-01T15:26:00Z,ITEM-000314,L1_STAGE,L1,25,,closeprobability → 25
ITEM-000314,Update,the000g__revenuetype,,604720002,ACTOR-0003,5/1/26 15:26,2026-05-01T15:26:00Z,ITEM-000314,L2_MILESTONE,L2,604720002,,the000g__revenuetype → 604720002
ITEM-000315,Update,owningbusinessunit,"businessunit,0a4ccfd6-e6d9-e611-80f2-5065f38aba91","businessunit,0a4ccfd6-e6d9-e611-80f2-5065f38aba91",ACTOR-0002,8/1/26 9:40,2026-08-01T09:40:00Z,ITEM-000315,L3_ADMIN,L3,"businessunit,0a4ccfd6-e6d9-e611-80f2-5065f38aba91",,owningbusinessunit changed
ITEM-000315,Update,ownerid,"systemuser,7b9d5323-2ef3-4d52-9d6c-dd45deb05e3b","systemuser,efd3822d-8c8b-4619-8eb9-39ddf9c5c57f",ACTOR-0002,8/1/26 9:40,2026-08-01T09:40:00Z,ITEM-000315,L3_ADMIN,L3,"systemuser,efd3822d-8c8b-4619-8eb9-39ddf9c5c57f",,Owner changed
ITEM-000317,Update,owningbusinessunit,"businessunit,0a4ccfd6-e6d9-e611-80f2-5065f38aba91","businessunit,0a4ccfd6-e6d9-e611-80f2-5065f38aba91",ACTOR-0002,7/10/25 10:45,2025-07-10T10:45:00Z,ITEM-000317,L3_ADMIN,L3,"businessunit,0a4ccfd6-e6d9-e611-80f2-5065f38aba91",,owningbusinessunit changed
ITEM-000317,Update,ownerid,"systemuser,7b9d5323-2ef3-4d52-9d6c-dd45deb05e3b","systemuser,efd3822d-8c8b-4619-8eb9-39ddf9c5c57f",ACTOR-0002,7/10/25 10:45,2025-07-10T10:45:00Z,ITEM-000317,L3_ADMIN,L3,"systemuser,efd3822d-8c8b-4619-8eb9-39ddf9c5c57f",,Owner changed
ITEM-000318,Update,stepname,,14-Qualify,ACTOR-0008,14/08/2025 14:04,2025-08-14T14:04:00Z,ITEM-000318,L1_STAGE,L1,14-Qualify,14.0,stepname → 14-Qualify
ITEM-000318,Create,statecode,,0,ACTOR-0009,14/08/2025 14:04,2025-08-14T14:04:00Z,ITEM-000318,L1_STAGE,L1,Open,,Case Created
ITEM-000318,Update,statuscode,1,3,ACTOR-0009,14/08/2025 14:12,2025-08-14T14:12:00Z,ITEM-000318,L1_STAGE,L1,Won,,statuscode → Won
ITEM-000318,Update,msdyn_forecastcategory,100000001,100000005,ACTOR-0009,14/08/2025 14:12,2025-08-14T14:12:00Z,ITEM-000318,L1_STAGE,L1,100000005,,msdyn_forecastcategory → 100000005
ITEM-000318,Update,actualclosedate,,8/14/25 0:00,ACTOR-0009,14/08/2025 14:12,2025-08-14T14:12:00Z,ITEM-000318,L1_STAGE,L1,8/14/25 0:00,,actualclosedate → 8/14/25 0:00
ITEM-000318,Update,salesstage,,3,ACTOR-0009,14/08/2025 14:12,2025-08-14T14:12:00Z,ITEM-000318,L1_STAGE,L1,3,,salesstage → 3
ITEM-000318,Update,statecode,0,1,ACTOR-0009,14/08/2025 14:12,2025-08-14T14:12:00Z,ITEM-000318,L1_STAGE,L1,Won,,statecode → Won
ITEM-000319,Update,owningbusinessunit,"businessunit,0a4ccfd6-e6d9-e611-80f2-5065f38aba91","businessunit,0a4ccfd6-e6d9-e611-80f2-5065f38aba91",ACTOR-0003,26/08/2025 07:43,2025-08-26T07:43:00Z,ITEM-000319,L3_ADMIN,L3,"businessunit,0a4ccfd6-e6d9-e611-80f2-5065f38aba91",,owningbusinessunit changed
ITEM-000319,Update,ownerid,"systemuser,b5f00e27-78b3-4a71-90af-5dcef3c25bba","systemuser,efd3822d-8c8b-4619-8eb9-39ddf9c5c57f",ACTOR-0003,26/08/2025 07:43,2025-08-26T07:43:00Z,ITEM-000319,L3_ADMIN,L3,"systemuser,efd3822d-8c8b-4619-8eb9-39ddf9c5c57f",,Owner changed
ITEM-000320,Update,owningbusinessunit,"businessunit,0a4ccfd6-e6d9-e611-80f2-5065f38aba91","businessunit,0a4ccfd6-e6d9-e611-80f2-5065f38aba91",ACTOR-0002,8/9/25 8:04,2025-08-09T08:04:00Z,ITEM-000320,L3_ADMIN,L3,"businessunit,0a4ccfd6-e6d9-e611-80f2-5065f38aba91",,owningbusinessunit changed
ITEM-000320,Update,ownerid,"systemuser,ddf0a409-01d5-4caa-bd27-c1b42fee109e","systemuser,efd3822d-8c8b-4619-8eb9-39ddf9c5c57f",ACTOR-0002,8/9/25 8:04,2025-08-09T08:04:00Z,ITEM-000320,L3_ADMIN,L3,"systemuser,efd3822d-8c8b-4619-8eb9-39ddf9c5c57f",,Owner changed
ITEM-000321,Update,stepname,,14-Qualify,ACTOR-0008,22/10/2025 09:55,2025-10-22T09:55:00Z,ITEM-000321,L1_STAGE,L1,14-Qualify,14.0,stepname → 14-Qualify
ITEM-000321,Create,statecode,,0,ACTOR-0003,22/10/2025 09:55,2025-10-22T09:55:00Z,ITEM-000321,L1_STAGE,L1,Open,,Case Created
ITEM-000321,Update,statuscode,1,4,ACTOR-0003,19/11/2025 11:05,2025-11-19T11:05:00Z,ITEM-000321,L1_STAGE,L1,Canceled,,statuscode → Canceled
ITEM-000321,Update,msdyn_forecastcategory,100000001,100000006,ACTOR-0003,19/11/2025 11:05,2025-11-19T11:05:00Z,ITEM-000321,L1_STAGE,L1,100000006,,msdyn_forecastcategory → 100000006
ITEM-000321,Update,actualclosedate,,11/19/25 0:00,ACTOR-0003,19/11/2025 11:05,2025-11-19T11:05:00Z,ITEM-000321,L1_STAGE,L1,11/19/25 0:00,,actualclosedate → 11/19/25 0:00
ITEM-000321,Update,salesstage,,3,ACTOR-0003,19/11/2025 11:05,2025-11-19T11:05:00Z,ITEM-000321,L1_STAGE,L1,3,,salesstage → 3
ITEM-000321,Update,statecode,0,2,ACTOR-0003,19/11/2025 11:05,2025-11-19T11:05:00Z,ITEM-000321,L1_STAGE,L1,Lost,,statecode → Lost
ITEM-000322,Update,owningbusinessunit,"businessunit,0a4ccfd6-e6d9-e611-80f2-5065f38aba91","businessunit,0a4ccfd6-e6d9-e611-80f2-5065f38aba91",ACTOR-0003,26/08/2025 07:43,2025-08-26T07:43:00Z,ITEM-000322,L3_ADMIN,L3,"businessunit,0a4ccfd6-e6d9-e611-80f2-5065f38aba91",,owningbusinessunit changed
ITEM-000322,Update,ownerid,"systemuser,b5f00e27-78b3-4a71-90af-5dcef3c25bba","systemuser,efd3822d-8c8b-4619-8eb9-39ddf9c5c57f",ACTOR-0003,26/08/2025 07:43,2025-08-26T07:43:00Z,ITEM-000322,L3_ADMIN,L3,"systemuser,efd3822d-8c8b-4619-8eb9-39ddf9c5c57f",,Owner changed
ITEM-000323,Update,stepname,,14-Qualify,ACTOR-0008,13/01/2026 10:44,2026-01-13T10:44:00Z,ITEM-000323,L1_STAGE,L1,14-Qualify,14.0,stepname → 14-Qualify
ITEM-000323,Create,statecode,,0,ACTOR-0009,13/01/2026 10:44,2026-01-13T10:44:00Z,ITEM-000323,L1_STAGE,L1,Open,,Case Created
ITEM-000325,Update,owningbusinessunit,"businessunit,0a4ccfd6-e6d9-e611-80f2-5065f38aba91","businessunit,0a4ccfd6-e6d9-e611-80f2-5065f38aba91",ACTOR-0002,8/1/26 9:40,2026-08-01T09:40:00Z,ITEM-000325,L3_ADMIN,L3,"businessunit,0a4ccfd6-e6d9-e611-80f2-5065f38aba91",,owningbusinessunit changed
ITEM-000325,Update,ownerid,"systemuser,7b9d5323-2ef3-4d52-9d6c-dd45deb05e3b","systemuser,efd3822d-8c8b-4619-8eb9-39ddf9c5c57f",ACTOR-0002,8/1/26 9:40,2026-08-01T09:40:00Z,ITEM-000325,L3_ADMIN,L3,"systemuser,efd3822d-8c8b-4619-8eb9-39ddf9c5c57f",,Owner changed
ITEM-000327,Update,stepname,,14-Qualify,ACTOR-0008,21/10/2025 09:49,2025-10-21T09:49:00Z,ITEM-000327,L1_STAGE,L1,14-Qualify,14.0,stepname → 14-Qualify
ITEM-000327,Create,purchaseprocess,,0,ACTOR-0003,21/10/2025 09:49,2025-10-21T09:49:00Z,ITEM-000327,L2_MILESTONE,L2,0,,Case Created
ITEM-000327,Update,statuscode,1,3,ACTOR-0003,12/11/25 13:14,2025-12-11T13:14:00Z,ITEM-000327,L1_STAGE,L1,Won,,statuscode → Won
ITEM-000327,Update,msdyn_forecastcategory,100000001,100000005,ACTOR-0003,12/11/25 13:14,2025-12-11T13:14:00Z,ITEM-000327,L1_STAGE,L1,100000005,,msdyn_forecastcategory → 100000005
ITEM-000327,Update,actualclosedate,,11/12/25 0:00,ACTOR-0003,12/11/25 13:14,2025-12-11T13:14:00Z,ITEM-000327,L1_STAGE,L1,11/12/25 0:00,,actualclosedate → 11/12/25 0:00
ITEM-000327,Update,salesstage,,3,ACTOR-0003,12/11/25 13:14,2025-12-11T13:14:00Z,ITEM-000327,L1_STAGE,L1,3,,salesstage → 3
ITEM-000327,Update,statecode,0,1,ACTOR-0003,12/11/25 13:14,2025-12-11T13:14:00Z,ITEM-000327,L1_STAGE,L1,Won,,statecode → Won
ITEM-000330,Update,statuscode,1,4,ACTOR-0003,28/08/2025 09:32,2025-08-28T09:32:00Z,ITEM-000330,L1_STAGE,L1,Canceled,,statuscode → Canceled
ITEM-000330,Update,msdyn_forecastcategory,100000001,100000006,ACTOR-0003,28/08/2025 09:32,2025-08-28T09:32:00Z,ITEM-000330,L1_STAGE,L1,100000006,,msdyn_forecastcategory → 100000006
ITEM-000330,Update,actualclosedate,,8/28/25 0:00,ACTOR-0003,28/08/2025 09:32,2025-08-28T09:32:00Z,ITEM-000330,L1_STAGE,L1,8/28/25 0:00,,actualclosedate → 8/28/25 0:00
ITEM-000330,Update,salesstage,,3,ACTOR-0003,28/08/2025 09:32,2025-08-28T09:32:00Z,ITEM-000330,L1_STAGE,L1,3,,salesstage → 3
ITEM-000330,Update,statecode,0,2,ACTOR-0003,28/08/2025 09:32,2025-08-28T09:32:00Z,ITEM-000330,L1_STAGE,L1,Lost,,statecode → Lost
ITEM-000331,Update,stepname,,14-Qualify,ACTOR-0008,10/11/25 9:33,2025-10-11T09:33:00Z,ITEM-000331,L1_STAGE,L1,14-Qualify,14.0,stepname → 14-Qualify
ITEM-000331,Create,statecode,,0,ACTOR-0009,10/11/25 9:33,2025-10-11T09:33:00Z,ITEM-000331,L1_STAGE,L1,Open,,Case Created
ITEM-000331,Update,statuscode,1,4,ACTOR-0009,18/12/2025 09:21,2025-12-18T09:21:00Z,ITEM-000331,L1_STAGE,L1,Canceled,,statuscode → Canceled
ITEM-000331,Update,msdyn_forecastcategory,100000001,100000006,ACTOR-0009,18/12/2025 09:21,2025-12-18T09:21:00Z,ITEM-000331,L1_STAGE,L1,100000006,,msdyn_forecastcategory → 100000006
ITEM-000331,Update,actualclosedate,,12/18/25 0:00,ACTOR-0009,18/12/2025 09:21,2025-12-18T09:21:00Z,ITEM-000331,L1_STAGE,L1,12/18/25 0:00,,actualclosedate → 12/18/25 0:00
ITEM-000331,Update,salesstage,,3,ACTOR-0009,18/12/2025 09:21,2025-12-18T09:21:00Z,ITEM-000331,L1_STAGE,L1,3,,salesstage → 3
ITEM-000331,Update,statecode,0,2,ACTOR-0009,18/12/2025 09:21,2025-12-18T09:21:00Z,ITEM-000331,L1_STAGE,L1,Lost,,statecode → Lost
ITEM-000332,Update,estimatedclosedate,12/10/25 0:00,12/3/25 0:00,ACTOR-0002,1/12/25 16:54,2025-01-12T16:54:00Z,ITEM-000332,L1_STAGE,L1,12/3/25 0:00,,estimatedclosedate → 12/3/25 0:00
ITEM-000332,Update,stepname,14-Qualify,15-Develop,ACTOR-0008,1/12/25 16:55,2025-01-12T16:55:00Z,ITEM-000332,L1_STAGE,L1,15-Develop,15.0,stepname → 15-Develop
ITEM-000332,Update,stepname,15-Develop,16-Propose,ACTOR-0008,1/12/25 16:55,2025-01-12T16:55:00Z,ITEM-000332,L1_STAGE,L1,16-Propose,16.0,stepname → 16-Propose
ITEM-000332,Update,stepname,16-Propose,17-Close,ACTOR-0008,1/12/25 16:55,2025-01-12T16:55:00Z,ITEM-000332,L1_STAGE,L1,17-Close,17.0,stepname → 17-Close
ITEM-000332,Update,statuscode,1,3,ACTOR-0002,2/12/25 10:52,2025-02-12T10:52:00Z,ITEM-000332,L1_STAGE,L1,Won,,statuscode → Won
ITEM-000332,Update,msdyn_forecastcategory,100000001,100000005,ACTOR-0002,2/12/25 10:52,2025-02-12T10:52:00Z,ITEM-000332,L1_STAGE,L1,100000005,,msdyn_forecastcategory → 100000005
ITEM-000332,Update,actualclosedate,,12/2/25 0:00,ACTOR-0002,2/12/25 10:52,2025-02-12T10:52:00Z,ITEM-000332,L1_STAGE,L1,12/2/25 0:00,,actualclosedate → 12/2/25 0:00
ITEM-000332,Update,salesstage,,3,ACTOR-0002,2/12/25 10:52,2025-02-12T10:52:00Z,ITEM-000332,L1_STAGE,L1,3,,salesstage → 3
ITEM-000332,Update,statecode,0,1,ACTOR-0002,2/12/25 10:52,2025-02-12T10:52:00Z,ITEM-000332,L1_STAGE,L1,Won,,statecode → Won
ITEM-000332,Update,new_contracttermmonths,,12,ACTOR-0002,2/12/25 10:52,2025-02-12T10:52:00Z,ITEM-000332,L2_MILESTONE,L2,12,,new_contracttermmonths → 12
ITEM-000332,Update,closeprobability,25,100,ACTOR-0002,2/12/25 10:52,2025-02-12T10:52:00Z,ITEM-000332,L1_STAGE,L1,100,,closeprobability → 100
ITEM-000332,Update,the000g_isrenewal,FALSE,TRUE,ACTOR-0002,2/12/25 10:52,2025-02-12T10:52:00Z,ITEM-000332,L3_ADMIN,L3,TRUE,,the000g_isrenewal changed
ITEM-000332,Update,stepname,,14-Qualify,ACTOR-0008,10/11/25 15:14,2025-10-11T15:14:00Z,ITEM-000332,L1_STAGE,L1,14-Qualify,14.0,stepname → 14-Qualify
ITEM-000332,Create,purchasetimeframe,,0,ACTOR-0002,10/11/25 15:14,2025-10-11T15:14:00Z,ITEM-000332,L2_MILESTONE,L2,0,,Case Created
ITEM-000333,Update,stepname,,14-Qualify,ACTOR-0008,20/10/2025 12:56,2025-10-20T12:56:00Z,ITEM-000333,L1_STAGE,L1,14-Qualify,14.0,stepname → 14-Qualify
ITEM-000333,Create,purchaseprocess,,0,ACTOR-0003,20/10/2025 12:56,2025-10-20T12:56:00Z,ITEM-000333,L2_MILESTONE,L2,0,,Case Created
ITEM-000333,Update,new_contracttermmonths,12,2,ACTOR-0003,23/10/2025 12:34,2025-10-23T12:34:00Z,ITEM-000333,L2_MILESTONE,L2,2,,new_contracttermmonths → 2
ITEM-000333,Update,the000g_revenuetype,604720000,604720001,ACTOR-0003,23/10/2025 13:39,2025-10-23T13:39:00Z,ITEM-000333,L2_MILESTONE,L2,604720001,,the000g_revenuetype → 604720001
ITEM-000333,Update,statuscode,1,3,ACTOR-0003,23/10/2025 13:43,2025-10-23T13:43:00Z,ITEM-000333,L1_STAGE,L1,Won,,statuscode → Won
ITEM-000333,Update,msdyn_forecastcategory,100000001,100000005,ACTOR-0003,23/10/2025 13:43,2025-10-23T13:43:00Z,ITEM-000333,L1_STAGE,L1,100000005,,msdyn_forecastcategory → 100000005
ITEM-000333,Update,actualclosedate,,10/23/25 0:00,ACTOR-0003,23/10/2025 13:43,2025-10-23T13:43:00Z,ITEM-000333,L1_STAGE,L1,10/23/25 0:00,,actualclosedate → 10/23/25 0:00
ITEM-000333,Update,salesstage,,3,ACTOR-0003,23/10/2025 13:43,2025-10-23T13:43:00Z,ITEM-000333,L1_STAGE,L1,3,,salesstage → 3
ITEM-000333,Update,statecode,0,1,ACTOR-0003,23/10/2025 13:43,2025-10-23T13:43:00Z,ITEM-000333,L1_STAGE,L1,Won,,statecode → Won
ITEM-000333,Update,statuscode,3,1,ACTOR-0003,23/10/2025 13:58,2025-10-23T13:58:00Z,ITEM-000333,L1_STAGE,L1,In Progress,,statuscode → In Progress
ITEM-000333,Update,msdyn_forecastcategory,100000005,100000001,ACTOR-0003,23/10/2025 13:58,2025-10-23T13:58:00Z,ITEM-000333,L1_STAGE,L1,100000001,,msdyn_forecastcategory → 100000001
ITEM-000333,Update,statecode,1,0,ACTOR-0003,23/10/2025 13:58,2025-10-23T13:58:00Z,ITEM-000333,L1_STAGE,L1,Open,,statecode → Open
ITEM-000333,Update,actualclosedate,10/23/25 0:00,,ACTOR-0003,23/10/2025 13:58,2025-10-23T13:58:00Z,ITEM-000333,L1_STAGE,L1,,,actualclosedate → 
ITEM-000333,Update,salesstage,3,0,ACTOR-0003,23/10/2025 13:58,2025-10-23T13:58:00Z,ITEM-000333,L1_STAGE,L1,0,,salesstage → 0
ITEM-000333,Update,statuscode,1,3,ACTOR-0003,28/10/2025 13:58,2025-10-28T13:58:00Z,ITEM-000333,L1_STAGE,L1,Won,,statuscode → Won
ITEM-000333,Update,msdyn_forecastcategory,100000001,100000005,ACTOR-0003,28/10/2025 13:58,2025-10-28T13:58:00Z,ITEM-000333,L1_STAGE,L1,100000005,,msdyn_forecastcategory → 100000005
ITEM-000333,Update,actualclosedate,,10/28/25 0:00,ACTOR-0003,28/10/2025 13:58,2025-10-28T13:58:00Z,ITEM-000333,L1_STAGE,L1,10/28/25 0:00,,actualclosedate → 10/28/25 0:00
ITEM-000333,Update,statecode,0,1,ACTOR-0003,28/10/2025 13:58,2025-10-28T13:58:00Z,ITEM-000333,L1_STAGE,L1,Won,,statecode → Won
ITEM-000333,Update,salesstage,0,3,ACTOR-0003,28/10/2025 13:58,2025-10-28T13:58:00Z,ITEM-000333,L1_STAGE,L1,3,,salesstage → 3
ITEM-000334,Update,stepname,,14-Qualify,ACTOR-0008,18/09/2025 11:28,2025-09-18T11:28:00Z,ITEM-000334,L1_STAGE,L1,14-Qualify,14.0,stepname → 14-Qualify
ITEM-000334,Create,purchasetimeframe,,0,ACTOR-0007,18/09/2025 11:28,2025-09-18T11:28:00Z,ITEM-000334,L2_MILESTONE,L2,0,,Case Created
ITEM-000334,Update,statuscode,1,3,ACTOR-0007,26/09/2025 14:22,2025-09-26T14:22:00Z,ITEM-000334,L1_STAGE,L1,Won,,statuscode → Won
ITEM-000334,Update,msdyn_forecastcategory,100000001,100000005,ACTOR-0007,26/09/2025 14:22,2025-09-26T14:22:00Z,ITEM-000334,L1_STAGE,L1,100000005,,msdyn_forecastcategory → 100000005
ITEM-000334,Update,actualclosedate,,9/26/25 0:00,ACTOR-0007,26/09/2025 14:22,2025-09-26T14:22:00Z,ITEM-000334,L1_STAGE,L1,9/26/25 0:00,,actualclosedate → 9/26/25 0:00
ITEM-000334,Update,salesstage,,3,ACTOR-0007,26/09/2025 14:22,2025-09-26T14:22:00Z,ITEM-000334,L1_STAGE,L1,3,,salesstage → 3
ITEM-000334,Update,statecode,0,1,ACTOR-0007,26/09/2025 14:22,2025-09-26T14:22:00Z,ITEM-000334,L1_STAGE,L1,Won,,statecode → Won
ITEM-000335,Update,stepname,,14-Qualify,ACTOR-0008,11/11/25 10:10,2025-11-11T10:10:00Z,ITEM-000335,L1_STAGE,L1,14-Qualify,14.0,stepname → 14-Qualify
ITEM-000335,Create,statecode,,0,ACTOR-0009,11/11/25 10:10,2025-11-11T10:10:00Z,ITEM-000335,L1_STAGE,L1,Open,,Case Created
ITEM-000336,Update,owningbusinessunit,"businessunit,0a4ccfd6-e6d9-e611-80f2-5065f38aba91","businessunit,0a4ccfd6-e6d9-e611-80f2-5065f38aba91",ACTOR-0002,1/9/25 9:16,2025-01-09T09:16:00Z,ITEM-000336,L3_ADMIN,L3,"businessunit,0a4ccfd6-e6d9-e611-80f2-5065f38aba91",,owningbusinessunit changed
ITEM-000336,Update,ownerid,"systemuser,b5f00e27-78b3-4a71-90af-5dcef3c25bba","systemuser,efd3822d-8c8b-4619-8eb9-39ddf9c5c57f",ACTOR-0002,1/9/25 9:16,2025-01-09T09:16:00Z,ITEM-000336,L3_ADMIN,L3,"systemuser,efd3822d-8c8b-4619-8eb9-39ddf9c5c57f",,Owner changed
ITEM-000338,Update,owningbusinessunit,"businessunit,0a4ccfd6-e6d9-e611-80f2-5065f38aba91","businessunit,0a4ccfd6-e6d9-e611-80f2-5065f38aba91",ACTOR-0002,7/10/25 10:45,2025-07-10T10:45:00Z,ITEM-000338,L3_ADMIN,L3,"businessunit,0a4ccfd6-e6d9-e611-80f2-5065f38aba91",,owningbusinessunit changed
ITEM-000338,Update,ownerid,"systemuser,7b9d5323-2ef3-4d52-9d6c-dd45deb05e3b","systemuser,efd3822d-8c8b-4619-8eb9-39ddf9c5c57f",ACTOR-0002,7/10/25 10:45,2025-07-10T10:45:00Z,ITEM-000338,L3_ADMIN,L3,"systemuser,efd3822d-8c8b-4619-8eb9-39ddf9c5c57f",,Owner changed
ITEM-000340,Update,owningbusinessunit,"businessunit,0a4ccfd6-e6d9-e611-80f2-5065f38aba91","businessunit,0a4ccfd6-e6d9-e611-80f2-5065f38aba91",ACTOR-0002,7/10/25 10:45,2025-07-10T10:45:00Z,ITEM-000340,L3_ADMIN,L3,"businessunit,0a4ccfd6-e6d9-e611-80f2-5065f38aba91",,owningbusinessunit changed
ITEM-000340,Update,ownerid,"systemuser,7b9d5323-2ef3-4d52-9d6c-dd45deb05e3b","systemuser,efd3822d-8c8b-4619-8eb9-39ddf9c5c57f",ACTOR-0002,7/10/25 10:45,2025-07-10T10:45:00Z,ITEM-000340,L3_ADMIN,L3,"systemuser,efd3822d-8c8b-4619-8eb9-39ddf9c5c57f",,Owner changed
ITEM-000341,Update,stepname,,14-Qualify,ACTOR-0008,8/1/26 11:36,2026-08-01T11:36:00Z,ITEM-000341,L1_STAGE,L1,14-Qualify,14.0,stepname → 14-Qualify
ITEM-000341,Create,statecode,,0,ACTOR-0005,8/1/26 11:36,2026-08-01T11:36:00Z,ITEM-000341,L1_STAGE,L1,Open,,Case Created
ITEM-000341,Update,the000g__revenuetype,604720004,604720001,ACTOR-0005,12/1/26 12:34,2026-12-01T12:34:00Z,ITEM-000341,L2_MILESTONE,L2,604720001,,the000g__revenuetype → 604720001
ITEM-000341,Update,the000g_revenuetype,604720001,604720000,ACTOR-0005,12/1/26 12:35,2026-12-01T12:35:00Z,ITEM-000341,L2_MILESTONE,L2,604720000,,the000g_revenuetype → 604720000
ITEM-000343,Update,stepname,,14-Qualify,ACTOR-0008,9/1/26 8:18,2026-09-01T08:18:00Z,ITEM-000343,L1_STAGE,L1,14-Qualify,14.0,stepname → 14-Qualify
ITEM-000343,Create,purchasetimeframe,,0,ACTOR-0003,9/1/26 8:18,2026-09-01T08:18:00Z,ITEM-000343,L2_MILESTONE,L2,0,,Case Created
ITEM-000343,Update,statuscode,1,3,ACTOR-0003,9/1/26 10:58,2026-09-01T10:58:00Z,ITEM-000343,L1_STAGE,L1,Won,,statuscode → Won
ITEM-000343,Update,msdyn_forecastcategory,100000003,100000005,ACTOR-0003,9/1/26 10:58,2026-09-01T10:58:00Z,ITEM-000343,L1_STAGE,L1,100000005,,msdyn_forecastcategory → 100000005
ITEM-000343,Update,actualclosedate,,1/9/26 0:00,ACTOR-0003,9/1/26 10:58,2026-09-01T10:58:00Z,ITEM-000343,L1_STAGE,L1,1/9/26 0:00,,actualclosedate → 1/9/26 0:00
ITEM-000343,Update,salesstage,,3,ACTOR-0003,9/1/26 10:58,2026-09-01T10:58:00Z,ITEM-000343,L1_STAGE,L1,3,,salesstage → 3
ITEM-000343,Update,statecode,0,1,ACTOR-0003,9/1/26 10:58,2026-09-01T10:58:00Z,ITEM-000343,L1_STAGE,L1,Won,,statecode → Won
ITEM-000344,Update,owningbusinessunit,"businessunit,0a4ccfd6-e6d9-e611-80f2-5065f38aba91","businessunit,0a4ccfd6-e6d9-e611-80f2-5065f38aba91",ACTOR-0002,7/10/25 10:46,2025-07-10T10:46:00Z,ITEM-000344,L3_ADMIN,L3,"businessunit,0a4ccfd6-e6d9-e611-80f2-5065f38aba91",,owningbusinessunit changed
ITEM-000344,Update,ownerid,"systemuser,7b9d5323-2ef3-4d52-9d6c-dd45deb05e3b","systemuser,efd3822d-8c8b-4619-8eb9-39ddf9c5c57f",ACTOR-0002,7/10/25 10:46,2025-07-10T10:46:00Z,ITEM-000344,L3_ADMIN,L3,"systemuser,efd3822d-8c8b-4619-8eb9-39ddf9c5c57f",,Owner changed
ITEM-000345,Update,owningbusinessunit,"businessunit,0a4ccfd6-e6d9-e611-80f2-5065f38aba91","businessunit,0a4ccfd6-e6d9-e611-80f2-5065f38aba91",ACTOR-0003,27/10/2025 11:18,2025-10-27T11:18:00Z,ITEM-000345,L3_ADMIN,L3,"businessunit,0a4ccfd6-e6d9-e611-80f2-5065f38aba91",,owningbusinessunit changed
ITEM-000345,Update,ownerid,"systemuser,2d7fbe83-3f35-4a1d-bc05-1b39dbf446d9","systemuser,efd3822d-8c8b-4619-8eb9-39ddf9c5c57f",ACTOR-0003,27/10/2025 11:18,2025-10-27T11:18:00Z,ITEM-000345,L3_ADMIN,L3,"systemuser,efd3822d-8c8b-4619-8eb9-39ddf9c5c57f",,Owner changed
ITEM-000346,Update,owningbusinessunit,"businessunit,0a4ccfd6-e6d9-e611-80f2-5065f38aba91","businessunit,0a4ccfd6-e6d9-e611-80f2-5065f38aba91",ACTOR-0003,26/08/2025 07:43,2025-08-26T07:43:00Z,ITEM-000346,L3_ADMIN,L3,"businessunit,0a4ccfd6-e6d9-e611-80f2-5065f38aba91",,owningbusinessunit changed
ITEM-000346,Update,ownerid,"systemuser,b5f00e27-78b3-4a71-90af-5dcef3c25bba","systemuser,efd3822d-8c8b-4619-8eb9-39ddf9c5c57f",ACTOR-0003,26/08/2025 07:43,2025-08-26T07:43:00Z,ITEM-000346,L3_ADMIN,L3,"systemuser,efd3822d-8c8b-4619-8eb9-39ddf9c5c57f",,Owner changed
ITEM-000347,Update,owningbusinessunit,"businessunit,0a4ccfd6-e6d9-e611-80f2-5065f38aba91","businessunit,0a4ccfd6-e6d9-e611-80f2-5065f38aba91",ACTOR-0004,26/09/2025 09:21,2025-09-26T09:21:00Z,ITEM-000347,L3_ADMIN,L3,"businessunit,0a4ccfd6-e6d9-e611-80f2-5065f38aba91",,owningbusinessunit changed
ITEM-000347,Update,ownerid,"systemuser,1cba5fd4-6e4e-4e0f-85ff-a6438bc2f2f0","systemuser,b5f00e27-78b3-4a71-90af-5dcef3c25bba",ACTOR-0004,26/09/2025 09:21,2025-09-26T09:21:00Z,ITEM-000347,L3_ADMIN,L3,"systemuser,b5f00e27-78b3-4a71-90af-5dcef3c25bba",,Owner changed
ITEM-000348,Update,owningbusinessunit,"businessunit,0a4ccfd6-e6d9-e611-80f2-5065f38aba91","businessunit,0a4ccfd6-e6d9-e611-80f2-5065f38aba91",ACTOR-0004,26/09/2025 09:21,2025-09-26T09:21:00Z,ITEM-000348,L3_ADMIN,L3,"businessunit,0a4ccfd6-e6d9-e611-80f2-5065f38aba91",,owningbusinessunit changed
ITEM-000348,Update,ownerid,"systemuser,1cba5fd4-6e4e-4e0f-85ff-a6438bc2f2f0","systemuser,09f34b91-4d86-4fc8-8b41-8af3d91e94bf",ACTOR-0004,26/09/2025 09:21,2025-09-26T09:21:00Z,ITEM-000348,L3_ADMIN,L3,"systemuser,09f34b91-4d86-4fc8-8b41-8af3d91e94bf",,Owner changed
ITEM-000349,Update,stepname,,14-Qualify,ACTOR-0008,22/10/2025 16:53,2025-10-22T16:53:00Z,ITEM-000349,L1_STAGE,L1,14-Qualify,14.0,stepname → 14-Qualify
ITEM-000349,Create,statecode,,0,ACTOR-0003,22/10/2025 16:53,2025-10-22T16:53:00Z,ITEM-000349,L1_STAGE,L1,Open,,Case Created
ITEM-000349,Update,closeprobability,,75,ACTOR-0003,11/11/25 9:59,2025-11-11T09:59:00Z,ITEM-000349,L1_STAGE,L1,75,,closeprobability → 75
ITEM-000349,Update,stepname,17-Close,16-Propose,ACTOR-0008,13/01/2026 08:48,2026-01-13T08:48:00Z,ITEM-000349,L1_STAGE,L1,16-Propose,16.0,stepname → 16-Propose
ITEM-000349,Update,stepname,16-Propose,17-Close,ACTOR-0008,13/01/2026 08:48,2026-01-13T08:48:00Z,ITEM-000349,L1_STAGE,L1,17-Close,17.0,stepname → 17-Close
ITEM-000349,Update,closeprobability,50,75,ACTOR-0003,15/01/2026 12:24,2026-01-15T12:24:00Z,ITEM-000349,L1_STAGE,L1,75,,closeprobability → 75
ITEM-000349,Update,new_contractterm,,100000002,ACTOR-0003,15/01/2026 12:24,2026-01-15T12:24:00Z,ITEM-000349,L2_MILESTONE,L2,100000002,,new_contractterm → 100000002
ITEM-000349,Update,msdyn_forecastcategory,100000002,100000001,ACTOR-0003,15/01/2026 12:24,2026-01-15T12:24:00Z,ITEM-000349,L1_STAGE,L1,100000001,,msdyn_forecastcategory → 100000001
ITEM-000349,Update,estimatedclosedate,1/23/26 0:00,2/20/26 0:00,ACTOR-0003,21/01/2026 19:54,2026-01-21T19:54:00Z,ITEM-000349,L1_STAGE,L1,2/20/26 0:00,,estimatedclosedate → 2/20/26 0:00
ITEM-000349,Update,new_contracttermmonths,3,6,ACTOR-0006,28/01/2026 09:06,2026-01-28T09:06:00Z,ITEM-000349,L2_MILESTONE,L2,6,,new_contracttermmonths → 6
ITEM-000349,Update,the000g__revenuetype,,604720002,ACTOR-0003,8/1/26 10:04,2026-08-01T10:04:00Z,ITEM-000349,L2_MILESTONE,L2,604720002,,the000g__revenuetype → 604720002
ITEM-000349,Update,stepname,,15-Develop,ACTOR-0008,8/1/26 10:39,2026-08-01T10:39:00Z,ITEM-000349,L1_STAGE,L1,15-Develop,15.0,stepname → 15-Develop
ITEM-000349,Update,purchaseprocess,,1,ACTOR-0003,8/1/26 10:39,2026-08-01T10:39:00Z,ITEM-000349,L2_MILESTONE,L2,1,,purchaseprocess → 1
ITEM-000349,Update,purchasetimeframe,,1,ACTOR-0003,8/1/26 10:39,2026-08-01T10:39:00Z,ITEM-000349,L2_MILESTONE,L2,1,,purchasetimeframe → 1
ITEM-000349,Update,msdyn_forecastcategory,100000001,100000002,ACTOR-0003,8/1/26 10:39,2026-08-01T10:39:00Z,ITEM-000349,L1_STAGE,L1,100000002,,msdyn_forecastcategory → 100000002
ITEM-000349,Update,stepname,14-Qualify,,ACTOR-0003,8/1/26 10:39,2026-08-01T10:39:00Z,ITEM-000349,L1_STAGE,L1,,,stepname → 
ITEM-000349,Update,stepname,15-Develop,16-Propose,ACTOR-0003,12/1/26 17:13,2026-12-01T17:13:00Z,ITEM-000349,L1_STAGE,L1,16-Propose,16.0,stepname → 16-Propose
ITEM-000349,Update,estimatedclosedate,1/16/26 0:00,1/23/26 0:00,ACTOR-0003,12/1/26 17:13,2026-12-01T17:13:00Z,ITEM-000349,L1_STAGE,L1,1/23/26 0:00,,estimatedclosedate → 1/23/26 0:00
ITEM-000349,Update,closeprobability,75,50,ACTOR-0003,12/1/26 17:13,2026-12-01T17:13:00Z,ITEM-000349,L1_STAGE,L1,50,,closeprobability → 50
ITEM-000350,Update,owningbusinessunit,"businessunit,0a4ccfd6-e6d9-e611-80f2-5065f38aba91","businessunit,0a4ccfd6-e6d9-e611-80f2-5065f38aba91",ACTOR-0002,22/08/2025 08:12,2025-08-22T08:12:00Z,ITEM-000350,L3_ADMIN,L3,"businessunit,0a4ccfd6-e6d9-e611-80f2-5065f38aba91",,owningbusinessunit changed
ITEM-000350,Update,ownerid,"systemuser,7b9d5323-2ef3-4d52-9d6c-dd45deb05e3b","systemuser,efd3822d-8c8b-4619-8eb9-39ddf9c5c57f",ACTOR-0002,22/08/2025 08:12,2025-08-22T08:12:00Z,ITEM-000350,L3_ADMIN,L3,"systemuser,efd3822d-8c8b-4619-8eb9-39ddf9c5c57f",,Owner changed
ITEM-000352,Update,ownerid,"systemuser,09f34b91-4d86-4fc8-8b41-8af3d91e94bf","systemuser,efd3822d-8c8b-4619-8eb9-39ddf9c5c57f",ACTOR-0003,2/12/25 10:29,2025-02-12T10:29:00Z,ITEM-000352,L3_ADMIN,L3,"systemuser,efd3822d-8c8b-4619-8eb9-39ddf9c5c57f",,Owner changed
ITEM-000352,Update,statuscode,1,4,ACTOR-0003,9/10/25 7:39,2025-09-10T07:39:00Z,ITEM-000352,L1_STAGE,L1,Canceled,,statuscode → Canceled
ITEM-000352,Update,msdyn_forecastcategory,100000001,100000006,ACTOR-0003,9/10/25 7:39,2025-09-10T07:39:00Z,ITEM-000352,L1_STAGE,L1,100000006,,msdyn_forecastcategory → 100000006
ITEM-000352,Update,actualclosedate,,10/9/25 0:00,ACTOR-0003,9/10/25 7:39,2025-09-10T07:39:00Z,ITEM-000352,L1_STAGE,L1,10/9/25 0:00,,actualclosedate → 10/9/25 0:00
ITEM-000352,Update,salesstage,,3,ACTOR-0003,9/10/25 7:39,2025-09-10T07:39:00Z,ITEM-000352,L1_STAGE,L1,3,,salesstage → 3
ITEM-000352,Update,statecode,0,2,ACTOR-0003,9/10/25 7:39,2025-09-10T07:39:00Z,ITEM-000352,L1_STAGE,L1,Lost,,statecode → Lost
ITEM-000353,Update,stepname,,14-Qualify,ACTOR-0008,14/08/2025 14:10,2025-08-14T14:10:00Z,ITEM-000353,L1_STAGE,L1,14-Qualify,14.0,stepname → 14-Qualify
ITEM-000353,Create,statecode,,0,ACTOR-0009,14/08/2025 14:10,2025-08-14T14:10:00Z,ITEM-000353,L1_STAGE,L1,Open,,Case Created
ITEM-000354,Update,owningbusinessunit,"businessunit,0a4ccfd6-e6d9-e611-80f2-5065f38aba91","businessunit,0a4ccfd6-e6d9-e611-80f2-5065f38aba91",ACTOR-0002,1/9/25 9:16,2025-01-09T09:16:00Z,ITEM-000354,L3_ADMIN,L3,"businessunit,0a4ccfd6-e6d9-e611-80f2-5065f38aba91",,owningbusinessunit changed
ITEM-000354,Update,ownerid,"systemuser,b5f00e27-78b3-4a71-90af-5dcef3c25bba","systemuser,efd3822d-8c8b-4619-8eb9-39ddf9c5c57f",ACTOR-0002,1/9/25 9:16,2025-01-09T09:16:00Z,ITEM-000354,L3_ADMIN,L3,"systemuser,efd3822d-8c8b-4619-8eb9-39ddf9c5c57f",,Owner changed
ITEM-000355,Update,owningbusinessunit,"businessunit,0a4ccfd6-e6d9-e611-80f2-5065f38aba91","businessunit,0a4ccfd6-e6d9-e611-80f2-5065f38aba91",ACTOR-0004,26/09/2025 09:21,2025-09-26T09:21:00Z,ITEM-000355,L3_ADMIN,L3,"businessunit,0a4ccfd6-e6d9-e611-80f2-5065f38aba91",,owningbusinessunit changed
ITEM-000355,Update,ownerid,"systemuser,09f34b91-4d86-4fc8-8b41-8af3d91e94bf","systemuser,b5f00e27-78b3-4a71-90af-5dcef3c25bba",ACTOR-0004,26/09/2025 09:21,2025-09-26T09:21:00Z,ITEM-000355,L3_ADMIN,L3,"systemuser,b5f00e27-78b3-4a71-90af-5dcef3c25bba",,Owner changed
ITEM-000356,Update,owningbusinessunit,"businessunit,0a4ccfd6-e6d9-e611-80f2-5065f38aba91","businessunit,0a4ccfd6-e6d9-e611-80f2-5065f38aba91",ACTOR-0004,26/09/2025 09:21,2025-09-26T09:21:00Z,ITEM-000356,L3_ADMIN,L3,"businessunit,0a4ccfd6-e6d9-e611-80f2-5065f38aba91",,owningbusinessunit changed
ITEM-000356,Update,ownerid,"systemuser,1cba5fd4-6e4e-4e0f-85ff-a6438bc2f2f0","systemuser,b5f00e27-78b3-4a71-90af-5dcef3c25bba",ACTOR-0004,26/09/2025 09:21,2025-09-26T09:21:00Z,ITEM-000356,L3_ADMIN,L3,"systemuser,b5f00e27-78b3-4a71-90af-5dcef3c25bba",,Owner changed
ITEM-000357,Update,statuscode,1,4,ACTOR-0003,28/08/2025 09:32,2025-08-28T09:32:00Z,ITEM-000357,L1_STAGE,L1,Canceled,,statuscode → Canceled
ITEM-000357,Update,msdyn_forecastcategory,100000001,100000006,ACTOR-0003,28/08/2025 09:32,2025-08-28T09:32:00Z,ITEM-000357,L1_STAGE,L1,100000006,,msdyn_forecastcategory → 100000006
ITEM-000357,Update,actualclosedate,,8/28/25 0:00,ACTOR-0003,28/08/2025 09:32,2025-08-28T09:32:00Z,ITEM-000357,L1_STAGE,L1,8/28/25 0:00,,actualclosedate → 8/28/25 0:00
ITEM-000357,Update,salesstage,,3,ACTOR-0003,28/08/2025 09:32,2025-08-28T09:32:00Z,ITEM-000357,L1_STAGE,L1,3,,salesstage → 3
ITEM-000357,Update,statecode,0,2,ACTOR-0003,28/08/2025 09:32,2025-08-28T09:32:00Z,ITEM-000357,L1_STAGE,L1,Lost,,statecode → Lost
ITEM-000358,Update,stepname,,14-Qualify,ACTOR-0008,22/10/2025 16:54,2025-10-22T16:54:00Z,ITEM-000358,L1_STAGE,L1,14-Qualify,14.0,stepname → 14-Qualify
ITEM-000358,Create,statecode,,0,ACTOR-0003,22/10/2025 16:54,2025-10-22T16:54:00Z,ITEM-000358,L1_STAGE,L1,Open,,Case Created
ITEM-000358,Update,the000g__revenuetype,,604720002,ACTOR-0006,28/01/2026 10:11,2026-01-28T10:11:00Z,ITEM-000358,L2_MILESTONE,L2,604720002,,the000g__revenuetype → 604720002
ITEM-000360,Update,owningbusinessunit,"businessunit,0a4ccfd6-e6d9-e611-80f2-5065f38aba91","businessunit,0a4ccfd6-e6d9-e611-80f2-5065f38aba91",ACTOR-0002,22/08/2025 13:23,2025-08-22T13:23:00Z,ITEM-000360,L3_ADMIN,L3,"businessunit,0a4ccfd6-e6d9-e611-80f2-5065f38aba91",,owningbusinessunit changed
ITEM-000360,Update,ownerid,"systemuser,7b9d5323-2ef3-4d52-9d6c-dd45deb05e3b","systemuser,efd3822d-8c8b-4619-8eb9-39ddf9c5c57f",ACTOR-0002,22/08/2025 13:23,2025-08-22T13:23:00Z,ITEM-000360,L3_ADMIN,L3,"systemuser,efd3822d-8c8b-4619-8eb9-39ddf9c5c57f",,Owner changed
ITEM-000361,Update,owningbusinessunit,"businessunit,0a4ccfd6-e6d9-e611-80f2-5065f38aba91","businessunit,0a4ccfd6-e6d9-e611-80f2-5065f38aba91",ACTOR-0002,8/1/26 9:40,2026-08-01T09:40:00Z,ITEM-000361,L3_ADMIN,L3,"businessunit,0a4ccfd6-e6d9-e611-80f2-5065f38aba91",,owningbusinessunit changed
ITEM-000361,Update,ownerid,"systemuser,7b9d5323-2ef3-4d52-9d6c-dd45deb05e3b","systemuser,efd3822d-8c8b-4619-8eb9-39ddf9c5c57f",ACTOR-0002,8/1/26 9:40,2026-08-01T09:40:00Z,ITEM-000361,L3_ADMIN,L3,"systemuser,efd3822d-8c8b-4619-8eb9-39ddf9c5c57f",,Owner changed
ITEM-000362,Update,statuscode,1,4,ACTOR-0003,1/9/25 8:37,2025-01-09T08:37:00Z,ITEM-000362,L1_STAGE,L1,Canceled,,statuscode → Canceled
ITEM-000362,Update,msdyn_forecastcategory,100000001,100000006,ACTOR-0003,1/9/25 8:37,2025-01-09T08:37:00Z,ITEM-000362,L1_STAGE,L1,100000006,,msdyn_forecastcategory → 100000006
ITEM-000362,Update,actualclosedate,,9/1/25 0:00,ACTOR-0003,1/9/25 8:37,2025-01-09T08:37:00Z,ITEM-000362,L1_STAGE,L1,9/1/25 0:00,,actualclosedate → 9/1/25 0:00
ITEM-000362,Update,salesstage,,3,ACTOR-0003,1/9/25 8:37,2025-01-09T08:37:00Z,ITEM-000362,L1_STAGE,L1,3,,salesstage → 3
ITEM-000362,Update,statecode,0,2,ACTOR-0003,1/9/25 8:37,2025-01-09T08:37:00Z,ITEM-000362,L1_STAGE,L1,Lost,,statecode → Lost
ITEM-000362,Update,ownerid,"systemuser,09f34b91-4d86-4fc8-8b41-8af3d91e94bf","systemuser,efd3822d-8c8b-4619-8eb9-39ddf9c5c57f",ACTOR-0003,2/12/25 10:30,2025-02-12T10:30:00Z,ITEM-000362,L3_ADMIN,L3,"systemuser,efd3822d-8c8b-4619-8eb9-39ddf9c5c57f",,Owner changed
ITEM-000363,Update,stepname,,14-Qualify,ACTOR-0008,27/01/2026 10:13,2026-01-27T10:13:00Z,ITEM-000363,L1_STAGE,L1,14-Qualify,14.0,stepname → 14-Qualify
ITEM-000363,Create,statecode,,0,ACTOR-0002,27/01/2026 10:13,2026-01-27T10:13:00Z,ITEM-000363,L1_STAGE,L1,Open,,Case Created
ITEM-000365,Update,statuscode,1,3,ACTOR-0003,28/08/2025 09:29,2025-08-28T09:29:00Z,ITEM-000365,L1_STAGE,L1,Won,,statuscode → Won
ITEM-000365,Update,msdyn_forecastcategory,100000002,100000005,ACTOR-0003,28/08/2025 09:29,2025-08-28T09:29:00Z,ITEM-000365,L1_STAGE,L1,100000005,,msdyn_forecastcategory → 100000005
ITEM-000365,Update,statecode,0,1,ACTOR-0003,28/08/2025 09:29,2025-08-28T09:29:00Z,ITEM-000365,L1_STAGE,L1,Won,,statecode → Won
ITEM-000365,Update,actualclosedate,1/28/22 0:00,8/28/25 0:00,ACTOR-0003,28/08/2025 09:29,2025-08-28T09:29:00Z,ITEM-000365,L1_STAGE,L1,8/28/25 0:00,,actualclosedate → 8/28/25 0:00
ITEM-000365,Update,the000g_revenuetype,,604720000,ACTOR-0003,28/08/2025 09:29,2025-08-28T09:29:00Z,ITEM-000365,L2_MILESTONE,L2,604720000,,the000g_revenuetype → 604720000
ITEM-000365,Update,the000g_isrenewal,,TRUE,ACTOR-0003,28/08/2025 09:29,2025-08-28T09:29:00Z,ITEM-000365,L3_ADMIN,L3,TRUE,,the000g_isrenewal changed
ITEM-000367,Update,owningbusinessunit,"businessunit,0a4ccfd6-e6d9-e611-80f2-5065f38aba91","businessunit,0a4ccfd6-e6d9-e611-80f2-5065f38aba91",ACTOR-0002,1/9/25 9:15,2025-01-09T09:15:00Z,ITEM-000367,L3_ADMIN,L3,"businessunit,0a4ccfd6-e6d9-e611-80f2-5065f38aba91",,owningbusinessunit changed
ITEM-000367,Update,ownerid,"systemuser,b5f00e27-78b3-4a71-90af-5dcef3c25bba","systemuser,efd3822d-8c8b-4619-8eb9-39ddf9c5c57f",ACTOR-0002,1/9/25 9:15,2025-01-09T09:15:00Z,ITEM-000367,L3_ADMIN,L3,"systemuser,efd3822d-8c8b-4619-8eb9-39ddf9c5c57f",,Owner changed
ITEM-000369,Update,the000g_isrenewal,,FALSE,ACTOR-0009,4/9/25 8:21,2025-04-09T08:21:00Z,ITEM-000369,L3_ADMIN,L3,FALSE,,the000g_isrenewal changed
ITEM-000369,Update,statuscode,1,3,ACTOR-0009,4/9/25 8:22,2025-04-09T08:22:00Z,ITEM-000369,L1_STAGE,L1,Won,,statuscode → Won
ITEM-000369,Update,msdyn_forecastcategory,100000001,100000005,ACTOR-0009,4/9/25 8:22,2025-04-09T08:22:00Z,ITEM-000369,L1_STAGE,L1,100000005,,msdyn_forecastcategory → 100000005
ITEM-000369,Update,actualclosedate,,9/4/25 0:00,ACTOR-0009,4/9/25 8:22,2025-04-09T08:22:00Z,ITEM-000369,L1_STAGE,L1,9/4/25 0:00,,actualclosedate → 9/4/25 0:00
ITEM-000369,Update,salesstage,,3,ACTOR-0009,4/9/25 8:22,2025-04-09T08:22:00Z,ITEM-000369,L1_STAGE,L1,3,,salesstage → 3
ITEM-000369,Update,statecode,0,1,ACTOR-0009,4/9/25 8:22,2025-04-09T08:22:00Z,ITEM-000369,L1_STAGE,L1,Won,,statecode → Won
ITEM-000370,Update,stepname,,14-Qualify,ACTOR-0008,10/10/25 11:06,2025-10-10T11:06:00Z,ITEM-000370,L1_STAGE,L1,14-Qualify,14.0,stepname → 14-Qualify
ITEM-000370,Create,statecode,,0,ACTOR-0009,10/10/25 11:06,2025-10-10T11:06:00Z,ITEM-000370,L1_STAGE,L1,Open,,Case Created
ITEM-000370,Update,statuscode,1,3,ACTOR-0009,16/12/2025 09:39,2025-12-16T09:39:00Z,ITEM-000370,L1_STAGE,L1,Won,,statuscode → Won
ITEM-000370,Update,msdyn_forecastcategory,100000001,100000005,ACTOR-0009,16/12/2025 09:39,2025-12-16T09:39:00Z,ITEM-000370,L1_STAGE,L1,100000005,,msdyn_forecastcategory → 100000005
ITEM-000370,Update,actualclosedate,,12/16/25 0:00,ACTOR-0009,16/12/2025 09:39,2025-12-16T09:39:00Z,ITEM-000370,L1_STAGE,L1,12/16/25 0:00,,actualclosedate → 12/16/25 0:00
ITEM-000370,Update,salesstage,,3,ACTOR-0009,16/12/2025 09:39,2025-12-16T09:39:00Z,ITEM-000370,L1_STAGE,L1,3,,salesstage → 3
ITEM-000370,Update,statecode,0,1,ACTOR-0009,16/12/2025 09:39,2025-12-16T09:39:00Z,ITEM-000370,L1_STAGE,L1,Won,,statecode → Won
ITEM-000371,Update,owningbusinessunit,"businessunit,0a4ccfd6-e6d9-e611-80f2-5065f38aba91","businessunit,0a4ccfd6-e6d9-e611-80f2-5065f38aba91",ACTOR-0004,26/09/2025 09:20,2025-09-26T09:20:00Z,ITEM-000371,L3_ADMIN,L3,"businessunit,0a4ccfd6-e6d9-e611-80f2-5065f38aba91",,owningbusinessunit changed
ITEM-000371,Update,ownerid,"systemuser,1cba5fd4-6e4e-4e0f-85ff-a6438bc2f2f0","systemuser,b5f00e27-78b3-4a71-90af-5dcef3c25bba",ACTOR-0004,26/09/2025 09:20,2025-09-26T09:20:00Z,ITEM-000371,L3_ADMIN,L3,"systemuser,b5f00e27-78b3-4a71-90af-5dcef3c25bba",,Owner changed
ITEM-000372,Update,owningbusinessunit,"businessunit,0a4ccfd6-e6d9-e611-80f2-5065f38aba91","businessunit,0a4ccfd6-e6d9-e611-80f2-5065f38aba91",ACTOR-0002,7/10/25 10:46,2025-07-10T10:46:00Z,ITEM-000372,L3_ADMIN,L3,"businessunit,0a4ccfd6-e6d9-e611-80f2-5065f38aba91",,owningbusinessunit changed
ITEM-000372,Update,ownerid,"systemuser,7b9d5323-2ef3-4d52-9d6c-dd45deb05e3b","systemuser,efd3822d-8c8b-4619-8eb9-39ddf9c5c57f",ACTOR-0002,7/10/25 10:46,2025-07-10T10:46:00Z,ITEM-000372,L3_ADMIN,L3,"systemuser,efd3822d-8c8b-4619-8eb9-39ddf9c5c57f",,Owner changed
ITEM-000373,Update,owningbusinessunit,"businessunit,0a4ccfd6-e6d9-e611-80f2-5065f38aba91","businessunit,0a4ccfd6-e6d9-e611-80f2-5065f38aba91",ACTOR-0004,12/8/25 10:44,2025-12-08T10:44:00Z,ITEM-000373,L3_ADMIN,L3,"businessunit,0a4ccfd6-e6d9-e611-80f2-5065f38aba91",,owningbusinessunit changed
ITEM-000373,Update,ownerid,"team,0e9fee3e-5a6b-ef11-a670-6045bdf33728","systemuser,efd3822d-8c8b-4619-8eb9-39ddf9c5c57f",ACTOR-0004,12/8/25 10:44,2025-12-08T10:44:00Z,ITEM-000373,L3_ADMIN,L3,"systemuser,efd3822d-8c8b-4619-8eb9-39ddf9c5c57f",,Owner changed
ITEM-000374,Update,stepname,,14-Qualify,ACTOR-0008,10/10/25 11:05,2025-10-10T11:05:00Z,ITEM-000374,L1_STAGE,L1,14-Qualify,14.0,stepname → 14-Qualify
ITEM-000374,Create,statecode,,0,ACTOR-0009,10/10/25 11:05,2025-10-10T11:05:00Z,ITEM-000374,L1_STAGE,L1,Open,,Case Created
ITEM-000374,Update,the000g__revenuetype,,604720001,ACTOR-0009,18/12/2025 09:22,2025-12-18T09:22:00Z,ITEM-000374,L2_MILESTONE,L2,604720001,,the000g__revenuetype → 604720001
ITEM-000374,Update,estimatedclosedate,12/10/25 0:00,2/25/26 0:00,ACTOR-0009,18/12/2025 09:22,2025-12-18T09:22:00Z,ITEM-000374,L1_STAGE,L1,2/25/26 0:00,,estimatedclosedate → 2/25/26 0:00
ITEM-000374,Update,stepname,14-Qualify,15-Develop,ACTOR-0008,5/1/26 15:51,2026-05-01T15:51:00Z,ITEM-000374,L1_STAGE,L1,15-Develop,15.0,stepname → 15-Develop
ITEM-000374,Update,closeprobability,,25,ACTOR-0003,5/1/26 15:51,2026-05-01T15:51:00Z,ITEM-000374,L1_STAGE,L1,25,,closeprobability → 25
ITEM-000375,Update,owningbusinessunit,"businessunit,0a4ccfd6-e6d9-e611-80f2-5065f38aba91","businessunit,0a4ccfd6-e6d9-e611-80f2-5065f38aba91",ACTOR-0002,7/10/25 10:45,2025-07-10T10:45:00Z,ITEM-000375,L3_ADMIN,L3,"businessunit,0a4ccfd6-e6d9-e611-80f2-5065f38aba91",,owningbusinessunit changed
ITEM-000375,Update,ownerid,"systemuser,7b9d5323-2ef3-4d52-9d6c-dd45deb05e3b","systemuser,efd3822d-8c8b-4619-8eb9-39ddf9c5c57f",ACTOR-0002,7/10/25 10:45,2025-07-10T10:45:00Z,ITEM-000375,L3_ADMIN,L3,"systemuser,efd3822d-8c8b-4619-8eb9-39ddf9c5c57f",,Owner changed
ITEM-000376,Update,owningbusinessunit,"businessunit,0a4ccfd6-e6d9-e611-80f2-5065f38aba91","businessunit,0a4ccfd6-e6d9-e611-80f2-5065f38aba91",ACTOR-0002,7/10/25 10:45,2025-07-10T10:45:00Z,ITEM-000376,L3_ADMIN,L3,"businessunit,0a4ccfd6-e6d9-e611-80f2-5065f38aba91",,owningbusinessunit changed
ITEM-000376,Update,ownerid,"systemuser,7b9d5323-2ef3-4d52-9d6c-dd45deb05e3b","systemuser,efd3822d-8c8b-4619-8eb9-39ddf9c5c57f",ACTOR-0002,7/10/25 10:45,2025-07-10T10:45:00Z,ITEM-000376,L3_ADMIN,L3,"systemuser,efd3822d-8c8b-4619-8eb9-39ddf9c5c57f",,Owner changed
ITEM-000377,Update,stepname,,14-Qualify,ACTOR-0008,9/9/25 12:45,2025-09-09T12:45:00Z,ITEM-000377,L1_STAGE,L1,14-Qualify,14.0,stepname → 14-Qualify
ITEM-000377,Create,statecode,,0,ACTOR-0009,9/9/25 12:45,2025-09-09T12:45:00Z,ITEM-000377,L1_STAGE,L1,Open,,Case Created
ITEM-000377,Update,statuscode,1,3,ACTOR-0009,9/9/25 13:02,2025-09-09T13:02:00Z,ITEM-000377,L1_STAGE,L1,Won,,statuscode → Won
ITEM-000377,Update,msdyn_forecastcategory,100000001,100000005,ACTOR-0009,9/9/25 13:02,2025-09-09T13:02:00Z,ITEM-000377,L1_STAGE,L1,100000005,,msdyn_forecastcategory → 100000005
ITEM-000377,Update,actualclosedate,,9/9/25 0:00,ACTOR-0009,9/9/25 13:02,2025-09-09T13:02:00Z,ITEM-000377,L1_STAGE,L1,9/9/25 0:00,,actualclosedate → 9/9/25 0:00
ITEM-000377,Update,salesstage,,3,ACTOR-0009,9/9/25 13:02,2025-09-09T13:02:00Z,ITEM-000377,L1_STAGE,L1,3,,salesstage → 3
ITEM-000377,Update,statecode,0,1,ACTOR-0009,9/9/25 13:02,2025-09-09T13:02:00Z,ITEM-000377,L1_STAGE,L1,Won,,statecode → Won
ITEM-000380,Update,the000g__revenuetype,,604720001,ACTOR-0002,12/1/26 15:56,2026-12-01T15:56:00Z,ITEM-000380,L2_MILESTONE,L2,604720001,,the000g__revenuetype → 604720001
ITEM-000380,Update,estimatedclosedate,3/25/26 0:00,5/27/26 0:00,ACTOR-0002,12/1/26 15:56,2026-12-01T15:56:00Z,ITEM-000380,L1_STAGE,L1,5/27/26 0:00,,estimatedclosedate → 5/27/26 0:00
ITEM-000381,Update,owningbusinessunit,"businessunit,0a4ccfd6-e6d9-e611-80f2-5065f38aba91","businessunit,0a4ccfd6-e6d9-e611-80f2-5065f38aba91",ACTOR-0002,1/9/25 9:15,2025-01-09T09:15:00Z,ITEM-000381,L3_ADMIN,L3,"businessunit,0a4ccfd6-e6d9-e611-80f2-5065f38aba91",,owningbusinessunit changed
ITEM-000381,Update,ownerid,"systemuser,b5f00e27-78b3-4a71-90af-5dcef3c25bba","systemuser,efd3822d-8c8b-4619-8eb9-39ddf9c5c57f",ACTOR-0002,1/9/25 9:15,2025-01-09T09:15:00Z,ITEM-000381,L3_ADMIN,L3,"systemuser,efd3822d-8c8b-4619-8eb9-39ddf9c5c57f",,Owner changed
ITEM-000382,Update,stepname,,14-Qualify,ACTOR-0008,15/12/2025 15:11,2025-12-15T15:11:00Z,ITEM-000382,L1_STAGE,L1,14-Qualify,14.0,stepname → 14-Qualify
ITEM-000382,Create,statecode,,0,ACTOR-0003,15/12/2025 15:11,2025-12-15T15:11:00Z,ITEM-000382,L1_STAGE,L1,Open,,Case Created
ITEM-000382,Update,stepname,14-Qualify,15-Develop,ACTOR-0003,13/01/2026 08:31,2026-01-13T08:31:00Z,ITEM-000382,L1_STAGE,L1,15-Develop,15.0,stepname → 15-Develop
ITEM-000382,Update,msdyn_forecastcategory,100000001,100000002,ACTOR-0003,13/01/2026 08:31,2026-01-13T08:31:00Z,ITEM-000382,L1_STAGE,L1,100000002,,msdyn_forecastcategory → 100000002
ITEM-000382,Update,stepname,15-Develop,16-Propose,ACTOR-0008,15/01/2026 14:00,2026-01-15T14:00:00Z,ITEM-000382,L1_STAGE,L1,16-Propose,16.0,stepname → 16-Propose
ITEM-000382,Update,stepname,16-Propose,17-Close,ACTOR-0008,15/01/2026 14:00,2026-01-15T14:00:00Z,ITEM-000382,L1_STAGE,L1,17-Close,17.0,stepname → 17-Close
ITEM-000382,Update,new_contracttermmonths,4,3,ACTOR-0003,22/01/2026 05:20,2026-01-22T05:20:00Z,ITEM-000382,L2_MILESTONE,L2,3,,new_contracttermmonths → 3
ITEM-000382,Update,the000g__revenuetype,,604720001,ACTOR-0003,12/1/26 10:27,2026-12-01T10:27:00Z,ITEM-000382,L2_MILESTONE,L2,604720001,,the000g__revenuetype → 604720001
ITEM-000382,Update,estimatedclosedate,1/9/26 0:00,2/13/26 0:00,ACTOR-0003,12/1/26 17:10,2026-12-01T17:10:00Z,ITEM-000382,L1_STAGE,L1,2/13/26 0:00,,estimatedclosedate → 2/13/26 0:00
ITEM-000383,Update,owningbusinessunit,"businessunit,0a4ccfd6-e6d9-e611-80f2-5065f38aba91","businessunit,0a4ccfd6-e6d9-e611-80f2-5065f38aba91",ACTOR-0002,8/9/25 8:04,2025-08-09T08:04:00Z,ITEM-000383,L3_ADMIN,L3,"businessunit,0a4ccfd6-e6d9-e611-80f2-5065f38aba91",,owningbusinessunit changed
ITEM-000383,Update,ownerid,"systemuser,ddf0a409-01d5-4caa-bd27-c1b42fee109e","systemuser,efd3822d-8c8b-4619-8eb9-39ddf9c5c57f",ACTOR-0002,8/9/25 8:04,2025-08-09T08:04:00Z,ITEM-000383,L3_ADMIN,L3,"systemuser,efd3822d-8c8b-4619-8eb9-39ddf9c5c57f",,Owner changed
ITEM-000384,Update,stepname,,14-Qualify,ACTOR-0008,19/01/2026 12:34,2026-01-19T12:34:00Z,ITEM-000384,L1_STAGE,L1,14-Qualify,14.0,stepname → 14-Qualify
ITEM-000384,Create,statecode,,0,ACTOR-0002,19/01/2026 12:34,2026-01-19T12:34:00Z,ITEM-000384,L1_STAGE,L1,Open,,Case Created
ITEM-000386,Update,stepname,,14-Qualify,ACTOR-0008,11/11/25 9:18,2025-11-11T09:18:00Z,ITEM-000386,L1_STAGE,L1,14-Qualify,14.0,stepname → 14-Qualify
ITEM-000386,Create,statecode,,0,ACTOR-0009,11/11/25 9:18,2025-11-11T09:18:00Z,ITEM-000386,L1_STAGE,L1,Open,,Case Created
ITEM-000386,Update,the000g__revenuetype,,604720002,ACTOR-0009,15/01/2026 14:07,2026-01-15T14:07:00Z,ITEM-000386,L2_MILESTONE,L2,604720002,,the000g__revenuetype → 604720002
ITEM-000388,Update,owningbusinessunit,"businessunit,0a4ccfd6-e6d9-e611-80f2-5065f38aba91","businessunit,0a4ccfd6-e6d9-e611-80f2-5065f38aba91",ACTOR-0003,27/08/2025 12:57,2025-08-27T12:57:00Z,ITEM-000388,L3_ADMIN,L3,"businessunit,0a4ccfd6-e6d9-e611-80f2-5065f38aba91",,owningbusinessunit changed
ITEM-000388,Update,ownerid,"systemuser,7b9d5323-2ef3-4d52-9d6c-dd45deb05e3b","systemuser,b5f00e27-78b3-4a71-90af-5dcef3c25bba",ACTOR-0003,27/08/2025 12:57,2025-08-27T12:57:00Z,ITEM-000388,L3_ADMIN,L3,"systemuser,b5f00e27-78b3-4a71-90af-5dcef3c25bba",,Owner changed
ITEM-000390,Update,owningbusinessunit,"businessunit,0a4ccfd6-e6d9-e611-80f2-5065f38aba91","businessunit,0a4ccfd6-e6d9-e611-80f2-5065f38aba91",ACTOR-0003,27/10/2025 11:18,2025-10-27T11:18:00Z,ITEM-000390,L3_ADMIN,L3,"businessunit,0a4ccfd6-e6d9-e611-80f2-5065f38aba91",,owningbusinessunit changed
ITEM-000390,Update,ownerid,"systemuser,2d7fbe83-3f35-4a1d-bc05-1b39dbf446d9","systemuser,efd3822d-8c8b-4619-8eb9-39ddf9c5c57f",ACTOR-0003,27/10/2025 11:18,2025-10-27T11:18:00Z,ITEM-000390,L3_ADMIN,L3,"systemuser,efd3822d-8c8b-4619-8eb9-39ddf9c5c57f",,Owner changed
ITEM-000391,Update,estimatedclosedate,2/19/26 0:00,1/30/26 0:00,ACTOR-0002,26/01/2026 14:14,2026-01-26T14:14:00Z,ITEM-000391,L1_STAGE,L1,1/30/26 0:00,,estimatedclosedate → 1/30/26 0:00
ITEM-000391,Update,estimatedclosedate,1/30/26 0:00,1/29/26 0:00,ACTOR-0002,29/01/2026 14:20,2026-01-29T14:20:00Z,ITEM-000391,L1_STAGE,L1,1/29/26 0:00,,estimatedclosedate → 1/29/26 0:00
ITEM-000391,Update,statuscode,1,3,ACTOR-0002,29/01/2026 14:21,2026-01-29T14:21:00Z,ITEM-000391,L1_STAGE,L1,Won,,statuscode → Won
ITEM-000391,Update,stepname,14-Qualify,15-Develop,ACTOR-0008,29/01/2026 14:21,2026-01-29T14:21:00Z,ITEM-000391,L1_STAGE,L1,15-Develop,15.0,stepname → 15-Develop
ITEM-000391,Update,stepname,15-Develop,16-Propose,ACTOR-0008,29/01/2026 14:21,2026-01-29T14:21:00Z,ITEM-000391,L1_STAGE,L1,16-Propose,16.0,stepname → 16-Propose
ITEM-000391,Update,stepname,16-Propose,17-Close,ACTOR-0008,29/01/2026 14:21,2026-01-29T14:21:00Z,ITEM-000391,L1_STAGE,L1,17-Close,17.0,stepname → 17-Close
ITEM-000391,Update,msdyn_forecastcategory,100000001,100000005,ACTOR-0002,29/01/2026 14:21,2026-01-29T14:21:00Z,ITEM-000391,L1_STAGE,L1,100000005,,msdyn_forecastcategory → 100000005
ITEM-000391,Update,actualclosedate,,1/29/26 0:00,ACTOR-0002,29/01/2026 14:21,2026-01-29T14:21:00Z,ITEM-000391,L1_STAGE,L1,1/29/26 0:00,,actualclosedate → 1/29/26 0:00
ITEM-000391,Update,salesstage,,3,ACTOR-0002,29/01/2026 14:21,2026-01-29T14:21:00Z,ITEM-000391,L1_STAGE,L1,3,,salesstage → 3
ITEM-000391,Update,statecode,0,1,ACTOR-0002,29/01/2026 14:21,2026-01-29T14:21:00Z,ITEM-000391,L1_STAGE,L1,Won,,statecode → Won
ITEM-000391,Update,stepname,,14-Qualify,ACTOR-0008,12/1/26 15:36,2026-12-01T15:36:00Z,ITEM-000391,L1_STAGE,L1,14-Qualify,14.0,stepname → 14-Qualify
ITEM-000391,Create,purchaseprocess,,0,ACTOR-0002,12/1/26 15:36,2026-12-01T15:36:00Z,ITEM-000391,L2_MILESTONE,L2,0,,Case Created
ITEM-000392,Update,owningbusinessunit,"businessunit,0a4ccfd6-e6d9-e611-80f2-5065f38aba91","businessunit,0a4ccfd6-e6d9-e611-80f2-5065f38aba91",ACTOR-0002,7/10/25 10:45,2025-07-10T10:45:00Z,ITEM-000392,L3_ADMIN,L3,"businessunit,0a4ccfd6-e6d9-e611-80f2-5065f38aba91",,owningbusinessunit changed
ITEM-000392,Update,ownerid,"systemuser,7b9d5323-2ef3-4d52-9d6c-dd45deb05e3b","systemuser,efd3822d-8c8b-4619-8eb9-39ddf9c5c57f",ACTOR-0002,7/10/25 10:45,2025-07-10T10:45:00Z,ITEM-000392,L3_ADMIN,L3,"systemuser,efd3822d-8c8b-4619-8eb9-39ddf9c5c57f",,Owner changed
ITEM-000393,Update,owningbusinessunit,"businessunit,0a4ccfd6-e6d9-e611-80f2-5065f38aba91","businessunit,0a4ccfd6-e6d9-e611-80f2-5065f38aba91",ACTOR-0002,7/10/25 10:45,2025-07-10T10:45:00Z,ITEM-000393,L3_ADMIN,L3,"businessunit,0a4ccfd6-e6d9-e611-80f2-5065f38aba91",,owningbusinessunit changed
ITEM-000393,Update,ownerid,"systemuser,7b9d5323-2ef3-4d52-9d6c-dd45deb05e3b","systemuser,efd3822d-8c8b-4619-8eb9-39ddf9c5c57f",ACTOR-0002,7/10/25 10:45,2025-07-10T10:45:00Z,ITEM-000393,L3_ADMIN,L3,"systemuser,efd3822d-8c8b-4619-8eb9-39ddf9c5c57f",,Owner changed
ITEM-000394,Update,owningbusinessunit,"businessunit,0a4ccfd6-e6d9-e611-80f2-5065f38aba91","businessunit,0a4ccfd6-e6d9-e611-80f2-5065f38aba91",ACTOR-0002,7/10/25 10:46,2025-07-10T10:46:00Z,ITEM-000394,L3_ADMIN,L3,"businessunit,0a4ccfd6-e6d9-e611-80f2-5065f38aba91",,owningbusinessunit changed
ITEM-000394,Update,ownerid,"systemuser,7b9d5323-2ef3-4d52-9d6c-dd45deb05e3b","systemuser,efd3822d-8c8b-4619-8eb9-39ddf9c5c57f",ACTOR-0002,7/10/25 10:46,2025-07-10T10:46:00Z,ITEM-000394,L3_ADMIN,L3,"systemuser,efd3822d-8c8b-4619-8eb9-39ddf9c5c57f",,Owner changed
ITEM-000395,Update,owningbusinessunit,"businessunit,0a4ccfd6-e6d9-e611-80f2-5065f38aba91","businessunit,0a4ccfd6-e6d9-e611-80f2-5065f38aba91",ACTOR-0003,26/08/2025 07:42,2025-08-26T07:42:00Z,ITEM-000395,L3_ADMIN,L3,"businessunit,0a4ccfd6-e6d9-e611-80f2-5065f38aba91",,owningbusinessunit changed
ITEM-000395,Update,ownerid,"systemuser,ddf0a409-01d5-4caa-bd27-c1b42fee109e","systemuser,efd3822d-8c8b-4619-8eb9-39ddf9c5c57f",ACTOR-0003,26/08/2025 07:42,2025-08-26T07:42:00Z,ITEM-000395,L3_ADMIN,L3,"systemuser,efd3822d-8c8b-4619-8eb9-39ddf9c5c57f",,Owner changed
ITEM-000397,Create,purchaseprocess,,0,ACTOR-0003,15/12/2025 13:36,2025-12-15T13:36:00Z,ITEM-000397,L2_MILESTONE,L2,0,,Case Created
ITEM-000397,Update,stepname,,14-Qualify,ACTOR-0008,15/12/2025 13:37,2025-12-15T13:37:00Z,ITEM-000397,L1_STAGE,L1,14-Qualify,14.0,stepname → 14-Qualify
ITEM-000397,Update,statuscode,1,3,ACTOR-0003,15/12/2025 13:44,2025-12-15T13:44:00Z,ITEM-000397,L1_STAGE,L1,Won,,statuscode → Won
ITEM-000397,Update,msdyn_forecastcategory,100000001,100000005,ACTOR-0003,15/12/2025 13:44,2025-12-15T13:44:00Z,ITEM-000397,L1_STAGE,L1,100000005,,msdyn_forecastcategory → 100000005
ITEM-000397,Update,actualclosedate,,12/15/25 0:00,ACTOR-0003,15/12/2025 13:44,2025-12-15T13:44:00Z,ITEM-000397,L1_STAGE,L1,12/15/25 0:00,,actualclosedate → 12/15/25 0:00
ITEM-000397,Update,salesstage,,3,ACTOR-0003,15/12/2025 13:44,2025-12-15T13:44:00Z,ITEM-000397,L1_STAGE,L1,3,,salesstage → 3
ITEM-000397,Update,statecode,0,1,ACTOR-0003,15/12/2025 13:44,2025-12-15T13:44:00Z,ITEM-000397,L1_STAGE,L1,Won,,statecode → Won
ITEM-000398,Update,owningbusinessunit,"businessunit,0a4ccfd6-e6d9-e611-80f2-5065f38aba91","businessunit,0a4ccfd6-e6d9-e611-80f2-5065f38aba91",ACTOR-0003,27/08/2025 12:57,2025-08-27T12:57:00Z,ITEM-000398,L3_ADMIN,L3,"businessunit,0a4ccfd6-e6d9-e611-80f2-5065f38aba91",,owningbusinessunit changed
ITEM-000398,Update,ownerid,"systemuser,7b9d5323-2ef3-4d52-9d6c-dd45deb05e3b","systemuser,b5f00e27-78b3-4a71-90af-5dcef3c25bba",ACTOR-0003,27/08/2025 12:57,2025-08-27T12:57:00Z,ITEM-000398,L3_ADMIN,L3,"systemuser,b5f00e27-78b3-4a71-90af-5dcef3c25bba",,Owner changed
ITEM-000399,Update,owningbusinessunit,"businessunit,0a4ccfd6-e6d9-e611-80f2-5065f38aba91","businessunit,0a4ccfd6-e6d9-e611-80f2-5065f38aba91",ACTOR-0003,27/10/2025 11:18,2025-10-27T11:18:00Z,ITEM-000399,L3_ADMIN,L3,"businessunit,0a4ccfd6-e6d9-e611-80f2-5065f38aba91",,owningbusinessunit changed
ITEM-000399,Update,ownerid,"systemuser,a1bb889b-dfab-4e28-b508-75e672da7cb8","systemuser,efd3822d-8c8b-4619-8eb9-39ddf9c5c57f",ACTOR-0003,27/10/2025 11:18,2025-10-27T11:18:00Z,ITEM-000399,L3_ADMIN,L3,"systemuser,efd3822d-8c8b-4619-8eb9-39ddf9c5c57f",,Owner changed
ITEM-000400,Update,statuscode,1,100000001,ACTOR-0002,2/12/25 10:54,2025-02-12T10:54:00Z,ITEM-000400,L1_STAGE,L1,100000001,,statuscode → 100000001
ITEM-000400,Update,stepname,14-Qualify,15-Develop,ACTOR-0008,2/12/25 10:54,2025-02-12T10:54:00Z,ITEM-000400,L1_STAGE,L1,15-Develop,15.0,stepname → 15-Develop
ITEM-000400,Update,stepname,15-Develop,16-Propose,ACTOR-0008,2/12/25 10:54,2025-02-12T10:54:00Z,ITEM-000400,L1_STAGE,L1,16-Propose,16.0,stepname → 16-Propose
ITEM-000400,Create,purchaseprocess,,0,ACTOR-0002,12/11/25 11:08,2025-12-11T11:08:00Z,ITEM-000400,L2_MILESTONE,L2,0,,Case Created
ITEM-000400,Update,stepname,,14-Qualify,ACTOR-0008,12/11/25 11:09,2025-12-11T11:09:00Z,ITEM-000400,L1_STAGE,L1,14-Qualify,14.0,stepname → 14-Qualify
ITEM-000400,Update,estimatedclosedate,12/16/25 0:00,1/7/26 0:00,ACTOR-0002,15/12/2025 14:33,2025-12-15T14:33:00Z,ITEM-000400,L1_STAGE,L1,1/7/26 0:00,,estimatedclosedate → 1/7/26 0:00
ITEM-000400,Update,new_contracttermmonths,,2,ACTOR-0006,28/01/2026 09:52,2026-01-28T09:52:00Z,ITEM-000400,L2_MILESTONE,L2,2,,new_contracttermmonths → 2
ITEM-000400,Update,new_contracttermmonths,2,12,ACTOR-0002,28/01/2026 11:29,2026-01-28T11:29:00Z,ITEM-000400,L2_MILESTONE,L2,12,,new_contracttermmonths → 12
ITEM-000400,Update,estimatedclosedate,1/29/26 0:00,1/30/26 0:00,ACTOR-0002,28/01/2026 11:33,2026-01-28T11:33:00Z,ITEM-000400,L1_STAGE,L1,1/30/26 0:00,,estimatedclosedate → 1/30/26 0:00
ITEM-000400,Update,the000g__revenuetype,,604720002,ACTOR-0003,5/1/26 16:06,2026-05-01T16:06:00Z,ITEM-000400,L2_MILESTONE,L2,604720002,,the000g__revenuetype → 604720002
ITEM-000400,Update,new_oppotunitytype,100000000,100000001,ACTOR-0003,5/1/26 16:06,2026-05-01T16:06:00Z,ITEM-000400,L2_MILESTONE,L2,100000001,,new_oppotunitytype → 100000001
ITEM-000400,Update,msdyn_forecastcategory,100000001,100000002,ACTOR-0003,5/1/26 16:06,2026-05-01T16:06:00Z,ITEM-000400,L1_STAGE,L1,100000002,,msdyn_forecastcategory → 100000002
ITEM-000400,Update,estimatedclosedate,1/7/26 0:00,1/13/26 0:00,ACTOR-0002,6/1/26 11:18,2026-06-01T11:18:00Z,ITEM-000400,L1_STAGE,L1,1/13/26 0:00,,estimatedclosedate → 1/13/26 0:00
ITEM-000400,Update,estimatedclosedate,1/13/26 0:00,1/29/26 0:00,ACTOR-0002,12/1/26 9:55,2026-12-01T09:55:00Z,ITEM-000400,L1_STAGE,L1,1/29/26 0:00,,estimatedclosedate → 1/29/26 0:00
ITEM-000401,Update,stepname,,14-Qualify,ACTOR-0008,15/12/2025 14:31,2025-12-15T14:31:00Z,ITEM-000401,L1_STAGE,L1,14-Qualify,14.0,stepname → 14-Qualify
ITEM-000401,Update,stepname,14-Qualify,15-Develop,ACTOR-0008,15/12/2025 14:31,2025-12-15T14:31:00Z,ITEM-000401,L1_STAGE,L1,15-Develop,15.0,stepname → 15-Develop
ITEM-000401,Update,stepname,15-Develop,16-Propose,ACTOR-0008,15/12/2025 14:31,2025-12-15T14:31:00Z,ITEM-000401,L1_STAGE,L1,16-Propose,16.0,stepname → 16-Propose
ITEM-000401,Update,stepname,16-Propose,17-Close,ACTOR-0008,15/12/2025 14:31,2025-12-15T14:31:00Z,ITEM-000401,L1_STAGE,L1,17-Close,17.0,stepname → 17-Close
ITEM-000401,Create,purchaseprocess,,0,ACTOR-0002,15/12/2025 14:31,2025-12-15T14:31:00Z,ITEM-000401,L2_MILESTONE,L2,0,,Case Created
ITEM-000401,Update,statuscode,100000003,3,ACTOR-0002,15/12/2025 14:32,2025-12-15T14:32:00Z,ITEM-000401,L1_STAGE,L1,Won,,statuscode → Won
ITEM-000401,Update,msdyn_forecastcategory,100000003,100000005,ACTOR-0002,15/12/2025 14:32,2025-12-15T14:32:00Z,ITEM-000401,L1_STAGE,L1,100000005,,msdyn_forecastcategory → 100000005
ITEM-000401,Update,actualclosedate,,12/15/25 0:00,ACTOR-0002,15/12/2025 14:32,2025-12-15T14:32:00Z,ITEM-000401,L1_STAGE,L1,12/15/25 0:00,,actualclosedate → 12/15/25 0:00
ITEM-000401,Update,salesstage,,3,ACTOR-0002,15/12/2025 14:32,2025-12-15T14:32:00Z,ITEM-000401,L1_STAGE,L1,3,,salesstage → 3
ITEM-000401,Update,statecode,0,1,ACTOR-0002,15/12/2025 14:32,2025-12-15T14:32:00Z,ITEM-000401,L1_STAGE,L1,Won,,statecode → Won
ITEM-000402,Update,statuscode,1,4,ACTOR-0003,11/8/25 8:54,2025-11-08T08:54:00Z,ITEM-000402,L1_STAGE,L1,Canceled,,statuscode → Canceled
ITEM-000402,Update,msdyn_forecastcategory,100000001,100000006,ACTOR-0003,11/8/25 8:54,2025-11-08T08:54:00Z,ITEM-000402,L1_STAGE,L1,100000006,,msdyn_forecastcategory → 100000006
ITEM-000402,Update,actualclosedate,,8/11/25 0:00,ACTOR-0003,11/8/25 8:54,2025-11-08T08:54:00Z,ITEM-000402,L1_STAGE,L1,8/11/25 0:00,,actualclosedate → 8/11/25 0:00
ITEM-000402,Update,salesstage,,3,ACTOR-0003,11/8/25 8:54,2025-11-08T08:54:00Z,ITEM-000402,L1_STAGE,L1,3,,salesstage → 3
ITEM-000402,Update,statecode,0,2,ACTOR-0003,11/8/25 8:54,2025-11-08T08:54:00Z,ITEM-000402,L1_STAGE,L1,Lost,,statecode → Lost
ITEM-000404,Update,stepname,,14-Qualify,ACTOR-0008,28/10/2025 09:23,2025-10-28T09:23:00Z,ITEM-000404,L1_STAGE,L1,14-Qualify,14.0,stepname → 14-Qualify
ITEM-000404,Create,statecode,,0,ACTOR-0009,28/10/2025 09:23,2025-10-28T09:23:00Z,ITEM-000404,L1_STAGE,L1,Open,,Case Created
ITEM-000404,Update,the000g__revenuetype,,604720004,ACTOR-0009,18/12/2025 09:19,2025-12-18T09:19:00Z,ITEM-000404,L2_MILESTONE,L2,604720004,,the000g__revenuetype → 604720004
ITEM-000404,Update,estimatedclosedate,11/19/25 0:00,1/31/26 0:00,ACTOR-0009,18/12/2025 09:19,2025-12-18T09:19:00Z,ITEM-000404,L1_STAGE,L1,1/31/26 0:00,,estimatedclosedate → 1/31/26 0:00
ITEM-000404,Update,estimatedclosedate,1/31/26 0:00,4/23/26 0:00,ACTOR-0009,26/01/2026 15:33,2026-01-26T15:33:00Z,ITEM-000404,L1_STAGE,L1,4/23/26 0:00,,estimatedclosedate → 4/23/26 0:00
ITEM-000404,Update,closeprobability,,25,ACTOR-0003,5/1/26 15:35,2026-05-01T15:35:00Z,ITEM-000404,L1_STAGE,L1,25,,closeprobability → 25
ITEM-000405,Create,statecode,,0,ACTOR-0009,14/10/2025 09:13,2025-10-14T09:13:00Z,ITEM-000405,L1_STAGE,L1,Open,,Case Created
ITEM-000405,Update,stepname,,14-Qualify,ACTOR-0008,14/10/2025 09:14,2025-10-14T09:14:00Z,ITEM-000405,L1_STAGE,L1,14-Qualify,14.0,stepname → 14-Qualify
ITEM-000405,Update,estimatedclosedate,2/17/26 0:00,2/26/26 0:00,ACTOR-0009,26/01/2026 15:34,2026-01-26T15:34:00Z,ITEM-000405,L1_STAGE,L1,2/26/26 0:00,,estimatedclosedate → 2/26/26 0:00
ITEM-000405,Update,estimatedclosedate,2/26/26 0:00,3/31/26 0:00,ACTOR-0009,28/01/2026 12:17,2026-01-28T12:17:00Z,ITEM-000405,L1_STAGE,L1,3/31/26 0:00,,estimatedclosedate → 3/31/26 0:00
ITEM-000405,Update,stepname,14-Qualify,15-Develop,ACTOR-0003,5/1/26 15:40,2026-05-01T15:40:00Z,ITEM-000405,L1_STAGE,L1,15-Develop,15.0,stepname → 15-Develop
ITEM-000405,Update,the000g__revenuetype,,604720002,ACTOR-0003,5/1/26 15:40,2026-05-01T15:40:00Z,ITEM-000405,L2_MILESTONE,L2,604720002,,the000g__revenuetype → 604720002
ITEM-000405,Update,closeprobability,,50,ACTOR-0003,5/1/26 15:40,2026-05-01T15:40:00Z,ITEM-000405,L1_STAGE,L1,50,,closeprobability → 50
ITEM-000406,Update,owningbusinessunit,"businessunit,0a4ccfd6-e6d9-e611-80f2-5065f38aba91","businessunit,0a4ccfd6-e6d9-e611-80f2-5065f38aba91",ACTOR-0003,26/08/2025 07:43,2025-08-26T07:43:00Z,ITEM-000406,L3_ADMIN,L3,"businessunit,0a4ccfd6-e6d9-e611-80f2-5065f38aba91",,owningbusinessunit changed
ITEM-000406,Update,ownerid,"systemuser,b5f00e27-78b3-4a71-90af-5dcef3c25bba","systemuser,efd3822d-8c8b-4619-8eb9-39ddf9c5c57f",ACTOR-0003,26/08/2025 07:43,2025-08-26T07:43:00Z,ITEM-000406,L3_ADMIN,L3,"systemuser,efd3822d-8c8b-4619-8eb9-39ddf9c5c57f",,Owner changed
ITEM-000408,Update,stepname,,14-Qualify,ACTOR-0008,16/01/2026 09:03,2026-01-16T09:03:00Z,ITEM-000408,L1_STAGE,L1,14-Qualify,14.0,stepname → 14-Qualify
ITEM-000408,Create,statecode,,0,ACTOR-0002,16/01/2026 09:03,2026-01-16T09:03:00Z,ITEM-000408,L1_STAGE,L1,Open,,Case Created
ITEM-000408,Update,estimatedclosedate,1/30/26 0:00,2/18/26 0:00,ACTOR-0002,19/01/2026 10:18,2026-01-19T10:18:00Z,ITEM-000408,L1_STAGE,L1,2/18/26 0:00,,estimatedclosedate → 2/18/26 0:00
ITEM-000408,Update,estimatedclosedate,2/18/26 0:00,2/26/26 0:00,ACTOR-0002,22/01/2026 10:28,2026-01-22T10:28:00Z,ITEM-000408,L1_STAGE,L1,2/26/26 0:00,,estimatedclosedate → 2/26/26 0:00
ITEM-000411,Update,owningbusinessunit,"businessunit,0a4ccfd6-e6d9-e611-80f2-5065f38aba91","businessunit,0a4ccfd6-e6d9-e611-80f2-5065f38aba91",ACTOR-0002,8/1/26 9:40,2026-08-01T09:40:00Z,ITEM-000411,L3_ADMIN,L3,"businessunit,0a4ccfd6-e6d9-e611-80f2-5065f38aba91",,owningbusinessunit changed
ITEM-000411,Update,ownerid,"systemuser,7b9d5323-2ef3-4d52-9d6c-dd45deb05e3b","systemuser,efd3822d-8c8b-4619-8eb9-39ddf9c5c57f",ACTOR-0002,8/1/26 9:40,2026-08-01T09:40:00Z,ITEM-000411,L3_ADMIN,L3,"systemuser,efd3822d-8c8b-4619-8eb9-39ddf9c5c57f",,Owner changed
ITEM-000413,Update,stepname,,14-Qualify,ACTOR-0008,9/9/25 12:57,2025-09-09T12:57:00Z,ITEM-000413,L1_STAGE,L1,14-Qualify,14.0,stepname → 14-Qualify
ITEM-000413,Create,statecode,,0,ACTOR-0009,9/9/25 12:57,2025-09-09T12:57:00Z,ITEM-000413,L1_STAGE,L1,Open,,Case Created
ITEM-000415,Update,owningbusinessunit,"businessunit,0a4ccfd6-e6d9-e611-80f2-5065f38aba91","businessunit,0a4ccfd6-e6d9-e611-80f2-5065f38aba91",ACTOR-0003,27/10/2025 11:18,2025-10-27T11:18:00Z,ITEM-000415,L3_ADMIN,L3,"businessunit,0a4ccfd6-e6d9-e611-80f2-5065f38aba91",,owningbusinessunit changed
ITEM-000415,Update,ownerid,"systemuser,2d7fbe83-3f35-4a1d-bc05-1b39dbf446d9","systemuser,efd3822d-8c8b-4619-8eb9-39ddf9c5c57f",ACTOR-0003,27/10/2025 11:18,2025-10-27T11:18:00Z,ITEM-000415,L3_ADMIN,L3,"systemuser,efd3822d-8c8b-4619-8eb9-39ddf9c5c57f",,Owner changed
ITEM-000416,Update,owningbusinessunit,"businessunit,0a4ccfd6-e6d9-e611-80f2-5065f38aba91","businessunit,0a4ccfd6-e6d9-e611-80f2-5065f38aba91",ACTOR-0002,8/1/26 9:40,2026-08-01T09:40:00Z,ITEM-000416,L3_ADMIN,L3,"businessunit,0a4ccfd6-e6d9-e611-80f2-5065f38aba91",,owningbusinessunit changed
ITEM-000416,Update,ownerid,"systemuser,7b9d5323-2ef3-4d52-9d6c-dd45deb05e3b","systemuser,efd3822d-8c8b-4619-8eb9-39ddf9c5c57f",ACTOR-0002,8/1/26 9:40,2026-08-01T09:40:00Z,ITEM-000416,L3_ADMIN,L3,"systemuser,efd3822d-8c8b-4619-8eb9-39ddf9c5c57f",,Owner changed
ITEM-000417,Update,owningbusinessunit,"businessunit,0a4ccfd6-e6d9-e611-80f2-5065f38aba91","businessunit,0a4ccfd6-e6d9-e611-80f2-5065f38aba91",ACTOR-0003,26/08/2025 07:43,2025-08-26T07:43:00Z,ITEM-000417,L3_ADMIN,L3,"businessunit,0a4ccfd6-e6d9-e611-80f2-5065f38aba91",,owningbusinessunit changed
ITEM-000417,Update,ownerid,"systemuser,b5f00e27-78b3-4a71-90af-5dcef3c25bba","systemuser,efd3822d-8c8b-4619-8eb9-39ddf9c5c57f",ACTOR-0003,26/08/2025 07:43,2025-08-26T07:43:00Z,ITEM-000417,L3_ADMIN,L3,"systemuser,efd3822d-8c8b-4619-8eb9-39ddf9c5c57f",,Owner changed
ITEM-000418,Update,owningbusinessunit,"businessunit,0a4ccfd6-e6d9-e611-80f2-5065f38aba91","businessunit,0a4ccfd6-e6d9-e611-80f2-5065f38aba91",ACTOR-0003,27/10/2025 11:18,2025-10-27T11:18:00Z,ITEM-000418,L3_ADMIN,L3,"businessunit,0a4ccfd6-e6d9-e611-80f2-5065f38aba91",,owningbusinessunit changed
ITEM-000418,Update,ownerid,"systemuser,2d7fbe83-3f35-4a1d-bc05-1b39dbf446d9","systemuser,efd3822d-8c8b-4619-8eb9-39ddf9c5c57f",ACTOR-0003,27/10/2025 11:18,2025-10-27T11:18:00Z,ITEM-000418,L3_ADMIN,L3,"systemuser,efd3822d-8c8b-4619-8eb9-39ddf9c5c57f",,Owner changed
ITEM-000422,Update,stepname,,14-Qualify,ACTOR-0008,13/08/2025 12:03,2025-08-13T12:03:00Z,ITEM-000422,L1_STAGE,L1,14-Qualify,14.0,stepname → 14-Qualify
ITEM-000422,Create,statecode,,0,ACTOR-0003,13/08/2025 12:03,2025-08-13T12:03:00Z,ITEM-000422,L1_STAGE,L1,Open,,Case Created
ITEM-000422,Update,statuscode,1,3,ACTOR-0003,19/08/2025 08:15,2025-08-19T08:15:00Z,ITEM-000422,L1_STAGE,L1,Won,,statuscode → Won
ITEM-000422,Update,msdyn_forecastcategory,100000001,100000005,ACTOR-0003,19/08/2025 08:15,2025-08-19T08:15:00Z,ITEM-000422,L1_STAGE,L1,100000005,,msdyn_forecastcategory → 100000005
ITEM-000422,Update,actualclosedate,,8/15/25 0:00,ACTOR-0003,19/08/2025 08:15,2025-08-19T08:15:00Z,ITEM-000422,L1_STAGE,L1,8/15/25 0:00,,actualclosedate → 8/15/25 0:00
ITEM-000422,Update,salesstage,,3,ACTOR-0003,19/08/2025 08:15,2025-08-19T08:15:00Z,ITEM-000422,L1_STAGE,L1,3,,salesstage → 3
ITEM-000422,Update,statecode,0,1,ACTOR-0003,19/08/2025 08:15,2025-08-19T08:15:00Z,ITEM-000422,L1_STAGE,L1,Won,,statecode → Won
ITEM-000423,Update,owningbusinessunit,"businessunit,0a4ccfd6-e6d9-e611-80f2-5065f38aba91","businessunit,0a4ccfd6-e6d9-e611-80f2-5065f38aba91",ACTOR-0003,27/10/2025 11:18,2025-10-27T11:18:00Z,ITEM-000423,L3_ADMIN,L3,"businessunit,0a4ccfd6-e6d9-e611-80f2-5065f38aba91",,owningbusinessunit changed
ITEM-000423,Update,ownerid,"systemuser,2d7fbe83-3f35-4a1d-bc05-1b39dbf446d9","systemuser,efd3822d-8c8b-4619-8eb9-39ddf9c5c57f",ACTOR-0003,27/10/2025 11:18,2025-10-27T11:18:00Z,ITEM-000423,L3_ADMIN,L3,"systemuser,efd3822d-8c8b-4619-8eb9-39ddf9c5c57f",,Owner changed
ITEM-000424,Update,stepname,,14-Qualify,ACTOR-0008,24/10/2025 12:24,2025-10-24T12:24:00Z,ITEM-000424,L1_STAGE,L1,14-Qualify,14.0,stepname → 14-Qualify
ITEM-000424,Create,statecode,,0,ACTOR-0009,24/10/2025 12:24,2025-10-24T12:24:00Z,ITEM-000424,L1_STAGE,L1,Open,,Case Created
ITEM-000424,Update,the000g__revenuetype,,604720001,ACTOR-0009,18/12/2025 09:23,2025-12-18T09:23:00Z,ITEM-000424,L2_MILESTONE,L2,604720001,,the000g__revenuetype → 604720001
ITEM-000424,Update,estimatedclosedate,12/17/25 0:00,1/27/26 0:00,ACTOR-0009,18/12/2025 09:23,2025-12-18T09:23:00Z,ITEM-000424,L1_STAGE,L1,1/27/26 0:00,,estimatedclosedate → 1/27/26 0:00
ITEM-000424,Update,estimatedclosedate,1/27/26 0:00,2/20/26 0:00,ACTOR-0003,22/01/2026 04:39,2026-01-22T04:39:00Z,ITEM-000424,L1_STAGE,L1,2/20/26 0:00,,estimatedclosedate → 2/20/26 0:00
ITEM-000424,Update,stepname,14-Qualify,16-Propose,ACTOR-0003,5/1/26 15:23,2026-05-01T15:23:00Z,ITEM-000424,L1_STAGE,L1,16-Propose,16.0,stepname → 16-Propose
ITEM-000424,Update,closeprobability,,75,ACTOR-0003,5/1/26 15:23,2026-05-01T15:23:00Z,ITEM-000424,L1_STAGE,L1,75,,closeprobability → 75
ITEM-000425,Update,the000g_revenuetype,,604720002,ACTOR-0003,14/08/2025 13:05,2025-08-14T13:05:00Z,ITEM-000425,L2_MILESTONE,L2,604720002,,the000g_revenuetype → 604720002
ITEM-000425,Update,the000g_isrenewal,,TRUE,ACTOR-0003,14/08/2025 13:05,2025-08-14T13:05:00Z,ITEM-000425,L3_ADMIN,L3,TRUE,,the000g_isrenewal changed
ITEM-000425,Update,estimatedclosedate,8/22/25 0:00,12/17/25 0:00,ACTOR-0002,29/10/2025 06:51,2025-10-29T06:51:00Z,ITEM-000425,L1_STAGE,L1,12/17/25 0:00,,estimatedclosedate → 12/17/25 0:00
ITEM-000425,Update,owningbusinessunit,"businessunit,0a4ccfd6-e6d9-e611-80f2-5065f38aba91","businessunit,0a4ccfd6-e6d9-e611-80f2-5065f38aba91",ACTOR-0003,11/8/25 8:55,2025-11-08T08:55:00Z,ITEM-000425,L3_ADMIN,L3,"businessunit,0a4ccfd6-e6d9-e611-80f2-5065f38aba91",,owningbusinessunit changed
ITEM-000425,Update,ownerid,"systemuser,09f34b91-4d86-4fc8-8b41-8af3d91e94bf","systemuser,efd3822d-8c8b-4619-8eb9-39ddf9c5c57f",ACTOR-0003,11/8/25 8:55,2025-11-08T08:55:00Z,ITEM-000425,L3_ADMIN,L3,"systemuser,efd3822d-8c8b-4619-8eb9-39ddf9c5c57f",,Owner changed
ITEM-000425,Update,the000g__revenuetype,,604720003,ACTOR-0002,18/12/2025 15:43,2025-12-18T15:43:00Z,ITEM-000425,L2_MILESTONE,L2,604720003,,the000g__revenuetype → 604720003
ITEM-000425,Update,estimatedclosedate,12/17/25 0:00,4/1/26 0:00,ACTOR-0002,18/12/2025 15:43,2025-12-18T15:43:00Z,ITEM-000425,L1_STAGE,L1,4/1/26 0:00,,estimatedclosedate → 4/1/26 0:00
ITEM-000425,Update,statuscode,1,4,ACTOR-0002,5/1/26 9:54,2026-05-01T09:54:00Z,ITEM-000425,L1_STAGE,L1,Canceled,,statuscode → Canceled
ITEM-000425,Update,msdyn_forecastcategory,100000001,100000006,ACTOR-0002,5/1/26 9:54,2026-05-01T09:54:00Z,ITEM-000425,L1_STAGE,L1,100000006,,msdyn_forecastcategory → 100000006
ITEM-000425,Update,statecode,0,2,ACTOR-0002,5/1/26 9:54,2026-05-01T09:54:00Z,ITEM-000425,L1_STAGE,L1,Lost,,statecode → Lost
ITEM-000425,Update,actualclosedate,2/22/22 0:00,1/5/26 0:00,ACTOR-0002,5/1/26 9:54,2026-05-01T09:54:00Z,ITEM-000425,L1_STAGE,L1,1/5/26 0:00,,actualclosedate → 1/5/26 0:00
ITEM-000426,Update,owningbusinessunit,"businessunit,0a4ccfd6-e6d9-e611-80f2-5065f38aba91","businessunit,0a4ccfd6-e6d9-e611-80f2-5065f38aba91",ACTOR-0004,26/09/2025 09:21,2025-09-26T09:21:00Z,ITEM-000426,L3_ADMIN,L3,"businessunit,0a4ccfd6-e6d9-e611-80f2-5065f38aba91",,owningbusinessunit changed
ITEM-000426,Update,ownerid,"systemuser,1cba5fd4-6e4e-4e0f-85ff-a6438bc2f2f0","systemuser,b5f00e27-78b3-4a71-90af-5dcef3c25bba",ACTOR-0004,26/09/2025 09:21,2025-09-26T09:21:00Z,ITEM-000426,L3_ADMIN,L3,"systemuser,b5f00e27-78b3-4a71-90af-5dcef3c25bba",,Owner changed
ITEM-000427,Update,stepname,,14-Qualify,ACTOR-0008,14/10/2025 15:32,2025-10-14T15:32:00Z,ITEM-000427,L1_STAGE,L1,14-Qualify,14.0,stepname → 14-Qualify
ITEM-000427,Create,statecode,,0,ACTOR-0009,14/10/2025 15:32,2025-10-14T15:32:00Z,ITEM-000427,L1_STAGE,L1,Open,,Case Created
ITEM-000427,Update,statuscode,1,3,ACTOR-0009,14/10/2025 15:37,2025-10-14T15:37:00Z,ITEM-000427,L1_STAGE,L1,Won,,statuscode → Won
ITEM-000427,Update,msdyn_forecastcategory,100000001,100000005,ACTOR-0009,14/10/2025 15:37,2025-10-14T15:37:00Z,ITEM-000427,L1_STAGE,L1,100000005,,msdyn_forecastcategory → 100000005
ITEM-000427,Update,actualclosedate,,10/14/25 0:00,ACTOR-0009,14/10/2025 15:37,2025-10-14T15:37:00Z,ITEM-000427,L1_STAGE,L1,10/14/25 0:00,,actualclosedate → 10/14/25 0:00
ITEM-000427,Update,salesstage,,3,ACTOR-0009,14/10/2025 15:37,2025-10-14T15:37:00Z,ITEM-000427,L1_STAGE,L1,3,,salesstage → 3
ITEM-000427,Update,statecode,0,1,ACTOR-0009,14/10/2025 15:37,2025-10-14T15:37:00Z,ITEM-000427,L1_STAGE,L1,Won,,statecode → Won
ITEM-000427,Update,owningbusinessunit,"businessunit,0a4ccfd6-e6d9-e611-80f2-5065f38aba91","businessunit,0a4ccfd6-e6d9-e611-80f2-5065f38aba91",ACTOR-0003,27/10/2025 11:18,2025-10-27T11:18:00Z,ITEM-000427,L3_ADMIN,L3,"businessunit,0a4ccfd6-e6d9-e611-80f2-5065f38aba91",,owningbusinessunit changed
ITEM-000427,Update,ownerid,"systemuser,b5f00e27-78b3-4a71-90af-5dcef3c25bba","systemuser,efd3822d-8c8b-4619-8eb9-39ddf9c5c57f",ACTOR-0003,27/10/2025 11:18,2025-10-27T11:18:00Z,ITEM-000427,L3_ADMIN,L3,"systemuser,efd3822d-8c8b-4619-8eb9-39ddf9c5c57f",,Owner changed
ITEM-000428,Update,owningbusinessunit,"businessunit,0a4ccfd6-e6d9-e611-80f2-5065f38aba91","businessunit,0a4ccfd6-e6d9-e611-80f2-5065f38aba91",ACTOR-0004,26/09/2025 09:20,2025-09-26T09:20:00Z,ITEM-000428,L3_ADMIN,L3,"businessunit,0a4ccfd6-e6d9-e611-80f2-5065f38aba91",,owningbusinessunit changed
ITEM-000428,Update,ownerid,"systemuser,1cba5fd4-6e4e-4e0f-85ff-a6438bc2f2f0","systemuser,b5f00e27-78b3-4a71-90af-5dcef3c25bba",ACTOR-0004,26/09/2025 09:20,2025-09-26T09:20:00Z,ITEM-000428,L3_ADMIN,L3,"systemuser,b5f00e27-78b3-4a71-90af-5dcef3c25bba",,Owner changed
ITEM-000430,Update,owningbusinessunit,"businessunit,0a4ccfd6-e6d9-e611-80f2-5065f38aba91","businessunit,0a4ccfd6-e6d9-e611-80f2-5065f38aba91",ACTOR-0004,26/09/2025 09:20,2025-09-26T09:20:00Z,ITEM-000430,L3_ADMIN,L3,"businessunit,0a4ccfd6-e6d9-e611-80f2-5065f38aba91",,owningbusinessunit changed
ITEM-000430,Update,ownerid,"systemuser,1cba5fd4-6e4e-4e0f-85ff-a6438bc2f2f0","systemuser,b5f00e27-78b3-4a71-90af-5dcef3c25bba",ACTOR-0004,26/09/2025 09:20,2025-09-26T09:20:00Z,ITEM-000430,L3_ADMIN,L3,"systemuser,b5f00e27-78b3-4a71-90af-5dcef3c25bba",,Owner changed
ITEM-000431,Update,stepname,,14-Qualify,ACTOR-0008,28/01/2026 14:49,2026-01-28T14:49:00Z,ITEM-000431,L1_STAGE,L1,14-Qualify,14.0,stepname → 14-Qualify
ITEM-000431,Create,statecode,,0,ACTOR-0009,28/01/2026 14:49,2026-01-28T14:49:00Z,ITEM-000431,L1_STAGE,L1,Open,,Case Created
ITEM-000431,Update,estimatedclosedate,2/26/26 0:00,7/15/26 0:00,ACTOR-0009,28/01/2026 15:59,2026-01-28T15:59:00Z,ITEM-000431,L1_STAGE,L1,7/15/26 0:00,,estimatedclosedate → 7/15/26 0:00
ITEM-000432,Update,owningbusinessunit,"businessunit,0a4ccfd6-e6d9-e611-80f2-5065f38aba91","businessunit,0a4ccfd6-e6d9-e611-80f2-5065f38aba91",ACTOR-0002,7/10/25 10:46,2025-07-10T10:46:00Z,ITEM-000432,L3_ADMIN,L3,"businessunit,0a4ccfd6-e6d9-e611-80f2-5065f38aba91",,owningbusinessunit changed
ITEM-000432,Update,ownerid,"systemuser,7b9d5323-2ef3-4d52-9d6c-dd45deb05e3b","systemuser,efd3822d-8c8b-4619-8eb9-39ddf9c5c57f",ACTOR-0002,7/10/25 10:46,2025-07-10T10:46:00Z,ITEM-000432,L3_ADMIN,L3,"systemuser,efd3822d-8c8b-4619-8eb9-39ddf9c5c57f",,Owner changed
ITEM-000436,Update,owningbusinessunit,"businessunit,0a4ccfd6-e6d9-e611-80f2-5065f38aba91","businessunit,0a4ccfd6-e6d9-e611-80f2-5065f38aba91",ACTOR-0003,27/10/2025 11:18,2025-10-27T11:18:00Z,ITEM-000436,L3_ADMIN,L3,"businessunit,0a4ccfd6-e6d9-e611-80f2-5065f38aba91",,owningbusinessunit changed
ITEM-000436,Update,ownerid,"systemuser,2d7fbe83-3f35-4a1d-bc05-1b39dbf446d9","systemuser,efd3822d-8c8b-4619-8eb9-39ddf9c5c57f",ACTOR-0003,27/10/2025 11:18,2025-10-27T11:18:00Z,ITEM-000436,L3_ADMIN,L3,"systemuser,efd3822d-8c8b-4619-8eb9-39ddf9c5c57f",,Owner changed
ITEM-000437,Update,the000g_revenuetype,604720001,604720003,ACTOR-0009,14/08/2025 13:29,2025-08-14T13:29:00Z,ITEM-000437,L2_MILESTONE,L2,604720003,,the000g_revenuetype → 604720003
ITEM-000437,Update,statuscode,1,3,ACTOR-0009,14/08/2025 13:31,2025-08-14T13:31:00Z,ITEM-000437,L1_STAGE,L1,Won,,statuscode → Won
ITEM-000437,Update,msdyn_forecastcategory,100000001,100000005,ACTOR-0009,14/08/2025 13:31,2025-08-14T13:31:00Z,ITEM-000437,L1_STAGE,L1,100000005,,msdyn_forecastcategory → 100000005
ITEM-000437,Update,actualclosedate,,8/14/25 0:00,ACTOR-0009,14/08/2025 13:31,2025-08-14T13:31:00Z,ITEM-000437,L1_STAGE,L1,8/14/25 0:00,,actualclosedate → 8/14/25 0:00
ITEM-000437,Update,salesstage,,3,ACTOR-0009,14/08/2025 13:31,2025-08-14T13:31:00Z,ITEM-000437,L1_STAGE,L1,3,,salesstage → 3
ITEM-000437,Update,statecode,0,1,ACTOR-0009,14/08/2025 13:31,2025-08-14T13:31:00Z,ITEM-000437,L1_STAGE,L1,Won,,statecode → Won
ITEM-000437,Update,estimatedclosedate,8/27/25 0:00,8/14/25 0:00,ACTOR-0009,14/08/2025 13:31,2025-08-14T13:31:00Z,ITEM-000437,L1_STAGE,L1,8/14/25 0:00,,estimatedclosedate → 8/14/25 0:00
ITEM-000438,Update,stepname,,14-Qualify,ACTOR-0008,16/01/2026 12:46,2026-01-16T12:46:00Z,ITEM-000438,L1_STAGE,L1,14-Qualify,14.0,stepname → 14-Qualify
ITEM-000438,Create,statecode,,0,ACTOR-0002,16/01/2026 12:46,2026-01-16T12:46:00Z,ITEM-000438,L1_STAGE,L1,Open,,Case Created
ITEM-000439,Update,owningbusinessunit,"businessunit,0a4ccfd6-e6d9-e611-80f2-5065f38aba91","businessunit,0a4ccfd6-e6d9-e611-80f2-5065f38aba91",ACTOR-0002,7/10/25 10:45,2025-07-10T10:45:00Z,ITEM-000439,L3_ADMIN,L3,"businessunit,0a4ccfd6-e6d9-e611-80f2-5065f38aba91",,owningbusinessunit changed
ITEM-000439,Update,ownerid,"systemuser,7b9d5323-2ef3-4d52-9d6c-dd45deb05e3b","systemuser,efd3822d-8c8b-4619-8eb9-39ddf9c5c57f",ACTOR-0002,7/10/25 10:45,2025-07-10T10:45:00Z,ITEM-000439,L3_ADMIN,L3,"systemuser,efd3822d-8c8b-4619-8eb9-39ddf9c5c57f",,Owner changed
ITEM-000440,Update,owningbusinessunit,"businessunit,0a4ccfd6-e6d9-e611-80f2-5065f38aba91","businessunit,0a4ccfd6-e6d9-e611-80f2-5065f38aba91",ACTOR-0002,1/9/25 9:15,2025-01-09T09:15:00Z,ITEM-000440,L3_ADMIN,L3,"businessunit,0a4ccfd6-e6d9-e611-80f2-5065f38aba91",,owningbusinessunit changed
ITEM-000440,Update,ownerid,"systemuser,b5f00e27-78b3-4a71-90af-5dcef3c25bba","systemuser,efd3822d-8c8b-4619-8eb9-39ddf9c5c57f",ACTOR-0002,1/9/25 9:15,2025-01-09T09:15:00Z,ITEM-000440,L3_ADMIN,L3,"systemuser,efd3822d-8c8b-4619-8eb9-39ddf9c5c57f",,Owner changed
ITEM-000444,Update,owningbusinessunit,"businessunit,0a4ccfd6-e6d9-e611-80f2-5065f38aba91","businessunit,0a4ccfd6-e6d9-e611-80f2-5065f38aba91",ACTOR-0002,22/08/2025 13:23,2025-08-22T13:23:00Z,ITEM-000444,L3_ADMIN,L3,"businessunit,0a4ccfd6-e6d9-e611-80f2-5065f38aba91",,owningbusinessunit changed
ITEM-000444,Update,ownerid,"systemuser,7b9d5323-2ef3-4d52-9d6c-dd45deb05e3b","systemuser,efd3822d-8c8b-4619-8eb9-39ddf9c5c57f",ACTOR-0002,22/08/2025 13:23,2025-08-22T13:23:00Z,ITEM-000444,L3_ADMIN,L3,"systemuser,efd3822d-8c8b-4619-8eb9-39ddf9c5c57f",,Owner changed
ITEM-000445,Update,stepname,,14-Qualify,ACTOR-0008,6/10/25 10:01,2025-06-10T10:01:00Z,ITEM-000445,L1_STAGE,L1,14-Qualify,14.0,stepname → 14-Qualify
ITEM-000445,Create,statecode,,0,ACTOR-0009,6/10/25 10:01,2025-06-10T10:01:00Z,ITEM-000445,L1_STAGE,L1,Open,,Case Created
ITEM-000445,Update,closeprobability,,25,ACTOR-0003,5/1/26 15:54,2026-05-01T15:54:00Z,ITEM-000445,L1_STAGE,L1,25,,closeprobability → 25
ITEM-000445,Update,the000g__revenuetype,,604720002,ACTOR-0009,12/1/26 15:06,2026-12-01T15:06:00Z,ITEM-000445,L2_MILESTONE,L2,604720002,,the000g__revenuetype → 604720002
ITEM-000445,Update,estimatedclosedate,2/26/26 0:00,4/14/26 0:00,ACTOR-0009,12/1/26 15:06,2026-12-01T15:06:00Z,ITEM-000445,L1_STAGE,L1,4/14/26 0:00,,estimatedclosedate → 4/14/26 0:00
ITEM-000446,Update,estimatedclosedate,12/16/25 0:00,2/18/26 0:00,ACTOR-0002,8/12/25 10:25,2025-08-12T10:25:00Z,ITEM-000446,L1_STAGE,L1,2/18/26 0:00,,estimatedclosedate → 2/18/26 0:00
ITEM-000446,Update,stepname,,14-Qualify,ACTOR-0008,29/10/2025 06:54,2025-10-29T06:54:00Z,ITEM-000446,L1_STAGE,L1,14-Qualify,14.0,stepname → 14-Qualify
ITEM-000446,Create,purchaseprocess,,0,ACTOR-0002,29/10/2025 06:54,2025-10-29T06:54:00Z,ITEM-000446,L2_MILESTONE,L2,0,,Case Created
ITEM-000446,Update,the000g__revenuetype,,604720002,ACTOR-0002,5/1/26 17:07,2026-05-01T17:07:00Z,ITEM-000446,L2_MILESTONE,L2,604720002,,the000g__revenuetype → 604720002
ITEM-000446,Update,new_contracttermmonths,,12,ACTOR-0002,12/1/26 15:51,2026-12-01T15:51:00Z,ITEM-000446,L2_MILESTONE,L2,12,,new_contracttermmonths → 12
ITEM-000446,Update,estimatedclosedate,2/18/26 0:00,3/31/26 0:00,ACTOR-0002,12/1/26 15:51,2026-12-01T15:51:00Z,ITEM-000446,L1_STAGE,L1,3/31/26 0:00,,estimatedclosedate → 3/31/26 0:00
ITEM-000447,Update,owningbusinessunit,"businessunit,0a4ccfd6-e6d9-e611-80f2-5065f38aba91","businessunit,0a4ccfd6-e6d9-e611-80f2-5065f38aba91",ACTOR-0002,7/10/25 10:46,2025-07-10T10:46:00Z,ITEM-000447,L3_ADMIN,L3,"businessunit,0a4ccfd6-e6d9-e611-80f2-5065f38aba91",,owningbusinessunit changed
ITEM-000447,Update,ownerid,"systemuser,7b9d5323-2ef3-4d52-9d6c-dd45deb05e3b","systemuser,efd3822d-8c8b-4619-8eb9-39ddf9c5c57f",ACTOR-0002,7/10/25 10:46,2025-07-10T10:46:00Z,ITEM-000447,L3_ADMIN,L3,"systemuser,efd3822d-8c8b-4619-8eb9-39ddf9c5c57f",,Owner changed
ITEM-000449,Update,stepname,,14-Qualify,ACTOR-0008,12/11/25 10:57,2025-12-11T10:57:00Z,ITEM-000449,L1_STAGE,L1,14-Qualify,14.0,stepname → 14-Qualify
ITEM-000449,Create,statecode,,0,ACTOR-0002,12/11/25 10:57,2025-12-11T10:57:00Z,ITEM-000449,L1_STAGE,L1,Open,,Case Created
ITEM-000450,Update,stepname,,14-Qualify,ACTOR-0008,16/10/2025 13:35,2025-10-16T13:35:00Z,ITEM-000450,L1_STAGE,L1,14-Qualify,14.0,stepname → 14-Qualify
ITEM-000450,Create,purchasetimeframe,,0,ACTOR-0003,16/10/2025 13:35,2025-10-16T13:35:00Z,ITEM-000450,L2_MILESTONE,L2,0,,Case Created
ITEM-000450,Update,stepname,14-Qualify,15-Develop,ACTOR-0008,29/10/2025 16:28,2025-10-29T16:28:00Z,ITEM-000450,L1_STAGE,L1,15-Develop,15.0,stepname → 15-Develop
ITEM-000450,Update,stepname,15-Develop,16-Propose,ACTOR-0008,29/10/2025 16:28,2025-10-29T16:28:00Z,ITEM-000450,L1_STAGE,L1,16-Propose,16.0,stepname → 16-Propose
ITEM-000450,Update,stepname,16-Propose,17-Close,ACTOR-0008,29/10/2025 16:28,2025-10-29T16:28:00Z,ITEM-000450,L1_STAGE,L1,17-Close,17.0,stepname → 17-Close
ITEM-000450,Update,statuscode,1,4,ACTOR-0002,29/10/2025 16:29,2025-10-29T16:29:00Z,ITEM-000450,L1_STAGE,L1,Canceled,,statuscode → Canceled
ITEM-000450,Update,msdyn_forecastcategory,100000001,100000006,ACTOR-0002,29/10/2025 16:29,2025-10-29T16:29:00Z,ITEM-000450,L1_STAGE,L1,100000006,,msdyn_forecastcategory → 100000006
ITEM-000450,Update,actualclosedate,,10/29/25 0:00,ACTOR-0002,29/10/2025 16:29,2025-10-29T16:29:00Z,ITEM-000450,L1_STAGE,L1,10/29/25 0:00,,actualclosedate → 10/29/25 0:00
ITEM-000450,Update,salesstage,,3,ACTOR-0002,29/10/2025 16:29,2025-10-29T16:29:00Z,ITEM-000450,L1_STAGE,L1,3,,salesstage → 3
ITEM-000450,Update,statecode,0,2,ACTOR-0002,29/10/2025 16:29,2025-10-29T16:29:00Z,ITEM-000450,L1_STAGE,L1,Lost,,statecode → Lost
ITEM-000451,Update,stepname,,14-Qualify,ACTOR-0008,1/10/25 15:07,2025-01-10T15:07:00Z,ITEM-000451,L1_STAGE,L1,14-Qualify,14.0,stepname → 14-Qualify
ITEM-000451,Create,statecode,,0,ACTOR-0002,1/10/25 15:07,2025-01-10T15:07:00Z,ITEM-000451,L1_STAGE,L1,Open,,Case Created
ITEM-000452,Update,statuscode,1,4,ACTOR-0009,6/10/25 9:58,2025-06-10T09:58:00Z,ITEM-000452,L1_STAGE,L1,Canceled,,statuscode → Canceled
ITEM-000452,Update,msdyn_forecastcategory,100000001,100000006,ACTOR-0009,6/10/25 9:58,2025-06-10T09:58:00Z,ITEM-000452,L1_STAGE,L1,100000006,,msdyn_forecastcategory → 100000006
ITEM-000452,Update,actualclosedate,,10/6/25 0:00,ACTOR-0009,6/10/25 9:58,2025-06-10T09:58:00Z,ITEM-000452,L1_STAGE,L1,10/6/25 0:00,,actualclosedate → 10/6/25 0:00
ITEM-000452,Update,salesstage,,3,ACTOR-0009,6/10/25 9:58,2025-06-10T09:58:00Z,ITEM-000452,L1_STAGE,L1,3,,salesstage → 3
ITEM-000452,Update,statecode,0,2,ACTOR-0009,6/10/25 9:58,2025-06-10T09:58:00Z,ITEM-000452,L1_STAGE,L1,Lost,,statecode → Lost
ITEM-000453,Update,statuscode,1,4,ACTOR-0003,29/08/2025 07:05,2025-08-29T07:05:00Z,ITEM-000453,L1_STAGE,L1,Canceled,,statuscode → Canceled
ITEM-000453,Update,msdyn_forecastcategory,100000001,100000006,ACTOR-0003,29/08/2025 07:05,2025-08-29T07:05:00Z,ITEM-000453,L1_STAGE,L1,100000006,,msdyn_forecastcategory → 100000006
ITEM-000453,Update,actualclosedate,,8/29/25 0:00,ACTOR-0003,29/08/2025 07:05,2025-08-29T07:05:00Z,ITEM-000453,L1_STAGE,L1,8/29/25 0:00,,actualclosedate → 8/29/25 0:00
ITEM-000453,Update,salesstage,,3,ACTOR-0003,29/08/2025 07:05,2025-08-29T07:05:00Z,ITEM-000453,L1_STAGE,L1,3,,salesstage → 3
ITEM-000453,Update,statecode,0,2,ACTOR-0003,29/08/2025 07:05,2025-08-29T07:05:00Z,ITEM-000453,L1_STAGE,L1,Lost,,statecode → Lost
ITEM-000454,Update,the000g_revenuetype,,604720001,ACTOR-0009,6/10/25 9:57,2025-06-10T09:57:00Z,ITEM-000454,L2_MILESTONE,L2,604720001,,the000g_revenuetype → 604720001
ITEM-000454,Update,the000g_isrenewal,,FALSE,ACTOR-0009,6/10/25 9:57,2025-06-10T09:57:00Z,ITEM-000454,L3_ADMIN,L3,FALSE,,the000g_isrenewal changed
ITEM-000454,Update,estimatedclosedate,12/17/25 0:00,4/15/26 0:00,ACTOR-0009,29/10/2025 09:27,2025-10-29T09:27:00Z,ITEM-000454,L1_STAGE,L1,4/15/26 0:00,,estimatedclosedate → 4/15/26 0:00
ITEM-000456,Update,owningbusinessunit,"businessunit,0a4ccfd6-e6d9-e611-80f2-5065f38aba91","businessunit,0a4ccfd6-e6d9-e611-80f2-5065f38aba91",ACTOR-0002,1/9/25 9:16,2025-01-09T09:16:00Z,ITEM-000456,L3_ADMIN,L3,"businessunit,0a4ccfd6-e6d9-e611-80f2-5065f38aba91",,owningbusinessunit changed
ITEM-000456,Update,ownerid,"systemuser,b5f00e27-78b3-4a71-90af-5dcef3c25bba","systemuser,efd3822d-8c8b-4619-8eb9-39ddf9c5c57f",ACTOR-0002,1/9/25 9:16,2025-01-09T09:16:00Z,ITEM-000456,L3_ADMIN,L3,"systemuser,efd3822d-8c8b-4619-8eb9-39ddf9c5c57f",,Owner changed
ITEM-000457,Update,owningbusinessunit,"businessunit,0a4ccfd6-e6d9-e611-80f2-5065f38aba91","businessunit,0a4ccfd6-e6d9-e611-80f2-5065f38aba91",ACTOR-0002,22/08/2025 13:23,2025-08-22T13:23:00Z,ITEM-000457,L3_ADMIN,L3,"businessunit,0a4ccfd6-e6d9-e611-80f2-5065f38aba91",,owningbusinessunit changed
ITEM-000457,Update,ownerid,"systemuser,7b9d5323-2ef3-4d52-9d6c-dd45deb05e3b","systemuser,efd3822d-8c8b-4619-8eb9-39ddf9c5c57f",ACTOR-0002,22/08/2025 13:23,2025-08-22T13:23:00Z,ITEM-000457,L3_ADMIN,L3,"systemuser,efd3822d-8c8b-4619-8eb9-39ddf9c5c57f",,Owner changed
ITEM-000460,Update,stepname,,14-Qualify,ACTOR-0008,13/01/2026 10:37,2026-01-13T10:37:00Z,ITEM-000460,L1_STAGE,L1,14-Qualify,14.0,stepname → 14-Qualify
ITEM-000460,Create,statecode,,0,ACTOR-0009,13/01/2026 10:37,2026-01-13T10:37:00Z,ITEM-000460,L1_STAGE,L1,Open,,Case Created
ITEM-000463,Update,owningbusinessunit,"businessunit,0a4ccfd6-e6d9-e611-80f2-5065f38aba91","businessunit,0a4ccfd6-e6d9-e611-80f2-5065f38aba91",ACTOR-0002,7/10/25 10:45,2025-07-10T10:45:00Z,ITEM-000463,L3_ADMIN,L3,"businessunit,0a4ccfd6-e6d9-e611-80f2-5065f38aba91",,owningbusinessunit changed
ITEM-000463,Update,ownerid,"systemuser,7b9d5323-2ef3-4d52-9d6c-dd45deb05e3b","systemuser,efd3822d-8c8b-4619-8eb9-39ddf9c5c57f",ACTOR-0002,7/10/25 10:45,2025-07-10T10:45:00Z,ITEM-000463,L3_ADMIN,L3,"systemuser,efd3822d-8c8b-4619-8eb9-39ddf9c5c57f",,Owner changed
ITEM-000464,Create,statecode,,0,ACTOR-0009,11/11/25 9:14,2025-11-11T09:14:00Z,ITEM-000464,L1_STAGE,L1,Open,,Case Created
ITEM-000464,Update,stepname,,14-Qualify,ACTOR-0008,11/11/25 9:15,2025-11-11T09:15:00Z,ITEM-000464,L1_STAGE,L1,14-Qualify,14.0,stepname → 14-Qualify
ITEM-000464,Update,closeprobability,,25,ACTOR-0003,5/1/26 15:54,2026-05-01T15:54:00Z,ITEM-000464,L1_STAGE,L1,25,,closeprobability → 25
ITEM-000465,Update,stepname,,14-Qualify,ACTOR-0008,14/08/2025 10:39,2025-08-14T10:39:00Z,ITEM-000465,L1_STAGE,L1,14-Qualify,14.0,stepname → 14-Qualify
ITEM-000465,Create,statecode,,0,ACTOR-0009,14/08/2025 10:39,2025-08-14T10:39:00Z,ITEM-000465,L1_STAGE,L1,Open,,Case Created
ITEM-000465,Update,statuscode,1,3,ACTOR-0009,15/08/2025 10:05,2025-08-15T10:05:00Z,ITEM-000465,L1_STAGE,L1,Won,,statuscode → Won
ITEM-000465,Update,msdyn_forecastcategory,100000001,100000005,ACTOR-0009,15/08/2025 10:05,2025-08-15T10:05:00Z,ITEM-000465,L1_STAGE,L1,100000005,,msdyn_forecastcategory → 100000005
ITEM-000465,Update,actualclosedate,,8/12/25 0:00,ACTOR-0009,15/08/2025 10:05,2025-08-15T10:05:00Z,ITEM-000465,L1_STAGE,L1,8/12/25 0:00,,actualclosedate → 8/12/25 0:00
ITEM-000465,Update,salesstage,,3,ACTOR-0009,15/08/2025 10:05,2025-08-15T10:05:00Z,ITEM-000465,L1_STAGE,L1,3,,salesstage → 3
ITEM-000465,Update,statecode,0,1,ACTOR-0009,15/08/2025 10:05,2025-08-15T10:05:00Z,ITEM-000465,L1_STAGE,L1,Won,,statecode → Won
ITEM-000469,Update,the000g_revenuetype,,604720001,ACTOR-0003,29/08/2025 07:08,2025-08-29T07:08:00Z,ITEM-000469,L2_MILESTONE,L2,604720001,,the000g_revenuetype → 604720001
ITEM-000469,Update,the000g_isrenewal,,FALSE,ACTOR-0003,29/08/2025 07:08,2025-08-29T07:08:00Z,ITEM-000469,L3_ADMIN,L3,FALSE,,the000g_isrenewal changed
ITEM-000469,Update,new_contracttermmonths,3,1,ACTOR-0003,29/08/2025 07:08,2025-08-29T07:08:00Z,ITEM-000469,L2_MILESTONE,L2,1,,new_contracttermmonths → 1
ITEM-000469,Update,statuscode,1,3,ACTOR-0003,29/08/2025 08:38,2025-08-29T08:38:00Z,ITEM-000469,L1_STAGE,L1,Won,,statuscode → Won
ITEM-000469,Update,msdyn_forecastcategory,100000001,100000005,ACTOR-0003,29/08/2025 08:38,2025-08-29T08:38:00Z,ITEM-000469,L1_STAGE,L1,100000005,,msdyn_forecastcategory → 100000005
ITEM-000469,Update,actualclosedate,,8/25/25 0:00,ACTOR-0003,29/08/2025 08:38,2025-08-29T08:38:00Z,ITEM-000469,L1_STAGE,L1,8/25/25 0:00,,actualclosedate → 8/25/25 0:00
ITEM-000469,Update,salesstage,,3,ACTOR-0003,29/08/2025 08:38,2025-08-29T08:38:00Z,ITEM-000469,L1_STAGE,L1,3,,salesstage → 3
ITEM-000469,Update,statecode,0,1,ACTOR-0003,29/08/2025 08:38,2025-08-29T08:38:00Z,ITEM-000469,L1_STAGE,L1,Won,,statecode → Won
ITEM-000471,Update,stepname,,14-Qualify,ACTOR-0008,16/12/2025 17:00,2025-12-16T17:00:00Z,ITEM-000471,L1_STAGE,L1,14-Qualify,14.0,stepname → 14-Qualify
ITEM-000471,Create,purchaseprocess,,0,ACTOR-0003,16/12/2025 17:00,2025-12-16T17:00:00Z,ITEM-000471,L2_MILESTONE,L2,0,,Case Created
ITEM-000471,Update,the000g__revenuetype,,604720002,ACTOR-0003,17/12/2025 20:36,2025-12-17T20:36:00Z,ITEM-000471,L2_MILESTONE,L2,604720002,,the000g__revenuetype → 604720002
ITEM-000471,Update,statuscode,1,3,ACTOR-0003,2/1/26 9:58,2026-02-01T09:58:00Z,ITEM-000471,L1_STAGE,L1,Won,,statuscode → Won
ITEM-000471,Update,msdyn_forecastcategory,100000001,100000005,ACTOR-0003,2/1/26 9:58,2026-02-01T09:58:00Z,ITEM-000471,L1_STAGE,L1,100000005,,msdyn_forecastcategory → 100000005
ITEM-000471,Update,actualclosedate,,1/2/26 0:00,ACTOR-0003,2/1/26 9:58,2026-02-01T09:58:00Z,ITEM-000471,L1_STAGE,L1,1/2/26 0:00,,actualclosedate → 1/2/26 0:00
ITEM-000471,Update,salesstage,,3,ACTOR-0003,2/1/26 9:58,2026-02-01T09:58:00Z,ITEM-000471,L1_STAGE,L1,3,,salesstage → 3
ITEM-000471,Update,statecode,0,1,ACTOR-0003,2/1/26 9:58,2026-02-01T09:58:00Z,ITEM-000471,L1_STAGE,L1,Won,,statecode → Won
ITEM-000472,Update,stepname,16-Propose,14-Qualify,ACTOR-0002,28/10/2025 17:16,2025-10-28T17:16:00Z,ITEM-000472,L1_STAGE,L1,14-Qualify,14.0,stepname → 14-Qualify
ITEM-000472,Create,purchaseprocess,,0,ACTOR-0002,28/10/2025 17:16,2025-10-28T17:16:00Z,ITEM-000472,L2_MILESTONE,L2,0,,Case Created
ITEM-000472,Update,closeprobability,75,25,ACTOR-0002,28/10/2025 17:18,2025-10-28T17:18:00Z,ITEM-000472,L1_STAGE,L1,25,,closeprobability → 25
ITEM-000472,Update,estimatedclosedate,10/30/25 0:00,6/25/26 0:00,ACTOR-0002,28/10/2025 17:18,2025-10-28T17:18:00Z,ITEM-000472,L1_STAGE,L1,6/25/26 0:00,,estimatedclosedate → 6/25/26 0:00
ITEM-000472,Update,the000g_isrenewal,TRUE,FALSE,ACTOR-0002,28/10/2025 17:18,2025-10-28T17:18:00Z,ITEM-000472,L3_ADMIN,L3,FALSE,,the000g_isrenewal changed
ITEM-000472,Update,the000g__revenuetype,,604720003,ACTOR-0002,12/1/26 15:57,2026-12-01T15:57:00Z,ITEM-000472,L2_MILESTONE,L2,604720003,,the000g__revenuetype → 604720003
ITEM-000472,Update,msdyn_forecastcategory,100000001,100000002,ACTOR-0002,12/1/26 15:57,2026-12-01T15:57:00Z,ITEM-000472,L1_STAGE,L1,100000002,,msdyn_forecastcategory → 100000002
ITEM-000472,Update,closeprobability,25,50,ACTOR-0002,12/1/26 15:57,2026-12-01T15:57:00Z,ITEM-000472,L1_STAGE,L1,50,,closeprobability → 50
ITEM-000474,Update,stepname,,14-Qualify,ACTOR-0008,27/10/2025 12:39,2025-10-27T12:39:00Z,ITEM-000474,L1_STAGE,L1,14-Qualify,14.0,stepname → 14-Qualify
ITEM-000474,Create,statecode,,0,ACTOR-0003,27/10/2025 12:39,2025-10-27T12:39:00Z,ITEM-000474,L1_STAGE,L1,Open,,Case Created
ITEM-000474,Update,statuscode,1,3,ACTOR-0003,24/11/2025 13:39,2025-11-24T13:39:00Z,ITEM-000474,L1_STAGE,L1,Won,,statuscode → Won
ITEM-000474,Update,msdyn_forecastcategory,100000001,100000005,ACTOR-0003,24/11/2025 13:39,2025-11-24T13:39:00Z,ITEM-000474,L1_STAGE,L1,100000005,,msdyn_forecastcategory → 100000005
ITEM-000474,Update,actualclosedate,,11/24/25 0:00,ACTOR-0003,24/11/2025 13:39,2025-11-24T13:39:00Z,ITEM-000474,L1_STAGE,L1,11/24/25 0:00,,actualclosedate → 11/24/25 0:00
ITEM-000474,Update,salesstage,,3,ACTOR-0003,24/11/2025 13:39,2025-11-24T13:39:00Z,ITEM-000474,L1_STAGE,L1,3,,salesstage → 3
ITEM-000474,Update,statecode,0,1,ACTOR-0003,24/11/2025 13:39,2025-11-24T13:39:00Z,ITEM-000474,L1_STAGE,L1,Won,,statecode → Won
ITEM-000475,Update,the000g_isrenewal,,FALSE,ACTOR-0003,11/8/25 8:16,2025-11-08T08:16:00Z,ITEM-000475,L3_ADMIN,L3,FALSE,,the000g_isrenewal changed
ITEM-000475,Update,statuscode,1,3,ACTOR-0003,11/8/25 8:49,2025-11-08T08:49:00Z,ITEM-000475,L1_STAGE,L1,Won,,statuscode → Won
ITEM-000475,Update,msdyn_forecastcategory,100000001,100000005,ACTOR-0003,11/8/25 8:49,2025-11-08T08:49:00Z,ITEM-000475,L1_STAGE,L1,100000005,,msdyn_forecastcategory → 100000005
ITEM-000475,Update,actualclosedate,,8/8/25 0:00,ACTOR-0003,11/8/25 8:49,2025-11-08T08:49:00Z,ITEM-000475,L1_STAGE,L1,8/8/25 0:00,,actualclosedate → 8/8/25 0:00
ITEM-000475,Update,salesstage,,3,ACTOR-0003,11/8/25 8:49,2025-11-08T08:49:00Z,ITEM-000475,L1_STAGE,L1,3,,salesstage → 3
ITEM-000475,Update,statecode,0,1,ACTOR-0003,11/8/25 8:49,2025-11-08T08:49:00Z,ITEM-000475,L1_STAGE,L1,Won,,statecode → Won
ITEM-000476,Update,the000g_revenuetype,,604720001,ACTOR-0003,17/08/2025 13:01,2025-08-17T13:01:00Z,ITEM-000476,L2_MILESTONE,L2,604720001,,the000g_revenuetype → 604720001
ITEM-000476,Update,owningbusinessunit,"businessunit,0a4ccfd6-e6d9-e611-80f2-5065f38aba91","businessunit,0a4ccfd6-e6d9-e611-80f2-5065f38aba91",ACTOR-0004,26/09/2025 09:21,2025-09-26T09:21:00Z,ITEM-000476,L3_ADMIN,L3,"businessunit,0a4ccfd6-e6d9-e611-80f2-5065f38aba91",,owningbusinessunit changed
ITEM-000476,Update,ownerid,"systemuser,09f34b91-4d86-4fc8-8b41-8af3d91e94bf","systemuser,b5f00e27-78b3-4a71-90af-5dcef3c25bba",ACTOR-0004,26/09/2025 09:21,2025-09-26T09:21:00Z,ITEM-000476,L3_ADMIN,L3,"systemuser,b5f00e27-78b3-4a71-90af-5dcef3c25bba",,Owner changed
ITEM-000478,Update,stepname,,14-Qualify,ACTOR-0008,28/08/2025 13:43,2025-08-28T13:43:00Z,ITEM-000478,L1_STAGE,L1,14-Qualify,14.0,stepname → 14-Qualify
ITEM-000478,Create,statecode,,0,ACTOR-0002,28/08/2025 13:43,2025-08-28T13:43:00Z,ITEM-000478,L1_STAGE,L1,Open,,Case Created
ITEM-000478,Update,purchaseprocess,,0,ACTOR-0002,19/01/2026 10:16,2026-01-19T10:16:00Z,ITEM-000478,L2_MILESTONE,L2,0,,purchaseprocess → 0
ITEM-000478,Update,purchasetimeframe,,2,ACTOR-0002,19/01/2026 10:16,2026-01-19T10:16:00Z,ITEM-000478,L2_MILESTONE,L2,2,,purchasetimeframe → 2
ITEM-000478,Update,the000g__revenuetype,,604720002,ACTOR-0002,19/01/2026 10:16,2026-01-19T10:16:00Z,ITEM-000478,L2_MILESTONE,L2,604720002,,the000g__revenuetype → 604720002
ITEM-000478,Update,estimatedclosedate,2/26/26 0:00,3/30/26 0:00,ACTOR-0002,19/01/2026 10:17,2026-01-19T10:17:00Z,ITEM-000478,L1_STAGE,L1,3/30/26 0:00,,estimatedclosedate → 3/30/26 0:00
ITEM-000478,Update,closeprobability,,50,ACTOR-0003,5/1/26 16:36,2026-05-01T16:36:00Z,ITEM-000478,L1_STAGE,L1,50,,closeprobability → 50
ITEM-000479,Update,owningbusinessunit,"businessunit,0a4ccfd6-e6d9-e611-80f2-5065f38aba91","businessunit,0a4ccfd6-e6d9-e611-80f2-5065f38aba91",ACTOR-0002,8/1/26 9:40,2026-08-01T09:40:00Z,ITEM-000479,L3_ADMIN,L3,"businessunit,0a4ccfd6-e6d9-e611-80f2-5065f38aba91",,owningbusinessunit changed
ITEM-000479,Update,ownerid,"systemuser,7b9d5323-2ef3-4d52-9d6c-dd45deb05e3b","systemuser,efd3822d-8c8b-4619-8eb9-39ddf9c5c57f",ACTOR-0002,8/1/26 9:40,2026-08-01T09:40:00Z,ITEM-000479,L3_ADMIN,L3,"systemuser,efd3822d-8c8b-4619-8eb9-39ddf9c5c57f",,Owner changed
ITEM-000480,Update,owningbusinessunit,"businessunit,0a4ccfd6-e6d9-e611-80f2-5065f38aba91","businessunit,0a4ccfd6-e6d9-e611-80f2-5065f38aba91",ACTOR-0003,26/08/2025 07:43,2025-08-26T07:43:00Z,ITEM-000480,L3_ADMIN,L3,"businessunit,0a4ccfd6-e6d9-e611-80f2-5065f38aba91",,owningbusinessunit changed
ITEM-000480,Update,ownerid,"systemuser,b5f00e27-78b3-4a71-90af-5dcef3c25bba","systemuser,efd3822d-8c8b-4619-8eb9-39ddf9c5c57f",ACTOR-0003,26/08/2025 07:43,2025-08-26T07:43:00Z,ITEM-000480,L3_ADMIN,L3,"systemuser,efd3822d-8c8b-4619-8eb9-39ddf9c5c57f",,Owner changed
ITEM-000482,Update,owningbusinessunit,"businessunit,0a4ccfd6-e6d9-e611-80f2-5065f38aba91","businessunit,0a4ccfd6-e6d9-e611-80f2-5065f38aba91",ACTOR-0004,26/09/2025 09:21,2025-09-26T09:21:00Z,ITEM-000482,L3_ADMIN,L3,"businessunit,0a4ccfd6-e6d9-e611-80f2-5065f38aba91",,owningbusinessunit changed
ITEM-000482,Update,ownerid,"systemuser,1cba5fd4-6e4e-4e0f-85ff-a6438bc2f2f0","systemuser,b5f00e27-78b3-4a71-90af-5dcef3c25bba",ACTOR-0004,26/09/2025 09:21,2025-09-26T09:21:00Z,ITEM-000482,L3_ADMIN,L3,"systemuser,b5f00e27-78b3-4a71-90af-5dcef3c25bba",,Owner changed
ITEM-000483,Update,owningbusinessunit,"businessunit,0a4ccfd6-e6d9-e611-80f2-5065f38aba91","businessunit,0a4ccfd6-e6d9-e611-80f2-5065f38aba91",ACTOR-0004,26/09/2025 09:20,2025-09-26T09:20:00Z,ITEM-000483,L3_ADMIN,L3,"businessunit,0a4ccfd6-e6d9-e611-80f2-5065f38aba91",,owningbusinessunit changed
ITEM-000483,Update,ownerid,"systemuser,1cba5fd4-6e4e-4e0f-85ff-a6438bc2f2f0","systemuser,b5f00e27-78b3-4a71-90af-5dcef3c25bba",ACTOR-0004,26/09/2025 09:20,2025-09-26T09:20:00Z,ITEM-000483,L3_ADMIN,L3,"systemuser,b5f00e27-78b3-4a71-90af-5dcef3c25bba",,Owner changed
ITEM-000485,Update,owningbusinessunit,"businessunit,0a4ccfd6-e6d9-e611-80f2-5065f38aba91","businessunit,0a4ccfd6-e6d9-e611-80f2-5065f38aba91",ACTOR-0003,27/10/2025 11:18,2025-10-27T11:18:00Z,ITEM-000485,L3_ADMIN,L3,"businessunit,0a4ccfd6-e6d9-e611-80f2-5065f38aba91",,owningbusinessunit changed
ITEM-000485,Update,ownerid,"systemuser,2d7fbe83-3f35-4a1d-bc05-1b39dbf446d9","systemuser,efd3822d-8c8b-4619-8eb9-39ddf9c5c57f",ACTOR-0003,27/10/2025 11:18,2025-10-27T11:18:00Z,ITEM-000485,L3_ADMIN,L3,"systemuser,efd3822d-8c8b-4619-8eb9-39ddf9c5c57f",,Owner changed
ITEM-000486,Update,stepname,,14-Qualify,ACTOR-0008,5/1/26 14:28,2026-05-01T14:28:00Z,ITEM-000486,L1_STAGE,L1,14-Qualify,14.0,stepname → 14-Qualify
ITEM-000486,Create,statecode,,0,ACTOR-0002,5/1/26 14:28,2026-05-01T14:28:00Z,ITEM-000486,L1_STAGE,L1,Open,,Case Created
ITEM-000487,Update,owningbusinessunit,"businessunit,0a4ccfd6-e6d9-e611-80f2-5065f38aba91","businessunit,0a4ccfd6-e6d9-e611-80f2-5065f38aba91",ACTOR-0003,27/10/2025 11:18,2025-10-27T11:18:00Z,ITEM-000487,L3_ADMIN,L3,"businessunit,0a4ccfd6-e6d9-e611-80f2-5065f38aba91",,owningbusinessunit changed
ITEM-000487,Update,ownerid,"systemuser,2d7fbe83-3f35-4a1d-bc05-1b39dbf446d9","systemuser,efd3822d-8c8b-4619-8eb9-39ddf9c5c57f",ACTOR-0003,27/10/2025 11:18,2025-10-27T11:18:00Z,ITEM-000487,L3_ADMIN,L3,"systemuser,efd3822d-8c8b-4619-8eb9-39ddf9c5c57f",,Owner changed
ITEM-000490,Update,stepname,,14-Qualify,ACTOR-0008,15/12/2025 15:13,2025-12-15T15:13:00Z,ITEM-000490,L1_STAGE,L1,14-Qualify,14.0,stepname → 14-Qualify
ITEM-000490,Create,statecode,,0,ACTOR-0003,15/12/2025 15:13,2025-12-15T15:13:00Z,ITEM-000490,L1_STAGE,L1,Open,,Case Created
ITEM-000490,Update,the000g__revenuetype,,604720002,ACTOR-0003,18/12/2025 09:19,2025-12-18T09:19:00Z,ITEM-000490,L2_MILESTONE,L2,604720002,,the000g__revenuetype → 604720002
ITEM-000490,Update,statuscode,1,3,ACTOR-0003,5/1/26 14:13,2026-05-01T14:13:00Z,ITEM-000490,L1_STAGE,L1,Won,,statuscode → Won
ITEM-000490,Update,msdyn_forecastcategory,100000001,100000005,ACTOR-0003,5/1/26 14:13,2026-05-01T14:13:00Z,ITEM-000490,L1_STAGE,L1,100000005,,msdyn_forecastcategory → 100000005
ITEM-000490,Update,actualclosedate,,1/5/26 0:00,ACTOR-0003,5/1/26 14:13,2026-05-01T14:13:00Z,ITEM-000490,L1_STAGE,L1,1/5/26 0:00,,actualclosedate → 1/5/26 0:00
ITEM-000490,Update,salesstage,,3,ACTOR-0003,5/1/26 14:13,2026-05-01T14:13:00Z,ITEM-000490,L1_STAGE,L1,3,,salesstage → 3
ITEM-000490,Update,statecode,0,1,ACTOR-0003,5/1/26 14:13,2026-05-01T14:13:00Z,ITEM-000490,L1_STAGE,L1,Won,,statecode → Won
ITEM-000491,Update,stepname,,14-Qualify,ACTOR-0008,13/01/2026 07:36,2026-01-13T07:36:00Z,ITEM-000491,L1_STAGE,L1,14-Qualify,14.0,stepname → 14-Qualify
ITEM-000491,Create,statecode,,0,ACTOR-0005,13/01/2026 07:36,2026-01-13T07:36:00Z,ITEM-000491,L1_STAGE,L1,Open,,Case Created
ITEM-000492,Update,owningbusinessunit,"businessunit,0a4ccfd6-e6d9-e611-80f2-5065f38aba91","businessunit,0a4ccfd6-e6d9-e611-80f2-5065f38aba91",ACTOR-0002,7/10/25 10:45,2025-07-10T10:45:00Z,ITEM-000492,L3_ADMIN,L3,"businessunit,0a4ccfd6-e6d9-e611-80f2-5065f38aba91",,owningbusinessunit changed
ITEM-000492,Update,ownerid,"systemuser,7b9d5323-2ef3-4d52-9d6c-dd45deb05e3b","systemuser,efd3822d-8c8b-4619-8eb9-39ddf9c5c57f",ACTOR-0002,7/10/25 10:45,2025-07-10T10:45:00Z,ITEM-000492,L3_ADMIN,L3,"systemuser,efd3822d-8c8b-4619-8eb9-39ddf9c5c57f",,Owner changed
ITEM-000493,Update,statuscode,1,4,ACTOR-0003,6/10/25 14:32,2025-06-10T14:32:00Z,ITEM-000493,L1_STAGE,L1,Canceled,,statuscode → Canceled
ITEM-000493,Update,msdyn_forecastcategory,100000001,100000006,ACTOR-0003,6/10/25 14:32,2025-06-10T14:32:00Z,ITEM-000493,L1_STAGE,L1,100000006,,msdyn_forecastcategory → 100000006
ITEM-000493,Update,actualclosedate,,10/6/25 0:00,ACTOR-0003,6/10/25 14:32,2025-06-10T14:32:00Z,ITEM-000493,L1_STAGE,L1,10/6/25 0:00,,actualclosedate → 10/6/25 0:00
ITEM-000493,Update,salesstage,,3,ACTOR-0003,6/10/25 14:32,2025-06-10T14:32:00Z,ITEM-000493,L1_STAGE,L1,3,,salesstage → 3
ITEM-000493,Update,statecode,0,2,ACTOR-0003,6/10/25 14:32,2025-06-10T14:32:00Z,ITEM-000493,L1_STAGE,L1,Lost,,statecode → Lost
ITEM-000494,Update,owningbusinessunit,"businessunit,0a4ccfd6-e6d9-e611-80f2-5065f38aba91","businessunit,0a4ccfd6-e6d9-e611-80f2-5065f38aba91",ACTOR-0004,26/09/2025 09:20,2025-09-26T09:20:00Z,ITEM-000494,L3_ADMIN,L3,"businessunit,0a4ccfd6-e6d9-e611-80f2-5065f38aba91",,owningbusinessunit changed
ITEM-000494,Update,ownerid,"systemuser,1cba5fd4-6e4e-4e0f-85ff-a6438bc2f2f0","systemuser,b5f00e27-78b3-4a71-90af-5dcef3c25bba",ACTOR-0004,26/09/2025 09:20,2025-09-26T09:20:00Z,ITEM-000494,L3_ADMIN,L3,"systemuser,b5f00e27-78b3-4a71-90af-5dcef3c25bba",,Owner changed
ITEM-000495,Update,owningbusinessunit,"businessunit,0a4ccfd6-e6d9-e611-80f2-5065f38aba91","businessunit,0a4ccfd6-e6d9-e611-80f2-5065f38aba91",ACTOR-0003,26/08/2025 07:43,2025-08-26T07:43:00Z,ITEM-000495,L3_ADMIN,L3,"businessunit,0a4ccfd6-e6d9-e611-80f2-5065f38aba91",,owningbusinessunit changed
ITEM-000495,Update,ownerid,"systemuser,b5f00e27-78b3-4a71-90af-5dcef3c25bba","systemuser,efd3822d-8c8b-4619-8eb9-39ddf9c5c57f",ACTOR-0003,26/08/2025 07:43,2025-08-26T07:43:00Z,ITEM-000495,L3_ADMIN,L3,"systemuser,efd3822d-8c8b-4619-8eb9-39ddf9c5c57f",,Owner changed
ITEM-000496,Update,estimatedclosedate,1/29/26 0:00,2/20/26 0:00,ACTOR-0003,22/01/2026 04:40,2026-01-22T04:40:00Z,ITEM-000496,L1_STAGE,L1,2/20/26 0:00,,estimatedclosedate → 2/20/26 0:00
ITEM-000496,Update,stepname,,14-Qualify,ACTOR-0008,12/1/26 15:49,2026-12-01T15:49:00Z,ITEM-000496,L1_STAGE,L1,14-Qualify,14.0,stepname → 14-Qualify
ITEM-000496,Create,purchaseprocess,,0,ACTOR-0002,12/1/26 15:49,2026-12-01T15:49:00Z,ITEM-000496,L2_MILESTONE,L2,0,,Case Created
ITEM-000497,Update,owningbusinessunit,"businessunit,0a4ccfd6-e6d9-e611-80f2-5065f38aba91","businessunit,0a4ccfd6-e6d9-e611-80f2-5065f38aba91",ACTOR-0003,27/10/2025 11:18,2025-10-27T11:18:00Z,ITEM-000497,L3_ADMIN,L3,"businessunit,0a4ccfd6-e6d9-e611-80f2-5065f38aba91",,owningbusinessunit changed
ITEM-000497,Update,ownerid,"systemuser,09f34b91-4d86-4fc8-8b41-8af3d91e94bf","systemuser,efd3822d-8c8b-4619-8eb9-39ddf9c5c57f",ACTOR-0003,27/10/2025 11:18,2025-10-27T11:18:00Z,ITEM-000497,L3_ADMIN,L3,"systemuser,efd3822d-8c8b-4619-8eb9-39ddf9c5c57f",,Owner changed
ITEM-000498,Update,owningbusinessunit,"businessunit,0a4ccfd6-e6d9-e611-80f2-5065f38aba91","businessunit,0a4ccfd6-e6d9-e611-80f2-5065f38aba91",ACTOR-0002,7/10/25 10:46,2025-07-10T10:46:00Z,ITEM-000498,L3_ADMIN,L3,"businessunit,0a4ccfd6-e6d9-e611-80f2-5065f38aba91",,owningbusinessunit changed
ITEM-000498,Update,ownerid,"systemuser,7b9d5323-2ef3-4d52-9d6c-dd45deb05e3b","systemuser,efd3822d-8c8b-4619-8eb9-39ddf9c5c57f",ACTOR-0002,7/10/25 10:46,2025-07-10T10:46:00Z,ITEM-000498,L3_ADMIN,L3,"systemuser,efd3822d-8c8b-4619-8eb9-39ddf9c5c57f",,Owner changed
ITEM-000499,Update,stepname,,14-Qualify,ACTOR-0008,19/12/2025 10:13,2025-12-19T10:13:00Z,ITEM-000499,L1_STAGE,L1,14-Qualify,14.0,stepname → 14-Qualify
ITEM-000499,Create,statecode,,0,ACTOR-0005,19/12/2025 10:13,2025-12-19T10:13:00Z,ITEM-000499,L1_STAGE,L1,Open,,Case Created
ITEM-000500,Update,owningbusinessunit,"businessunit,0a4ccfd6-e6d9-e611-80f2-5065f38aba91","businessunit,0a4ccfd6-e6d9-e611-80f2-5065f38aba91",ACTOR-0002,8/1/26 9:40,2026-08-01T09:40:00Z,ITEM-000500,L3_ADMIN,L3,"businessunit,0a4ccfd6-e6d9-e611-80f2-5065f38aba91",,owningbusinessunit changed
ITEM-000500,Update,ownerid,"systemuser,7b9d5323-2ef3-4d52-9d6c-dd45deb05e3b","systemuser,efd3822d-8c8b-4619-8eb9-39ddf9c5c57f",ACTOR-0002,8/1/26 9:40,2026-08-01T09:40:00Z,ITEM-000500,L3_ADMIN,L3,"systemuser,efd3822d-8c8b-4619-8eb9-39ddf9c5c57f",,Owner changed
ITEM-000501,Update,the000g_revenuetype,,604720001,ACTOR-0003,17/08/2025 12:50,2025-08-17T12:50:00Z,ITEM-000501,L2_MILESTONE,L2,604720001,,the000g_revenuetype → 604720001
ITEM-000501,Update,statuscode,1,4,ACTOR-0003,11/8/25 11:40,2025-11-08T11:40:00Z,ITEM-000501,L1_STAGE,L1,Canceled,,statuscode → Canceled
ITEM-000501,Update,msdyn_forecastcategory,100000001,100000006,ACTOR-0003,11/8/25 11:40,2025-11-08T11:40:00Z,ITEM-000501,L1_STAGE,L1,100000006,,msdyn_forecastcategory → 100000006
ITEM-000501,Update,actualclosedate,,8/11/25 0:00,ACTOR-0003,11/8/25 11:40,2025-11-08T11:40:00Z,ITEM-000501,L1_STAGE,L1,8/11/25 0:00,,actualclosedate → 8/11/25 0:00
ITEM-000501,Update,salesstage,,3,ACTOR-0003,11/8/25 11:40,2025-11-08T11:40:00Z,ITEM-000501,L1_STAGE,L1,3,,salesstage → 3
ITEM-000501,Update,statecode,0,2,ACTOR-0003,11/8/25 11:40,2025-11-08T11:40:00Z,ITEM-000501,L1_STAGE,L1,Lost,,statecode → Lost
ITEM-000502,Update,owningbusinessunit,"businessunit,0a4ccfd6-e6d9-e611-80f2-5065f38aba91","businessunit,0a4ccfd6-e6d9-e611-80f2-5065f38aba91",ACTOR-0002,1/9/25 9:15,2025-01-09T09:15:00Z,ITEM-000502,L3_ADMIN,L3,"businessunit,0a4ccfd6-e6d9-e611-80f2-5065f38aba91",,owningbusinessunit changed
ITEM-000502,Update,ownerid,"systemuser,b5f00e27-78b3-4a71-90af-5dcef3c25bba","systemuser,efd3822d-8c8b-4619-8eb9-39ddf9c5c57f",ACTOR-0002,1/9/25 9:15,2025-01-09T09:15:00Z,ITEM-000502,L3_ADMIN,L3,"systemuser,efd3822d-8c8b-4619-8eb9-39ddf9c5c57f",,Owner changed
ITEM-000504,Update,the000g_revenuetype,,604720002,ACTOR-0003,17/08/2025 12:56,2025-08-17T12:56:00Z,ITEM-000504,L2_MILESTONE,L2,604720002,,the000g_revenuetype → 604720002
ITEM-000504,Update,owningbusinessunit,"businessunit,0a4ccfd6-e6d9-e611-80f2-5065f38aba91","businessunit,0a4ccfd6-e6d9-e611-80f2-5065f38aba91",ACTOR-0003,27/10/2025 11:18,2025-10-27T11:18:00Z,ITEM-000504,L3_ADMIN,L3,"businessunit,0a4ccfd6-e6d9-e611-80f2-5065f38aba91",,owningbusinessunit changed
ITEM-000504,Update,ownerid,"systemuser,2d7fbe83-3f35-4a1d-bc05-1b39dbf446d9","systemuser,efd3822d-8c8b-4619-8eb9-39ddf9c5c57f",ACTOR-0003,27/10/2025 11:18,2025-10-27T11:18:00Z,ITEM-000504,L3_ADMIN,L3,"systemuser,efd3822d-8c8b-4619-8eb9-39ddf9c5c57f",,Owner changed
ITEM-000505,Create,statecode,,0,ACTOR-0009,9/9/25 12:53,2025-09-09T12:53:00Z,ITEM-000505,L1_STAGE,L1,Open,,Case Created
ITEM-000505,Update,stepname,,14-Qualify,ACTOR-0008,9/9/25 12:54,2025-09-09T12:54:00Z,ITEM-000505,L1_STAGE,L1,14-Qualify,14.0,stepname → 14-Qualify
ITEM-000505,Update,statuscode,1,3,ACTOR-0009,9/9/25 13:01,2025-09-09T13:01:00Z,ITEM-000505,L1_STAGE,L1,Won,,statuscode → Won
ITEM-000505,Update,msdyn_forecastcategory,100000001,100000005,ACTOR-0009,9/9/25 13:01,2025-09-09T13:01:00Z,ITEM-000505,L1_STAGE,L1,100000005,,msdyn_forecastcategory → 100000005
ITEM-000505,Update,actualclosedate,,9/9/25 0:00,ACTOR-0009,9/9/25 13:01,2025-09-09T13:01:00Z,ITEM-000505,L1_STAGE,L1,9/9/25 0:00,,actualclosedate → 9/9/25 0:00
ITEM-000505,Update,salesstage,,3,ACTOR-0009,9/9/25 13:01,2025-09-09T13:01:00Z,ITEM-000505,L1_STAGE,L1,3,,salesstage → 3
ITEM-000505,Update,statecode,0,1,ACTOR-0009,9/9/25 13:01,2025-09-09T13:01:00Z,ITEM-000505,L1_STAGE,L1,Won,,statecode → Won
ITEM-000506,Update,owningbusinessunit,"businessunit,0a4ccfd6-e6d9-e611-80f2-5065f38aba91","businessunit,0a4ccfd6-e6d9-e611-80f2-5065f38aba91",ACTOR-0002,16/10/2025 10:39,2025-10-16T10:39:00Z,ITEM-000506,L3_ADMIN,L3,"businessunit,0a4ccfd6-e6d9-e611-80f2-5065f38aba91",,owningbusinessunit changed
ITEM-000506,Update,ownerid,"systemuser,9ab13e3b-1ff4-4d57-a2c8-d0c8f2ce3f42","systemuser,efd3822d-8c8b-4619-8eb9-39ddf9c5c57f",ACTOR-0002,16/10/2025 10:39,2025-10-16T10:39:00Z,ITEM-000506,L3_ADMIN,L3,"systemuser,efd3822d-8c8b-4619-8eb9-39ddf9c5c57f",,Owner changed
ITEM-000507,Update,owningbusinessunit,"businessunit,0a4ccfd6-e6d9-e611-80f2-5065f38aba91","businessunit,0a4ccfd6-e6d9-e611-80f2-5065f38aba91",ACTOR-0003,27/08/2025 12:57,2025-08-27T12:57:00Z,ITEM-000507,L3_ADMIN,L3,"businessunit,0a4ccfd6-e6d9-e611-80f2-5065f38aba91",,owningbusinessunit changed
ITEM-000507,Update,ownerid,"systemuser,7b9d5323-2ef3-4d52-9d6c-dd45deb05e3b","systemuser,b5f00e27-78b3-4a71-90af-5dcef3c25bba",ACTOR-0003,27/08/2025 12:57,2025-08-27T12:57:00Z,ITEM-000507,L3_ADMIN,L3,"systemuser,b5f00e27-78b3-4a71-90af-5dcef3c25bba",,Owner changed
ITEM-000508,Update,statuscode,1,3,ACTOR-0003,1/12/25 15:07,2025-01-12T15:07:00Z,ITEM-000508,L1_STAGE,L1,Won,,statuscode → Won
ITEM-000508,Update,msdyn_forecastcategory,100000001,100000005,ACTOR-0003,1/12/25 15:07,2025-01-12T15:07:00Z,ITEM-000508,L1_STAGE,L1,100000005,,msdyn_forecastcategory → 100000005
ITEM-000508,Update,actualclosedate,,12/1/25 0:00,ACTOR-0003,1/12/25 15:07,2025-01-12T15:07:00Z,ITEM-000508,L1_STAGE,L1,12/1/25 0:00,,actualclosedate → 12/1/25 0:00
ITEM-000508,Update,salesstage,,3,ACTOR-0003,1/12/25 15:07,2025-01-12T15:07:00Z,ITEM-000508,L1_STAGE,L1,3,,salesstage → 3
ITEM-000508,Update,statecode,0,1,ACTOR-0003,1/12/25 15:07,2025-01-12T15:07:00Z,ITEM-000508,L1_STAGE,L1,Won,,statecode → Won
ITEM-000508,Create,statecode,,0,ACTOR-0003,14/11/2025 17:26,2025-11-14T17:26:00Z,ITEM-000508,L1_STAGE,L1,Open,,Case Created
ITEM-000508,Update,stepname,,14-Qualify,ACTOR-0008,14/11/2025 17:27,2025-11-14T17:27:00Z,ITEM-000508,L1_STAGE,L1,14-Qualify,14.0,stepname → 14-Qualify
ITEM-000509,Update,owningbusinessunit,"businessunit,0a4ccfd6-e6d9-e611-80f2-5065f38aba91","businessunit,0a4ccfd6-e6d9-e611-80f2-5065f38aba91",ACTOR-0002,16/10/2025 10:39,2025-10-16T10:39:00Z,ITEM-000509,L3_ADMIN,L3,"businessunit,0a4ccfd6-e6d9-e611-80f2-5065f38aba91",,owningbusinessunit changed
ITEM-000509,Update,ownerid,"systemuser,9ab13e3b-1ff4-4d57-a2c8-d0c8f2ce3f42","systemuser,efd3822d-8c8b-4619-8eb9-39ddf9c5c57f",ACTOR-0002,16/10/2025 10:39,2025-10-16T10:39:00Z,ITEM-000509,L3_ADMIN,L3,"systemuser,efd3822d-8c8b-4619-8eb9-39ddf9c5c57f",,Owner changed
ITEM-000510,Update,stepname,,14-Qualify,ACTOR-0008,15/12/2025 15:07,2025-12-15T15:07:00Z,ITEM-000510,L1_STAGE,L1,14-Qualify,14.0,stepname → 14-Qualify
ITEM-000510,Create,statecode,,0,ACTOR-0003,15/12/2025 15:07,2025-12-15T15:07:00Z,ITEM-000510,L1_STAGE,L1,Open,,Case Created
ITEM-000510,Update,stepname,14-Qualify,15-Develop,ACTOR-0008,8/1/26 15:03,2026-08-01T15:03:00Z,ITEM-000510,L1_STAGE,L1,15-Develop,15.0,stepname → 15-Develop
ITEM-000510,Update,the000g__revenuetype,,604720002,ACTOR-0003,8/1/26 15:03,2026-08-01T15:03:00Z,ITEM-000510,L2_MILESTONE,L2,604720002,,the000g__revenuetype → 604720002
ITEM-000510,Update,msdyn_forecastcategory,100000001,100000005,ACTOR-0003,8/1/26 15:03,2026-08-01T15:03:00Z,ITEM-000510,L1_STAGE,L1,100000005,,msdyn_forecastcategory → 100000005
ITEM-000510,Update,stepname,15-Develop,16-Propose,ACTOR-0008,8/1/26 15:04,2026-08-01T15:04:00Z,ITEM-000510,L1_STAGE,L1,16-Propose,16.0,stepname → 16-Propose
ITEM-000510,Update,stepname,16-Propose,17-Close,ACTOR-0008,8/1/26 15:04,2026-08-01T15:04:00Z,ITEM-000510,L1_STAGE,L1,17-Close,17.0,stepname → 17-Close
ITEM-000510,Update,statuscode,1,3,ACTOR-0003,8/1/26 15:32,2026-08-01T15:32:00Z,ITEM-000510,L1_STAGE,L1,Won,,statuscode → Won
ITEM-000510,Update,actualclosedate,,12/19/25 0:00,ACTOR-0003,8/1/26 15:32,2026-08-01T15:32:00Z,ITEM-000510,L1_STAGE,L1,12/19/25 0:00,,actualclosedate → 12/19/25 0:00
ITEM-000510,Update,salesstage,,3,ACTOR-0003,8/1/26 15:32,2026-08-01T15:32:00Z,ITEM-000510,L1_STAGE,L1,3,,salesstage → 3
ITEM-000510,Update,statecode,0,1,ACTOR-0003,8/1/26 15:32,2026-08-01T15:32:00Z,ITEM-000510,L1_STAGE,L1,Won,,statecode → Won
ITEM-000511,Update,owningbusinessunit,"businessunit,0a4ccfd6-e6d9-e611-80f2-5065f38aba91","businessunit,0a4ccfd6-e6d9-e611-80f2-5065f38aba91",ACTOR-0002,1/9/25 9:15,2025-01-09T09:15:00Z,ITEM-000511,L3_ADMIN,L3,"businessunit,0a4ccfd6-e6d9-e611-80f2-5065f38aba91",,owningbusinessunit changed
ITEM-000511,Update,ownerid,"systemuser,b5f00e27-78b3-4a71-90af-5dcef3c25bba","systemuser,efd3822d-8c8b-4619-8eb9-39ddf9c5c57f",ACTOR-0002,1/9/25 9:15,2025-01-09T09:15:00Z,ITEM-000511,L3_ADMIN,L3,"systemuser,efd3822d-8c8b-4619-8eb9-39ddf9c5c57f",,Owner changed
ITEM-000512,Update,stepname,,14-Qualify,ACTOR-0008,16/10/2025 09:51,2025-10-16T09:51:00Z,ITEM-000512,L1_STAGE,L1,14-Qualify,14.0,stepname → 14-Qualify
ITEM-000512,Create,statecode,,0,ACTOR-0009,16/10/2025 09:51,2025-10-16T09:51:00Z,ITEM-000512,L1_STAGE,L1,Open,,Case Created
ITEM-000512,Update,the000g__revenuetype,,604720002,ACTOR-0009,18/12/2025 09:23,2025-12-18T09:23:00Z,ITEM-000512,L2_MILESTONE,L2,604720002,,the000g__revenuetype → 604720002
ITEM-000512,Update,estimatedclosedate,12/15/25 0:00,3/26/26 0:00,ACTOR-0009,18/12/2025 09:23,2025-12-18T09:23:00Z,ITEM-000512,L1_STAGE,L1,3/26/26 0:00,,estimatedclosedate → 3/26/26 0:00
ITEM-000512,Update,estimatedclosedate,3/26/26 0:00,4/23/26 0:00,ACTOR-0009,13/01/2026 12:43,2026-01-13T12:43:00Z,ITEM-000512,L1_STAGE,L1,4/23/26 0:00,,estimatedclosedate → 4/23/26 0:00
ITEM-000513,Update,stepname,14-Qualify,15-Develop,ACTOR-0008,15/01/2026 14:01,2026-01-15T14:01:00Z,ITEM-000513,L1_STAGE,L1,15-Develop,15.0,stepname → 15-Develop
ITEM-000513,Update,purchasetimeframe,,2,ACTOR-0003,15/01/2026 14:01,2026-01-15T14:01:00Z,ITEM-000513,L2_MILESTONE,L2,2,,purchasetimeframe → 2
ITEM-000513,Update,the000g_revenuetype,,604720000,ACTOR-0003,15/01/2026 14:01,2026-01-15T14:01:00Z,ITEM-000513,L2_MILESTONE,L2,604720000,,the000g_revenuetype → 604720000
ITEM-000513,Update,the000g__revenuetype,,604720001,ACTOR-0003,15/01/2026 14:01,2026-01-15T14:01:00Z,ITEM-000513,L2_MILESTONE,L2,604720001,,the000g__revenuetype → 604720001
ITEM-000513,Update,the000g_isrenewal,,TRUE,ACTOR-0003,15/01/2026 14:01,2026-01-15T14:01:00Z,ITEM-000513,L3_ADMIN,L3,TRUE,,the000g_isrenewal changed
ITEM-000513,Update,msdyn_forecastcategory,100000001,100000003,ACTOR-0003,15/01/2026 14:01,2026-01-15T14:01:00Z,ITEM-000513,L1_STAGE,L1,100000003,,msdyn_forecastcategory → 100000003
ITEM-000513,Update,stepname,15-Develop,16-Propose,ACTOR-0008,15/01/2026 14:02,2026-01-15T14:02:00Z,ITEM-000513,L1_STAGE,L1,16-Propose,16.0,stepname → 16-Propose
ITEM-000516,Update,owningbusinessunit,"businessunit,0a4ccfd6-e6d9-e611-80f2-5065f38aba91","businessunit,0a4ccfd6-e6d9-e611-80f2-5065f38aba91",ACTOR-0002,7/10/25 10:46,2025-07-10T10:46:00Z,ITEM-000516,L3_ADMIN,L3,"businessunit,0a4ccfd6-e6d9-e611-80f2-5065f38aba91",,owningbusinessunit changed
ITEM-000516,Update,ownerid,"systemuser,7b9d5323-2ef3-4d52-9d6c-dd45deb05e3b","systemuser,efd3822d-8c8b-4619-8eb9-39ddf9c5c57f",ACTOR-0002,7/10/25 10:46,2025-07-10T10:46:00Z,ITEM-000516,L3_ADMIN,L3,"systemuser,efd3822d-8c8b-4619-8eb9-39ddf9c5c57f",,Owner changed
ITEM-000518,Update,stepname,,14-Qualify,ACTOR-0008,6/10/25 10:06,2025-06-10T10:06:00Z,ITEM-000518,L1_STAGE,L1,14-Qualify,14.0,stepname → 14-Qualify
ITEM-000518,Create,statecode,,0,ACTOR-0009,6/10/25 10:06,2025-06-10T10:06:00Z,ITEM-000518,L1_STAGE,L1,Open,,Case Created
ITEM-000518,Update,estimatedclosedate,11/27/25 0:00,2/18/26 0:00,ACTOR-0009,29/10/2025 09:15,2025-10-29T09:15:00Z,ITEM-000518,L1_STAGE,L1,2/18/26 0:00,,estimatedclosedate → 2/18/26 0:00
ITEM-000518,Update,closeprobability,,25,ACTOR-0003,5/1/26 15:40,2026-05-01T15:40:00Z,ITEM-000518,L1_STAGE,L1,25,,closeprobability → 25
ITEM-000518,Update,the000g__revenuetype,,604720002,ACTOR-0009,12/1/26 14:57,2026-12-01T14:57:00Z,ITEM-000518,L2_MILESTONE,L2,604720002,,the000g__revenuetype → 604720002
ITEM-000519,Update,stepname,,14-Qualify,ACTOR-0008,16/09/2025 11:00,2025-09-16T11:00:00Z,ITEM-000519,L1_STAGE,L1,14-Qualify,14.0,stepname → 14-Qualify
ITEM-000519,Create,purchasetimeframe,,0,ACTOR-0007,16/09/2025 11:00,2025-09-16T11:00:00Z,ITEM-000519,L2_MILESTONE,L2,0,,Case Created
ITEM-000519,Update,statuscode,1,3,ACTOR-0007,26/09/2025 14:19,2025-09-26T14:19:00Z,ITEM-000519,L1_STAGE,L1,Won,,statuscode → Won
ITEM-000519,Update,msdyn_forecastcategory,100000001,100000005,ACTOR-0007,26/09/2025 14:19,2025-09-26T14:19:00Z,ITEM-000519,L1_STAGE,L1,100000005,,msdyn_forecastcategory → 100000005
ITEM-000519,Update,actualclosedate,,9/26/25 0:00,ACTOR-0007,26/09/2025 14:19,2025-09-26T14:19:00Z,ITEM-000519,L1_STAGE,L1,9/26/25 0:00,,actualclosedate → 9/26/25 0:00
ITEM-000519,Update,salesstage,,3,ACTOR-0007,26/09/2025 14:19,2025-09-26T14:19:00Z,ITEM-000519,L1_STAGE,L1,3,,salesstage → 3
ITEM-000519,Update,statecode,0,1,ACTOR-0007,26/09/2025 14:19,2025-09-26T14:19:00Z,ITEM-000519,L1_STAGE,L1,Won,,statecode → Won
ITEM-000520,Update,owningbusinessunit,"businessunit,0a4ccfd6-e6d9-e611-80f2-5065f38aba91","businessunit,0a4ccfd6-e6d9-e611-80f2-5065f38aba91",ACTOR-0002,1/9/25 9:15,2025-01-09T09:15:00Z,ITEM-000520,L3_ADMIN,L3,"businessunit,0a4ccfd6-e6d9-e611-80f2-5065f38aba91",,owningbusinessunit changed
ITEM-000520,Update,ownerid,"systemuser,b5f00e27-78b3-4a71-90af-5dcef3c25bba","systemuser,efd3822d-8c8b-4619-8eb9-39ddf9c5c57f",ACTOR-0002,1/9/25 9:15,2025-01-09T09:15:00Z,ITEM-000520,L3_ADMIN,L3,"systemuser,efd3822d-8c8b-4619-8eb9-39ddf9c5c57f",,Owner changed
ITEM-000522,Update,owningbusinessunit,"businessunit,0a4ccfd6-e6d9-e611-80f2-5065f38aba91","businessunit,0a4ccfd6-e6d9-e611-80f2-5065f38aba91",ACTOR-0002,1/9/25 9:15,2025-01-09T09:15:00Z,ITEM-000522,L3_ADMIN,L3,"businessunit,0a4ccfd6-e6d9-e611-80f2-5065f38aba91",,owningbusinessunit changed
ITEM-000522,Update,ownerid,"systemuser,b5f00e27-78b3-4a71-90af-5dcef3c25bba","systemuser,efd3822d-8c8b-4619-8eb9-39ddf9c5c57f",ACTOR-0002,1/9/25 9:15,2025-01-09T09:15:00Z,ITEM-000522,L3_ADMIN,L3,"systemuser,efd3822d-8c8b-4619-8eb9-39ddf9c5c57f",,Owner changed
ITEM-000523,Update,owningbusinessunit,"businessunit,0a4ccfd6-e6d9-e611-80f2-5065f38aba91","businessunit,0a4ccfd6-e6d9-e611-80f2-5065f38aba91",ACTOR-0003,27/10/2025 11:18,2025-10-27T11:18:00Z,ITEM-000523,L3_ADMIN,L3,"businessunit,0a4ccfd6-e6d9-e611-80f2-5065f38aba91",,owningbusinessunit changed
ITEM-000523,Update,ownerid,"systemuser,2d7fbe83-3f35-4a1d-bc05-1b39dbf446d9","systemuser,efd3822d-8c8b-4619-8eb9-39ddf9c5c57f",ACTOR-0003,27/10/2025 11:18,2025-10-27T11:18:00Z,ITEM-000523,L3_ADMIN,L3,"systemuser,efd3822d-8c8b-4619-8eb9-39ddf9c5c57f",,Owner changed
ITEM-000524,Update,stepname,,14-Qualify,ACTOR-0008,26/09/2025 14:33,2025-09-26T14:33:00Z,ITEM-000524,L1_STAGE,L1,14-Qualify,14.0,stepname → 14-Qualify
ITEM-000524,Create,purchasetimeframe,,0,ACTOR-0007,26/09/2025 14:33,2025-09-26T14:33:00Z,ITEM-000524,L2_MILESTONE,L2,0,,Case Created
ITEM-000524,Update,statuscode,1,3,ACTOR-0007,14/01/2026 14:24,2026-01-14T14:24:00Z,ITEM-000524,L1_STAGE,L1,Won,,statuscode → Won
ITEM-000524,Update,msdyn_forecastcategory,100000001,100000005,ACTOR-0007,14/01/2026 14:24,2026-01-14T14:24:00Z,ITEM-000524,L1_STAGE,L1,100000005,,msdyn_forecastcategory → 100000005
ITEM-000524,Update,actualclosedate,,1/14/26 0:00,ACTOR-0007,14/01/2026 14:24,2026-01-14T14:24:00Z,ITEM-000524,L1_STAGE,L1,1/14/26 0:00,,actualclosedate → 1/14/26 0:00
ITEM-000524,Update,salesstage,,3,ACTOR-0007,14/01/2026 14:24,2026-01-14T14:24:00Z,ITEM-000524,L1_STAGE,L1,3,,salesstage → 3
ITEM-000524,Update,statecode,0,1,ACTOR-0007,14/01/2026 14:24,2026-01-14T14:24:00Z,ITEM-000524,L1_STAGE,L1,Won,,statecode → Won
ITEM-000524,Update,the000g__revenuetype,,604720004,ACTOR-0007,14/01/2026 14:24,2026-01-14T14:24:00Z,ITEM-000524,L2_MILESTONE,L2,604720004,,the000g__revenuetype → 604720004
ITEM-000525,Update,stepname,,14-Qualify,ACTOR-0008,25/09/2025 10:11,2025-09-25T10:11:00Z,ITEM-000525,L1_STAGE,L1,14-Qualify,14.0,stepname → 14-Qualify
ITEM-000525,Create,purchaseprocess,,0,ACTOR-0002,25/09/2025 10:11,2025-09-25T10:11:00Z,ITEM-000525,L2_MILESTONE,L2,0,,Case Created
ITEM-000525,Update,stepname,14-Qualify,15-Develop,ACTOR-0008,22/10/2025 09:05,2025-10-22T09:05:00Z,ITEM-000525,L1_STAGE,L1,15-Develop,15.0,stepname → 15-Develop
ITEM-000525,Update,stepname,15-Develop,16-Propose,ACTOR-0008,22/10/2025 09:05,2025-10-22T09:05:00Z,ITEM-000525,L1_STAGE,L1,16-Propose,16.0,stepname → 16-Propose
ITEM-000525,Update,stepname,16-Propose,17-Close,ACTOR-0008,22/10/2025 09:05,2025-10-22T09:05:00Z,ITEM-000525,L1_STAGE,L1,17-Close,17.0,stepname → 17-Close
ITEM-000525,Update,statuscode,1,3,ACTOR-0002,22/10/2025 09:06,2025-10-22T09:06:00Z,ITEM-000525,L1_STAGE,L1,Won,,statuscode → Won
ITEM-000525,Update,msdyn_forecastcategory,100000001,100000005,ACTOR-0002,22/10/2025 09:06,2025-10-22T09:06:00Z,ITEM-000525,L1_STAGE,L1,100000005,,msdyn_forecastcategory → 100000005
ITEM-000525,Update,actualclosedate,,10/22/25 0:00,ACTOR-0002,22/10/2025 09:06,2025-10-22T09:06:00Z,ITEM-000525,L1_STAGE,L1,10/22/25 0:00,,actualclosedate → 10/22/25 0:00
ITEM-000525,Update,salesstage,,3,ACTOR-0002,22/10/2025 09:06,2025-10-22T09:06:00Z,ITEM-000525,L1_STAGE,L1,3,,salesstage → 3
ITEM-000525,Update,statecode,0,1,ACTOR-0002,22/10/2025 09:06,2025-10-22T09:06:00Z,ITEM-000525,L1_STAGE,L1,Won,,statecode → Won
ITEM-000526,Update,the000g_revenuetype,,604720001,ACTOR-0009,6/10/25 9:51,2025-06-10T09:51:00Z,ITEM-000526,L2_MILESTONE,L2,604720001,,the000g_revenuetype → 604720001
ITEM-000526,Update,the000g_isrenewal,,FALSE,ACTOR-0009,6/10/25 9:51,2025-06-10T09:51:00Z,ITEM-000526,L3_ADMIN,L3,FALSE,,the000g_isrenewal changed
ITEM-000526,Update,estimatedclosedate,9/17/25 0:00,12/17/25 0:00,ACTOR-0009,6/10/25 9:51,2025-06-10T09:51:00Z,ITEM-000526,L1_STAGE,L1,12/17/25 0:00,,estimatedclosedate → 12/17/25 0:00
ITEM-000526,Update,estimatedclosedate,12/17/25 0:00,3/18/26 0:00,ACTOR-0009,29/10/2025 09:21,2025-10-29T09:21:00Z,ITEM-000526,L1_STAGE,L1,3/18/26 0:00,,estimatedclosedate → 3/18/26 0:00
ITEM-000526,Update,closeprobability,,50,ACTOR-0003,5/1/26 15:56,2026-05-01T15:56:00Z,ITEM-000526,L1_STAGE,L1,50,,closeprobability → 50
ITEM-000527,Update,stepname,,14-Qualify,ACTOR-0008,15/08/2025 10:03,2025-08-15T10:03:00Z,ITEM-000527,L1_STAGE,L1,14-Qualify,14.0,stepname → 14-Qualify
ITEM-000527,Create,statecode,,0,ACTOR-0009,15/08/2025 10:03,2025-08-15T10:03:00Z,ITEM-000527,L1_STAGE,L1,Open,,Case Created
ITEM-000529,Update,owningbusinessunit,"businessunit,0a4ccfd6-e6d9-e611-80f2-5065f38aba91","businessunit,0a4ccfd6-e6d9-e611-80f2-5065f38aba91",ACTOR-0003,27/10/2025 11:18,2025-10-27T11:18:00Z,ITEM-000529,L3_ADMIN,L3,"businessunit,0a4ccfd6-e6d9-e611-80f2-5065f38aba91",,owningbusinessunit changed
ITEM-000529,Update,ownerid,"systemuser,2d7fbe83-3f35-4a1d-bc05-1b39dbf446d9","systemuser,efd3822d-8c8b-4619-8eb9-39ddf9c5c57f",ACTOR-0003,27/10/2025 11:18,2025-10-27T11:18:00Z,ITEM-000529,L3_ADMIN,L3,"systemuser,efd3822d-8c8b-4619-8eb9-39ddf9c5c57f",,Owner changed
ITEM-000530,Update,owningbusinessunit,"businessunit,0a4ccfd6-e6d9-e611-80f2-5065f38aba91","businessunit,0a4ccfd6-e6d9-e611-80f2-5065f38aba91",ACTOR-0004,26/09/2025 09:20,2025-09-26T09:20:00Z,ITEM-000530,L3_ADMIN,L3,"businessunit,0a4ccfd6-e6d9-e611-80f2-5065f38aba91",,owningbusinessunit changed
ITEM-000530,Update,ownerid,"systemuser,1cba5fd4-6e4e-4e0f-85ff-a6438bc2f2f0","systemuser,b5f00e27-78b3-4a71-90af-5dcef3c25bba",ACTOR-0004,26/09/2025 09:20,2025-09-26T09:20:00Z,ITEM-000530,L3_ADMIN,L3,"systemuser,b5f00e27-78b3-4a71-90af-5dcef3c25bba",,Owner changed
ITEM-000531,Update,owningbusinessunit,"businessunit,0a4ccfd6-e6d9-e611-80f2-5065f38aba91","businessunit,0a4ccfd6-e6d9-e611-80f2-5065f38aba91",ACTOR-0002,8/9/25 8:04,2025-08-09T08:04:00Z,ITEM-000531,L3_ADMIN,L3,"businessunit,0a4ccfd6-e6d9-e611-80f2-5065f38aba91",,owningbusinessunit changed
ITEM-000531,Update,ownerid,"systemuser,09f34b91-4d86-4fc8-8b41-8af3d91e94bf","systemuser,efd3822d-8c8b-4619-8eb9-39ddf9c5c57f",ACTOR-0002,8/9/25 8:04,2025-08-09T08:04:00Z,ITEM-000531,L3_ADMIN,L3,"systemuser,efd3822d-8c8b-4619-8eb9-39ddf9c5c57f",,Owner changed
ITEM-000532,Update,stepname,,14-Qualify,ACTOR-0008,5/1/26 17:11,2026-05-01T17:11:00Z,ITEM-000532,L1_STAGE,L1,14-Qualify,14.0,stepname → 14-Qualify
ITEM-000532,Create,statecode,,0,ACTOR-0002,5/1/26 17:11,2026-05-01T17:11:00Z,ITEM-000532,L1_STAGE,L1,Open,,Case Created
ITEM-000534,Update,owningbusinessunit,"businessunit,0a4ccfd6-e6d9-e611-80f2-5065f38aba91","businessunit,0a4ccfd6-e6d9-e611-80f2-5065f38aba91",ACTOR-0002,1/9/25 9:15,2025-01-09T09:15:00Z,ITEM-000534,L3_ADMIN,L3,"businessunit,0a4ccfd6-e6d9-e611-80f2-5065f38aba91",,owningbusinessunit changed
ITEM-000534,Update,ownerid,"systemuser,b5f00e27-78b3-4a71-90af-5dcef3c25bba","systemuser,efd3822d-8c8b-4619-8eb9-39ddf9c5c57f",ACTOR-0002,1/9/25 9:15,2025-01-09T09:15:00Z,ITEM-000534,L3_ADMIN,L3,"systemuser,efd3822d-8c8b-4619-8eb9-39ddf9c5c57f",,Owner changed
ITEM-000535,Update,owningbusinessunit,"businessunit,0a4ccfd6-e6d9-e611-80f2-5065f38aba91","businessunit,0a4ccfd6-e6d9-e611-80f2-5065f38aba91",ACTOR-0002,16/10/2025 10:39,2025-10-16T10:39:00Z,ITEM-000535,L3_ADMIN,L3,"businessunit,0a4ccfd6-e6d9-e611-80f2-5065f38aba91",,owningbusinessunit changed
ITEM-000535,Update,ownerid,"systemuser,9ab13e3b-1ff4-4d57-a2c8-d0c8f2ce3f42","systemuser,efd3822d-8c8b-4619-8eb9-39ddf9c5c57f",ACTOR-0002,16/10/2025 10:39,2025-10-16T10:39:00Z,ITEM-000535,L3_ADMIN,L3,"systemuser,efd3822d-8c8b-4619-8eb9-39ddf9c5c57f",,Owner changed
ITEM-000536,Update,owningbusinessunit,"businessunit,0a4ccfd6-e6d9-e611-80f2-5065f38aba91","businessunit,0a4ccfd6-e6d9-e611-80f2-5065f38aba91",ACTOR-0004,26/09/2025 09:21,2025-09-26T09:21:00Z,ITEM-000536,L3_ADMIN,L3,"businessunit,0a4ccfd6-e6d9-e611-80f2-5065f38aba91",,owningbusinessunit changed
ITEM-000536,Update,ownerid,"systemuser,1cba5fd4-6e4e-4e0f-85ff-a6438bc2f2f0","systemuser,b5f00e27-78b3-4a71-90af-5dcef3c25bba",ACTOR-0004,26/09/2025 09:21,2025-09-26T09:21:00Z,ITEM-000536,L3_ADMIN,L3,"systemuser,b5f00e27-78b3-4a71-90af-5dcef3c25bba",,Owner changed
ITEM-000537,Update,owningbusinessunit,"businessunit,0a4ccfd6-e6d9-e611-80f2-5065f38aba91","businessunit,0a4ccfd6-e6d9-e611-80f2-5065f38aba91",ACTOR-0004,26/09/2025 09:20,2025-09-26T09:20:00Z,ITEM-000537,L3_ADMIN,L3,"businessunit,0a4ccfd6-e6d9-e611-80f2-5065f38aba91",,owningbusinessunit changed
ITEM-000537,Update,ownerid,"systemuser,1cba5fd4-6e4e-4e0f-85ff-a6438bc2f2f0","systemuser,b5f00e27-78b3-4a71-90af-5dcef3c25bba",ACTOR-0004,26/09/2025 09:20,2025-09-26T09:20:00Z,ITEM-000537,L3_ADMIN,L3,"systemuser,b5f00e27-78b3-4a71-90af-5dcef3c25bba",,Owner changed
ITEM-000538,Update,owningbusinessunit,"businessunit,0a4ccfd6-e6d9-e611-80f2-5065f38aba91","businessunit,0a4ccfd6-e6d9-e611-80f2-5065f38aba91",ACTOR-0002,22/08/2025 13:23,2025-08-22T13:23:00Z,ITEM-000538,L3_ADMIN,L3,"businessunit,0a4ccfd6-e6d9-e611-80f2-5065f38aba91",,owningbusinessunit changed
ITEM-000538,Update,ownerid,"systemuser,7b9d5323-2ef3-4d52-9d6c-dd45deb05e3b","systemuser,efd3822d-8c8b-4619-8eb9-39ddf9c5c57f",ACTOR-0002,22/08/2025 13:23,2025-08-22T13:23:00Z,ITEM-000538,L3_ADMIN,L3,"systemuser,efd3822d-8c8b-4619-8eb9-39ddf9c5c57f",,Owner changed
ITEM-000539,Update,stepname,,14-Qualify,ACTOR-0008,7/11/25 8:48,2025-07-11T08:48:00Z,ITEM-000539,L1_STAGE,L1,14-Qualify,14.0,stepname → 14-Qualify
ITEM-000539,Create,statecode,,0,ACTOR-0002,7/11/25 8:48,2025-07-11T08:48:00Z,ITEM-000539,L1_STAGE,L1,Open,,Case Created
ITEM-000540,Update,owningbusinessunit,"businessunit,0a4ccfd6-e6d9-e611-80f2-5065f38aba91","businessunit,0a4ccfd6-e6d9-e611-80f2-5065f38aba91",ACTOR-0002,7/10/25 10:45,2025-07-10T10:45:00Z,ITEM-000540,L3_ADMIN,L3,"businessunit,0a4ccfd6-e6d9-e611-80f2-5065f38aba91",,owningbusinessunit changed
ITEM-000540,Update,ownerid,"systemuser,7b9d5323-2ef3-4d52-9d6c-dd45deb05e3b","systemuser,efd3822d-8c8b-4619-8eb9-39ddf9c5c57f",ACTOR-0002,7/10/25 10:45,2025-07-10T10:45:00Z,ITEM-000540,L3_ADMIN,L3,"systemuser,efd3822d-8c8b-4619-8eb9-39ddf9c5c57f",,Owner changed
ITEM-000543,Update,owningbusinessunit,"businessunit,0a4ccfd6-e6d9-e611-80f2-5065f38aba91","businessunit,0a4ccfd6-e6d9-e611-80f2-5065f38aba91",ACTOR-0002,8/1/26 9:40,2026-08-01T09:40:00Z,ITEM-000543,L3_ADMIN,L3,"businessunit,0a4ccfd6-e6d9-e611-80f2-5065f38aba91",,owningbusinessunit changed
ITEM-000543,Update,ownerid,"systemuser,7b9d5323-2ef3-4d52-9d6c-dd45deb05e3b","systemuser,efd3822d-8c8b-4619-8eb9-39ddf9c5c57f",ACTOR-0002,8/1/26 9:40,2026-08-01T09:40:00Z,ITEM-000543,L3_ADMIN,L3,"systemuser,efd3822d-8c8b-4619-8eb9-39ddf9c5c57f",,Owner changed
ITEM-000544,Update,owningbusinessunit,"businessunit,0a4ccfd6-e6d9-e611-80f2-5065f38aba91","businessunit,0a4ccfd6-e6d9-e611-80f2-5065f38aba91",ACTOR-0004,12/8/25 10:44,2025-12-08T10:44:00Z,ITEM-000544,L3_ADMIN,L3,"businessunit,0a4ccfd6-e6d9-e611-80f2-5065f38aba91",,owningbusinessunit changed
ITEM-000544,Update,ownerid,"team,0e9fee3e-5a6b-ef11-a670-6045bdf33728","systemuser,efd3822d-8c8b-4619-8eb9-39ddf9c5c57f",ACTOR-0004,12/8/25 10:44,2025-12-08T10:44:00Z,ITEM-000544,L3_ADMIN,L3,"systemuser,efd3822d-8c8b-4619-8eb9-39ddf9c5c57f",,Owner changed
ITEM-000545,Update,statuscode,1,4,ACTOR-0009,6/10/25 9:50,2025-06-10T09:50:00Z,ITEM-000545,L1_STAGE,L1,Canceled,,statuscode → Canceled
ITEM-000545,Update,msdyn_forecastcategory,100000001,100000006,ACTOR-0009,6/10/25 9:50,2025-06-10T09:50:00Z,ITEM-000545,L1_STAGE,L1,100000006,,msdyn_forecastcategory → 100000006
ITEM-000545,Update,actualclosedate,,10/6/25 0:00,ACTOR-0009,6/10/25 9:50,2025-06-10T09:50:00Z,ITEM-000545,L1_STAGE,L1,10/6/25 0:00,,actualclosedate → 10/6/25 0:00
ITEM-000545,Update,salesstage,,3,ACTOR-0009,6/10/25 9:50,2025-06-10T09:50:00Z,ITEM-000545,L1_STAGE,L1,3,,salesstage → 3
ITEM-000545,Update,statecode,0,2,ACTOR-0009,6/10/25 9:50,2025-06-10T09:50:00Z,ITEM-000545,L1_STAGE,L1,Lost,,statecode → Lost
ITEM-000545,Update,the000g_revenuetype,,604720001,ACTOR-0009,6/10/25 9:50,2025-06-10T09:50:00Z,ITEM-000545,L2_MILESTONE,L2,604720001,,the000g_revenuetype → 604720001
ITEM-000545,Update,the000g_isrenewal,,FALSE,ACTOR-0009,6/10/25 9:50,2025-06-10T09:50:00Z,ITEM-000545,L3_ADMIN,L3,FALSE,,the000g_isrenewal changed
ITEM-000546,Update,stepname,,14-Qualify,ACTOR-0008,11/11/25 13:46,2025-11-11T13:46:00Z,ITEM-000546,L1_STAGE,L1,14-Qualify,14.0,stepname → 14-Qualify
ITEM-000546,Create,statecode,,0,ACTOR-0009,11/11/25 13:46,2025-11-11T13:46:00Z,ITEM-000546,L1_STAGE,L1,Open,,Case Created
ITEM-000546,Update,statuscode,1,3,ACTOR-0009,11/11/25 15:25,2025-11-11T15:25:00Z,ITEM-000546,L1_STAGE,L1,Won,,statuscode → Won
ITEM-000546,Update,msdyn_forecastcategory,100000001,100000005,ACTOR-0009,11/11/25 15:25,2025-11-11T15:25:00Z,ITEM-000546,L1_STAGE,L1,100000005,,msdyn_forecastcategory → 100000005
ITEM-000546,Update,actualclosedate,,11/11/25 0:00,ACTOR-0009,11/11/25 15:25,2025-11-11T15:25:00Z,ITEM-000546,L1_STAGE,L1,11/11/25 0:00,,actualclosedate → 11/11/25 0:00
ITEM-000546,Update,salesstage,,3,ACTOR-0009,11/11/25 15:25,2025-11-11T15:25:00Z,ITEM-000546,L1_STAGE,L1,3,,salesstage → 3
ITEM-000546,Update,statecode,0,1,ACTOR-0009,11/11/25 15:25,2025-11-11T15:25:00Z,ITEM-000546,L1_STAGE,L1,Won,,statecode → Won
ITEM-000547,Update,owningbusinessunit,"businessunit,0a4ccfd6-e6d9-e611-80f2-5065f38aba91","businessunit,0a4ccfd6-e6d9-e611-80f2-5065f38aba91",ACTOR-0002,8/9/25 8:04,2025-08-09T08:04:00Z,ITEM-000547,L3_ADMIN,L3,"businessunit,0a4ccfd6-e6d9-e611-80f2-5065f38aba91",,owningbusinessunit changed
ITEM-000547,Update,ownerid,"systemuser,ddf0a409-01d5-4caa-bd27-c1b42fee109e","systemuser,efd3822d-8c8b-4619-8eb9-39ddf9c5c57f",ACTOR-0002,8/9/25 8:04,2025-08-09T08:04:00Z,ITEM-000547,L3_ADMIN,L3,"systemuser,efd3822d-8c8b-4619-8eb9-39ddf9c5c57f",,Owner changed
ITEM-000553,Update,stepname,,14-Qualify,ACTOR-0008,6/10/25 10:00,2025-06-10T10:00:00Z,ITEM-000553,L1_STAGE,L1,14-Qualify,14.0,stepname → 14-Qualify
ITEM-000553,Create,statecode,,0,ACTOR-0009,6/10/25 10:00,2025-06-10T10:00:00Z,ITEM-000553,L1_STAGE,L1,Open,,Case Created
ITEM-000553,Update,the000g__revenuetype,,604720002,ACTOR-0009,18/12/2025 09:24,2025-12-18T09:24:00Z,ITEM-000553,L2_MILESTONE,L2,604720002,,the000g__revenuetype → 604720002
ITEM-000553,Update,estimatedclosedate,1/29/26 0:00,4/15/26 0:00,ACTOR-0009,18/12/2025 09:24,2025-12-18T09:24:00Z,ITEM-000553,L1_STAGE,L1,4/15/26 0:00,,estimatedclosedate → 4/15/26 0:00
ITEM-000554,Update,stepname,,14-Qualify,ACTOR-0008,28/01/2026 15:54,2026-01-28T15:54:00Z,ITEM-000554,L1_STAGE,L1,14-Qualify,14.0,stepname → 14-Qualify
ITEM-000554,Create,statecode,,0,ACTOR-0001,28/01/2026 15:54,2026-01-28T15:54:00Z,ITEM-000554,L1_STAGE,L1,Open,,Case Created
ITEM-000560,Update,stepname,,14-Qualify,ACTOR-0008,27/10/2025 10:44,2025-10-27T10:44:00Z,ITEM-000560,L1_STAGE,L1,14-Qualify,14.0,stepname → 14-Qualify
ITEM-000560,Create,purchaseprocess,,0,ACTOR-0002,27/10/2025 10:44,2025-10-27T10:44:00Z,ITEM-000560,L2_MILESTONE,L2,0,,Case Created
ITEM-000560,Update,stepname,14-Qualify,15-Develop,ACTOR-0008,27/10/2025 14:35,2025-10-27T14:35:00Z,ITEM-000560,L1_STAGE,L1,15-Develop,15.0,stepname → 15-Develop
ITEM-000560,Update,stepname,15-Develop,16-Propose,ACTOR-0008,27/10/2025 14:35,2025-10-27T14:35:00Z,ITEM-000560,L1_STAGE,L1,16-Propose,16.0,stepname → 16-Propose
ITEM-000560,Update,stepname,16-Propose,17-Close,ACTOR-0008,27/10/2025 14:35,2025-10-27T14:35:00Z,ITEM-000560,L1_STAGE,L1,17-Close,17.0,stepname → 17-Close
ITEM-000560,Update,statuscode,1,4,ACTOR-0002,27/10/2025 14:36,2025-10-27T14:36:00Z,ITEM-000560,L1_STAGE,L1,Canceled,,statuscode → Canceled
ITEM-000560,Update,msdyn_forecastcategory,100000001,100000006,ACTOR-0002,27/10/2025 14:36,2025-10-27T14:36:00Z,ITEM-000560,L1_STAGE,L1,100000006,,msdyn_forecastcategory → 100000006
ITEM-000560,Update,actualclosedate,,10/27/25 0:00,ACTOR-0002,27/10/2025 14:36,2025-10-27T14:36:00Z,ITEM-000560,L1_STAGE,L1,10/27/25 0:00,,actualclosedate → 10/27/25 0:00
ITEM-000560,Update,salesstage,,3,ACTOR-0002,27/10/2025 14:36,2025-10-27T14:36:00Z,ITEM-000560,L1_STAGE,L1,3,,salesstage → 3
ITEM-000560,Update,statecode,0,2,ACTOR-0002,27/10/2025 14:36,2025-10-27T14:36:00Z,ITEM-000560,L1_STAGE,L1,Lost,,statecode → Lost
ITEM-000560,Update,completefinalproposal,FALSE,TRUE,ACTOR-0002,27/10/2025 14:36,2025-10-27T14:36:00Z,ITEM-000560,L2_MILESTONE,L2,TRUE,,completefinalproposal completed
ITEM-000561,Update,stepname,,14-Qualify,ACTOR-0008,19/12/2025 10:23,2025-12-19T10:23:00Z,ITEM-000561,L1_STAGE,L1,14-Qualify,14.0,stepname → 14-Qualify
ITEM-000561,Create,statecode,,0,ACTOR-0005,19/12/2025 10:23,2025-12-19T10:23:00Z,ITEM-000561,L1_STAGE,L1,Open,,Case Created
ITEM-000564,Update,stepname,,14-Qualify,ACTOR-0008,11/11/25 9:16,2025-11-11T09:16:00Z,ITEM-000564,L1_STAGE,L1,14-Qualify,14.0,stepname → 14-Qualify
ITEM-000564,Create,statecode,,0,ACTOR-0009,11/11/25 9:16,2025-11-11T09:16:00Z,ITEM-000564,L1_STAGE,L1,Open,,Case Created
ITEM-000564,Update,the000g__revenuetype,,604720002,ACTOR-0009,26/01/2026 15:36,2026-01-26T15:36:00Z,ITEM-000564,L2_MILESTONE,L2,604720002,,the000g__revenuetype → 604720002
ITEM-000564,Update,estimatedclosedate,3/18/26 0:00,7/14/26 0:00,ACTOR-0009,26/01/2026 15:36,2026-01-26T15:36:00Z,ITEM-000564,L1_STAGE,L1,7/14/26 0:00,,estimatedclosedate → 7/14/26 0:00
ITEM-000564,Update,closeprobability,,25,ACTOR-0003,5/1/26 15:54,2026-05-01T15:54:00Z,ITEM-000564,L1_STAGE,L1,25,,closeprobability → 25
ITEM-000565,Update,stepname,,14-Qualify,ACTOR-0008,2/12/25 14:11,2025-02-12T14:11:00Z,ITEM-000565,L1_STAGE,L1,14-Qualify,14.0,stepname → 14-Qualify
ITEM-000565,Create,purchaseprocess,,0,ACTOR-0002,2/12/25 14:11,2025-02-12T14:11:00Z,ITEM-000565,L2_MILESTONE,L2,0,,Case Created
ITEM-000565,Update,stepname,14-Qualify,15-Develop,ACTOR-0008,2/12/25 14:42,2025-02-12T14:42:00Z,ITEM-000565,L1_STAGE,L1,15-Develop,15.0,stepname → 15-Develop
ITEM-000565,Update,the000g__revenuetype,,604720003,ACTOR-0002,5/1/26 9:51,2026-05-01T09:51:00Z,ITEM-000565,L2_MILESTONE,L2,604720003,,the000g__revenuetype → 604720003
ITEM-000565,Update,estimatedclosedate,1/22/26 0:00,6/24/26 0:00,ACTOR-0002,5/1/26 9:51,2026-05-01T09:51:00Z,ITEM-000565,L1_STAGE,L1,6/24/26 0:00,,estimatedclosedate → 6/24/26 0:00
ITEM-000566,Update,stepname,,14-Qualify,ACTOR-0008,21/01/2026 13:23,2026-01-21T13:23:00Z,ITEM-000566,L1_STAGE,L1,14-Qualify,14.0,stepname → 14-Qualify
ITEM-000566,Create,statecode,,0,ACTOR-0003,21/01/2026 13:23,2026-01-21T13:23:00Z,ITEM-000566,L1_STAGE,L1,Open,,Case Created
ITEM-000567,Update,owningbusinessunit,"businessunit,0a4ccfd6-e6d9-e611-80f2-5065f38aba91","businessunit,0a4ccfd6-e6d9-e611-80f2-5065f38aba91",ACTOR-0003,27/10/2025 11:18,2025-10-27T11:18:00Z,ITEM-000567,L3_ADMIN,L3,"businessunit,0a4ccfd6-e6d9-e611-80f2-5065f38aba91",,owningbusinessunit changed
ITEM-000567,Update,ownerid,"systemuser,a1bb889b-dfab-4e28-b508-75e672da7cb8","systemuser,efd3822d-8c8b-4619-8eb9-39ddf9c5c57f",ACTOR-0003,27/10/2025 11:18,2025-10-27T11:18:00Z,ITEM-000567,L3_ADMIN,L3,"systemuser,efd3822d-8c8b-4619-8eb9-39ddf9c5c57f",,Owner changed
ITEM-000568,Update,owningbusinessunit,"businessunit,0a4ccfd6-e6d9-e611-80f2-5065f38aba91","businessunit,0a4ccfd6-e6d9-e611-80f2-5065f38aba91",ACTOR-0002,8/9/25 8:04,2025-08-09T08:04:00Z,ITEM-000568,L3_ADMIN,L3,"businessunit,0a4ccfd6-e6d9-e611-80f2-5065f38aba91",,owningbusinessunit changed
ITEM-000568,Update,ownerid,"systemuser,ddf0a409-01d5-4caa-bd27-c1b42fee109e","systemuser,efd3822d-8c8b-4619-8eb9-39ddf9c5c57f",ACTOR-0002,8/9/25 8:04,2025-08-09T08:04:00Z,ITEM-000568,L3_ADMIN,L3,"systemuser,efd3822d-8c8b-4619-8eb9-39ddf9c5c57f",,Owner changed
ITEM-000570,Update,owningbusinessunit,"businessunit,0a4ccfd6-e6d9-e611-80f2-5065f38aba91","businessunit,0a4ccfd6-e6d9-e611-80f2-5065f38aba91",ACTOR-0004,26/09/2025 09:20,2025-09-26T09:20:00Z,ITEM-000570,L3_ADMIN,L3,"businessunit,0a4ccfd6-e6d9-e611-80f2-5065f38aba91",,owningbusinessunit changed
ITEM-000570,Update,ownerid,"systemuser,1cba5fd4-6e4e-4e0f-85ff-a6438bc2f2f0","systemuser,b5f00e27-78b3-4a71-90af-5dcef3c25bba",ACTOR-0004,26/09/2025 09:20,2025-09-26T09:20:00Z,ITEM-000570,L3_ADMIN,L3,"systemuser,b5f00e27-78b3-4a71-90af-5dcef3c25bba",,Owner changed
ITEM-000571,Update,owningbusinessunit,"businessunit,0a4ccfd6-e6d9-e611-80f2-5065f38aba91","businessunit,0a4ccfd6-e6d9-e611-80f2-5065f38aba91",ACTOR-0002,7/10/25 10:46,2025-07-10T10:46:00Z,ITEM-000571,L3_ADMIN,L3,"businessunit,0a4ccfd6-e6d9-e611-80f2-5065f38aba91",,owningbusinessunit changed
ITEM-000571,Update,ownerid,"systemuser,f0df2f4c-7b1a-46f2-9e80-2a19c6df8dd8","systemuser,efd3822d-8c8b-4619-8eb9-39ddf9c5c57f",ACTOR-0002,7/10/25 10:46,2025-07-10T10:46:00Z,ITEM-000571,L3_ADMIN,L3,"systemuser,efd3822d-8c8b-4619-8eb9-39ddf9c5c57f",,Owner changed
ITEM-000574,Update,owningbusinessunit,"businessunit,0a4ccfd6-e6d9-e611-80f2-5065f38aba91","businessunit,0a4ccfd6-e6d9-e611-80f2-5065f38aba91",ACTOR-0002,7/10/25 10:45,2025-07-10T10:45:00Z,ITEM-000574,L3_ADMIN,L3,"businessunit,0a4ccfd6-e6d9-e611-80f2-5065f38aba91",,owningbusinessunit changed
ITEM-000574,Update,ownerid,"systemuser,7b9d5323-2ef3-4d52-9d6c-dd45deb05e3b","systemuser,efd3822d-8c8b-4619-8eb9-39ddf9c5c57f",ACTOR-0002,7/10/25 10:45,2025-07-10T10:45:00Z,ITEM-000574,L3_ADMIN,L3,"systemuser,efd3822d-8c8b-4619-8eb9-39ddf9c5c57f",,Owner changed
ITEM-000575,Update,owningbusinessunit,"businessunit,0a4ccfd6-e6d9-e611-80f2-5065f38aba91","businessunit,0a4ccfd6-e6d9-e611-80f2-5065f38aba91",ACTOR-0002,7/10/25 10:46,2025-07-10T10:46:00Z,ITEM-000575,L3_ADMIN,L3,"businessunit,0a4ccfd6-e6d9-e611-80f2-5065f38aba91",,owningbusinessunit changed
ITEM-000575,Update,ownerid,"systemuser,7b9d5323-2ef3-4d52-9d6c-dd45deb05e3b","systemuser,efd3822d-8c8b-4619-8eb9-39ddf9c5c57f",ACTOR-0002,7/10/25 10:46,2025-07-10T10:46:00Z,ITEM-000575,L3_ADMIN,L3,"systemuser,efd3822d-8c8b-4619-8eb9-39ddf9c5c57f",,Owner changed
ITEM-000578,Create,statecode,,0,ACTOR-0005,22/10/2025 14:04,2025-10-22T14:04:00Z,ITEM-000578,L1_STAGE,L1,Open,,Case Created
ITEM-000578,Update,stepname,,14-Qualify,ACTOR-0008,22/10/2025 14:05,2025-10-22T14:05:00Z,ITEM-000578,L1_STAGE,L1,14-Qualify,14.0,stepname → 14-Qualify
ITEM-000578,Update,estimatedclosedate,6/1/26 0:00,2/27/26 0:00,ACTOR-0005,22/10/2025 14:14,2025-10-22T14:14:00Z,ITEM-000578,L1_STAGE,L1,2/27/26 0:00,,estimatedclosedate → 2/27/26 0:00
ITEM-000578,Update,statuscode,1,100000006,ACTOR-0005,19/12/2025 10:31,2025-12-19T10:31:00Z,ITEM-000578,L1_STAGE,L1,100000006,,statuscode → 100000006
ITEM-000578,Update,the000g__revenuetype,,604720002,ACTOR-0005,19/12/2025 10:31,2025-12-19T10:31:00Z,ITEM-000578,L2_MILESTONE,L2,604720002,,the000g__revenuetype → 604720002
ITEM-000578,Update,statuscode,100000006,4,ACTOR-0005,19/12/2025 10:37,2025-12-19T10:37:00Z,ITEM-000578,L1_STAGE,L1,Canceled,,statuscode → Canceled
ITEM-000578,Update,msdyn_forecastcategory,100000001,100000006,ACTOR-0005,19/12/2025 10:37,2025-12-19T10:37:00Z,ITEM-000578,L1_STAGE,L1,100000006,,msdyn_forecastcategory → 100000006
ITEM-000578,Update,actualclosedate,,12/19/25 0:00,ACTOR-0005,19/12/2025 10:37,2025-12-19T10:37:00Z,ITEM-000578,L1_STAGE,L1,12/19/25 0:00,,actualclosedate → 12/19/25 0:00
ITEM-000578,Update,salesstage,,3,ACTOR-0005,19/12/2025 10:37,2025-12-19T10:37:00Z,ITEM-000578,L1_STAGE,L1,3,,salesstage → 3
ITEM-000578,Update,statecode,0,2,ACTOR-0005,19/12/2025 10:37,2025-12-19T10:37:00Z,ITEM-000578,L1_STAGE,L1,Lost,,statecode → Lost
ITEM-000580,Update,stepname,14-Qualify,,ACTOR-0003,13/01/2026 08:25,2026-01-13T08:25:00Z,ITEM-000580,L1_STAGE,L1,,,stepname → 
ITEM-000580,Update,estimatedclosedate,1/30/26 0:00,3/27/26 0:00,ACTOR-0003,13/01/2026 08:25,2026-01-13T08:25:00Z,ITEM-000580,L1_STAGE,L1,3/27/26 0:00,,estimatedclosedate → 3/27/26 0:00
ITEM-000580,Update,stepname,Qualify,14-Qualify,ACTOR-0003,13/01/2026 08:27,2026-01-13T08:27:00Z,ITEM-000580,L1_STAGE,L1,14-Qualify,14.0,stepname → 14-Qualify
ITEM-000580,Update,the000g_revenuetype,,604720000,ACTOR-0003,13/01/2026 08:27,2026-01-13T08:27:00Z,ITEM-000580,L2_MILESTONE,L2,604720000,,the000g_revenuetype → 604720000
ITEM-000580,Update,the000g__revenuetype,,604720001,ACTOR-0003,13/01/2026 08:27,2026-01-13T08:27:00Z,ITEM-000580,L2_MILESTONE,L2,604720001,,the000g__revenuetype → 604720001
ITEM-000580,Update,the000g_isrenewal,,FALSE,ACTOR-0003,13/01/2026 08:27,2026-01-13T08:27:00Z,ITEM-000580,L3_ADMIN,L3,FALSE,,the000g_isrenewal changed
ITEM-000580,Update,stepname,,Qualify,ACTOR-0003,13/01/2026 08:27,2026-01-13T08:27:00Z,ITEM-000580,L1_STAGE,L1,Qualify,,stepname → Qualify
ITEM-000580,Update,owningbusinessunit,"businessunit,0a4ccfd6-e6d9-e611-80f2-5065f38aba91","businessunit,0a4ccfd6-e6d9-e611-80f2-5065f38aba91",ACTOR-0003,13/01/2026 12:58,2026-01-13T12:58:00Z,ITEM-000580,L3_ADMIN,L3,"businessunit,0a4ccfd6-e6d9-e611-80f2-5065f38aba91",,owningbusinessunit changed
ITEM-000580,Update,ownerid,"systemuser,09f34b91-4d86-4fc8-8b41-8af3d91e94bf","systemuser,b5f00e27-78b3-4a71-90af-5dcef3c25bba",ACTOR-0003,13/01/2026 12:58,2026-01-13T12:58:00Z,ITEM-000580,L3_ADMIN,L3,"systemuser,b5f00e27-78b3-4a71-90af-5dcef3c25bba",,Owner changed
ITEM-000580,Update,estimatedclosedate,3/27/26 0:00,5/14/26 0:00,ACTOR-0009,26/01/2026 15:39,2026-01-26T15:39:00Z,ITEM-000580,L1_STAGE,L1,5/14/26 0:00,,estimatedclosedate → 5/14/26 0:00
ITEM-000581,Update,owningbusinessunit,"businessunit,0a4ccfd6-e6d9-e611-80f2-5065f38aba91","businessunit,0a4ccfd6-e6d9-e611-80f2-5065f38aba91",ACTOR-0004,26/09/2025 09:20,2025-09-26T09:20:00Z,ITEM-000581,L3_ADMIN,L3,"businessunit,0a4ccfd6-e6d9-e611-80f2-5065f38aba91",,owningbusinessunit changed
ITEM-000581,Update,ownerid,"systemuser,09f34b91-4d86-4fc8-8b41-8af3d91e94bf","systemuser,b5f00e27-78b3-4a71-90af-5dcef3c25bba",ACTOR-0004,26/09/2025 09:20,2025-09-26T09:20:00Z,ITEM-000581,L3_ADMIN,L3,"systemuser,b5f00e27-78b3-4a71-90af-5dcef3c25bba",,Owner changed
ITEM-000583,Update,owningbusinessunit,"businessunit,0a4ccfd6-e6d9-e611-80f2-5065f38aba91","businessunit,0a4ccfd6-e6d9-e611-80f2-5065f38aba91",ACTOR-0003,26/08/2025 07:43,2025-08-26T07:43:00Z,ITEM-000583,L3_ADMIN,L3,"businessunit,0a4ccfd6-e6d9-e611-80f2-5065f38aba91",,owningbusinessunit changed
ITEM-000583,Update,ownerid,"systemuser,b5f00e27-78b3-4a71-90af-5dcef3c25bba","systemuser,efd3822d-8c8b-4619-8eb9-39ddf9c5c57f",ACTOR-0003,26/08/2025 07:43,2025-08-26T07:43:00Z,ITEM-000583,L3_ADMIN,L3,"systemuser,efd3822d-8c8b-4619-8eb9-39ddf9c5c57f",,Owner changed
ITEM-000584,Update,owningbusinessunit,"businessunit,0a4ccfd6-e6d9-e611-80f2-5065f38aba91","businessunit,0a4ccfd6-e6d9-e611-80f2-5065f38aba91",ACTOR-0003,27/08/2025 12:57,2025-08-27T12:57:00Z,ITEM-000584,L3_ADMIN,L3,"businessunit,0a4ccfd6-e6d9-e611-80f2-5065f38aba91",,owningbusinessunit changed
ITEM-000584,Update,ownerid,"systemuser,7b9d5323-2ef3-4d52-9d6c-dd45deb05e3b","systemuser,b5f00e27-78b3-4a71-90af-5dcef3c25bba",ACTOR-0003,27/08/2025 12:57,2025-08-27T12:57:00Z,ITEM-000584,L3_ADMIN,L3,"systemuser,b5f00e27-78b3-4a71-90af-5dcef3c25bba",,Owner changed
ITEM-000586,Update,stepname,,14-Qualify,ACTOR-0008,2/12/25 10:48,2025-02-12T10:48:00Z,ITEM-000586,L1_STAGE,L1,14-Qualify,14.0,stepname → 14-Qualify
ITEM-000586,Create,statecode,,0,ACTOR-0002,2/12/25 10:48,2025-02-12T10:48:00Z,ITEM-000586,L1_STAGE,L1,Open,,Case Created
ITEM-000586,Update,estimatedclosedate,1/29/26 0:00,2/5/26 0:00,ACTOR-0002,28/01/2026 16:28,2026-01-28T16:28:00Z,ITEM-000586,L1_STAGE,L1,2/5/26 0:00,,estimatedclosedate → 2/5/26 0:00
ITEM-000586,Update,the000g__revenuetype,,604720003,ACTOR-0002,12/1/26 9:56,2026-12-01T09:56:00Z,ITEM-000586,L2_MILESTONE,L2,604720003,,the000g__revenuetype → 604720003
ITEM-000586,Update,estimatedclosedate,1/22/26 0:00,1/29/26 0:00,ACTOR-0002,12/1/26 9:56,2026-12-01T09:56:00Z,ITEM-000586,L1_STAGE,L1,1/29/26 0:00,,estimatedclosedate → 1/29/26 0:00
ITEM-000588,Update,owningbusinessunit,"businessunit,0a4ccfd6-e6d9-e611-80f2-5065f38aba91","businessunit,0a4ccfd6-e6d9-e611-80f2-5065f38aba91",ACTOR-0002,8/1/26 9:40,2026-08-01T09:40:00Z,ITEM-000588,L3_ADMIN,L3,"businessunit,0a4ccfd6-e6d9-e611-80f2-5065f38aba91",,owningbusinessunit changed
ITEM-000588,Update,ownerid,"systemuser,7b9d5323-2ef3-4d52-9d6c-dd45deb05e3b","systemuser,efd3822d-8c8b-4619-8eb9-39ddf9c5c57f",ACTOR-0002,8/1/26 9:40,2026-08-01T09:40:00Z,ITEM-000588,L3_ADMIN,L3,"systemuser,efd3822d-8c8b-4619-8eb9-39ddf9c5c57f",,Owner changed
ITEM-000591,Update,owningbusinessunit,"businessunit,0a4ccfd6-e6d9-e611-80f2-5065f38aba91","businessunit,0a4ccfd6-e6d9-e611-80f2-5065f38aba91",ACTOR-0002,7/10/25 10:46,2025-07-10T10:46:00Z,ITEM-000591,L3_ADMIN,L3,"businessunit,0a4ccfd6-e6d9-e611-80f2-5065f38aba91",,owningbusinessunit changed
ITEM-000591,Update,ownerid,"systemuser,7b9d5323-2ef3-4d52-9d6c-dd45deb05e3b","systemuser,efd3822d-8c8b-4619-8eb9-39ddf9c5c57f",ACTOR-0002,7/10/25 10:46,2025-07-10T10:46:00Z,ITEM-000591,L3_ADMIN,L3,"systemuser,efd3822d-8c8b-4619-8eb9-39ddf9c5c57f",,Owner changed
ITEM-000594,Update,statuscode,1,3,ACTOR-0003,17/09/2025 14:37,2025-09-17T14:37:00Z,ITEM-000594,L1_STAGE,L1,Won,,statuscode → Won
ITEM-000594,Update,msdyn_forecastcategory,100000001,100000005,ACTOR-0003,17/09/2025 14:37,2025-09-17T14:37:00Z,ITEM-000594,L1_STAGE,L1,100000005,,msdyn_forecastcategory → 100000005
ITEM-000594,Update,actualclosedate,,9/17/25 0:00,ACTOR-0003,17/09/2025 14:37,2025-09-17T14:37:00Z,ITEM-000594,L1_STAGE,L1,9/17/25 0:00,,actualclosedate → 9/17/25 0:00
ITEM-000594,Update,salesstage,,3,ACTOR-0003,17/09/2025 14:37,2025-09-17T14:37:00Z,ITEM-000594,L1_STAGE,L1,3,,salesstage → 3
ITEM-000594,Update,statecode,0,1,ACTOR-0003,17/09/2025 14:37,2025-09-17T14:37:00Z,ITEM-000594,L1_STAGE,L1,Won,,statecode → Won
ITEM-000594,Update,the000g_revenuetype,,604720001,ACTOR-0003,11/8/25 8:51,2025-11-08T08:51:00Z,ITEM-000594,L2_MILESTONE,L2,604720001,,the000g_revenuetype → 604720001
ITEM-000594,Update,the000g_isrenewal,,FALSE,ACTOR-0003,11/8/25 8:51,2025-11-08T08:51:00Z,ITEM-000594,L3_ADMIN,L3,FALSE,,the000g_isrenewal changed
ITEM-000594,Update,estimatedclosedate,8/8/25 0:00,8/29/25 0:00,ACTOR-0003,11/8/25 8:51,2025-11-08T08:51:00Z,ITEM-000594,L1_STAGE,L1,8/29/25 0:00,,estimatedclosedate → 8/29/25 0:00
ITEM-000596,Update,owningbusinessunit,"businessunit,0a4ccfd6-e6d9-e611-80f2-5065f38aba91","businessunit,0a4ccfd6-e6d9-e611-80f2-5065f38aba91",ACTOR-0003,27/10/2025 11:18,2025-10-27T11:18:00Z,ITEM-000596,L3_ADMIN,L3,"businessunit,0a4ccfd6-e6d9-e611-80f2-5065f38aba91",,owningbusinessunit changed
ITEM-000596,Update,ownerid,"systemuser,2d7fbe83-3f35-4a1d-bc05-1b39dbf446d9","systemuser,efd3822d-8c8b-4619-8eb9-39ddf9c5c57f",ACTOR-0003,27/10/2025 11:18,2025-10-27T11:18:00Z,ITEM-000596,L3_ADMIN,L3,"systemuser,efd3822d-8c8b-4619-8eb9-39ddf9c5c57f",,Owner changed
ITEM-000597,Update,stepname,,14-Qualify,ACTOR-0008,14/08/2025 11:06,2025-08-14T11:06:00Z,ITEM-000597,L1_STAGE,L1,14-Qualify,14.0,stepname → 14-Qualify
ITEM-000597,Create,statecode,,0,ACTOR-0009,14/08/2025 11:06,2025-08-14T11:06:00Z,ITEM-000597,L1_STAGE,L1,Open,,Case Created
ITEM-000597,Update,estimatedclosedate,8/28/25 0:00,6/17/26 0:00,ACTOR-0009,29/10/2025 09:15,2025-10-29T09:15:00Z,ITEM-000597,L1_STAGE,L1,6/17/26 0:00,,estimatedclosedate → 6/17/26 0:00
ITEM-000600,Update,owningbusinessunit,"businessunit,0a4ccfd6-e6d9-e611-80f2-5065f38aba91","businessunit,0a4ccfd6-e6d9-e611-80f2-5065f38aba91",ACTOR-0003,27/10/2025 11:18,2025-10-27T11:18:00Z,ITEM-000600,L3_ADMIN,L3,"businessunit,0a4ccfd6-e6d9-e611-80f2-5065f38aba91",,owningbusinessunit changed
ITEM-000600,Update,ownerid,"systemuser,2d7fbe83-3f35-4a1d-bc05-1b39dbf446d9","systemuser,efd3822d-8c8b-4619-8eb9-39ddf9c5c57f",ACTOR-0003,27/10/2025 11:18,2025-10-27T11:18:00Z,ITEM-000600,L3_ADMIN,L3,"systemuser,efd3822d-8c8b-4619-8eb9-39ddf9c5c57f",,Owner changed
ITEM-000601,Update,stepname,,14-Qualify,ACTOR-0008,8/10/25 15:33,2025-08-10T15:33:00Z,ITEM-000601,L1_STAGE,L1,14-Qualify,14.0,stepname → 14-Qualify
ITEM-000601,Update,stepname,14-Qualify,15-Develop,ACTOR-0008,8/10/25 15:33,2025-08-10T15:33:00Z,ITEM-000601,L1_STAGE,L1,15-Develop,15.0,stepname → 15-Develop
ITEM-000601,Create,statecode,,0,ACTOR-0003,8/10/25 15:33,2025-08-10T15:33:00Z,ITEM-000601,L1_STAGE,L1,Open,,Case Created
ITEM-000601,Update,adx_readyfordistribution,FALSE,TRUE,ACTOR-0003,8/10/25 15:33,2025-08-10T15:33:00Z,ITEM-000601,L2_MILESTONE,L2,TRUE,,adx_readyfordistribution → TRUE
ITEM-000601,Update,estimatedclosedate,,10/24/25 0:00,ACTOR-0003,8/10/25 16:00,2025-08-10T16:00:00Z,ITEM-000601,L1_STAGE,L1,10/24/25 0:00,,estimatedclosedate → 10/24/25 0:00
ITEM-000601,Update,estimatedclosedate,10/24/25 0:00,11/14/25 0:00,ACTOR-0003,28/10/2025 14:14,2025-10-28T14:14:00Z,ITEM-000601,L1_STAGE,L1,11/14/25 0:00,,estimatedclosedate → 11/14/25 0:00
ITEM-000601,Update,statuscode,1,756150004,ACTOR-0003,11/11/25 9:51,2025-11-11T09:51:00Z,ITEM-000601,L1_STAGE,L1,756150004,,statuscode → 756150004
ITEM-000601,Update,msdyn_forecastcategory,100000001,100000006,ACTOR-0003,11/11/25 9:51,2025-11-11T09:51:00Z,ITEM-000601,L1_STAGE,L1,100000006,,msdyn_forecastcategory → 100000006
ITEM-000601,Update,actualclosedate,,11/11/25 0:00,ACTOR-0003,11/11/25 9:51,2025-11-11T09:51:00Z,ITEM-000601,L1_STAGE,L1,11/11/25 0:00,,actualclosedate → 11/11/25 0:00
ITEM-000601,Update,salesstage,,3,ACTOR-0003,11/11/25 9:51,2025-11-11T09:51:00Z,ITEM-000601,L1_STAGE,L1,3,,salesstage → 3
ITEM-000601,Update,statecode,0,2,ACTOR-0003,11/11/25 9:51,2025-11-11T09:51:00Z,ITEM-000601,L1_STAGE,L1,Lost,,statecode → Lost
ITEM-000602,Update,owningbusinessunit,"businessunit,0a4ccfd6-e6d9-e611-80f2-5065f38aba91","businessunit,0a4ccfd6-e6d9-e611-80f2-5065f38aba91",ACTOR-0003,27/10/2025 11:18,2025-10-27T11:18:00Z,ITEM-000602,L3_ADMIN,L3,"businessunit,0a4ccfd6-e6d9-e611-80f2-5065f38aba91",,owningbusinessunit changed
ITEM-000602,Update,ownerid,"systemuser,2d7fbe83-3f35-4a1d-bc05-1b39dbf446d9","systemuser,efd3822d-8c8b-4619-8eb9-39ddf9c5c57f",ACTOR-0003,27/10/2025 11:18,2025-10-27T11:18:00Z,ITEM-000602,L3_ADMIN,L3,"systemuser,efd3822d-8c8b-4619-8eb9-39ddf9c5c57f",,Owner changed
ITEM-000603,Update,owningbusinessunit,"businessunit,0a4ccfd6-e6d9-e611-80f2-5065f38aba91","businessunit,0a4ccfd6-e6d9-e611-80f2-5065f38aba91",ACTOR-0003,27/10/2025 11:18,2025-10-27T11:18:00Z,ITEM-000603,L3_ADMIN,L3,"businessunit,0a4ccfd6-e6d9-e611-80f2-5065f38aba91",,owningbusinessunit changed
ITEM-000603,Update,ownerid,"systemuser,2d7fbe83-3f35-4a1d-bc05-1b39dbf446d9","systemuser,efd3822d-8c8b-4619-8eb9-39ddf9c5c57f",ACTOR-0003,27/10/2025 11:18,2025-10-27T11:18:00Z,ITEM-000603,L3_ADMIN,L3,"systemuser,efd3822d-8c8b-4619-8eb9-39ddf9c5c57f",,Owner changed
ITEM-000604,Update,owningbusinessunit,"businessunit,0a4ccfd6-e6d9-e611-80f2-5065f38aba91","businessunit,0a4ccfd6-e6d9-e611-80f2-5065f38aba91",ACTOR-0002,22/08/2025 13:23,2025-08-22T13:23:00Z,ITEM-000604,L3_ADMIN,L3,"businessunit,0a4ccfd6-e6d9-e611-80f2-5065f38aba91",,owningbusinessunit changed
ITEM-000604,Update,ownerid,"systemuser,7b9d5323-2ef3-4d52-9d6c-dd45deb05e3b","systemuser,efd3822d-8c8b-4619-8eb9-39ddf9c5c57f",ACTOR-0002,22/08/2025 13:23,2025-08-22T13:23:00Z,ITEM-000604,L3_ADMIN,L3,"systemuser,efd3822d-8c8b-4619-8eb9-39ddf9c5c57f",,Owner changed
ITEM-000605,Update,owningbusinessunit,"businessunit,0a4ccfd6-e6d9-e611-80f2-5065f38aba91","businessunit,0a4ccfd6-e6d9-e611-80f2-5065f38aba91",ACTOR-0004,26/09/2025 09:20,2025-09-26T09:20:00Z,ITEM-000605,L3_ADMIN,L3,"businessunit,0a4ccfd6-e6d9-e611-80f2-5065f38aba91",,owningbusinessunit changed
ITEM-000605,Update,ownerid,"systemuser,1cba5fd4-6e4e-4e0f-85ff-a6438bc2f2f0","systemuser,b5f00e27-78b3-4a71-90af-5dcef3c25bba",ACTOR-0004,26/09/2025 09:20,2025-09-26T09:20:00Z,ITEM-000605,L3_ADMIN,L3,"systemuser,b5f00e27-78b3-4a71-90af-5dcef3c25bba",,Owner changed
ITEM-000606,Update,owningbusinessunit,"businessunit,0a4ccfd6-e6d9-e611-80f2-5065f38aba91","businessunit,0a4ccfd6-e6d9-e611-80f2-5065f38aba91",ACTOR-0002,22/08/2025 13:23,2025-08-22T13:23:00Z,ITEM-000606,L3_ADMIN,L3,"businessunit,0a4ccfd6-e6d9-e611-80f2-5065f38aba91",,owningbusinessunit changed
ITEM-000606,Update,ownerid,"systemuser,7b9d5323-2ef3-4d52-9d6c-dd45deb05e3b","systemuser,efd3822d-8c8b-4619-8eb9-39ddf9c5c57f",ACTOR-0002,22/08/2025 13:23,2025-08-22T13:23:00Z,ITEM-000606,L3_ADMIN,L3,"systemuser,efd3822d-8c8b-4619-8eb9-39ddf9c5c57f",,Owner changed
ITEM-000608,Update,owningbusinessunit,"businessunit,0a4ccfd6-e6d9-e611-80f2-5065f38aba91","businessunit,0a4ccfd6-e6d9-e611-80f2-5065f38aba91",ACTOR-0004,26/09/2025 09:20,2025-09-26T09:20:00Z,ITEM-000608,L3_ADMIN,L3,"businessunit,0a4ccfd6-e6d9-e611-80f2-5065f38aba91",,owningbusinessunit changed
ITEM-000608,Update,ownerid,"systemuser,1cba5fd4-6e4e-4e0f-85ff-a6438bc2f2f0","systemuser,b5f00e27-78b3-4a71-90af-5dcef3c25bba",ACTOR-0004,26/09/2025 09:20,2025-09-26T09:20:00Z,ITEM-000608,L3_ADMIN,L3,"systemuser,b5f00e27-78b3-4a71-90af-5dcef3c25bba",,Owner changed
ITEM-000609,Update,owningbusinessunit,"businessunit,0a4ccfd6-e6d9-e611-80f2-5065f38aba91","businessunit,0a4ccfd6-e6d9-e611-80f2-5065f38aba91",ACTOR-0003,26/08/2025 07:43,2025-08-26T07:43:00Z,ITEM-000609,L3_ADMIN,L3,"businessunit,0a4ccfd6-e6d9-e611-80f2-5065f38aba91",,owningbusinessunit changed
ITEM-000609,Update,ownerid,"systemuser,b5f00e27-78b3-4a71-90af-5dcef3c25bba","systemuser,efd3822d-8c8b-4619-8eb9-39ddf9c5c57f",ACTOR-0003,26/08/2025 07:43,2025-08-26T07:43:00Z,ITEM-000609,L3_ADMIN,L3,"systemuser,efd3822d-8c8b-4619-8eb9-39ddf9c5c57f",,Owner changed
ITEM-000610,Update,owningbusinessunit,"businessunit,0a4ccfd6-e6d9-e611-80f2-5065f38aba91","businessunit,0a4ccfd6-e6d9-e611-80f2-5065f38aba91",ACTOR-0002,7/10/25 10:46,2025-07-10T10:46:00Z,ITEM-000610,L3_ADMIN,L3,"businessunit,0a4ccfd6-e6d9-e611-80f2-5065f38aba91",,owningbusinessunit changed
ITEM-000610,Update,ownerid,"systemuser,7b9d5323-2ef3-4d52-9d6c-dd45deb05e3b","systemuser,efd3822d-8c8b-4619-8eb9-39ddf9c5c57f",ACTOR-0002,7/10/25 10:46,2025-07-10T10:46:00Z,ITEM-000610,L3_ADMIN,L3,"systemuser,efd3822d-8c8b-4619-8eb9-39ddf9c5c57f",,Owner changed
ITEM-000611,Update,owningbusinessunit,"businessunit,0a4ccfd6-e6d9-e611-80f2-5065f38aba91","businessunit,0a4ccfd6-e6d9-e611-80f2-5065f38aba91",ACTOR-0003,27/08/2025 12:57,2025-08-27T12:57:00Z,ITEM-000611,L3_ADMIN,L3,"businessunit,0a4ccfd6-e6d9-e611-80f2-5065f38aba91",,owningbusinessunit changed
ITEM-000611,Update,ownerid,"systemuser,7b9d5323-2ef3-4d52-9d6c-dd45deb05e3b","systemuser,b5f00e27-78b3-4a71-90af-5dcef3c25bba",ACTOR-0003,27/08/2025 12:57,2025-08-27T12:57:00Z,ITEM-000611,L3_ADMIN,L3,"systemuser,b5f00e27-78b3-4a71-90af-5dcef3c25bba",,Owner changed
ITEM-000612,Update,stepname,,14-Qualify,ACTOR-0008,8/9/25 9:00,2025-08-09T09:00:00Z,ITEM-000612,L1_STAGE,L1,14-Qualify,14.0,stepname → 14-Qualify
ITEM-000612,Create,statecode,,0,ACTOR-0002,8/9/25 9:00,2025-08-09T09:00:00Z,ITEM-000612,L1_STAGE,L1,Open,,Case Created
ITEM-000612,Update,purchaseprocess,,0,ACTOR-0002,18/09/2025 09:11,2025-09-18T09:11:00Z,ITEM-000612,L2_MILESTONE,L2,0,,purchaseprocess → 0
ITEM-000612,Update,new_contracttermmonths,,12,ACTOR-0002,18/09/2025 09:11,2025-09-18T09:11:00Z,ITEM-000612,L2_MILESTONE,L2,12,,new_contracttermmonths → 12
ITEM-000612,Update,closeprobability,,75,ACTOR-0002,18/09/2025 09:11,2025-09-18T09:11:00Z,ITEM-000612,L1_STAGE,L1,75,,closeprobability → 75
ITEM-000612,Update,stepname,14-Qualify,15-Develop,ACTOR-0008,27/10/2025 10:33,2025-10-27T10:33:00Z,ITEM-000612,L1_STAGE,L1,15-Develop,15.0,stepname → 15-Develop
ITEM-000612,Update,purchasetimeframe,,0,ACTOR-0002,27/10/2025 10:33,2025-10-27T10:33:00Z,ITEM-000612,L2_MILESTONE,L2,0,,purchasetimeframe → 0
ITEM-000612,Update,the000g_revenuetype,604720000,604720002,ACTOR-0002,27/10/2025 10:33,2025-10-27T10:33:00Z,ITEM-000612,L2_MILESTONE,L2,604720002,,the000g_revenuetype → 604720002
ITEM-000612,Update,the000g_isrenewal,FALSE,TRUE,ACTOR-0002,27/10/2025 10:33,2025-10-27T10:33:00Z,ITEM-000612,L3_ADMIN,L3,TRUE,,the000g_isrenewal changed
ITEM-000612,Update,stepname,15-Develop,16-Propose,ACTOR-0008,27/10/2025 10:34,2025-10-27T10:34:00Z,ITEM-000612,L1_STAGE,L1,16-Propose,16.0,stepname → 16-Propose
ITEM-000612,Update,closeprobability,75,100,ACTOR-0002,29/10/2025 15:55,2025-10-29T15:55:00Z,ITEM-000612,L1_STAGE,L1,100,,closeprobability → 100
ITEM-000612,Update,stepname,16-Propose,17-Close,ACTOR-0008,29/10/2025 16:23,2025-10-29T16:23:00Z,ITEM-000612,L1_STAGE,L1,17-Close,17.0,stepname → 17-Close
ITEM-000612,Update,completefinalproposal,FALSE,TRUE,ACTOR-0002,29/10/2025 16:23,2025-10-29T16:23:00Z,ITEM-000612,L2_MILESTONE,L2,TRUE,,completefinalproposal completed
ITEM-000612,Update,presentfinalproposal,FALSE,TRUE,ACTOR-0002,29/10/2025 16:23,2025-10-29T16:23:00Z,ITEM-000612,L2_MILESTONE,L2,TRUE,,presentfinalproposal completed
ITEM-000612,Update,statuscode,1,3,ACTOR-0002,29/10/2025 16:26,2025-10-29T16:26:00Z,ITEM-000612,L1_STAGE,L1,Won,,statuscode → Won
ITEM-000612,Update,msdyn_forecastcategory,100000001,100000005,ACTOR-0002,29/10/2025 16:26,2025-10-29T16:26:00Z,ITEM-000612,L1_STAGE,L1,100000005,,msdyn_forecastcategory → 100000005
ITEM-000612,Update,actualclosedate,,10/29/25 0:00,ACTOR-0002,29/10/2025 16:26,2025-10-29T16:26:00Z,ITEM-000612,L1_STAGE,L1,10/29/25 0:00,,actualclosedate → 10/29/25 0:00
ITEM-000612,Update,salesstage,,3,ACTOR-0002,29/10/2025 16:26,2025-10-29T16:26:00Z,ITEM-000612,L1_STAGE,L1,3,,salesstage → 3
ITEM-000612,Update,statecode,0,1,ACTOR-0002,29/10/2025 16:26,2025-10-29T16:26:00Z,ITEM-000612,L1_STAGE,L1,Won,,statecode → Won
ITEM-000613,Update,stepname,,14-Qualify,ACTOR-0008,21/10/2025 09:51,2025-10-21T09:51:00Z,ITEM-000613,L1_STAGE,L1,14-Qualify,14.0,stepname → 14-Qualify
ITEM-000613,Create,purchaseprocess,,0,ACTOR-0003,21/10/2025 09:51,2025-10-21T09:51:00Z,ITEM-000613,L2_MILESTONE,L2,0,,Case Created
ITEM-000613,Update,statuscode,1,3,ACTOR-0003,11/11/25 16:05,2025-11-11T16:05:00Z,ITEM-000613,L1_STAGE,L1,Won,,statuscode → Won
ITEM-000613,Update,msdyn_forecastcategory,100000001,100000005,ACTOR-0003,11/11/25 16:05,2025-11-11T16:05:00Z,ITEM-000613,L1_STAGE,L1,100000005,,msdyn_forecastcategory → 100000005
ITEM-000613,Update,actualclosedate,,11/11/25 0:00,ACTOR-0003,11/11/25 16:05,2025-11-11T16:05:00Z,ITEM-000613,L1_STAGE,L1,11/11/25 0:00,,actualclosedate → 11/11/25 0:00
ITEM-000613,Update,salesstage,,3,ACTOR-0003,11/11/25 16:05,2025-11-11T16:05:00Z,ITEM-000613,L1_STAGE,L1,3,,salesstage → 3
ITEM-000613,Update,statecode,0,1,ACTOR-0003,11/11/25 16:05,2025-11-11T16:05:00Z,ITEM-000613,L1_STAGE,L1,Won,,statecode → Won
ITEM-000613,Update,msdyn_ordertype,192350001,192350000,ACTOR-0003,11/11/25 16:05,2025-11-11T16:05:00Z,ITEM-000613,L2_MILESTONE,L2,192350000,,msdyn_ordertype → 192350000
ITEM-000614,Update,stepname,,14-Qualify,ACTOR-0008,22/10/2025 16:51,2025-10-22T16:51:00Z,ITEM-000614,L1_STAGE,L1,14-Qualify,14.0,stepname → 14-Qualify
ITEM-000614,Create,statecode,,0,ACTOR-0003,22/10/2025 16:51,2025-10-22T16:51:00Z,ITEM-000614,L1_STAGE,L1,Open,,Case Created
ITEM-000614,Update,statuscode,1,3,ACTOR-0003,25/11/2025 15:22,2025-11-25T15:22:00Z,ITEM-000614,L1_STAGE,L1,Won,,statuscode → Won
ITEM-000614,Update,msdyn_forecastcategory,100000001,100000005,ACTOR-0003,25/11/2025 15:22,2025-11-25T15:22:00Z,ITEM-000614,L1_STAGE,L1,100000005,,msdyn_forecastcategory → 100000005
ITEM-000614,Update,actualclosedate,,11/25/25 0:00,ACTOR-0003,25/11/2025 15:22,2025-11-25T15:22:00Z,ITEM-000614,L1_STAGE,L1,11/25/25 0:00,,actualclosedate → 11/25/25 0:00
ITEM-000614,Update,salesstage,,3,ACTOR-0003,25/11/2025 15:22,2025-11-25T15:22:00Z,ITEM-000614,L1_STAGE,L1,3,,salesstage → 3
ITEM-000614,Update,statecode,0,1,ACTOR-0003,25/11/2025 15:22,2025-11-25T15:22:00Z,ITEM-000614,L1_STAGE,L1,Won,,statecode → Won
ITEM-000615,Update,stepname,,14-Qualify,ACTOR-0008,19/12/2025 10:01,2025-12-19T10:01:00Z,ITEM-000615,L1_STAGE,L1,14-Qualify,14.0,stepname → 14-Qualify
ITEM-000615,Create,statecode,,0,ACTOR-0005,19/12/2025 10:01,2025-12-19T10:01:00Z,ITEM-000615,L1_STAGE,L1,Open,,Case Created
ITEM-000617,Update,statuscode,1,4,ACTOR-0009,6/10/25 9:49,2025-06-10T09:49:00Z,ITEM-000617,L1_STAGE,L1,Canceled,,statuscode → Canceled
ITEM-000617,Update,msdyn_forecastcategory,100000001,100000006,ACTOR-0009,6/10/25 9:49,2025-06-10T09:49:00Z,ITEM-000617,L1_STAGE,L1,100000006,,msdyn_forecastcategory → 100000006
ITEM-000617,Update,actualclosedate,,10/6/25 0:00,ACTOR-0009,6/10/25 9:49,2025-06-10T09:49:00Z,ITEM-000617,L1_STAGE,L1,10/6/25 0:00,,actualclosedate → 10/6/25 0:00
ITEM-000617,Update,salesstage,,3,ACTOR-0009,6/10/25 9:49,2025-06-10T09:49:00Z,ITEM-000617,L1_STAGE,L1,3,,salesstage → 3
ITEM-000617,Update,statecode,0,2,ACTOR-0009,6/10/25 9:49,2025-06-10T09:49:00Z,ITEM-000617,L1_STAGE,L1,Lost,,statecode → Lost
ITEM-000618,Update,owningbusinessunit,"businessunit,0a4ccfd6-e6d9-e611-80f2-5065f38aba91","businessunit,0a4ccfd6-e6d9-e611-80f2-5065f38aba91",ACTOR-0003,26/08/2025 07:43,2025-08-26T07:43:00Z,ITEM-000618,L3_ADMIN,L3,"businessunit,0a4ccfd6-e6d9-e611-80f2-5065f38aba91",,owningbusinessunit changed
ITEM-000618,Update,ownerid,"systemuser,b5f00e27-78b3-4a71-90af-5dcef3c25bba","systemuser,efd3822d-8c8b-4619-8eb9-39ddf9c5c57f",ACTOR-0003,26/08/2025 07:43,2025-08-26T07:43:00Z,ITEM-000618,L3_ADMIN,L3,"systemuser,efd3822d-8c8b-4619-8eb9-39ddf9c5c57f",,Owner changed
ITEM-000619,Update,stepname,,14-Qualify,ACTOR-0008,6/10/25 11:29,2025-06-10T11:29:00Z,ITEM-000619,L1_STAGE,L1,14-Qualify,14.0,stepname → 14-Qualify
ITEM-000619,Create,statecode,,0,ACTOR-0009,6/10/25 11:29,2025-06-10T11:29:00Z,ITEM-000619,L1_STAGE,L1,Open,,Case Created
ITEM-000619,Update,estimatedclosedate,10/30/25 0:00,11/27/25 0:00,ACTOR-0009,29/10/2025 09:17,2025-10-29T09:17:00Z,ITEM-000619,L1_STAGE,L1,11/27/25 0:00,,estimatedclosedate → 11/27/25 0:00
ITEM-000619,Update,statuscode,1,3,ACTOR-0009,11/11/25 13:44,2025-11-11T13:44:00Z,ITEM-000619,L1_STAGE,L1,Won,,statuscode → Won
ITEM-000619,Update,msdyn_forecastcategory,100000001,100000005,ACTOR-0009,11/11/25 13:44,2025-11-11T13:44:00Z,ITEM-000619,L1_STAGE,L1,100000005,,msdyn_forecastcategory → 100000005
ITEM-000619,Update,actualclosedate,,11/11/25 0:00,ACTOR-0009,11/11/25 13:44,2025-11-11T13:44:00Z,ITEM-000619,L1_STAGE,L1,11/11/25 0:00,,actualclosedate → 11/11/25 0:00
ITEM-000619,Update,salesstage,,3,ACTOR-0009,11/11/25 13:44,2025-11-11T13:44:00Z,ITEM-000619,L1_STAGE,L1,3,,salesstage → 3
ITEM-000619,Update,statecode,0,1,ACTOR-0009,11/11/25 13:44,2025-11-11T13:44:00Z,ITEM-000619,L1_STAGE,L1,Won,,statecode → Won
ITEM-000620,Update,stepname,,14-Qualify,ACTOR-0008,30/09/2025 09:31,2025-09-30T09:31:00Z,ITEM-000620,L1_STAGE,L1,14-Qualify,14.0,stepname → 14-Qualify
ITEM-000620,Create,statecode,,0,ACTOR-0009,30/09/2025 09:31,2025-09-30T09:31:00Z,ITEM-000620,L1_STAGE,L1,Open,,Case Created
ITEM-000621,Update,owningbusinessunit,"businessunit,0a4ccfd6-e6d9-e611-80f2-5065f38aba91","businessunit,0a4ccfd6-e6d9-e611-80f2-5065f38aba91",ACTOR-0002,7/10/25 10:46,2025-07-10T10:46:00Z,ITEM-000621,L3_ADMIN,L3,"businessunit,0a4ccfd6-e6d9-e611-80f2-5065f38aba91",,owningbusinessunit changed
ITEM-000621,Update,ownerid,"systemuser,7b9d5323-2ef3-4d52-9d6c-dd45deb05e3b","systemuser,efd3822d-8c8b-4619-8eb9-39ddf9c5c57f",ACTOR-0002,7/10/25 10:46,2025-07-10T10:46:00Z,ITEM-000621,L3_ADMIN,L3,"systemuser,efd3822d-8c8b-4619-8eb9-39ddf9c5c57f",,Owner changed
ITEM-000622,Update,owningbusinessunit,"businessunit,0a4ccfd6-e6d9-e611-80f2-5065f38aba91","businessunit,0a4ccfd6-e6d9-e611-80f2-5065f38aba91",ACTOR-0003,26/08/2025 07:42,2025-08-26T07:42:00Z,ITEM-000622,L3_ADMIN,L3,"businessunit,0a4ccfd6-e6d9-e611-80f2-5065f38aba91",,owningbusinessunit changed
ITEM-000622,Update,ownerid,"systemuser,ddf0a409-01d5-4caa-bd27-c1b42fee109e","systemuser,efd3822d-8c8b-4619-8eb9-39ddf9c5c57f",ACTOR-0003,26/08/2025 07:42,2025-08-26T07:42:00Z,ITEM-000622,L3_ADMIN,L3,"systemuser,efd3822d-8c8b-4619-8eb9-39ddf9c5c57f",,Owner changed
ITEM-000623,Update,statuscode,1,4,ACTOR-0009,29/10/2025 09:20,2025-10-29T09:20:00Z,ITEM-000623,L1_STAGE,L1,Canceled,,statuscode → Canceled
ITEM-000623,Update,msdyn_forecastcategory,100000001,100000006,ACTOR-0009,29/10/2025 09:20,2025-10-29T09:20:00Z,ITEM-000623,L1_STAGE,L1,100000006,,msdyn_forecastcategory → 100000006
ITEM-000623,Update,actualclosedate,,10/29/25 0:00,ACTOR-0009,29/10/2025 09:20,2025-10-29T09:20:00Z,ITEM-000623,L1_STAGE,L1,10/29/25 0:00,,actualclosedate → 10/29/25 0:00
ITEM-000623,Update,salesstage,,3,ACTOR-0009,29/10/2025 09:20,2025-10-29T09:20:00Z,ITEM-000623,L1_STAGE,L1,3,,salesstage → 3
ITEM-000623,Update,statecode,0,2,ACTOR-0009,29/10/2025 09:20,2025-10-29T09:20:00Z,ITEM-000623,L1_STAGE,L1,Lost,,statecode → Lost
ITEM-000626,Update,stepname,,14-Qualify,ACTOR-0008,20/08/2025 15:34,2025-08-20T15:34:00Z,ITEM-000626,L1_STAGE,L1,14-Qualify,14.0,stepname → 14-Qualify
ITEM-000626,Create,statecode,,0,ACTOR-0002,20/08/2025 15:34,2025-08-20T15:34:00Z,ITEM-000626,L1_STAGE,L1,Open,,Case Created
ITEM-000626,Update,estimatedclosedate,11/27/25 0:00,1/29/26 0:00,ACTOR-0002,29/10/2025 06:46,2025-10-29T06:46:00Z,ITEM-000626,L1_STAGE,L1,1/29/26 0:00,,estimatedclosedate → 1/29/26 0:00
ITEM-000626,Update,the000g__revenuetype,,604720002,ACTOR-0002,5/1/26 9:53,2026-05-01T09:53:00Z,ITEM-000626,L2_MILESTONE,L2,604720002,,the000g__revenuetype → 604720002
ITEM-000626,Update,estimatedclosedate,1/29/26 0:00,2/26/26 0:00,ACTOR-0002,5/1/26 9:53,2026-05-01T09:53:00Z,ITEM-000626,L1_STAGE,L1,2/26/26 0:00,,estimatedclosedate → 2/26/26 0:00
ITEM-000626,Update,closeprobability,,25,ACTOR-0002,12/1/26 15:45,2026-12-01T15:45:00Z,ITEM-000626,L1_STAGE,L1,25,,closeprobability → 25
ITEM-000626,Update,purchaseprocess,2,0,ACTOR-0002,12/1/26 15:45,2026-12-01T15:45:00Z,ITEM-000626,L2_MILESTONE,L2,0,,purchaseprocess → 0
ITEM-000627,Update,owningbusinessunit,"businessunit,0a4ccfd6-e6d9-e611-80f2-5065f38aba91","businessunit,0a4ccfd6-e6d9-e611-80f2-5065f38aba91",ACTOR-0004,26/09/2025 09:21,2025-09-26T09:21:00Z,ITEM-000627,L3_ADMIN,L3,"businessunit,0a4ccfd6-e6d9-e611-80f2-5065f38aba91",,owningbusinessunit changed
ITEM-000627,Update,ownerid,"systemuser,1cba5fd4-6e4e-4e0f-85ff-a6438bc2f2f0","systemuser,09f34b91-4d86-4fc8-8b41-8af3d91e94bf",ACTOR-0004,26/09/2025 09:21,2025-09-26T09:21:00Z,ITEM-000627,L3_ADMIN,L3,"systemuser,09f34b91-4d86-4fc8-8b41-8af3d91e94bf",,Owner changed
ITEM-000628,Update,stepname,,14-Qualify,ACTOR-0008,9/9/25 12:56,2025-09-09T12:56:00Z,ITEM-000628,L1_STAGE,L1,14-Qualify,14.0,stepname → 14-Qualify
ITEM-000628,Create,statecode,,0,ACTOR-0009,9/9/25 12:56,2025-09-09T12:56:00Z,ITEM-000628,L1_STAGE,L1,Open,,Case Created
ITEM-000628,Update,the000g_revenuetype,604720001,604720002,ACTOR-0009,9/9/25 12:56,2025-09-09T12:56:00Z,ITEM-000628,L2_MILESTONE,L2,604720002,,the000g_revenuetype → 604720002
ITEM-000629,Update,owningbusinessunit,"businessunit,0a4ccfd6-e6d9-e611-80f2-5065f38aba91","businessunit,0a4ccfd6-e6d9-e611-80f2-5065f38aba91",ACTOR-0002,7/10/25 10:45,2025-07-10T10:45:00Z,ITEM-000629,L3_ADMIN,L3,"businessunit,0a4ccfd6-e6d9-e611-80f2-5065f38aba91",,owningbusinessunit changed
ITEM-000629,Update,ownerid,"systemuser,7b9d5323-2ef3-4d52-9d6c-dd45deb05e3b","systemuser,efd3822d-8c8b-4619-8eb9-39ddf9c5c57f",ACTOR-0002,7/10/25 10:45,2025-07-10T10:45:00Z,ITEM-000629,L3_ADMIN,L3,"systemuser,efd3822d-8c8b-4619-8eb9-39ddf9c5c57f",,Owner changed
ITEM-000630,Update,owningbusinessunit,"businessunit,0a4ccfd6-e6d9-e611-80f2-5065f38aba91","businessunit,0a4ccfd6-e6d9-e611-80f2-5065f38aba91",ACTOR-0002,22/08/2025 13:23,2025-08-22T13:23:00Z,ITEM-000630,L3_ADMIN,L3,"businessunit,0a4ccfd6-e6d9-e611-80f2-5065f38aba91",,owningbusinessunit changed
ITEM-000630,Update,ownerid,"systemuser,7b9d5323-2ef3-4d52-9d6c-dd45deb05e3b","systemuser,efd3822d-8c8b-4619-8eb9-39ddf9c5c57f",ACTOR-0002,22/08/2025 13:23,2025-08-22T13:23:00Z,ITEM-000630,L3_ADMIN,L3,"systemuser,efd3822d-8c8b-4619-8eb9-39ddf9c5c57f",,Owner changed
ITEM-000632,Update,owningbusinessunit,"businessunit,0a4ccfd6-e6d9-e611-80f2-5065f38aba91","businessunit,0a4ccfd6-e6d9-e611-80f2-5065f38aba91",ACTOR-0002,22/08/2025 13:23,2025-08-22T13:23:00Z,ITEM-000632,L3_ADMIN,L3,"businessunit,0a4ccfd6-e6d9-e611-80f2-5065f38aba91",,owningbusinessunit changed
ITEM-000632,Update,ownerid,"systemuser,7b9d5323-2ef3-4d52-9d6c-dd45deb05e3b","systemuser,efd3822d-8c8b-4619-8eb9-39ddf9c5c57f",ACTOR-0002,22/08/2025 13:23,2025-08-22T13:23:00Z,ITEM-000632,L3_ADMIN,L3,"systemuser,efd3822d-8c8b-4619-8eb9-39ddf9c5c57f",,Owner changed
ITEM-000633,Update,owningbusinessunit,"businessunit,0a4ccfd6-e6d9-e611-80f2-5065f38aba91","businessunit,0a4ccfd6-e6d9-e611-80f2-5065f38aba91",ACTOR-0002,7/10/25 10:45,2025-07-10T10:45:00Z,ITEM-000633,L3_ADMIN,L3,"businessunit,0a4ccfd6-e6d9-e611-80f2-5065f38aba91",,owningbusinessunit changed
ITEM-000633,Update,ownerid,"systemuser,7b9d5323-2ef3-4d52-9d6c-dd45deb05e3b","systemuser,efd3822d-8c8b-4619-8eb9-39ddf9c5c57f",ACTOR-0002,7/10/25 10:45,2025-07-10T10:45:00Z,ITEM-000633,L3_ADMIN,L3,"systemuser,efd3822d-8c8b-4619-8eb9-39ddf9c5c57f",,Owner changed
ITEM-000634,Update,owningbusinessunit,"businessunit,0a4ccfd6-e6d9-e611-80f2-5065f38aba91","businessunit,0a4ccfd6-e6d9-e611-80f2-5065f38aba91",ACTOR-0002,7/10/25 10:45,2025-07-10T10:45:00Z,ITEM-000634,L3_ADMIN,L3,"businessunit,0a4ccfd6-e6d9-e611-80f2-5065f38aba91",,owningbusinessunit changed
ITEM-000634,Update,ownerid,"systemuser,7b9d5323-2ef3-4d52-9d6c-dd45deb05e3b","systemuser,efd3822d-8c8b-4619-8eb9-39ddf9c5c57f",ACTOR-0002,7/10/25 10:45,2025-07-10T10:45:00Z,ITEM-000634,L3_ADMIN,L3,"systemuser,efd3822d-8c8b-4619-8eb9-39ddf9c5c57f",,Owner changed
ITEM-000636,Update,stepname,,14-Qualify,ACTOR-0008,28/10/2025 10:09,2025-10-28T10:09:00Z,ITEM-000636,L1_STAGE,L1,14-Qualify,14.0,stepname → 14-Qualify
ITEM-000636,Create,statecode,,0,ACTOR-0002,28/10/2025 10:09,2025-10-28T10:09:00Z,ITEM-000636,L1_STAGE,L1,Open,,Case Created
ITEM-000636,Update,the000g__revenuetype,,604720001,ACTOR-0002,6/1/26 11:19,2026-06-01T11:19:00Z,ITEM-000636,L2_MILESTONE,L2,604720001,,the000g__revenuetype → 604720001
ITEM-000636,Update,estimatedclosedate,1/29/26 0:00,3/9/26 0:00,ACTOR-0002,6/1/26 11:19,2026-06-01T11:19:00Z,ITEM-000636,L1_STAGE,L1,3/9/26 0:00,,estimatedclosedate → 3/9/26 0:00
ITEM-000637,Update,owningbusinessunit,"businessunit,0a4ccfd6-e6d9-e611-80f2-5065f38aba91","businessunit,0a4ccfd6-e6d9-e611-80f2-5065f38aba91",ACTOR-0002,16/10/2025 10:39,2025-10-16T10:39:00Z,ITEM-000637,L3_ADMIN,L3,"businessunit,0a4ccfd6-e6d9-e611-80f2-5065f38aba91",,owningbusinessunit changed
ITEM-000637,Update,ownerid,"systemuser,9ab13e3b-1ff4-4d57-a2c8-d0c8f2ce3f42","systemuser,efd3822d-8c8b-4619-8eb9-39ddf9c5c57f",ACTOR-0002,16/10/2025 10:39,2025-10-16T10:39:00Z,ITEM-000637,L3_ADMIN,L3,"systemuser,efd3822d-8c8b-4619-8eb9-39ddf9c5c57f",,Owner changed
ITEM-000638,Update,owningbusinessunit,"businessunit,0a4ccfd6-e6d9-e611-80f2-5065f38aba91","businessunit,0a4ccfd6-e6d9-e611-80f2-5065f38aba91",ACTOR-0002,7/10/25 10:45,2025-07-10T10:45:00Z,ITEM-000638,L3_ADMIN,L3,"businessunit,0a4ccfd6-e6d9-e611-80f2-5065f38aba91",,owningbusinessunit changed
ITEM-000638,Update,ownerid,"systemuser,7b9d5323-2ef3-4d52-9d6c-dd45deb05e3b","systemuser,efd3822d-8c8b-4619-8eb9-39ddf9c5c57f",ACTOR-0002,7/10/25 10:45,2025-07-10T10:45:00Z,ITEM-000638,L3_ADMIN,L3,"systemuser,efd3822d-8c8b-4619-8eb9-39ddf9c5c57f",,Owner changed
ITEM-000640,Update,owningbusinessunit,"businessunit,0a4ccfd6-e6d9-e611-80f2-5065f38aba91","businessunit,0a4ccfd6-e6d9-e611-80f2-5065f38aba91",ACTOR-0002,22/08/2025 13:23,2025-08-22T13:23:00Z,ITEM-000640,L3_ADMIN,L3,"businessunit,0a4ccfd6-e6d9-e611-80f2-5065f38aba91",,owningbusinessunit changed
ITEM-000640,Update,ownerid,"systemuser,7b9d5323-2ef3-4d52-9d6c-dd45deb05e3b","systemuser,efd3822d-8c8b-4619-8eb9-39ddf9c5c57f",ACTOR-0002,22/08/2025 13:23,2025-08-22T13:23:00Z,ITEM-000640,L3_ADMIN,L3,"systemuser,efd3822d-8c8b-4619-8eb9-39ddf9c5c57f",,Owner changed
ITEM-000641,Update,stepname,14-Qualify,15-Develop,ACTOR-0008,6/10/25 14:35,2025-06-10T14:35:00Z,ITEM-000641,L1_STAGE,L1,15-Develop,15.0,stepname → 15-Develop
ITEM-000641,Update,the000g_revenuetype,,604720000,ACTOR-0003,6/10/25 14:36,2025-06-10T14:36:00Z,ITEM-000641,L2_MILESTONE,L2,604720000,,the000g_revenuetype → 604720000
ITEM-000641,Update,the000g_isrenewal,,FALSE,ACTOR-0003,6/10/25 14:36,2025-06-10T14:36:00Z,ITEM-000641,L3_ADMIN,L3,FALSE,,the000g_isrenewal changed
ITEM-000641,Update,estimatedclosedate,12/12/25 0:00,2/20/26 0:00,ACTOR-0003,11/11/25 9:57,2025-11-11T09:57:00Z,ITEM-000641,L1_STAGE,L1,2/20/26 0:00,,estimatedclosedate → 2/20/26 0:00
ITEM-000641,Update,stepname,15-Develop,16-Propose,ACTOR-0008,6/1/26 9:34,2026-06-01T09:34:00Z,ITEM-000641,L1_STAGE,L1,16-Propose,16.0,stepname → 16-Propose
ITEM-000641,Update,stepname,16-Propose,17-Close,ACTOR-0008,6/1/26 9:34,2026-06-01T09:34:00Z,ITEM-000641,L1_STAGE,L1,17-Close,17.0,stepname → 17-Close
ITEM-000641,Update,the000g__revenuetype,,604720001,ACTOR-0003,6/1/26 9:34,2026-06-01T09:34:00Z,ITEM-000641,L2_MILESTONE,L2,604720001,,the000g__revenuetype → 604720001
ITEM-000641,Update,new_contractterm,,100000004,ACTOR-0003,6/1/26 9:35,2026-06-01T09:35:00Z,ITEM-000641,L2_MILESTONE,L2,100000004,,new_contractterm → 100000004
ITEM-000642,Update,owningbusinessunit,"businessunit,0a4ccfd6-e6d9-e611-80f2-5065f38aba91","businessunit,0a4ccfd6-e6d9-e611-80f2-5065f38aba91",ACTOR-0002,7/10/25 10:45,2025-07-10T10:45:00Z,ITEM-000642,L3_ADMIN,L3,"businessunit,0a4ccfd6-e6d9-e611-80f2-5065f38aba91",,owningbusinessunit changed
ITEM-000642,Update,ownerid,"systemuser,7b9d5323-2ef3-4d52-9d6c-dd45deb05e3b","systemuser,efd3822d-8c8b-4619-8eb9-39ddf9c5c57f",ACTOR-0002,7/10/25 10:45,2025-07-10T10:45:00Z,ITEM-000642,L3_ADMIN,L3,"systemuser,efd3822d-8c8b-4619-8eb9-39ddf9c5c57f",,Owner changed
ITEM-000643,Update,stepname,14-Qualify,15-Develop,ACTOR-0008,1/12/25 10:40,2025-01-12T10:40:00Z,ITEM-000643,L1_STAGE,L1,15-Develop,15.0,stepname → 15-Develop
ITEM-000643,Update,stepname,15-Develop,16-Propose,ACTOR-0008,1/12/25 10:40,2025-01-12T10:40:00Z,ITEM-000643,L1_STAGE,L1,16-Propose,16.0,stepname → 16-Propose
ITEM-000643,Update,stepname,16-Propose,17-Close,ACTOR-0008,1/12/25 10:40,2025-01-12T10:40:00Z,ITEM-000643,L1_STAGE,L1,17-Close,17.0,stepname → 17-Close
ITEM-000643,Update,statuscode,1,756150004,ACTOR-0002,1/12/25 10:41,2025-01-12T10:41:00Z,ITEM-000643,L1_STAGE,L1,756150004,,statuscode → 756150004
ITEM-000643,Update,msdyn_forecastcategory,100000001,100000006,ACTOR-0002,1/12/25 10:41,2025-01-12T10:41:00Z,ITEM-000643,L1_STAGE,L1,100000006,,msdyn_forecastcategory → 100000006
ITEM-000643,Update,actualclosedate,,12/1/25 0:00,ACTOR-0002,1/12/25 10:41,2025-01-12T10:41:00Z,ITEM-000643,L1_STAGE,L1,12/1/25 0:00,,actualclosedate → 12/1/25 0:00
ITEM-000643,Update,salesstage,,3,ACTOR-0002,1/12/25 10:41,2025-01-12T10:41:00Z,ITEM-000643,L1_STAGE,L1,3,,salesstage → 3
ITEM-000643,Update,statecode,0,2,ACTOR-0002,1/12/25 10:41,2025-01-12T10:41:00Z,ITEM-000643,L1_STAGE,L1,Lost,,statecode → Lost
ITEM-000643,Update,stepname,,14-Qualify,ACTOR-0008,23/09/2025 09:43,2025-09-23T09:43:00Z,ITEM-000643,L1_STAGE,L1,14-Qualify,14.0,stepname → 14-Qualify
ITEM-000643,Create,statecode,,0,ACTOR-0002,23/09/2025 09:43,2025-09-23T09:43:00Z,ITEM-000643,L1_STAGE,L1,Open,,Case Created
ITEM-000644,Update,owningbusinessunit,"businessunit,0a4ccfd6-e6d9-e611-80f2-5065f38aba91","businessunit,0a4ccfd6-e6d9-e611-80f2-5065f38aba91",ACTOR-0004,26/09/2025 09:20,2025-09-26T09:20:00Z,ITEM-000644,L3_ADMIN,L3,"businessunit,0a4ccfd6-e6d9-e611-80f2-5065f38aba91",,owningbusinessunit changed
ITEM-000644,Update,ownerid,"systemuser,1cba5fd4-6e4e-4e0f-85ff-a6438bc2f2f0","systemuser,b5f00e27-78b3-4a71-90af-5dcef3c25bba",ACTOR-0004,26/09/2025 09:20,2025-09-26T09:20:00Z,ITEM-000644,L3_ADMIN,L3,"systemuser,b5f00e27-78b3-4a71-90af-5dcef3c25bba",,Owner changed
ITEM-000645,Update,owningbusinessunit,"businessunit,0a4ccfd6-e6d9-e611-80f2-5065f38aba91","businessunit,0a4ccfd6-e6d9-e611-80f2-5065f38aba91",ACTOR-0002,7/10/25 10:46,2025-07-10T10:46:00Z,ITEM-000645,L3_ADMIN,L3,"businessunit,0a4ccfd6-e6d9-e611-80f2-5065f38aba91",,owningbusinessunit changed
ITEM-000645,Update,ownerid,"systemuser,7b9d5323-2ef3-4d52-9d6c-dd45deb05e3b","systemuser,efd3822d-8c8b-4619-8eb9-39ddf9c5c57f",ACTOR-0002,7/10/25 10:46,2025-07-10T10:46:00Z,ITEM-000645,L3_ADMIN,L3,"systemuser,efd3822d-8c8b-4619-8eb9-39ddf9c5c57f",,Owner changed
ITEM-000647,Update,estimatedclosedate,7/31/25 0:00,8/22/25 0:00,ACTOR-0003,11/8/25 8:50,2025-11-08T08:50:00Z,ITEM-000647,L1_STAGE,L1,8/22/25 0:00,,estimatedclosedate → 8/22/25 0:00
ITEM-000647,Update,statuscode,1,3,ACTOR-0003,11/9/25 12:39,2025-11-09T12:39:00Z,ITEM-000647,L1_STAGE,L1,Won,,statuscode → Won
ITEM-000647,Update,msdyn_forecastcategory,100000001,100000005,ACTOR-0003,11/9/25 12:39,2025-11-09T12:39:00Z,ITEM-000647,L1_STAGE,L1,100000005,,msdyn_forecastcategory → 100000005
ITEM-000647,Update,actualclosedate,,9/11/25 0:00,ACTOR-0003,11/9/25 12:39,2025-11-09T12:39:00Z,ITEM-000647,L1_STAGE,L1,9/11/25 0:00,,actualclosedate → 9/11/25 0:00
ITEM-000647,Update,salesstage,,3,ACTOR-0003,11/9/25 12:39,2025-11-09T12:39:00Z,ITEM-000647,L1_STAGE,L1,3,,salesstage → 3
ITEM-000647,Update,statecode,0,1,ACTOR-0003,11/9/25 12:39,2025-11-09T12:39:00Z,ITEM-000647,L1_STAGE,L1,Won,,statecode → Won
ITEM-000648,Update,owningbusinessunit,"businessunit,0a4ccfd6-e6d9-e611-80f2-5065f38aba91","businessunit,0a4ccfd6-e6d9-e611-80f2-5065f38aba91",ACTOR-0003,27/10/2025 11:18,2025-10-27T11:18:00Z,ITEM-000648,L3_ADMIN,L3,"businessunit,0a4ccfd6-e6d9-e611-80f2-5065f38aba91",,owningbusinessunit changed
ITEM-000648,Update,ownerid,"systemuser,2d7fbe83-3f35-4a1d-bc05-1b39dbf446d9","systemuser,efd3822d-8c8b-4619-8eb9-39ddf9c5c57f",ACTOR-0003,27/10/2025 11:18,2025-10-27T11:18:00Z,ITEM-000648,L3_ADMIN,L3,"systemuser,efd3822d-8c8b-4619-8eb9-39ddf9c5c57f",,Owner changed
ITEM-000649,Update,owningbusinessunit,"businessunit,0a4ccfd6-e6d9-e611-80f2-5065f38aba91","businessunit,0a4ccfd6-e6d9-e611-80f2-5065f38aba91",ACTOR-0003,27/08/2025 12:57,2025-08-27T12:57:00Z,ITEM-000649,L3_ADMIN,L3,"businessunit,0a4ccfd6-e6d9-e611-80f2-5065f38aba91",,owningbusinessunit changed
ITEM-000649,Update,ownerid,"systemuser,7b9d5323-2ef3-4d52-9d6c-dd45deb05e3b","systemuser,b5f00e27-78b3-4a71-90af-5dcef3c25bba",ACTOR-0003,27/08/2025 12:57,2025-08-27T12:57:00Z,ITEM-000649,L3_ADMIN,L3,"systemuser,b5f00e27-78b3-4a71-90af-5dcef3c25bba",,Owner changed
ITEM-000650,Update,owningbusinessunit,"businessunit,0a4ccfd6-e6d9-e611-80f2-5065f38aba91","businessunit,0a4ccfd6-e6d9-e611-80f2-5065f38aba91",ACTOR-0002,7/10/25 10:46,2025-07-10T10:46:00Z,ITEM-000650,L3_ADMIN,L3,"businessunit,0a4ccfd6-e6d9-e611-80f2-5065f38aba91",,owningbusinessunit changed
ITEM-000650,Update,ownerid,"systemuser,a1bb889b-dfab-4e28-b508-75e672da7cb8","systemuser,efd3822d-8c8b-4619-8eb9-39ddf9c5c57f",ACTOR-0002,7/10/25 10:46,2025-07-10T10:46:00Z,ITEM-000650,L3_ADMIN,L3,"systemuser,efd3822d-8c8b-4619-8eb9-39ddf9c5c57f",,Owner changed
ITEM-000652,Update,owningbusinessunit,"businessunit,0a4ccfd6-e6d9-e611-80f2-5065f38aba91","businessunit,0a4ccfd6-e6d9-e611-80f2-5065f38aba91",ACTOR-0002,1/9/25 9:15,2025-01-09T09:15:00Z,ITEM-000652,L3_ADMIN,L3,"businessunit,0a4ccfd6-e6d9-e611-80f2-5065f38aba91",,owningbusinessunit changed
ITEM-000652,Update,ownerid,"systemuser,b5f00e27-78b3-4a71-90af-5dcef3c25bba","systemuser,efd3822d-8c8b-4619-8eb9-39ddf9c5c57f",ACTOR-0002,1/9/25 9:15,2025-01-09T09:15:00Z,ITEM-000652,L3_ADMIN,L3,"systemuser,efd3822d-8c8b-4619-8eb9-39ddf9c5c57f",,Owner changed
ITEM-000654,Update,owningbusinessunit,"businessunit,0a4ccfd6-e6d9-e611-80f2-5065f38aba91","businessunit,0a4ccfd6-e6d9-e611-80f2-5065f38aba91",ACTOR-0002,7/10/25 10:45,2025-07-10T10:45:00Z,ITEM-000654,L3_ADMIN,L3,"businessunit,0a4ccfd6-e6d9-e611-80f2-5065f38aba91",,owningbusinessunit changed
ITEM-000654,Update,ownerid,"systemuser,7b9d5323-2ef3-4d52-9d6c-dd45deb05e3b","systemuser,efd3822d-8c8b-4619-8eb9-39ddf9c5c57f",ACTOR-0002,7/10/25 10:45,2025-07-10T10:45:00Z,ITEM-000654,L3_ADMIN,L3,"systemuser,efd3822d-8c8b-4619-8eb9-39ddf9c5c57f",,Owner changed
ITEM-000657,Update,stepname,,14-Qualify,ACTOR-0008,17/09/2025 14:45,2025-09-17T14:45:00Z,ITEM-000657,L1_STAGE,L1,14-Qualify,14.0,stepname → 14-Qualify
ITEM-000657,Create,statecode,,0,ACTOR-0003,17/09/2025 14:45,2025-09-17T14:45:00Z,ITEM-000657,L1_STAGE,L1,Open,,Case Created
ITEM-000657,Update,statuscode,1,4,ACTOR-0003,28/10/2025 14:06,2025-10-28T14:06:00Z,ITEM-000657,L1_STAGE,L1,Canceled,,statuscode → Canceled
ITEM-000657,Update,msdyn_forecastcategory,100000001,100000006,ACTOR-0003,28/10/2025 14:06,2025-10-28T14:06:00Z,ITEM-000657,L1_STAGE,L1,100000006,,msdyn_forecastcategory → 100000006
ITEM-000657,Update,actualclosedate,,10/28/25 0:00,ACTOR-0003,28/10/2025 14:06,2025-10-28T14:06:00Z,ITEM-000657,L1_STAGE,L1,10/28/25 0:00,,actualclosedate → 10/28/25 0:00
ITEM-000657,Update,salesstage,,3,ACTOR-0003,28/10/2025 14:06,2025-10-28T14:06:00Z,ITEM-000657,L1_STAGE,L1,3,,salesstage → 3
ITEM-000657,Update,statecode,0,2,ACTOR-0003,28/10/2025 14:06,2025-10-28T14:06:00Z,ITEM-000657,L1_STAGE,L1,Lost,,statecode → Lost
ITEM-000658,Update,statuscode,1,3,ACTOR-0004,2/9/25 13:57,2025-02-09T13:57:00Z,ITEM-000658,L1_STAGE,L1,Won,,statuscode → Won
ITEM-000658,Update,msdyn_forecastcategory,100000001,100000005,ACTOR-0004,2/9/25 13:57,2025-02-09T13:57:00Z,ITEM-000658,L1_STAGE,L1,100000005,,msdyn_forecastcategory → 100000005
ITEM-000658,Update,actualclosedate,,9/2/25 0:00,ACTOR-0004,2/9/25 13:57,2025-02-09T13:57:00Z,ITEM-000658,L1_STAGE,L1,9/2/25 0:00,,actualclosedate → 9/2/25 0:00
ITEM-000658,Update,salesstage,,3,ACTOR-0004,2/9/25 13:57,2025-02-09T13:57:00Z,ITEM-000658,L1_STAGE,L1,3,,salesstage → 3
ITEM-000658,Update,statecode,0,1,ACTOR-0004,2/9/25 13:57,2025-02-09T13:57:00Z,ITEM-000658,L1_STAGE,L1,Won,,statecode → Won
ITEM-000658,Update,ownerid,"systemuser,1cba5fd4-6e4e-4e0f-85ff-a6438bc2f2f0","systemuser,09f34b91-4d86-4fc8-8b41-8af3d91e94bf",ACTOR-0003,20/10/2025 12:42,2025-10-20T12:42:00Z,ITEM-000658,L3_ADMIN,L3,"systemuser,09f34b91-4d86-4fc8-8b41-8af3d91e94bf",,Owner changed
ITEM-000659,Update,statuscode,1,4,ACTOR-0003,29/08/2025 08:41,2025-08-29T08:41:00Z,ITEM-000659,L1_STAGE,L1,Canceled,,statuscode → Canceled
ITEM-000659,Update,msdyn_forecastcategory,100000001,100000006,ACTOR-0003,29/08/2025 08:41,2025-08-29T08:41:00Z,ITEM-000659,L1_STAGE,L1,100000006,,msdyn_forecastcategory → 100000006
ITEM-000659,Update,actualclosedate,,8/29/25 0:00,ACTOR-0003,29/08/2025 08:41,2025-08-29T08:41:00Z,ITEM-000659,L1_STAGE,L1,8/29/25 0:00,,actualclosedate → 8/29/25 0:00
ITEM-000659,Update,salesstage,,3,ACTOR-0003,29/08/2025 08:41,2025-08-29T08:41:00Z,ITEM-000659,L1_STAGE,L1,3,,salesstage → 3
ITEM-000659,Update,statecode,0,2,ACTOR-0003,29/08/2025 08:41,2025-08-29T08:41:00Z,ITEM-000659,L1_STAGE,L1,Lost,,statecode → Lost
ITEM-000659,Update,the000g_revenuetype,,604720001,ACTOR-0003,11/8/25 8:50,2025-11-08T08:50:00Z,ITEM-000659,L2_MILESTONE,L2,604720001,,the000g_revenuetype → 604720001
ITEM-000659,Update,the000g_isrenewal,,FALSE,ACTOR-0003,11/8/25 8:50,2025-11-08T08:50:00Z,ITEM-000659,L3_ADMIN,L3,FALSE,,the000g_isrenewal changed
ITEM-000659,Update,estimatedclosedate,8/1/25 0:00,8/29/25 0:00,ACTOR-0003,11/8/25 8:50,2025-11-08T08:50:00Z,ITEM-000659,L1_STAGE,L1,8/29/25 0:00,,estimatedclosedate → 8/29/25 0:00
ITEM-000662,Update,owningbusinessunit,"businessunit,0a4ccfd6-e6d9-e611-80f2-5065f38aba91","businessunit,0a4ccfd6-e6d9-e611-80f2-5065f38aba91",ACTOR-0002,22/08/2025 13:23,2025-08-22T13:23:00Z,ITEM-000662,L3_ADMIN,L3,"businessunit,0a4ccfd6-e6d9-e611-80f2-5065f38aba91",,owningbusinessunit changed
ITEM-000662,Update,ownerid,"systemuser,7b9d5323-2ef3-4d52-9d6c-dd45deb05e3b","systemuser,efd3822d-8c8b-4619-8eb9-39ddf9c5c57f",ACTOR-0002,22/08/2025 13:23,2025-08-22T13:23:00Z,ITEM-000662,L3_ADMIN,L3,"systemuser,efd3822d-8c8b-4619-8eb9-39ddf9c5c57f",,Owner changed
ITEM-000663,Update,owningbusinessunit,"businessunit,0a4ccfd6-e6d9-e611-80f2-5065f38aba91","businessunit,0a4ccfd6-e6d9-e611-80f2-5065f38aba91",ACTOR-0002,22/08/2025 13:23,2025-08-22T13:23:00Z,ITEM-000663,L3_ADMIN,L3,"businessunit,0a4ccfd6-e6d9-e611-80f2-5065f38aba91",,owningbusinessunit changed
ITEM-000663,Update,ownerid,"systemuser,7b9d5323-2ef3-4d52-9d6c-dd45deb05e3b","systemuser,efd3822d-8c8b-4619-8eb9-39ddf9c5c57f",ACTOR-0002,22/08/2025 13:23,2025-08-22T13:23:00Z,ITEM-000663,L3_ADMIN,L3,"systemuser,efd3822d-8c8b-4619-8eb9-39ddf9c5c57f",,Owner changed
ITEM-000664,Update,estimatedclosedate,11/27/25 0:00,12/5/25 0:00,ACTOR-0002,1/12/25 16:50,2025-01-12T16:50:00Z,ITEM-000664,L1_STAGE,L1,12/5/25 0:00,,estimatedclosedate → 12/5/25 0:00
ITEM-000664,Update,estimatedclosedate,12/5/25 0:00,1/15/26 0:00,ACTOR-0002,8/12/25 10:22,2025-08-12T10:22:00Z,ITEM-000664,L1_STAGE,L1,1/15/26 0:00,,estimatedclosedate → 1/15/26 0:00
ITEM-000664,Update,stepname,,14-Qualify,ACTOR-0008,22/08/2025 09:06,2025-08-22T09:06:00Z,ITEM-000664,L1_STAGE,L1,14-Qualify,14.0,stepname → 14-Qualify
ITEM-000664,Create,statecode,,0,ACTOR-0002,22/08/2025 09:06,2025-08-22T09:06:00Z,ITEM-000664,L1_STAGE,L1,Open,,Case Created
ITEM-000664,Update,stepname,14-Qualify,15-Develop,ACTOR-0008,29/10/2025 06:43,2025-10-29T06:43:00Z,ITEM-000664,L1_STAGE,L1,15-Develop,15.0,stepname → 15-Develop
ITEM-000664,Update,stepname,15-Develop,16-Propose,ACTOR-0008,29/10/2025 06:43,2025-10-29T06:43:00Z,ITEM-000664,L1_STAGE,L1,16-Propose,16.0,stepname → 16-Propose
ITEM-000664,Update,estimatedclosedate,9/25/25 0:00,11/27/25 0:00,ACTOR-0002,29/10/2025 06:44,2025-10-29T06:44:00Z,ITEM-000664,L1_STAGE,L1,11/27/25 0:00,,estimatedclosedate → 11/27/25 0:00
ITEM-000664,Update,the000g_revenuetype,604720000,604720001,ACTOR-0002,29/10/2025 06:44,2025-10-29T06:44:00Z,ITEM-000664,L2_MILESTONE,L2,604720001,,the000g_revenuetype → 604720001
ITEM-000664,Update,estimatedclosedate,1/15/26 0:00,2/26/26 0:00,ACTOR-0002,14/01/2026 16:55,2026-01-14T16:55:00Z,ITEM-000664,L1_STAGE,L1,2/26/26 0:00,,estimatedclosedate → 2/26/26 0:00
ITEM-000664,Update,closeprobability,25,50,ACTOR-0003,5/1/26 16:09,2026-05-01T16:09:00Z,ITEM-000664,L1_STAGE,L1,50,,closeprobability → 50
ITEM-000664,Update,the000g__revenuetype,,604720002,ACTOR-0003,5/1/26 16:09,2026-05-01T16:09:00Z,ITEM-000664,L2_MILESTONE,L2,604720002,,the000g__revenuetype → 604720002
ITEM-000664,Update,msdyn_forecastcategory,100000001,100000002,ACTOR-0003,5/1/26 16:09,2026-05-01T16:09:00Z,ITEM-000664,L1_STAGE,L1,100000002,,msdyn_forecastcategory → 100000002
ITEM-000664,Update,new_contracttermmonths,,24,ACTOR-0002,12/1/26 15:34,2026-12-01T15:34:00Z,ITEM-000664,L2_MILESTONE,L2,24,,new_contracttermmonths → 24
ITEM-000666,Update,statuscode,1,4,ACTOR-0003,28/08/2025 09:33,2025-08-28T09:33:00Z,ITEM-000666,L1_STAGE,L1,Canceled,,statuscode → Canceled
ITEM-000666,Update,msdyn_forecastcategory,100000001,100000006,ACTOR-0003,28/08/2025 09:33,2025-08-28T09:33:00Z,ITEM-000666,L1_STAGE,L1,100000006,,msdyn_forecastcategory → 100000006
ITEM-000666,Update,actualclosedate,,8/28/25 0:00,ACTOR-0003,28/08/2025 09:33,2025-08-28T09:33:00Z,ITEM-000666,L1_STAGE,L1,8/28/25 0:00,,actualclosedate → 8/28/25 0:00
ITEM-000666,Update,salesstage,,3,ACTOR-0003,28/08/2025 09:33,2025-08-28T09:33:00Z,ITEM-000666,L1_STAGE,L1,3,,salesstage → 3
ITEM-000666,Update,statecode,0,2,ACTOR-0003,28/08/2025 09:33,2025-08-28T09:33:00Z,ITEM-000666,L1_STAGE,L1,Lost,,statecode → Lost
ITEM-000667,Update,the000g_revenuetype,,604720002,ACTOR-0003,17/08/2025 12:56,2025-08-17T12:56:00Z,ITEM-000667,L2_MILESTONE,L2,604720002,,the000g_revenuetype → 604720002
ITEM-000667,Update,owningbusinessunit,"businessunit,0a4ccfd6-e6d9-e611-80f2-5065f38aba91","businessunit,0a4ccfd6-e6d9-e611-80f2-5065f38aba91",ACTOR-0004,26/09/2025 09:20,2025-09-26T09:20:00Z,ITEM-000667,L3_ADMIN,L3,"businessunit,0a4ccfd6-e6d9-e611-80f2-5065f38aba91",,owningbusinessunit changed
ITEM-000667,Update,ownerid,"systemuser,a1bb889b-dfab-4e28-b508-75e672da7cb8","systemuser,b5f00e27-78b3-4a71-90af-5dcef3c25bba",ACTOR-0004,26/09/2025 09:20,2025-09-26T09:20:00Z,ITEM-000667,L3_ADMIN,L3,"systemuser,b5f00e27-78b3-4a71-90af-5dcef3c25bba",,Owner changed
ITEM-000668,Update,statuscode,1,4,ACTOR-0009,6/10/25 9:58,2025-06-10T09:58:00Z,ITEM-000668,L1_STAGE,L1,Canceled,,statuscode → Canceled
ITEM-000668,Update,msdyn_forecastcategory,100000001,100000006,ACTOR-0009,6/10/25 9:58,2025-06-10T09:58:00Z,ITEM-000668,L1_STAGE,L1,100000006,,msdyn_forecastcategory → 100000006
ITEM-000668,Update,actualclosedate,,10/6/25 0:00,ACTOR-0009,6/10/25 9:58,2025-06-10T09:58:00Z,ITEM-000668,L1_STAGE,L1,10/6/25 0:00,,actualclosedate → 10/6/25 0:00
ITEM-000668,Update,salesstage,,3,ACTOR-0009,6/10/25 9:58,2025-06-10T09:58:00Z,ITEM-000668,L1_STAGE,L1,3,,salesstage → 3
ITEM-000668,Update,statecode,0,2,ACTOR-0009,6/10/25 9:58,2025-06-10T09:58:00Z,ITEM-000668,L1_STAGE,L1,Lost,,statecode → Lost
ITEM-000669,Update,owningbusinessunit,"businessunit,0a4ccfd6-e6d9-e611-80f2-5065f38aba91","businessunit,0a4ccfd6-e6d9-e611-80f2-5065f38aba91",ACTOR-0003,13/01/2026 09:48,2026-01-13T09:48:00Z,ITEM-000669,L3_ADMIN,L3,"businessunit,0a4ccfd6-e6d9-e611-80f2-5065f38aba91",,owningbusinessunit changed
ITEM-000669,Update,ownerid,"systemuser,1cba5fd4-6e4e-4e0f-85ff-a6438bc2f2f0","systemuser,09f34b91-4d86-4fc8-8b41-8af3d91e94bf",ACTOR-0003,13/01/2026 09:48,2026-01-13T09:48:00Z,ITEM-000669,L3_ADMIN,L3,"systemuser,09f34b91-4d86-4fc8-8b41-8af3d91e94bf",,Owner changed
ITEM-000670,Update,ownerid,"systemuser,09f34b91-4d86-4fc8-8b41-8af3d91e94bf","systemuser,efd3822d-8c8b-4619-8eb9-39ddf9c5c57f",ACTOR-0003,2/12/25 10:29,2025-02-12T10:29:00Z,ITEM-000670,L3_ADMIN,L3,"systemuser,efd3822d-8c8b-4619-8eb9-39ddf9c5c57f",,Owner changed
ITEM-000670,Update,the000g_revenuetype,,604720001,ACTOR-0003,17/08/2025 13:01,2025-08-17T13:01:00Z,ITEM-000670,L2_MILESTONE,L2,604720001,,the000g_revenuetype → 604720001
